org_id,samp_id,samp_datetime,org_url,org_media_url,org_media_type,org_attached_links,org_text,org_hashtags,org_user_metions,user_id,user_name,user_screen_name,user_verified,user_profile_image_url,user_profile_banner_url,user_profile_background_image_url,user_followers_count,user_friends_count,org_favorite_count,org_quote_count,org_reply_count,org_retweet_count,org_datetime
1456852351025696773,1457123972437397507,2021-11-06T23:13:21.000-07:00,"","","","",We're hiring in New Taipei City! Click the link in our bio to apply to this job and more: EE/HW Design Manager at Flex #Engineering,['Engineering'],"",43259052,Taiwan Jobs,tmj_twn_jobs,false,http://pbs.twimg.com/profile_images/671021579640311808/zQ3Vy9y9_normal.jpg,https://pbs.twimg.com/profile_banners/43259052/1448818988,http://abs.twimg.com/images/themes/theme1/bg.png,867,259,0,0,0,1,2021-11-06T05:14:02.000-07:00
1456916129906102274,1457118296680054788,2021-11-06T22:50:48.000-07:00,"","","","","Shortly after the Takeover, Josh Kroenke was appointed Director of Arsenal FC with the view of being closer to the club and having a more 'hands on' approach.||His first appointments were with good intentions by hiring three experts in Raul Sanhelli, Mislintat and Huss Fahmy","","",1422929994377007113,z,PrivArsenal_Z,false,http://pbs.twimg.com/profile_images/1452569918973648903/NPxOL7O7_normal.jpg,https://pbs.twimg.com/profile_banners/1422929994377007113/1628190993,"",2633,229,93,0,1,5,2021-11-06T09:27:28.000-07:00
1456941259352907779,1457106417731657731,2021-11-06T22:03:36.000-07:00,https://twitter.com/MilfRach35/status/1456941259352907779/photo/1,['http://pbs.twimg.com/media/FDgYWjCXEAIcYQN.jpg'],['photo'],"","I’m looking for a porn Director to help me be successful in America, are there any on here that would be interested in hiring a white British natural milf xx https://t.co/61eeAKkPmL","","",1354895626740387846,MilfRach36,MilfRach35,false,http://pbs.twimg.com/profile_images/1414686105421615110/TLVJvvrK_normal.jpg,https://pbs.twimg.com/profile_banners/1354895626740387846/1620294183,"",225,676,8,0,2,3,2021-11-06T11:07:19.000-07:00
1456993875277623302,1457116957313019904,2021-11-06T22:45:29.000-07:00,"","","","",We are hiring: ||Senior Marketing Specialist ||Located in Riyadh 📍||Requirements:|- 2 - 3 years experience in the same field |- Preferably FMCG or F&amp;B background |- Fluent in English ||Please send your CV and mention position/city in the tittle of the email:|jobs@3bees.sa,"","",1131061273502900224,محارب البطاله 💪🏻💵#وظائف,mohareeb2019,false,http://pbs.twimg.com/profile_images/1131065062817488901/qfkWhbGY_normal.jpg,https://pbs.twimg.com/profile_banners/1131061273502900224/1604252182,"",28784,42,1,0,1,2,2021-11-06T14:36:24.000-07:00
1456995637334093840,1457102903894810630,2021-11-06T21:49:38.000-07:00,https://twitter.com/rkbtwo/status/1456995637334093840/photo/1,['http://pbs.twimg.com/tweet_video_thumb/FDhJzmwXMAYikwo.jpg'],['animated_gif'],['https://www.usajobs.gov/Search/Results?d=TD&k=transportation&s=startdate_desc&p=1'],So I heard you're excited about the passage of the Bipartisan Infrastructure Deal. How about you come join the team... @USDOT is hiring... |https://t.co/E1ETSxnsr9 https://t.co/zHpTIdjjT0,"",['USDOT'],300022396,Keith Benjamin,rkbtwo,false,http://pbs.twimg.com/profile_images/1451165563036831747/7kjxym63_normal.jpg,https://pbs.twimg.com/profile_banners/300022396/1620139692,http://abs.twimg.com/images/themes/theme1/bg.png,4388,491,15,1,0,2,2021-11-06T14:43:24.000-07:00
1456997208587337729,1457126313307803656,2021-11-06T23:22:39.000-07:00,https://twitter.com/uwcheme/status/1456997208587337729,"","",['https://apply.interfolio.com/92967'],"We are hiring! We're open to applicants from all ChemE subfields, with particular interest in those with polymer science, colloids, and/or soft matter expertise. Apply by 11/30 &amp; connect with us at #AIChE2021 https://t.co/JJIWDKIK34|#facultychemEjobs","['AIChE2021', 'facultychemEjobs']","",766296451643244544,UWChemE,UWChemE,false,http://pbs.twimg.com/profile_images/1083105256051863557/_4ZXggEx_normal.jpg,https://pbs.twimg.com/profile_banners/766296451643244544/1471882548,http://abs.twimg.com/images/themes/theme1/bg.png,1140,340,14,0,0,6,2021-11-06T14:49:38.000-07:00
1456998212313575425,1457128566009651205,2021-11-06T23:31:36.000-07:00,"","","","","So. Caregivers have been leaving the agencies they worked for because of the clot shot mandates (including me).||Now, home health agencies are on an apparent hiring spree but you can't get hired unless the gubment jabs you so they are STILL understaffed. Make that make sense. 🤪","","",1420054711030358021,🇺🇲Fiery_Meg🇺🇲,FieryMeg,false,http://pbs.twimg.com/profile_images/1427716074389139460/VCNNcTXm_normal.jpg,https://pbs.twimg.com/profile_banners/1420054711030358021/1634176795,"",6266,6208,236,7,18,161,2021-11-06T14:53:38.000-07:00
1457012964389687307,1457112875554590724,2021-11-06T22:29:16.000-07:00,"","","","","Jody Allen has a history of harassment allegations, they fired the PI who 'investigated' Billups weeks after the hiring, and one of the new assistants was accused of federal fraud before the season. And Olshey has (allegedly) been horrible for years under the team's watch.","","",3857083283,Eric Griffith,EricG_NBA,false,http://pbs.twimg.com/profile_images/824043418137530369/RPQ6BaPz_normal.jpg,https://pbs.twimg.com/profile_banners/3857083283/1523509514,http://abs.twimg.com/images/themes/theme1/bg.png,3362,956,71,6,6,11,2021-11-06T15:52:15.000-07:00
1457020716012945416,1457123700109557762,2021-11-06T23:12:16.000-07:00,https://twitter.com/Polycam3D/status/1457020716012945416/video/1,['http://pbs.twimg.com/ext_tw_video_thumb/1457019952343306244/pu/img/dwsWAnWKvPIQEb8b.jpg'],['video'],['https://angel.co/l/2w5U9c'],"Polycam is hiring a UI/UX designer 🤩||Looking for someone that's passionate about designing simple interfaces for powerful products.  If you're interested in 3D, #XR or the #Metaverse apply asap:  https://t.co/bFxSD69GRp 🚀||Please share and retweet to get the word out !! https://t.co/exBQO3W5Wp","['XR', 'Metaverse']","",1294778173549289473,polycam,Polycam3D,false,http://pbs.twimg.com/profile_images/1364754405145202689/Jmx03tIc_normal.jpg,https://pbs.twimg.com/profile_banners/1294778173549289473/1614217112,"",5194,45,55,3,2,8,2021-11-06T16:23:03.000-07:00
1457023092350357505,1457117415284875273,2021-11-06T22:47:18.000-07:00,https://twitter.com/ssttaavvii/status/1457023092350357505,"","","",Not yall doin what they did in the 80s/90s and try to pin music and artists to tragedies.. 2pac caused call the gangs and metallica caused all the murders right..||Shit organization and not hiring the correct staff is what happened,"","",800852453012840448,stavi,ssttaavvii,false,http://pbs.twimg.com/profile_images/1332340615359602689/EuI-0Gzk_normal.jpg,https://pbs.twimg.com/profile_banners/800852453012840448/1508311986,"",698,388,1,0,1,0,2021-11-06T16:32:30.000-07:00
1457042253873094665,1457128074638774272,2021-11-06T23:29:39.000-07:00,https://twitter.com/kb_thedon/status/1457042253873094665,"","","","I hate sittin in nailshops, I would rather hold a now hiring sign in the middle of june but …. I do it for you .. cause I fuck witcha &amp; if me sittin there witchu gone make u smile, how could I eva go against that","","",61928493,2Ea$y ♛,kb_thedon,false,http://pbs.twimg.com/profile_images/1456673821776359427/Z_IZ6Wkt_normal.jpg,https://pbs.twimg.com/profile_banners/61928493/1636059527,http://abs.twimg.com/images/themes/theme1/bg.png,10896,129,20,0,0,3,2021-11-06T17:48:38.000-07:00
1457045578303488005,1457118109836320768,2021-11-06T22:50:03.000-07:00,https://twitter.com/ucanr/status/1457045578303488005/photo/1,['http://pbs.twimg.com/media/FDh2zStUYAE-dBK.jpg'],['photo'],['https://bit.ly/3bQaOfz'],"Are you an expert in digital communications? Come work with us! We're #hiring a Digital Communications Specialist who will inform the public about the impacts of UC ANR research through news writing, media outreach and digital and multimedia communications.https://t.co/01qzfLl8HG https://t.co/VCo9EeTOKT",['hiring'],"",14957366,Ag&Natural Resources,ucanr,true,http://pbs.twimg.com/profile_images/1413666238459379713/CVMnBAax_normal.png,https://pbs.twimg.com/profile_banners/14957366/1480533429,http://abs.twimg.com/images/themes/theme16/bg.gif,13439,2008,2,0,0,2,2021-11-06T18:01:51.000-07:00
1457046263212519438,1457105097972924420,2021-11-06T21:58:21.000-07:00,"","","","","Keep an eye on Poch’s situation at PSG. Wouldn’t be discounting him and he still has admirers at the club#l.||Either way, it’s a mess and the board are incompetent themselves to be given the task of hiring yet another manager.||Ole needs to go, but so do the board #MUFC",['MUFC'],"",1708167986,Haider Rubbani 🇵🇸🇾🇪🎙⚽️,Haider_Rubbani,false,http://pbs.twimg.com/profile_images/1429393642582577156/qzPRDtFO_normal.jpg,https://pbs.twimg.com/profile_banners/1708167986/1634294297,http://abs.twimg.com/images/themes/theme1/bg.png,4866,434,22,0,0,3,2021-11-06T18:04:34.000-07:00
1457075358478520330,1457104464175898637,2021-11-06T21:55:50.000-07:00,"","","","",High-salaried executives will soon no longer need to live within driving distance of any office. Some multinationals are already hiring their executives in lower cost countries and fly them into headquarters for their periodic meetings. This is especially true for regional roles.,"","",719258243416133633,Clopp 🇪🇸,cloppbox,false,http://pbs.twimg.com/profile_images/1404039409373224960/783jJfNb_normal.jpg,https://pbs.twimg.com/profile_banners/719258243416133633/1609655497,"",8100,8907,2,0,1,1,2021-11-06T20:00:11.000-07:00
1457078220621291527,1457129178206294025,2021-11-06T23:34:02.000-07:00,"","","","","We are hiring like crazy on the marketing team at @SeismicSoftware - SDRs, videographer, email marketer, and many more. DMs open.","",['SeismicSoftware'],12727902,Kyle Lacy,kyleplacy,false,http://pbs.twimg.com/profile_images/1429470604940521477/wFqw1_lz_normal.jpg,https://pbs.twimg.com/profile_banners/12727902/1629647326,http://abs.twimg.com/images/themes/theme1/bg.png,33519,5625,9,0,0,2,2021-11-06T20:11:33.000-07:00
1457094716013547532,1457103983890378755,2021-11-06T21:53:56.000-07:00,https://twitter.com/DispatchMess/status/1457094716013547532/photo/1,['http://pbs.twimg.com/media/FDij61aWEAE99V2.jpg'],['photo'],"",Attention Omaha Area Friends!||Have you ever wondered what it’s like being a helicopter EMS dispatcher? ||Did you know that our dispatch center here in Omaha covers ALL 50 STATES?||And… did you know we’re hiring NO EXPERIENCE REQUIRED?! ||DM me if you are interested!! https://t.co/T5kpqDD2dz,"","",1243949725340008449,DispatchMess,DispatchMess,false,http://pbs.twimg.com/profile_images/1443013719030697987/oRc-9NIz_normal.jpg,https://pbs.twimg.com/profile_banners/1243949725340008449/1628723910,"",1221,594,9,0,1,3,2021-11-06T21:17:06.000-07:00
1457098111961075713,1457110352689188867,2021-11-06T22:19:14.000-07:00,"","","","",@kyrstensinema It’s all fun and games until you get primaried and the gravy train kicks you off. Voters won’t forget how you sold us out for personal enrichment. I hear Starbucks is hiring.,"",['kyrstensinema'],757207244446412800,Mo227,Morgan_227,false,http://pbs.twimg.com/profile_images/1331019896566603778/6drud5kX_normal.jpg,https://pbs.twimg.com/profile_banners/757207244446412800/1606174848,"",2395,3211,16,0,0,1,2021-11-06T21:30:36.000-07:00
1457099612024496131,1457103702968446979,2021-11-06T21:52:49.000-07:00,"","","","","Want to work at Norfolk Southern? We're hiring in #Atlanta, GA! Click the link in our bio for details on this job and more: Legal Operations Specialist #Legal","['Atlanta', 'Legal']","",22095775,TMJ-ATL Legal Jobs,tmj_atl_legal,false,http://pbs.twimg.com/profile_images/674519601011490816/QiXSL1Io_normal.jpg,https://pbs.twimg.com/profile_banners/22095775/1449652981,http://abs.twimg.com/images/themes/theme1/bg.png,422,281,0,0,0,1,2021-11-06T21:36:33.000-07:00
1457100710886064132,1457100710886064132,2021-11-06T21:40:55.000-07:00,"","","",['https://bit.ly/3mQM3WX'],"Want to work at Ericsson? We're hiring in #Budapest, Budapest! Click for details: https://t.co/S5QtQlqPjP #ProductMgmt","['Budapest', 'ProductMgmt']","",310299026,Ericsson Jobs,JobsAtEricsson,false,http://pbs.twimg.com/profile_images/1034121330503761929/q2ybgg9T_normal.jpg,https://pbs.twimg.com/profile_banners/310299026/1535388764,http://abs.twimg.com/images/themes/theme1/bg.png,2662,0,0,0,0,0,2021-11-06T21:40:55.000-07:00
1457100835339464705,1457100835339464705,2021-11-06T21:41:25.000-07:00,"","","","","Want to work at Envision Physician Services? We're hiring in #Hampton, VA! Click the link in our bio for details on this job and more: Emergency Medicine - Nocturnist - EM Physician #emergencymedicine","['Hampton', 'emergencymedicine']","",74021134,Physician-ER VA,tmj_va_erdoc,false,http://pbs.twimg.com/profile_images/697903504531165184/XtTFrQsj_normal.jpg,https://pbs.twimg.com/profile_banners/74021134/1455228138,http://abs.twimg.com/images/themes/theme1/bg.png,51,48,0,0,0,0,2021-11-06T21:41:25.000-07:00
1457100919082868736,1457100919082868736,2021-11-06T21:41:45.000-07:00,"","","","","Want to work at UPS? We're hiring in #Princeton, NJ! Click the link in our bio for details on this job and more: Seasonal Personal Vehicle Package Driver #Transportation","['Princeton', 'Transportation']","",23494578,TMJ-NJC Transp. Jobs,tmj_njc_transp,false,http://pbs.twimg.com/profile_images/680368120561664000/nlzWvYQC_normal.jpg,https://pbs.twimg.com/profile_banners/23494578/1451047378,http://abs.twimg.com/images/themes/theme1/bg.png,289,258,0,0,0,0,2021-11-06T21:41:45.000-07:00
1457100958899445760,1457100958899445760,2021-11-06T21:41:54.000-07:00,"","","",['https://bit.ly/3kd1Lda'],"We're hiring! Read about our latest job opening here: Registered Nurse/RN - Clinic - https://t.co/NNm0LKQeFj #RN #Chicago, IL","['RN', 'Chicago']","",1114265593744588806,UChicago Medicine Careers,UChicagoMedJobs,false,http://pbs.twimg.com/profile_images/1134138620481327105/8wozWCHI_normal.png,https://pbs.twimg.com/profile_banners/1114265593744588806/1559234770,http://abs.twimg.com/images/themes/theme1/bg.png,1463,62,0,0,0,0,2021-11-06T21:41:54.000-07:00
1457101002608316418,1457101002608316418,2021-11-06T21:42:05.000-07:00,"","","","","Medical Mutual is hiring in Brooklyn, OH! Read about our latest Insurance job opening via the link in our bio: Sr. Corporate Recruiter- Hybrid Remote #WeLoveOhio #veterans","['WeLoveOhio', 'veterans']","",37649659,TMJ Ins. Jobs,tmj_insjobs,false,http://pbs.twimg.com/profile_images/689256591149801472/vjrftXbZ_normal.jpg,https://pbs.twimg.com/profile_banners/37649659/1453166553,http://abs.twimg.com/images/themes/theme1/bg.png,189,102,0,0,0,0,2021-11-06T21:42:05.000-07:00
1457101074356047872,1457101074356047872,2021-11-06T21:42:22.000-07:00,"","","",['https://www.wsj.com/articles/help-really-wanted-no-degree-work-experience-or-background-checks-11636196307'],"With job openings continuing to outnumber available workers, employers are easing on requirements and expediting the hiring process. Of course, this applies to service-oriented jobs like in retail and supply chain roles https://t.co/AxOZev400L @laurenweberWSJ @ChipCutter #hiring",['hiring'],"['laurenweberWSJ', 'ChipCutter']",76052772,Albert Fong,albertfong98,false,http://pbs.twimg.com/profile_images/461301153557258240/tGS0akef_normal.jpeg,https://pbs.twimg.com/profile_banners/76052772/1398499175,http://abs.twimg.com/images/themes/theme1/bg.png,928,661,0,0,0,0,2021-11-06T21:42:22.000-07:00
1457101172544729089,1457101172544729089,2021-11-06T21:42:45.000-07:00,"","","","","CVS Health is hiring in #BelAir, MD! Read about our latest Pharmacy Technician - Retail Store job opening via the link in our bio: Pharmacy Technician - Target Store",['BelAir'],"",113371090,TMJ-MD Pharm. Jobs,tmj_MD_pharm,false,http://pbs.twimg.com/profile_images/703474899071860737/s7rv21vA_normal.jpg,https://pbs.twimg.com/profile_banners/113371090/1456556462,http://abs.twimg.com/images/themes/theme1/bg.png,276,262,0,0,0,0,2021-11-06T21:42:45.000-07:00
1457101266300149760,1457101288219586566,2021-11-06T21:43:13.000-07:00,"","","",['https://relode.co/QSZ9AYE'],"Great opportunity for Nurse Practitioner or Physician Assistant  in Long Island City, NY #hiring https://t.co/Q3pL1wqicn via @relodetweets |#healthcarejobs","['hiring', 'healthcarejobs']",['RelodeTweets'],2460446502,Gevonna Williams,GevonnaWilliams,false,http://pbs.twimg.com/profile_images/1431819193368948736/l1mPnaqK_normal.jpg,"",http://abs.twimg.com/images/themes/theme1/bg.png,32,101,0,0,0,1,2021-11-06T21:43:08.000-07:00
1457101303595765765,1457101303595765765,2021-11-06T21:43:17.000-07:00,"","","","","@DrDreHistorian If the blockchain robot can do all the hiring, why doesn’t he just do the job he’s hiring for while we work on our tan in the Bahamas?","",['DrDreHistorian'],2357735166,Hamish Price,hamishpricenz,false,http://pbs.twimg.com/profile_images/1063228008968871936/18VH5DuB_normal.jpg,"",http://abs.twimg.com/images/themes/theme1/bg.png,3691,2036,0,0,0,0,2021-11-06T21:43:17.000-07:00
1457101717804224515,1457101717804224515,2021-11-06T21:44:55.000-07:00,"","","","","Career tip for landing jobs like 'Senior Clinical Scientist / Medical Monitor - Oncology' in #LittleRock, AR. Go on informational interviews. The best way to get a meeting with a hiring manager is to ask for an informational meeting. #clinical","['LittleRock', 'clinical']","",150473893,TMJ-AR General Scien,tmj_AR_gensci,false,http://pbs.twimg.com/profile_images/709469765782216704/zw6liwNT_normal.jpg,https://pbs.twimg.com/profile_banners/150473893/1457985749,http://abs.twimg.com/images/themes/theme1/bg.png,253,236,0,0,0,0,2021-11-06T21:44:55.000-07:00
1457101927221583875,1457101927221583875,2021-11-06T21:45:45.000-07:00,"","","","","We're hiring in #TwainHarte, CA! Click the link in our bio to apply to this job and more: Client Relationship Consultant 1 (Banker) - Twain Harte, CA (30hrs) at U.S. Bank #branchbanking","['TwainHarte', 'branchbanking']","",56250594,TMJ-CA Bank Jobs,tmj_ca_banking,false,http://pbs.twimg.com/profile_images/694621709182210049/hNNQhIAO_normal.jpg,https://pbs.twimg.com/profile_banners/56250594/1454445697,http://abs.twimg.com/images/themes/theme1/bg.png,344,288,0,0,0,0,2021-11-06T21:45:45.000-07:00
1457101972608192512,1457101972608192512,2021-11-06T21:45:56.000-07:00,"","","","","Career tip for landing jobs like 'Researcher in Device Communication' in #Lund, NV. Go on informational interviews. The best way to get a meeting with a hiring manager is to ask for an informational meeting. #IT","['Lund', 'IT']","",113266457,TMJ-NV IT Jobs,tmj_NV_it,false,http://pbs.twimg.com/profile_images/704054066486255616/DoI7IS6r_normal.jpg,https://pbs.twimg.com/profile_banners/113266457/1456694546,http://abs.twimg.com/images/themes/theme1/bg.png,319,249,0,0,0,0,2021-11-06T21:45:56.000-07:00
1457102520799563777,1457102520799563777,2021-11-06T21:48:07.000-07:00,"","","",['https://cvs.jobs/300w3s9'],"We're hiring! Click to apply: Pharmacy Technician - https://t.co/gfFpHPt8vF #Florence, SC #cvspharmtech","['Florence', 'cvspharmtech']","",128001553,TMJ-SC Pharm. Jobs,tmj_SC_pharm,false,http://pbs.twimg.com/profile_images/703570962835337216/D5MEgSwV_normal.jpg,https://pbs.twimg.com/profile_banners/128001553/1456579365,http://abs.twimg.com/images/themes/theme1/bg.png,272,257,0,0,0,0,2021-11-06T21:48:07.000-07:00
1457102529771212808,1457102529771212808,2021-11-06T21:48:09.000-07:00,"","","",['https://relode.co/TWTX4YE'],Great opportunity for Digital Marketing Strategist in Remote #hiring https://t.co/aCzBPDzaQf via @relodetweets #hiring #remotejobs,"['hiring', 'hiring', 'remotejobs']",['RelodeTweets'],2460446502,Gevonna Williams,GevonnaWilliams,false,http://pbs.twimg.com/profile_images/1431819193368948736/l1mPnaqK_normal.jpg,"",http://abs.twimg.com/images/themes/theme1/bg.png,32,101,0,0,0,0,2021-11-06T21:48:09.000-07:00
1457102543562199047,1457102543562199047,2021-11-06T21:48:12.000-07:00,"","","","","@turturin And if what you're hiring for is diversity of opinion (because of its well-known advantages in a business environment) then yeah, you probably should try bringing something else to the table.","",['turturin'],336557376,Kerriodos,Kerriodos,false,http://pbs.twimg.com/profile_images/1397340589478326276/tI6uB-V6_normal.jpg,https://pbs.twimg.com/profile_banners/336557376/1431207600,http://abs.twimg.com/images/themes/theme1/bg.png,547,440,0,0,0,0,2021-11-06T21:48:12.000-07:00
1457102560121135105,1457102560121135105,2021-11-06T21:48:16.000-07:00,"","","","","We're hiring in #Tigard, OR! Click the link in our bio to apply to this job and more: Sales Associate at ACE Cash Express #CustomerService","['Tigard', 'CustomerService']","",21730093,TMJ - PDX Sales Jobs,tmj_pdx_sales,false,http://pbs.twimg.com/profile_images/668467478461198336/CTjbWX7B_normal.jpg,https://pbs.twimg.com/profile_banners/21730093/1448210042,http://abs.twimg.com/images/themes/theme1/bg.png,416,263,0,0,0,0,2021-11-06T21:48:16.000-07:00
1457102604110991361,1457102604110991361,2021-11-06T21:48:27.000-07:00,"","","","","Want to work at Fresenius Medical Care? We're hiring in Bryan, OH! Click the link in our bio for details on this job and more: Travel Dialysis Registered Nurse Acute RN- Bryan TX #Dialysis #RN","['Dialysis', 'RN']","",66473306,TMJ-OH Nursing Jobs,tmj_oh_nursing,false,http://pbs.twimg.com/profile_images/668192845556137984/nzZcsQSZ_normal.jpg,https://pbs.twimg.com/profile_banners/66473306/1448144565,http://abs.twimg.com/images/themes/theme1/bg.png,294,201,0,0,0,0,2021-11-06T21:48:27.000-07:00
1457102757161226244,1457102757161226244,2021-11-06T21:49:03.000-07:00,"","","","",@DigitalPatriot0 @KenPaxtonTX I think that’ll be a tougher one to fight considering the terrible legal precedent for discriminatory practices w federal hiring. Glad to strike this OSHA rule down immediately so our fed contractors have the option of seeking work in the private sector if big gov wins,"","['DigitalPatriot0', 'KenPaxtonTX']",11862562,Corinne Clark Barron,corinnec,false,http://pbs.twimg.com/profile_images/1267880125712019456/UDWgOO3e_normal.jpg,https://pbs.twimg.com/profile_banners/11862562/1398440032,http://abs.twimg.com/images/themes/theme12/bg.gif,26403,28160,0,0,0,0,2021-11-06T21:49:03.000-07:00
1457103026997510144,1457103026997510144,2021-11-06T21:50:07.000-07:00,"","","","","Career tip for landing jobs like 'Pharmacy Technician' in Dothan, AL. Go on informational interviews. The best way to get a meeting with a hiring manager is to ask for an informational meeting. #cvspharmtech #pharmtech","['cvspharmtech', 'pharmtech']","",114937031,TMJ-AL Pharm. Jobs,tmj_AL_pharm,false,http://pbs.twimg.com/profile_images/703384723825958913/HAyhxBhm_normal.jpg,https://pbs.twimg.com/profile_banners/114937031/1456534962,http://abs.twimg.com/images/themes/theme1/bg.png,267,258,0,0,0,0,2021-11-06T21:50:07.000-07:00
1457103069850787841,1457103091740839938,2021-11-06T21:50:23.000-07:00,"","","",['https://relode.co/QZH9AYE'],Great opportunity for Remote Enrollment Specialist in Remote #hiring https://t.co/WT6IhRXwoS via @relodetweets #hiring #remotejobs,"['hiring', 'hiring', 'remotejobs']",['RelodeTweets'],2460446502,Gevonna Williams,GevonnaWilliams,false,http://pbs.twimg.com/profile_images/1431819193368948736/l1mPnaqK_normal.jpg,"",http://abs.twimg.com/images/themes/theme1/bg.png,32,101,0,0,0,1,2021-11-06T21:50:18.000-07:00
1457103107150659592,1457103107150659592,2021-11-06T21:50:27.000-07:00,"","","","","Want to land a job like 'Clinical Coordinator' at Fresenius Medical Care? Applicant tracking systems look for specific keywords. Use the right keywords and get your resume in front of the hiring manager. #Nursing #Waianae, HI","['Nursing', 'Waianae']","",22873458,TMJ-HI Nursing Jobs,tmj_hi_nursing,false,http://pbs.twimg.com/profile_images/695346771141095426/w_EvP90P_normal.jpg,https://pbs.twimg.com/profile_banners/22873458/1454618565,http://abs.twimg.com/images/themes/theme1/bg.png,323,201,0,0,0,0,2021-11-06T21:50:27.000-07:00
1457103107909844992,1457103107909844992,2021-11-06T21:50:27.000-07:00,"","","","","We're hiring in #Washington, DC! Click the link in our bio to apply to this job and more: Process Improvement Analyst at SAIC #ProjectMgmt","['Washington', 'ProjectMgmt']","",113161375,TMJ-VAA IT Jobs,tmj_VAA_it,false,http://pbs.twimg.com/profile_images/703923289240924160/lYh-NWac_normal.jpg,https://pbs.twimg.com/profile_banners/113161375/1456663366,http://abs.twimg.com/images/themes/theme1/bg.png,361,239,0,0,0,0,2021-11-06T21:50:27.000-07:00
1457103148904947713,1457103148904947713,2021-11-06T21:50:37.000-07:00,"","","","","Remedy Intelligent Staffing is hiring in #CedarRapids, IA! Click the link in our bio to apply: Forklift Driver #Driver","['CedarRapids', 'Driver']","",74071418,TMJ-IAR Labor Jobs,tmj_iar_labor,false,http://pbs.twimg.com/profile_images/697027593787219970/6CRDsnJc_normal.jpg,https://pbs.twimg.com/profile_banners/74071418/1455019305,http://abs.twimg.com/images/themes/theme1/bg.png,209,207,0,0,0,0,2021-11-06T21:50:37.000-07:00
1457103238050635781,1457103238050635781,2021-11-06T21:50:58.000-07:00,"","","","","SAIC is hiring in #Tampa, FL! Click the link in our bio to apply: Senior Network Infrastructure Engineer #ProjectMgmt","['Tampa', 'ProjectMgmt']","",23696546,TMJ-TPA IT PM Jobs,tmj_tpa_itpm1,false,http://pbs.twimg.com/profile_images/675425416484487168/qfsB5b9j_normal.jpg,https://pbs.twimg.com/profile_banners/23696546/1449868945,http://abs.twimg.com/images/themes/theme1/bg.png,235,147,0,0,0,0,2021-11-06T21:50:58.000-07:00
