org_id,samp_id,samp_datetime,org_url,org_media_url,org_media_type,org_attached_links,org_text,org_hashtags,org_user_metions,user_id,user_name,user_screen_name,user_verified,user_profile_image_url,user_profile_banner_url,user_profile_background_image_url,user_followers_count,user_friends_count,org_favorite_count,org_quote_count,org_reply_count,org_retweet_count,org_datetime
1455781081500712965,1455781081500712965,2021-11-03T06:17:11.000-07:00,"","","",['http://Roblox.com/groups/3063855/Designer-Bros#!/store'],@RobotzR https://t.co/RTmzWtqgyo Join Designer Bros production team by Blackhawk Studios today! NOW HIRING/Taking Portfolios for: Low-end scripter+builder and animators. Hiring YouTube personalities now as well!,"",['RobotzR'],1453928116376588294,Trevor Wilson,BHStudios2021,false,http://pbs.twimg.com/profile_images/1455393616210194433/mjmT6UuG_normal.png,https://pbs.twimg.com/profile_banners/1453928116376588294/1635804184,"",3,6,0,0,0,0,2021-11-03T06:17:11.000-07:00
1455783521314693120,1455783521314693120,2021-11-03T06:26:53.000-07:00,"","","","","@Take3Tylenol Russia-gate is far more reaching than the Steele dossier. Hiring an independent agency to conduct an investigation on a political opponent is one thing. Colluding with foreign governments (&amp; wikileaks) to sway an election is an entirely different thing, btcute attempt at a gotcha","",['Take3Tylenol'],543823985,Marc Elias stan account (get vaxcinated)🤘,1CourtneyGannon,false,http://pbs.twimg.com/profile_images/580465515648417792/DcE29O2h_normal.jpg,https://pbs.twimg.com/profile_banners/543823985/1503510459,http://abs.twimg.com/images/themes/theme1/bg.png,305,1313,0,0,0,0,2021-11-03T06:26:53.000-07:00
1455783755633725447,1455783755633725447,2021-11-03T06:27:49.000-07:00,"","","",['https://cms.kdischool.ac.kr/image/57596d72-085d-4f16-9e26-0d2868806f7c.pdf'],"We are hiring! TT positions in 1) environ policy, 2) social &amp; welfare policy, 3) political economy of development, 4) dev econ, and 5) public admin. Great research environment, awesome colleagues, &amp; a highly international student body. For more info, see: https://t.co/qdKT8losY4","","",181775046,Inbok Rhee,inbok_rhee,false,http://pbs.twimg.com/profile_images/1182894486399045633/EQOnaAqA_normal.jpg,https://pbs.twimg.com/profile_banners/181775046/1570965020,http://abs.twimg.com/images/themes/theme1/bg.png,510,987,0,0,0,0,2021-11-03T06:27:49.000-07:00
1455783962786230277,1455784317897039873,2021-11-03T06:30:03.000-07:00,"","","",['https://bit.ly/3BFyJbS'],"Want to work at UCF Lake Nona Medical Center? We're hiring in Orlando, FL! Click for details: https://t.co/UJ8lYXF6IC #Emergency #ER","['Emergency', 'ER']","",1217186585030135808,HCANursingJobs,HCANursingJobs,false,http://pbs.twimg.com/profile_images/1217188138856206347/EJgNQwEr_normal.jpg,https://pbs.twimg.com/profile_banners/1217186585030135808/1581533500,"",1519,113,0,0,0,1,2021-11-03T06:28:38.000-07:00
1455784319977345024,1455784319977345024,2021-11-03T06:30:03.000-07:00,"","","",['https://startup.jobs/closeplan-customer-success-manager-peopleai-2575792'],.@ppl_ai is growing! 💪  Hiring a ClosePlan Customer Success Manager (Toronto) https://t.co/J9Yug4hbL5,"",['ppl_ai'],784795003977625600,⛑ Support Startup Jobs,AllSupportJobs,false,http://pbs.twimg.com/profile_images/1000729103186751489/9HmcqEdC_normal.jpg,https://pbs.twimg.com/profile_banners/784795003977625600/1527427785,http://abs.twimg.com/images/themes/theme1/bg.png,934,10,0,0,0,0,2021-11-03T06:30:03.000-07:00
1455784441402380303,1455784441402380303,2021-11-03T06:30:32.000-07:00,https://twitter.com/HiresGulf/status/1455784441402380303/photo/1,['http://pbs.twimg.com/media/FDP8M-GWQAAQDPB.jpg'],['photo'],"['https://www.hiresgulf.com/job?jobId=4637', 'http://HiresGulf.com']","Urgent Hiring: SOCIAL MEDIA SPECIALIST (UAE NATIONAL PREFERRED) - ABU DHABI, UAE||Apply Now: https://t.co/3oySvSMw2v||For more career options register with https://t.co/AmZOhs9BPd today!|#emiratisation #emirati #UAE #AbuDhabi #socialmedia #Hiring #JobSeekers https://t.co/FUfVF3NNst","['emiratisation', 'emirati', 'UAE', 'AbuDhabi', 'socialmedia', 'Hiring', 'JobSeekers']","",1293600167258726401,HiresGulf,HiresGulf,false,http://pbs.twimg.com/profile_images/1294510647053627395/TbmgLrFF_normal.jpg,https://pbs.twimg.com/profile_banners/1293600167258726401/1598429552,"",1541,2270,0,0,0,0,2021-11-03T06:30:32.000-07:00
1455784449761763330,1455784449761763330,2021-11-03T06:30:34.000-07:00,"","","",['https://www.jobs2careers.com/click.php?jid=42ffc7a2574db4ee7a03231ee&ri=94c94135d4ce47bdab08379ac4afa9a1&job_loc=Los+Angeles%2CCA&q=&spl=XlR4KXFDVdjAIg4e%3ANm7pATOLNpRNc6LJztFrJQ%3D%3D%3Am3%2B4t7PkVw4jr2B%2FRxnyWqaLDdIa3%2FQQpDQhvPse2hdz55PDuuzBIcT3sft7837gjxsO%2FqDs2Q%3D%3D&encrypt=0&l=Los+Angeles%2CCA'],Intuit is hiring in Los Angeles for a Work From Home - Experienced Tax Preparer. Click now to apply! |https://t.co/BJnKEM7ozI||#losangeles #LA #vacancy #jobinterview #hiring #jobseeker,"['losangeles', 'LA', 'vacancy', 'jobinterview', 'hiring', 'jobseeker']","",1287241305530064905,socal_jobs_bot,bot_socal,false,http://pbs.twimg.com/profile_images/1287246208491126784/bLWIFYa0_normal.jpg,https://pbs.twimg.com/profile_banners/1287241305530064905/1595738525,"",4,0,0,0,0,0,2021-11-03T06:30:34.000-07:00
1455785143881371648,1455785820518969345,2021-11-03T06:36:01.000-07:00,https://twitter.com/EOVDigital/status/1455770563784347651/photo/1,['http://pbs.twimg.com/media/FDPvnJ9XoAIupfa.jpg'],['photo'],"",Before we break for #Diwali time to spread the word ' Looking for Innovators to contribute as Software engineers'. Please reach out to kiran.mahajan@embarkingonvoyage.com||#Punejob #hiring #softwareengineers #developers #nodejs #dotnetcore #angular #reac… https://t.co/1G90kaRmrj,"['Diwali', 'Punejob', 'hiring', 'softwareengineers', 'developers', 'nodejs', 'dotnetcore', 'angular', 'reac']","",22117824,Mandar Thosar,mandarthosar,false,http://pbs.twimg.com/profile_images/83830604/mandarcutout_normal.jpg,https://pbs.twimg.com/profile_banners/22117824/1558422186,http://abs.twimg.com/images/themes/theme1/bg.png,3035,3074,1,0,0,4,2021-11-03T06:33:20.000-07:00
1455785219051581444,1455788297872191490,2021-11-03T06:45:52.000-07:00,"","","","","Want to work at Mastercard? We're hiring in #Pune, MH! Click the link in our bio for details on this job and more: Java Micro services Architecture #IT","['Pune', 'IT']","",40949464,TMJ-INP Jobs,tmj_inp_jobs,false,http://pbs.twimg.com/profile_images/691133897850036225/zzqzAn7m_normal.jpg,https://pbs.twimg.com/profile_banners/40949464/1453614138,http://abs.twimg.com/images/themes/theme1/bg.png,932,259,0,0,0,1,2021-11-03T06:33:38.000-07:00
1455785478834331650,1455785478834331650,2021-11-03T06:34:39.000-07:00,"","","",['https://ift.tt/3bAoQBE'],#hiring for Accountant in Dubai #UAE||Apply Now and comment below!! https://t.co/5Zh8ieVRpQ||#dubaijobs #uaejobs #expo2020 #abudhabijobs #,"['hiring', 'UAE', 'dubaijobs', 'uaejobs', 'expo2020', 'abudhabijobs']","",1230589001024901120,Trendy Career,TrendyCareer,false,http://pbs.twimg.com/profile_images/1230589396258299905/JwjrbAPJ_normal.jpg,https://pbs.twimg.com/profile_banners/1230589001024901120/1582230578,"",7,74,0,0,0,0,2021-11-03T06:34:39.000-07:00
1455785928295948290,1455785928295948290,2021-11-03T06:36:27.000-07:00,"","","","['https://is.gd/buzdaZp', 'https://is.gd/2111973452313']",The platform In-Earn is hiring part time staff. You can make more money in a daily basis. Excellent employees can earn over 5000KSh per day. https://t.co/HXy25CaLop|  https://t.co/xxS2aHWqhV| via @In-Earn,"",['in'],1380796764458995720,Green Maurice,GreenMaurice5,false,http://pbs.twimg.com/profile_images/1380796995858743297/wVgVarcm_normal.jpg,"","",4,5,0,0,0,0,2021-11-03T06:36:27.000-07:00
1455786230180827141,1455786230180827141,2021-11-03T06:37:39.000-07:00,"","","",['https://bit.ly/3GVTrIC'],We're hiring! Read about our latest job opening here: Defensive Driving Instructor - https://t.co/DvZVwx9ZWG #Education #highered,"['Education', 'highered']","",773979231147716608,Jobs at OSU-OKC,JobsatOSUOKC,false,http://pbs.twimg.com/profile_images/895019189974450176/Vl4KV0Gb_normal.jpg,https://pbs.twimg.com/profile_banners/773979231147716608/1473369746,http://abs.twimg.com/images/themes/theme1/bg.png,92,39,0,0,0,0,2021-11-03T06:37:39.000-07:00
1455786832700981255,1455786832700981255,2021-11-03T06:40:02.000-07:00,"","","",['https://startup.jobs/operations-associate-process-design-strategy-remote-oscar-2575211'],"Oscar Insurance is growing! 💪  Hiring an Operations Associate, Process Design &amp; Strategy...  https://t.co/pesU00w8xS","","",784785524024311809,🎨 Designer Startup Jobs,AllDesignJobs,false,http://pbs.twimg.com/profile_images/1000721801142521857/K_BQN0EO_normal.jpg,https://pbs.twimg.com/profile_banners/784785524024311809/1527425868,http://abs.twimg.com/images/themes/theme1/bg.png,2641,10,0,0,0,0,2021-11-03T06:40:02.000-07:00
1455786904994025476,1455787000485789697,2021-11-03T06:40:42.000-07:00,"","","",['https://bit.ly/2ZTqNqL'],We're hiring! Click to apply: Clinical Nurse B-ED - https://t.co/WWZVL0xKc5 #RN #NurseLife,"['RN', 'NurseLife']","",606543491,Loma Linda Careers,LLU_Careers,false,http://pbs.twimg.com/profile_images/843898125857177601/Q7Rx93FF_normal.jpg,https://pbs.twimg.com/profile_banners/606543491/1490126202,http://abs.twimg.com/images/themes/theme1/bg.png,857,121,0,0,0,1,2021-11-03T06:40:20.000-07:00
1455787416090923008,1455787416090923008,2021-11-03T06:42:21.000-07:00,"","","",['https://bit.ly/3waJjqk'],5 Important Packing and Moving Tips that Will Breeze Away Your Stress||If you are looking forward to hiring the services of Packers and Movers in Greater Noida.||🔗 Click Here For Tips: https://t.co/X8v9JsL93q|☎ Toll Free: 1800-102-9655|#Shifting #Movers #tips #Noida,"['Shifting', 'Movers', 'tips', 'Noida']","",413897467,LogisticMart,LogisticMart,false,http://pbs.twimg.com/profile_images/1031426285128568832/Ghiprtf9_normal.jpg,https://pbs.twimg.com/profile_banners/413897467/1614916935,http://abs.twimg.com/images/themes/theme15/bg.png,1910,3354,0,0,0,0,2021-11-03T06:42:21.000-07:00
1455788162660376579,1455788162660376579,2021-11-03T06:45:19.000-07:00,"","","","","@irumanyika @pmukasaofficial @URAuganda Is sharing the station with you, really important mr @irumanyika I know you guys can do better it’s a matter of hiring the best not The “Whose are you”","","['irumanyika', 'pmukasaofficial', 'URAuganda', 'irumanyika']",1454217570899447813,gracious kasigwa,Uganda_our,false,http://pbs.twimg.com/profile_images/1454218596096389122/DGFG8LwM_normal.jpg,"","",0,2,0,0,0,0,2021-11-03T06:45:19.000-07:00
1455788238677946371,1455788238677946371,2021-11-03T06:45:37.000-07:00,"","","",['https://bit.ly/31sfkPt'],Search Engine Journal Is Hiring A Paid Media Editor - Search Engine Journal https://t.co/4crmxf8TXv,"","",46295487,Bloomerang Solutions,Bloomerang_,false,http://pbs.twimg.com/profile_images/905860388805382144/Yr5tV_L3_normal.jpg,https://pbs.twimg.com/profile_banners/46295487/1513006891,http://abs.twimg.com/images/themes/theme13/bg.gif,1255,1606,0,0,0,0,2021-11-03T06:45:37.000-07:00
1455789120287125505,1455789142172966913,2021-11-03T06:49:13.000-07:00,"","","",['http://app.jobvite.com/m?3EKY7mwk'],Come and join the undisputed leader in the automotive reconditioning services market in North America. NOW HIRING!|#automotive #bodyshop #paint #PDR #dent #hiring #autobody #dentrepair #wheels ||https://t.co/Yqe1y7cbw0 #job,"['automotive', 'bodyshop', 'paint', 'PDR', 'dent', 'hiring', 'autobody', 'dentrepair', 'wheels', 'job']","",1339023626771849216,DentWizJim,DentWizJim,false,http://pbs.twimg.com/profile_images/1455641342986620930/pT0Doh7V_normal.jpg,https://pbs.twimg.com/profile_banners/1339023626771849216/1619212707,"",326,730,0,0,0,1,2021-11-03T06:49:08.000-07:00
1455790397142167557,1455790397142167557,2021-11-03T06:54:12.000-07:00,"","","",['https://bit.ly/3w94Z6l'],"Seeking all #healthcare professionals dedicated to enhancing the lives of older adults! Senior Helpers is growing, and we are currently hiring for a Seeking Highly Skilled CNA/Caregiver for... in #Lafayette, LA. Find your next opportunity now! https://t.co/12O5MIJ4HB","['healthcare', 'Lafayette']","",1306284430978355207,Senior Helpers Jobs,JobsHelpers,false,http://pbs.twimg.com/profile_images/1306284980297965569/WpJepUqy_normal.jpg,https://pbs.twimg.com/profile_banners/1306284430978355207/1616610560,"",1101,176,0,0,0,0,2021-11-03T06:54:12.000-07:00
1455790478146740227,1455790478146740227,2021-11-03T06:54:31.000-07:00,"","","","","BCD Travel is hiring in #Barcelona, CT! Click the link in our bio to apply: Travel Consultant #Hospitality","['Barcelona', 'Hospitality']","",33800573,TMJ-SPN HRTA Jobs,tmj_spn_hrta,false,http://pbs.twimg.com/profile_images/687947684162830340/MGPCTRfe_normal.jpg,https://pbs.twimg.com/profile_banners/33800573/1452854485,http://abs.twimg.com/images/themes/theme1/bg.png,103,89,0,0,0,0,2021-11-03T06:54:31.000-07:00
1455790532966420480,1455790532966420480,2021-11-03T06:54:44.000-07:00,"","","","",@MathewsNtanzi Bafo it was a big mistake hiring this fellow in the first place,"",['MathewsNtanzi'],4863722375,BOB,malukaguguletho,false,http://pbs.twimg.com/profile_images/1452558042369871878/2jgaDNO__normal.jpg,"","",467,1973,0,0,0,0,2021-11-03T06:54:44.000-07:00
1455790638616780804,1455790638616780804,2021-11-03T06:55:10.000-07:00,"","","",['https://lnkd.in/eubC5uu3'],I’m #hiring for an open role. Know anyone who would be a good fit? https://t.co/n9HZwmTDvY,['hiring'],"",125685032,Ananda Hota,anandahota,false,http://pbs.twimg.com/profile_images/1237391537866027016/JTolu2f9_normal.jpg,https://pbs.twimg.com/profile_banners/125685032/1583852168,http://abs.twimg.com/images/themes/theme1/bg.png,32,71,0,0,0,0,2021-11-03T06:55:10.000-07:00
1194504209154002946,1455775358716768259,2021-11-03T05:54:27.000-07:00,https://twitter.com/meghavimehta1/status/1194504209154002946/photo/1,['http://pbs.twimg.com/media/EJO7PbdUcAAasyD.jpg'],['photo'],"","Dear #Developer,||We are #hiring Node JS Developer who has experience between 0.5-4 years. If you or anyone in your contact is looking for the great #opportunity, you can share your CV on hr@ansibytecode.com. For more details you can reach us on +91 97243 14589. ||#vacancies https://t.co/ygTB7kiovf","['Developer', 'hiring', 'opportunity', 'vacancies']","",1192791233774505984,meghavi mehta,meghavimehta1,false,http://pbs.twimg.com/profile_images/1192791756711940096/RZzyCZvE_normal.jpg,"","",26,49,3,0,0,4,2019-11-13T06:36:10.000-08:00
1408508488540737536,1455763554162905092,2021-11-03T05:07:32.000-07:00,https://twitter.com/FidelityJobs/status/1408508488540737536/photo/1,['http://pbs.twimg.com/media/E4wGPCWWYAMGHjI.jpg'],['photo'],['http://adtrk.tw/tp/rj6-0y24z_I-K'],We’re hiring Principal Engineers to join our #FidelityIreland team. Learn more about our open roles and apply today: https://t.co/6atu5l8DFD |#FidelityAssociate #HiringNow #TechJobs #FindYourFidelity https://t.co/4MoL06bYv2,"['FidelityIreland', 'FidelityAssociate', 'HiringNow', 'TechJobs', 'FindYourFidelity']","",395511307,FidelityJobs,FidelityJobs,true,http://pbs.twimg.com/profile_images/1357702260634050574/lUfSZjTr_normal.png,https://pbs.twimg.com/profile_banners/395511307/1619623591,http://abs.twimg.com/images/themes/theme1/bg.png,7031,810,28,4,2,2,2021-06-25T19:32:47.000-07:00
1451210118037528580,1455786329485164547,2021-11-03T06:38:02.000-07:00,"","","","","We're hiring 1 scholar immediately. Must have previous experience, must maintain MMR above 1500 with a pure AAP team. Comment below with proof of your previous MMR to apply 👇||#AxieInfinity #axieinfinityscholarship #AxieScholarship #AxieScholar #axiescholarshipprogram #Axie","['AxieInfinity', 'axieinfinityscholarship', 'AxieScholarship', 'AxieScholar', 'axiescholarshipprogram', 'Axie']","",1446028888706928641,InfinityFam,InfinityFam2,false,http://pbs.twimg.com/profile_images/1446029789945425921/eWz7y23x_normal.jpg,https://pbs.twimg.com/profile_banners/1446028888706928641/1633595343,"",184,289,36,0,23,21,2021-10-21T15:33:48.000-07:00
1451652355284291584,1455767390193524738,2021-11-03T05:22:47.000-07:00,https://twitter.com/Nature_Fire/status/1451652355284291584/photo/1,['http://pbs.twimg.com/media/FCVNOsqUcAUN0wF.jpg'],['photo'],['http://nature.org/careers'],Our N. America Fire program is hiring an Associate Director of Communications. https://t.co/tKEol7NPM9 Job #50476.  Please spread the word. #goodfire https://t.co/13gRhwLUPf,['goodfire'],"",16275011,Conservancy Fire,Nature_Fire,false,http://pbs.twimg.com/profile_images/799380441916526592/nTHYM61s_normal.jpg,https://pbs.twimg.com/profile_banners/16275011/1498078988,http://abs.twimg.com/images/themes/theme10/bg.gif,4787,1606,18,0,0,8,2021-10-22T20:51:06.000-07:00
1452672801366630400,1455785249451823111,2021-11-03T06:33:45.000-07:00,"","","","","'Nothing We do is more important than hiring and developing people. At the end of the day, you bet on people, not on strategies.'|              |                           ~ Lawrence Bossidy|#NPC_INDIA_GOV |@NPC_INDIA_GOV |#quote","['NPC_INDIA_GOV', 'quote']",['NPC_INDIA_GOV'],783548897784434690,सत्य प्रकाश त्रिपाठी SATYA PRAKASH TRIPATHI,SPT_NPC,false,http://pbs.twimg.com/profile_images/1163838840659939330/7gqZIQaz_normal.jpg,https://pbs.twimg.com/profile_banners/783548897784434690/1568125507,http://abs.twimg.com/images/themes/theme1/bg.png,420,228,19,0,0,23,2021-10-25T16:25:59.000-07:00
1453172105747464194,1455764417161822217,2021-11-03T05:10:58.000-07:00,https://twitter.com/bpacnz/status/1453172105747464194,['http://pbs.twimg.com/media/FCq0KvNVIAcX_B2.jpg'],['photo'],['https://bpac.org.nz/medical-writer.aspx'],"We are hiring! We are looking for a Medical Writer to join our Publications team. If you are a health-related science graduate with a creative flair and superhero attitude, then we want to hear from you. More info here: https://t.co/N7uFhBnJuL||#medicalwriting #clinicaleducation https://t.co/MuH0Mnk3N8","['medicalwriting', 'clinicaleducation']","",801934054350147584,bpacnz,bpacnz,false,http://pbs.twimg.com/profile_images/823445686834208769/1EMg6-qr_normal.jpg,https://pbs.twimg.com/profile_banners/801934054350147584/1480032093,http://abs.twimg.com/images/themes/theme1/bg.png,207,22,2,1,0,2,2021-10-27T01:30:03.000-07:00
1453267504479019010,1455788380147564557,2021-11-03T06:46:11.000-07:00,https://twitter.com/TheChristieNHS/status/1453267504479019010,['http://pbs.twimg.com/ext_tw_video_thumb/1453267474309386249/pu/img/EutdKi1oGn8kGZwJ.jpg'],['video'],['https://bit.ly/3C002ig'],We asked our nurses what it's like to work here at The Christie. 👇 ||Join us at our virtual nursing career and recruitment event to find out more about the exciting opportunities available to work and develop. ||📅 11 November|⌚ 5pm|🎟️  https://t.co/YpqdYxnGa2 https://t.co/clXmmpqzqV,"","",437421261,TheChristieNHS,TheChristieNHS,true,http://pbs.twimg.com/profile_images/885538944959614978/tLkvqnbk_normal.jpg,https://pbs.twimg.com/profile_banners/437421261/1589284427,http://abs.twimg.com/images/themes/theme1/bg.png,16759,1408,5,1,0,4,2021-10-27T07:49:08.000-07:00
1454126150570102784,1455780282448203777,2021-11-03T06:14:01.000-07:00,https://twitter.com/gloriajoselyne_/status/1454126150570102784,"","","",. @owishemwe this is the other workplace we wanted to join. time to strategize 🤝,"",['Owishemwe'],1377308843487678467,g,gloriajoselyne_,false,http://pbs.twimg.com/profile_images/1454532290659459074/WsTlc012_normal.jpg,https://pbs.twimg.com/profile_banners/1377308843487678467/1635657590,"",618,244,3,0,1,0,2021-10-29T16:41:05.000-07:00
1454146498447376389,1455774997440434179,2021-11-03T05:53:01.000-07:00,https://twitter.com/bcachievement/status/1454146498447376389,['http://pbs.twimg.com/media/FC4qYQKVUAMrM7g.jpg'],['photo'],['https://bit.ly/3vtXjcA'],"Congratulations Tsawwassen Shuttles Inc: Indigenous Business Awardee of the Year 11+ person enterprise. TSI honours its roots by hiring locally, offering training &amp; equity options to employees &amp; supporting work of local organizations. #ShineTheLightBC https://t.co/kjEsogETOA https://t.co/MVIguHcATF",['ShineTheLightBC'],"",140594995,BC Achievement Fdn,bcachievement,false,http://pbs.twimg.com/profile_images/1123046962587099136/PXTp0-PK_normal.png,https://pbs.twimg.com/profile_banners/140594995/1556590836,http://abs.twimg.com/images/themes/theme1/bg.png,1724,3440,7,0,0,3,2021-10-29T18:01:56.000-07:00
1455120082359701506,1455765306127917058,2021-11-03T05:14:30.000-07:00,https://twitter.com/lpc_progression/status/1455120082359701506/photo/1,['http://pbs.twimg.com/media/FDGf8BdWQAYKEc2.jpg'],['photo'],['https://www.thelpc.uk/news/programme-manager-vacancy'],"📢WE'RE HIRING! ||Great relationship building &amp; communication skills?|Committed to improving the working lives of Londoners?| |We're looking for a new Programme Manager to lead the delivery of our SME support, helping businesses take on new apprentices.||https://t.co/y0WZGgM4KY https://t.co/1aTHFfyqGy","","",1212787975894863872,London Progression Collaboration,lpc_progression,false,http://pbs.twimg.com/profile_images/1223199955222958080/OH12HNyB_normal.png,https://pbs.twimg.com/profile_banners/1212787975894863872/1580468865,"",277,129,4,0,0,4,2021-11-01T10:30:37.000-07:00
1455437065987006467,1455768024686817282,2021-11-03T05:25:18.000-07:00,"","","",['https://cryptocurrencyjobs.co/startups/nervos-network/'],.@NervosNetwork is a blockchain platform for universal applications.||Now hiring remote for the following roles!||⚡️ Business Development Associate - DeFi|⚡️ Developer Relations|⚡️ Marketing Specialist||Apply now 👇|https://t.co/lNs2RDDtqT,"",['NervosNetwork'],919314949909958658,Cryptocurrency Jobs,jobsincrypto,false,http://pbs.twimg.com/profile_images/999432230567997440/jFuy4WRo_normal.jpg,"","",12773,522,81,0,3,18,2021-11-02T07:30:11.000-07:00
1455442185684389888,1455761100146978816,2021-11-03T04:57:47.000-07:00,https://twitter.com/WAAW_Foundation/status/1455442185684389888/photo/1,['http://pbs.twimg.com/media/FDLE1sjXEAgjPq9.jpg'],['photo'],['http://bit.ly/WAAW_DMA'],We are hiring a Full-Time Media and Marketing Associate to join the WAAW Foundation family in Abuja. Apply with this link: https://t.co/aFjpJwj1kZ||#waawfoundation #nowhiring #careers #jobs #jobopening #employment #hiringnow #jobopportunity #career #wearehiring #vacancy #jobalert https://t.co/cqpfSXsyrb,"['waawfoundation', 'nowhiring', 'careers', 'jobs', 'jobopening', 'employment', 'hiringnow', 'jobopportunity', 'career', 'wearehiring', 'vacancy', 'jobalert']","",716506086,WAAW Foundation,WAAW_Foundation,false,http://pbs.twimg.com/profile_images/1280430260027342848/RFvplJwt_normal.jpg,https://pbs.twimg.com/profile_banners/716506086/1594112554,http://abs.twimg.com/images/themes/theme6/bg.gif,2867,993,0,0,0,2,2021-11-02T07:50:32.000-07:00
1455448657164185604,1455762773762260992,2021-11-03T05:04:26.000-07:00,https://twitter.com/UN_CYPRUS/status/1455448657164185604/photo/1,['http://pbs.twimg.com/media/FDLK0NUXsAU5Awl.jpg'],['photo'],['https://unficyp.unmissions.org/jobs'],WE ARE HIRING! Are you interested in working with us? Check #UNFICYP's latest job opening for Driver (G3). Female candidates are strongly encouraged to apply. For more information visit our website: https://t.co/UHqTNFdigq https://t.co/u2WwqTNbOA,['UNFICYP'],"",413055301,UN Cyprus,UN_CYPRUS,true,http://pbs.twimg.com/profile_images/1336934311958867968/J3cQQOCU_normal.jpg,https://pbs.twimg.com/profile_banners/413055301/1634279638,http://abs.twimg.com/images/themes/theme1/bg.png,20663,702,14,0,1,5,2021-11-02T08:16:15.000-07:00
1455464463277101056,1455762810206568452,2021-11-03T05:04:35.000-07:00,https://twitter.com/IFDCnews/status/1455464463277101056/photo/1,['http://pbs.twimg.com/media/FDLZNmAXMAcbfW8.jpg'],['photo'],['https://ifdc.org/about-us/careers/'],"It’s not too late to #apply! We’re still #hiring for two positions at the IFDC #PilotPlant in Muscle Shoals, #Alabama. Visit our career portal for position requirements and to fill out your application today! ||https://t.co/7QMQ4xMwhp https://t.co/Ps8eWqySj2","['apply', 'hiring', 'PilotPlant', 'Alabama']","",125341608,IFDC,IFDCnews,true,http://pbs.twimg.com/profile_images/984124524177141761/05_pnf0Q_normal.jpg,https://pbs.twimg.com/profile_banners/125341608/1615409115,http://abs.twimg.com/images/themes/theme1/bg.png,15113,5095,3,0,0,4,2021-11-02T09:19:03.000-07:00
1455478639642955782,1455787087387561987,2021-11-03T06:41:03.000-07:00,"","","","['http://bit.ly/2DUsT9A', 'https://youtu.be/9bSaTeE5pT8']",Applications for our 2024 #TrainingContracts are now open. Watch our animation on how to apply and pick up some handy tips for the recruitment process. Start your journey towards becoming a #TraineeSolicitor today: https://t.co/KG4eE0W8Yp. Good luck!😀https://t.co/7VxHGrz64S,"['TrainingContracts', 'TraineeSolicitor']","",353095811,Irwin Mitchell Careers,IMCareers,false,http://pbs.twimg.com/profile_images/1174588965657153536/xr6MO7TA_normal.png,https://pbs.twimg.com/profile_banners/353095811/1621324233,http://abs.twimg.com/images/themes/theme1/bg.png,3008,561,37,3,0,30,2021-11-02T10:15:23.000-07:00
