org_id,samp_id,samp_datetime,org_url,org_media_url,org_media_type,org_attached_links,org_text,org_hashtags,org_user_metions,user_id,user_name,user_screen_name,user_verified,user_profile_image_url,user_profile_banner_url,user_profile_background_image_url,user_followers_count,user_friends_count,org_favorite_count,org_quote_count,org_reply_count,org_retweet_count,org_datetime
1440687362720219140,1451884947267067918,2021-10-23T12:15:20.000-07:00,https://twitter.com/NYCAnalytics/status/1440687362720219140/photo/1,['http://pbs.twimg.com/media/E_5ZhWqVQAwON77.jpg'],['photo'],"['https://on.nyc.gov/3lIhCQZ', 'https://on.nyc.gov/3hTboMZ']","We're not the experts on whether it's PSL season yet, but we can tell you that it's *hiring season* at MODA!||We now have TWO positions open - apply here:|Data Scientist 🔬 - https://t.co/OTIn5XxcCF|Data Engineer 🌉 - https://t.co/hL5EPA8kyB https://t.co/W3JeRjOQQr","","",850118292,NYC Mayor's Office of Data Analytics,NYCAnalytics,false,http://pbs.twimg.com/profile_images/378800000600334776/772494490e3eb0dd643bd0eb8ba6aaea_normal.jpeg,https://pbs.twimg.com/profile_banners/850118292/1569106914,http://abs.twimg.com/images/themes/theme1/bg.png,1866,118,6,2,0,4,2021-09-22T14:40:08.000-07:00
1445411333130817542,1451886992623538184,2021-10-23T12:23:28.000-07:00,"","","",['https://www.weareprimary.org/news/programme-assistant-kickstart-scheme'],"Are you 16-24 and on Universal Credit?||✨ We are hiring, come and join us! ✨||We’re recruiting a Programme Assistant through the Government #KickStart Scheme. ||For more information on how to apply, click the link below 👇||https://t.co/cDpqpwnTbO",['KickStart'],"",1381415107,Primary,WeArePrimary,false,http://pbs.twimg.com/profile_images/585053795882766336/vc6CCD1m_normal.jpg,https://pbs.twimg.com/profile_banners/1381415107/1619848860,http://abs.twimg.com/images/themes/theme1/bg.png,3446,1090,3,0,0,3,2021-10-05T15:31:30.000-07:00
1445959121300193280,1451879867427876864,2021-10-23T11:55:09.000-07:00,https://twitter.com/valensagency/status/1445959121300193280,"","",['https://docs.google.com/forms/d/e/1FAIpQLScnMjk2N7hQpUBmYquJIMrR7bnGhYZAh71wVTnu3JDo_kWT-g/viewform?usp=sf_link'],EDITOR APPLICATION FORM|https://t.co/KmQN26yaGd,"","",1414586455700115461,Valens Agency.,valensagency,false,http://pbs.twimg.com/profile_images/1429677630630944769/UtXeQzih_normal.jpg,https://pbs.twimg.com/profile_banners/1414586455700115461/1629696682,"",91,92,91,1,1,88,2021-10-07T03:48:13.000-07:00
1446547115044315137,1451866671359033349,2021-10-23T11:02:43.000-07:00,"","","",['https://arizona.csod.com/ux/ats/careersite/4/home/requisition/7199?c=arizona'],Come work with me! The @uazlibraries are hiring a Head of our Technology Strategy and Services (IT) department. This is a leadership position that reports to me and will help set priorities for the UA Libraries. Happy to talk to anyone interested! https://t.co/PkETqwzTad,"",['uazlibraries'],14077727,Sarah Shreeves,sshreeves,false,http://pbs.twimg.com/profile_images/3161392231/487de8f10fe8f9bb910e46effcbfb19a_normal.jpeg,https://pbs.twimg.com/profile_banners/14077727/1353446857,http://abs.twimg.com/images/themes/theme6/bg.gif,2581,1469,8,7,0,10,2021-10-08T18:44:42.000-07:00
1448167127446294529,1451877687866236934,2021-10-23T11:46:30.000-07:00,"","","","",Reading all your replies and responses on my Axie scholarship recruitment tweet and I am deeply overwhelmed with how many of you are looking for scholarships. I truly wish I could help all of you out - hopefully one day I will be in a position to do so 🙏,"","",1165892914293002240,Jolene Tiong,jolenetionggg,false,http://pbs.twimg.com/profile_images/1165893014868201472/rxHPrgnR_normal.jpg,"","",1179,73,273,2,61,91,2021-10-13T06:02:03.000-07:00
1448956212595335195,1451887279673389057,2021-10-23T12:24:36.000-07:00,https://twitter.com/SDCtrailers/status/1448956212595335195/photo/1,['http://pbs.twimg.com/media/FBu5_eRXMAEqkeO.jpg'],['photo'],['http://www.sdctrailers.com'],"We’re at the Rutledge Recruitment Fair in Meadowbank, Magherafelt today, if your in the area why not drop in for a chat about the wide range of career opportunities available at SDC Trailers.||https://t.co/CJuQtmo6gu||#recruitment #werehiring #teamSDC #careeropportunities https://t.co/vDynjB6Ude","['recruitment', 'werehiring', 'teamSDC', 'careeropportunities']","",274087783,SDC Trailers,SDCtrailers,false,http://pbs.twimg.com/profile_images/1212719402531065857/IKNXdYW-_normal.png,https://pbs.twimg.com/profile_banners/274087783/1578581569,http://abs.twimg.com/images/themes/theme1/bg.png,15592,16548,7,0,0,1,2021-10-15T10:17:36.000-07:00
1449703616302960640,1451881118655991815,2021-10-23T12:00:07.000-07:00,"","","",['https://www.gov.uk/apply-for-teacher-training'],"Wow! What a busy start to the recruitment year! Teaching is definitely trending, and rightly so! Get onto Apply https://t.co/cMdJzRs2RM and get your applications in to secure a place for Sep 2022. @getintoteaching","",['getintoteaching'],707180667558301696,ManchesterNexusSCITT,ManchesterSCITT,false,http://pbs.twimg.com/profile_images/773643247142989824/BfCb28fy_normal.jpg,https://pbs.twimg.com/profile_banners/707180667558301696/1630758744,http://abs.twimg.com/images/themes/theme1/bg.png,994,921,4,0,0,3,2021-10-17T11:47:30.000-07:00
1451170151580278787,1451878968383135745,2021-10-23T11:51:35.000-07:00,"","","","","Young professionals know the value of a mentally healthy workplace. They are looking for them. ||Businesses have an opportunity to improve recruitment, retention and productivity by creating workplace cultures and practices that support people to thrive.","","",4771799476,City Mental Health Alliance,City_MHA,false,http://pbs.twimg.com/profile_images/1412055913045712896/jriqrxQY_normal.jpg,https://pbs.twimg.com/profile_banners/4771799476/1567616708,"",2524,980,2,0,0,1,2021-10-21T12:55:00.000-07:00
1451190438522548225,1451866338083942400,2021-10-23T11:01:24.000-07:00,"","","",['https://getin4.com/job/rti-administrative-assistant-short-term-contract/'],Administrative #Jobs |RTI Administrative Assistant - Short Term Contract https://t.co/367EcBwLEK via @getin41 #JobSearch #IkoKaziKE #Hiring,"['Jobs', 'JobSearch', 'IkoKaziKE', 'Hiring']",['Getin41'],1329368040392241155,Getin4,Getin41,false,http://pbs.twimg.com/profile_images/1427199903390912517/eVXUIhI6_normal.jpg,https://pbs.twimg.com/profile_banners/1329368040392241155/1629106605,"",446,607,2,0,0,3,2021-10-21T14:15:37.000-07:00
1451286772776792084,1451886325062266884,2021-10-23T12:20:49.000-07:00,"","","",['https://pngtree.com/freepng/we-are-hiring-png-background-design-template_5482109.html?share=1'],We Are Hiring Png Background Design Template https://t.co/ZhicK5dIDC,"","",46612530,shazzadul,shazzadul,false,http://pbs.twimg.com/profile_images/1188554712892637189/02YT35RZ_normal.jpg,https://pbs.twimg.com/profile_banners/46612530/1552206563,http://abs.twimg.com/images/themes/theme9/bg.gif,1316,5003,1,0,0,1,2021-10-21T20:38:24.000-07:00
1451288087762399249,1451886514032365571,2021-10-23T12:21:34.000-07:00,"","","",['https://pngtree.com/freepng/we-are-hiring-png-background-image-design_5478758.html?share=1'],We Are Hiring Png Background Image Design https://t.co/edMmVCFRRK,"","",46612530,shazzadul,shazzadul,false,http://pbs.twimg.com/profile_images/1188554712892637189/02YT35RZ_normal.jpg,https://pbs.twimg.com/profile_banners/46612530/1552206563,http://abs.twimg.com/images/themes/theme9/bg.gif,1316,5003,1,0,0,1,2021-10-21T20:43:38.000-07:00
1451290449394626580,1451886545758158861,2021-10-23T12:21:41.000-07:00,"","","",['https://pngtree.com/freepng/we-are-hiring-png-background-design-template_5478753.html?share=1'],We Are Hiring Png Background Design Template https://t.co/yJeGn1k4lh,"","",46612530,shazzadul,shazzadul,false,http://pbs.twimg.com/profile_images/1188554712892637189/02YT35RZ_normal.jpg,https://pbs.twimg.com/profile_banners/46612530/1552206563,http://abs.twimg.com/images/themes/theme9/bg.gif,1316,5003,1,0,0,1,2021-10-21T20:53:01.000-07:00
1451332984720789508,1451885502492291076,2021-10-23T12:17:33.000-07:00,"","","",['http://essic.umd.edu/joom2/index.php/employment/3092-postdoc-for-coupled-atmosphericoceanicsea-ice-modeling-and-data-assimilation-in-the-noaa-ufs'],"If sea ice and ocean modeling is more your thing, I am also hiring a postdoc to work with my group on coupled data assimilation.||Postdoc for coupled atmospheric/oceanic/sea-ice modeling and data assimilation in the NOAA UFS https://t.co/hEsJLi9WDG","","",1445788235595071499,Jon Poterjoy,jpoterjoy,false,http://pbs.twimg.com/profile_images/1445804401982152711/EmNPDll__normal.jpg,"","",71,96,16,2,0,12,2021-10-21T23:42:02.000-07:00
1451360531084840961,1451885041647190016,2021-10-23T12:15:43.000-07:00,https://twitter.com/EunwooVoteTeam/status/1451360531084840961/photo/1,['http://pbs.twimg.com/media/FCREteoVgAAxA6F.jpg'],['photo'],"",[AAA 2021 VOTERS RECRUITMENT]||📢We’re looking for more active voters. Please DM @EunwooVoteTeam if you are interested to join❤||Let's work together and win this for Eunwoo!!!||#CHAEUNWOO #차은우 #ASTRO #아스트로 https://t.co/cFApYhIMon,"['CHAEUNWOO', '차은우', 'ASTRO', '아스트로']",['EunwooVoteTeam'],1278186014490546179,CHA EUNWOO VOTING SUPPORT TEAM 💫,EunwooVoteTeam,false,http://pbs.twimg.com/profile_images/1417445508310732804/IhFDezsq_normal.jpg,https://pbs.twimg.com/profile_banners/1278186014490546179/1632039188,"",960,17,101,3,0,60,2021-10-22T01:31:30.000-07:00
1451410924259086339,1451882284899086346,2021-10-23T12:04:46.000-07:00,"","","","","So that’s the cost - one artist to add muzzle flash in post vs. hiring an armorer, slowing the shoot, safety meetings, passing out earplugs, surrounding the crew with plexi &amp; plywood, and risking possible injury or death. It makes more sense creatively, financially &amp; safety-wise.","","",19733486,Ben Rockula,Neptunesalad,true,http://pbs.twimg.com/profile_images/609804247178162176/qSSfdKz0_normal.jpg,https://pbs.twimg.com/profile_banners/19733486/1625809143,http://abs.twimg.com/images/themes/theme1/bg.png,12019,4583,1581,5,4,62,2021-10-22T04:51:44.000-07:00
1451439413146398720,1451863729453338624,2021-10-23T10:51:02.000-07:00,https://twitter.com/vacancymailsa/status/1451439413146398720/photo/1,['http://pbs.twimg.com/media/FCSMchsWUAQih5p.png'],['photo'],['https://bit.ly/2ZmPaN8'],Distell is hiring||Apply &gt;&gt; https://t.co/C8m7IOznGM||#JobseekersSA https://t.co/e8eBFH2Bmz,['JobseekersSA'],"",4263749308,VacancyMail.co.za,vacancymailsa,false,http://pbs.twimg.com/profile_images/1305872257743495175/2gEZbUEf_normal.png,https://pbs.twimg.com/profile_banners/4263749308/1615404469,http://abs.twimg.com/images/themes/theme1/bg.png,65520,42917,2,0,0,7,2021-10-22T06:44:57.000-07:00
1451462446997118978,1451887703256141827,2021-10-23T12:26:17.000-07:00,"","","","",@Road_trippn @brian_family2 This is great. But it is time we require at least 3-years of college with a big dose of critical race theory as hiring requirements.,"","['Road_trippn', 'brian_family2']",827934520112472065,Richard Saunders,BoycottUtah,false,http://pbs.twimg.com/profile_images/827937328014385152/2BFay7mZ_normal.jpg,https://pbs.twimg.com/profile_banners/827934520112472065/1487620241,"",37614,41362,141,1,9,13,2021-10-22T08:16:28.000-07:00
1451484639164567552,1451873966658838528,2021-10-23T11:31:42.000-07:00,https://twitter.com/SarahOwen_/status/1451484639164567552,['http://pbs.twimg.com/media/FCS1fgHWEAMVqff.jpg'],['photo'],"","𝘉𝘢𝘯 𝘍𝘪𝘳𝘦 &amp; 𝘙𝘦𝘩𝘪𝘳𝘦||Today in Parliament, we’re voting to ban businesses sacking people and hiring them again on worse terms and conditions. Fire &amp; rehire is wrong.||@rach_hopkins and I are voting to strengthen people's job security in Luton. #FireandRehire #BarrysBill https://t.co/1FBKBmAHQi","['FireandRehire', 'BarrysBill']",['rach_hopkins'],250601094,Sarah Owen MP,SarahOwen_,true,http://pbs.twimg.com/profile_images/1387119701768146950/3li66IdM_normal.jpg,https://pbs.twimg.com/profile_banners/250601094/1573252267,http://abs.twimg.com/images/themes/theme7/bg.gif,20858,7684,97,2,3,19,2021-10-22T09:44:39.000-07:00
1451506969521504259,1451874130857377798,2021-10-23T11:32:21.000-07:00,https://twitter.com/DePocketFinance/status/1451506969521504259/photo/1,['http://pbs.twimg.com/media/FCTJ3bvUUAQxBeL.jpg'],['photo'],['https://forms.gle/r82uf5nue6awUJgH9'],"🚀🚀DEPOCKET HIRING - Chat Moderator &amp; Copywriter 💪|🚀🚀As we are growing quickly, we need to grow up the team!|👉 See more in the application form: https://t.co/E6LoU3BX9F|Come Join our Growing Team! 💪 https://t.co/ZUBffYWr7X","","",1398316820843532290,depocket.com,DePocketFinance,false,http://pbs.twimg.com/profile_images/1428960243719884801/EnjwdEis_normal.png,https://pbs.twimg.com/profile_banners/1398316820843532290/1634034522,"",18151,15,7,0,1,2,2021-10-22T11:13:23.000-07:00
1451517143737065475,1451867669800656899,2021-10-23T11:06:41.000-07:00,"","","",['https://getin4.com/job/optiven-credit-control-officer-2-positions/'],Optiven Credit Control Officer – 2 Positions. Job Opportunity https://t.co/x81gTyUbet via @getin41 #Career #IkoKaziKE #JobSearch #hiring,"['Career', 'IkoKaziKE', 'JobSearch', 'hiring']",['Getin41'],1329368040392241155,Getin4,Getin41,false,http://pbs.twimg.com/profile_images/1427199903390912517/eVXUIhI6_normal.jpg,https://pbs.twimg.com/profile_banners/1329368040392241155/1629106605,"",446,607,3,1,0,3,2021-10-22T11:53:49.000-07:00
1451518883551191070,1451867924399013891,2021-10-23T11:07:42.000-07:00,"","","",['https://getin4.com/job/assistants-sales-manager-dtb/'],Assistants Sales Manager Job at Diamond Trust Bank DTB - Kenya https://t.co/bLbOZ39Hag via @getin41 #Job #Career #IkoKaziKE #hiring,"['Job', 'Career', 'IkoKaziKE', 'hiring']",['Getin41'],1329368040392241155,Getin4,Getin41,false,http://pbs.twimg.com/profile_images/1427199903390912517/eVXUIhI6_normal.jpg,https://pbs.twimg.com/profile_banners/1329368040392241155/1629106605,"",446,607,2,0,0,1,2021-10-22T12:00:44.000-07:00
1451541567567585288,1451887948564107268,2021-10-23T12:27:16.000-07:00,"","","","",Samayam Tamil is hiring:||Visual editors with 1-3 years experience in Digital video production to join the desk in Chennai.| |editor.tamil@timesinternet.in,"","",291054635,Jayachandran Dhamodharan,Jayachandran_DJ,false,http://pbs.twimg.com/profile_images/1117417549115772929/8uetx2tt_normal.jpg,https://pbs.twimg.com/profile_banners/291054635/1619797942,http://abs.twimg.com/images/themes/theme4/bg.gif,2359,2645,42,4,0,14,2021-10-22T13:30:52.000-07:00
1451555461526863909,1451865928468209664,2021-10-23T10:59:46.000-07:00,https://twitter.com/DMHospitalGroup/status/1451555461526863909/photo/1,['http://pbs.twimg.com/media/FCT11WmXIA07yVj.jpg'],['photo'],['https://bit.ly/3jmghie'],#MRHTullamore is currently hiring Clinical Nurse Manager 2 Infection Prevention and Control | |Closing Date: Wednesday 3rd November 2021 | |Apply Here: https://t.co/chuU6VIyFF| |#jobfairy #DMHGJobs #nursingjobs @hselive @hse_hr @SoniaShortt @eile27 @TCD_SNM @IADNAM1 #JoinTeamMRHT https://t.co/T7SLO6afkX,"['MRHTullamore', 'jobfairy', 'DMHGJobs', 'nursingjobs', 'JoinTeamMRHT']","['HSELive', 'HSE_HR', 'SoniaShortt', 'eile27', 'TCD_SNM', 'IADNAM1']",1044516100346646528,Dublin Midlands Hospital Group,DMHospitalGroup,false,http://pbs.twimg.com/profile_images/1044545809180753920/aY1MpatR_normal.jpg,https://pbs.twimg.com/profile_banners/1044516100346646528/1592919514,http://abs.twimg.com/images/themes/theme1/bg.png,3484,1380,10,0,0,3,2021-10-22T14:26:05.000-07:00
1451563563538071593,1451868842507055109,2021-10-23T11:11:21.000-07:00,"","","",['https://www.cleveland.com/opinion/2021/10/police-defunding-reversals-suggest-most-of-us-want-more-police-on-our-streets-dave-yost.html'],"Across the country, the “defund the police” revolution is crashing and burning—and a counterrevolution is rising||Cities are putting money back into their police departments, hiring new officers and begging those already on the job to stay||Read my op-ed: https://t.co/bln7DO7FAi","","",583804113,Attorney General Dave Yost,Yost4Ohio,true,http://pbs.twimg.com/profile_images/1425440946846580742/2_46DZq2_normal.jpg,https://pbs.twimg.com/profile_banners/583804113/1548294832,http://abs.twimg.com/images/themes/theme1/bg.png,12680,505,46,5,9,14,2021-10-22T14:58:16.000-07:00
1451569243762343937,1451863780263141378,2021-10-23T10:51:14.000-07:00,"","","",['https://www.bath.ac.uk/jobs/Vacancy.aspx?ref=JB8363R'],My department is hiring a permanent lecturer (assistant professor) specialized in sustainability &amp; climate change|https://t.co/Nq4rktTRep|Join us to work with amazing colleagues @bathsps @CDS_Bath in the beautiful and historic city of Bath! @ESG_Project @ESS_of_ISA @Env_Pol,"","['bathsps', 'CDS_Bath', 'ESG_Project', 'ESS_of_ISA', 'Env_Pol']",152931842,Yixian SUN,yixiansun,false,http://pbs.twimg.com/profile_images/1210499080180375552/U2vwrBTe_normal.jpg,https://pbs.twimg.com/profile_banners/152931842/1595442224,http://abs.twimg.com/images/themes/theme1/bg.png,1486,2593,25,2,0,36,2021-10-22T15:20:51.000-07:00
1451593305641324544,1451878261886160906,2021-10-23T11:48:46.000-07:00,"","","","","my department is hiring more people in my position, Teaching Professor of academic writing. it's a renewable NTT job (no term limits), and we welcome applicants from any area of English (rhet/comp, literary studies, creative writing) with a strong interest in teaching writing.","","",1129430850758684672,Cari Hovanec,CariHovanec,false,http://pbs.twimg.com/profile_images/1414345348538146816/DgO52xDZ_normal.jpg,https://pbs.twimg.com/profile_banners/1129430850758684672/1558112875,"",689,591,81,3,4,31,2021-10-22T16:56:28.000-07:00
1451604748830855180,1451888673990008835,2021-10-23T12:30:09.000-07:00,https://twitter.com/People4Portland/status/1451604748830855180,"","",['https://www.koin.com/local/multnomah-county/wheeler-plans-to-rehire-100-recently-retired-officers/'],"This is inadequate. Portland is 300 officers below the minimum staffing levels for a city our size with record shootings, murders &amp; violence. The city council should fund 300 officers and phase in the hiring as quickly as can be responsibly achieved. #P4P https://t.co/35B0UNpfpu",['P4P'],"",1410611982672093202,People For Portland,People4Portland,false,http://pbs.twimg.com/profile_images/1422946500733177860/V0Ml4QsR_normal.jpg,https://pbs.twimg.com/profile_banners/1410611982672093202/1628091876,"",679,178,20,7,43,2,2021-10-22T17:41:56.000-07:00
1451648342434406400,1451868042569388032,2021-10-23T11:08:10.000-07:00,"","","",['https://cutt.ly/ERWAGEu'],#FixTheCountryNow|#FixTheCountry|#DearGhana||Halliburton is #hiring! TECH PROF-TCP #jobtube #ghana #vacancy #employment #jobseekers #jobsearch||👉https://t.co/7qC1HSuLyd||(✔️Please exercise due diligence in your job hunt &amp; always treat your personal safety as a top priority),"['FixTheCountryNow', 'FixTheCountry', 'DearGhana', 'hiring', 'jobtube', 'ghana', 'vacancy', 'employment', 'jobseekers', 'jobsearch']","",235647698,JobTube Ghana || Your #1 Job Hunting Partner,espioj,false,http://pbs.twimg.com/profile_images/1434908623453495297/mS6DuqiH_normal.jpg,https://pbs.twimg.com/profile_banners/235647698/1630943789,http://abs.twimg.com/images/themes/theme1/bg.png,8327,174,5,0,0,2,2021-10-22T20:35:09.000-07:00
1451704925415694339,1451885452290666496,2021-10-23T12:17:21.000-07:00,https://twitter.com/NEAarts/status/1451704925415694339/photo/1,['http://pbs.twimg.com/media/FCVG9yaXMAI4jN5.jpg'],['photo'],['https://go.usa.gov/xMSaB'],"On the blog, we're discussing how @NEAarts is working towards disability equity, from our hiring practices to our grantmaking. ||Learn about our approach &amp; how arts orgs can promote disability equity and inclusivity: https://t.co/FOeFYFLfK0 #NDEAM #NAHM https://t.co/SVvsedZuHd","['NDEAM', 'NAHM']",['NEAarts'],41655821,Nat'l Endow f/t Arts,NEAarts,true,http://pbs.twimg.com/profile_images/1299048723587235842/TUPYKYsx_normal.jpg,https://pbs.twimg.com/profile_banners/41655821/1634570298,http://abs.twimg.com/images/themes/theme9/bg.gif,104041,1032,5,0,0,4,2021-10-23T00:20:00.000-07:00
1451706329710596097,1451875235360296961,2021-10-23T11:36:45.000-07:00,https://twitter.com/clicknpush/status/1451706329710596097/photo/1,['http://pbs.twimg.com/media/FCV_NhhXEAAfIPr.jpg'],['photo'],"","Check out this article all about the importance of hiring students with disabilities early on in their career paths (link in our Instagram bio). Fortunately, programs like AWEP exist to hire students at University of Alberta. Click&amp;Push has been lucky enough to receive AWEP funds https://t.co/yihzbpmYZs","","",1065662285090156544,Click&Push Accessibility Inc.,clicknpush,false,http://pbs.twimg.com/profile_images/1260582666052698114/9xVX1qn2_normal.jpg,https://pbs.twimg.com/profile_banners/1065662285090156544/1600785475,http://abs.twimg.com/images/themes/theme1/bg.png,110,115,2,0,0,1,2021-10-23T00:25:35.000-07:00
1451787093210910726,1451878491012665348,2021-10-23T11:49:41.000-07:00,https://twitter.com/rosecharts/status/1451787093210910726/photo/1,['http://pbs.twimg.com/media/FCXIqccVUAEbd9n.jpg'],['photo'],['http://bit.ly/RSMAMAVT'],#ROSÉ MAMA Voting Team recruitment form is still open and accepting members! ||✍️https://t.co/gOcNkPRGd9 https://t.co/eM14PPqkKA,['ROSÉ'],"",904338986943995906,ROSÉ CHARTS,rosecharts,false,http://pbs.twimg.com/profile_images/1450449511663370240/UDG_HpEW_normal.jpg,https://pbs.twimg.com/profile_banners/904338986943995906/1634649087,http://abs.twimg.com/images/themes/theme1/bg.png,91499,71,141,2,0,81,2021-10-23T05:46:30.000-07:00
1451805592805261313,1451882100173508615,2021-10-23T12:04:02.000-07:00,https://twitter.com/leicspolice/status/1451805592805261313/photo/1,['http://pbs.twimg.com/media/FCSfKjHX0AsZchE.jpg'],['photo'],['http://bit.ly/2WwTtj6'],Did you know that we are hiring? 🤔 We are hiring for a number of support staff positions and a volunteering role. Come join #TeamLeicestershire and help keep your community safe! 🤗 Check out our website for more information: https://t.co/leW1x1m4Mu https://t.co/QeyPLW9gIh,['TeamLeicestershire'],"",87028400,Leicestershire Police,leicspolice,true,http://pbs.twimg.com/profile_images/1384063998757261314/02GfBUqy_normal.jpg,https://pbs.twimg.com/profile_banners/87028400/1608645672,http://abs.twimg.com/images/themes/theme1/bg.png,119743,999,4,0,0,2,2021-10-23T07:00:01.000-07:00
1451818174735917058,1451866790963855360,2021-10-23T11:03:12.000-07:00,https://twitter.com/CobraBiologics/status/1451818174735917058/photo/1,['http://pbs.twimg.com/media/FCXk738XsAUb4Pb.jpg'],['photo'],['https://hubs.la/H0ZWDzw0'],"We're Hiring! Take a look at the various opportunities to join our team, including:|QA Officer|Master Production Scheduler|Senior GMP Scientist|Technical Lead - Viral Vectors|Client Services Representative (Proposal Writer)||Apply online &gt;&gt;&gt; https://t.co/puQaJAUhjW https://t.co/ItpntzNGUE","","",1548308851,"Cobra Biologics, A Charles River Company",CobraBiologics,false,http://pbs.twimg.com/profile_images/1291421484213325832/MfEqAqph_normal.jpg,https://pbs.twimg.com/profile_banners/1548308851/1628586740,http://abs.twimg.com/images/themes/theme1/bg.png,2525,1635,0,0,0,2,2021-10-23T07:50:00.000-07:00
1451838008123088899,1451887608846557187,2021-10-23T12:25:55.000-07:00,"","","","",The thing for me is the brands know of his bigotry so is “outrage marketing” so effective that they’re willing to risk it all and take him on. Especially from Nando’s who’ve attached all their marketing jokes to black people and things relevant to us. Hiring Gareth is hard yoh,"","",634073838,Tswape 🍑,TkMatakanye,false,http://pbs.twimg.com/profile_images/1354188308440641542/W6lS9hYK_normal.jpg,https://pbs.twimg.com/profile_banners/634073838/1566463232,http://abs.twimg.com/images/themes/theme1/bg.png,28094,2875,2,0,0,1,2021-10-23T09:08:49.000-07:00
1451843370712711169,1451865268922236931,2021-10-23T10:57:09.000-07:00,https://twitter.com/AllianceMBS/status/1451843370712711169/photo/1,['http://pbs.twimg.com/media/FCX72iSWQAEOQMB.jpg'],['photo'],['https://bit.ly/3mHpqCP'],Want a new challenge? We are seeking to hire a Marketing and Recruitment Officer in our Executive Education team. Apply now: https://t.co/9ZQM5Osiwq|#AMBSlife https://t.co/XV2o6cDL18,['AMBSlife'],"",110377394,Alliance MBS,AllianceMBS,true,http://pbs.twimg.com/profile_images/645932937851064320/hR2NZtEt_normal.jpg,https://pbs.twimg.com/profile_banners/110377394/1594978927,http://abs.twimg.com/images/themes/theme1/bg.png,9157,1937,0,0,0,1,2021-10-23T09:30:08.000-07:00
1451850540237869058,1451886298399186949,2021-10-23T12:20:42.000-07:00,"","","","","In all your entitlement, know that employers are taking big risks by hiring you. Not just that DJ but everyone. It’s not a 1 way street","","",63200840,Thomas Mɛwɔw,wofa_slayzie,false,http://pbs.twimg.com/profile_images/1392043010611990530/wpHmWuR__normal.jpg,https://pbs.twimg.com/profile_banners/63200840/1595078379,http://abs.twimg.com/images/themes/theme15/bg.png,13998,4751,15,0,2,24,2021-10-23T09:58:37.000-07:00
1451850911526100993,1451883898695299081,2021-10-23T12:11:10.000-07:00,"","","","",@CMShehbaz Sir please save Khwaja Fareed University of Engineering and Information Technology Rahim Yar Khan. This was your initiative. #Save_Khwaja_Fareed_University |Very senior faculty is on peaceful strike for 58 days. VC is kicking them out and hiring new ones based on pure nepotism.,['Save_Khwaja_Fareed_University'],['CMShehbaz'],148307454,Humaira Anwer,humairaanwer,false,http://abs.twimg.com/sticky/default_profile_images/default_profile_normal.png,"",http://abs.twimg.com/images/themes/theme1/bg.png,18,158,1,0,0,1,2021-10-23T10:00:06.000-07:00
