org_id,samp_id,samp_datetime,org_url,org_media_url,org_media_type,org_attached_links,org_text,org_hashtags,org_user_metions,user_id,user_name,user_screen_name,user_verified,user_profile_image_url,user_profile_banner_url,user_profile_background_image_url,user_followers_count,user_friends_count,org_favorite_count,org_quote_count,org_reply_count,org_retweet_count,org_datetime
1456602782660706307,1457109775884374021,2021-11-06T22:16:57.000-07:00,https://twitter.com/espioj/status/1456602782660706307/photo/1,['http://pbs.twimg.com/media/FDbkgsRXMAgYEdf.jpg'],['photo'],"",#FixTheCountryNow|#FixTheCountry|#DearGhana||A company is #hiring! CUSTOMER SERVICE PERSONNEL #jobtube #ghana #vacancy #jobsearch #jobseekers #employment||Salary: GHS1500||(✔Please exercise due diligence in your job hunt and always treat your personal safety as a top priority) https://t.co/YHqmm9Pjpy,"['FixTheCountryNow', 'FixTheCountry', 'DearGhana', 'hiring', 'jobtube', 'ghana', 'vacancy', 'jobsearch', 'jobseekers', 'employment']","",235647698,JobTube Ghana || Your #1 Job Hunting Partner,espioj,false,http://pbs.twimg.com/profile_images/1434908623453495297/mS6DuqiH_normal.jpg,https://pbs.twimg.com/profile_banners/235647698/1630943789,http://abs.twimg.com/images/themes/theme1/bg.png,9007,153,16,0,3,12,2021-11-05T12:42:20.000-07:00
1456607294054076427,1457112130403065863,2021-11-06T22:26:18.000-07:00,https://twitter.com/digitwithraven/status/1456607294054076427/video/1,['http://pbs.twimg.com/ext_tw_video_thumb/1456605907698212867/pu/img/IhtmN_NDUYG9a9wQ.jpg'],['video'],"","The @Pitt_Rivers is hiring a Digital Engagement Officer, so of course I had to make some digital content for the application! |Had a blast visiting this museum again and getting creative in such an inspiring space https://t.co/eYYbX2Yf7O","",['Pitt_Rivers'],759765386116014081,Raven Todd DaSilva,digitwithraven,false,http://pbs.twimg.com/profile_images/1152816592218144768/UsCMoirn_normal.jpg,https://pbs.twimg.com/profile_banners/759765386116014081/1501767152,http://abs.twimg.com/images/themes/theme1/bg.png,1254,1492,321,5,25,29,2021-11-05T13:00:16.000-07:00
1456617326523080708,1457100869598466050,2021-11-06T21:41:33.000-07:00,https://twitter.com/RamonTonnaer/status/1456617326523080708/photo/1,['http://pbs.twimg.com/media/FDbxvTWVgAMGI_i.jpg'],['photo'],['http://dlvr.it/SBy7dM'],Google is hiring a Search Quality Analyst to fight search spam https://t.co/a7gYrSPvrK #seo https://t.co/Zl9H7ul3SZ,['seo'],"",37315687,Ramon Tonnaer,RamonTonnaer,false,http://pbs.twimg.com/profile_images/1369267250360881152/i1RnqRNQ_normal.jpg,https://pbs.twimg.com/profile_banners/37315687/1561366318,http://abs.twimg.com/images/themes/theme1/bg.png,25428,18343,1,0,0,3,2021-11-05T13:40:07.000-07:00
1456638685969936385,1457101171248803849,2021-11-06T21:42:45.000-07:00,https://twitter.com/ConservHalton/status/1456638685969936385/photo/1,['http://pbs.twimg.com/media/FDcDoBVX0AczKe2.jpg'],['photo'],['https://conservationhalton.ca/employment-opportunities'],"We're hiring seasonal positions and offering new perks! Not only are we paying more than minimum wage for all entry-level positions—we're also offering an hours-of-work incentive, free access to our parks, a Glen Eden season pass, and more! For more info: https://t.co/1KY4r8kX2j https://t.co/RZKFqLXRwv","","",27934941,Conservation Halton,ConservHalton,false,http://pbs.twimg.com/profile_images/1438898485521158155/Br-AZf_Q_normal.jpg,https://pbs.twimg.com/profile_banners/27934941/1584728364,http://abs.twimg.com/images/themes/theme13/bg.gif,13840,1783,14,2,0,7,2021-11-05T15:05:00.000-07:00
1456661845109006343,1457129885932081159,2021-11-06T23:36:51.000-07:00,"","","","",The Banaszynski lab is hiring a postdoc! We are a chromatin lab studying histone variant biology in the context of both development and disease. Help me spread the word and message me if you are interested. 1/,"","",811252828547284992,Laura Banaszynski,BanaszynskiLab,false,http://pbs.twimg.com/profile_images/824283486764699648/pa3Hn0fd_normal.jpg,https://pbs.twimg.com/profile_banners/811252828547284992/1486136042,"",957,627,83,1,2,52,2021-11-05T16:37:01.000-07:00
1456668054356643845,1457119058566987780,2021-11-06T22:53:50.000-07:00,https://twitter.com/SuperSpline/status/1456668054356643845/photo/1,['http://pbs.twimg.com/media/FDcfz5HXoAEB5nW.jpg'],['photo'],['https://supersplinestudios.com/jobs/'],"We're hiring again! Looking for a Senior Animator to join full time. ||We're a people first studio, which means we give staff weekly personal development time, training subsidies, no OT &amp; no crunch, ever.||More info &amp; watch a hilarious video here: ||https://t.co/wZeu88UUKq https://t.co/UGDt4VWlnB","","",720912047584780290,Super Spline Studios,SuperSpline,false,http://pbs.twimg.com/profile_images/791370001412395008/5Hjr0XKd_normal.jpg,https://pbs.twimg.com/profile_banners/720912047584780290/1579201166,http://abs.twimg.com/images/themes/theme1/bg.png,1298,290,36,2,2,23,2021-11-05T17:01:42.000-07:00
1456689512227160066,1457121708087840769,2021-11-06T23:04:21.000-07:00,"","","","","This poor hiring manager is so confused and not sure what's going on, he's defaulting to 'grab something from the snack basket in the hallway'","","",15620758,Firr,Firr,false,http://pbs.twimg.com/profile_images/1405706422323761154/ISr3TLII_normal.jpg,https://pbs.twimg.com/profile_banners/15620758/1535055584,http://abs.twimg.com/images/themes/theme5/bg.gif,13782,567,12773,4,12,96,2021-11-05T18:26:58.000-07:00
1456691321196847105,1457120659939774474,2021-11-06T23:00:11.000-07:00,https://twitter.com/Korihandy/status/1456691321196847105,"","",['https://careers.methodfi.com/'],"Quick plug: My friend @josebet1 (@methodfinancial) is hiring software devs, sales..etc unreal company benefits, go apply! these guys are killing it. |https://t.co/PAENTE0Jwc","","['josebet1', 'MethodFinancial']",42186383,Kori Handy,Korihandy,true,http://pbs.twimg.com/profile_images/1446356542798778382/42KRYr3J_normal.jpg,https://pbs.twimg.com/profile_banners/42186383/1631901219,http://abs.twimg.com/images/themes/theme1/bg.png,10232,1069,3,1,1,2,2021-11-05T18:34:09.000-07:00
1456697901917347842,1457109264577744905,2021-11-06T22:14:55.000-07:00,https://twitter.com/codeorg/status/1456697901917347842/photo/1,['http://pbs.twimg.com/media/FDc7BVCX0AgPikQ.jpg'],['photo'],['https://fal.cn/3jBX2'],"We’re hiring! Come join our fantastic team and help us transform computer science education! Open roles include Chief of Product, Software Engineer, Web Producer, Administrative Assistant, and more. https://t.co/By5IpKGxWY https://t.co/ACULjRWuc6","","",850107536,Code.org,codeorg,true,http://pbs.twimg.com/profile_images/1372232205347393536/mEN8uv4c_normal.jpg,https://pbs.twimg.com/profile_banners/850107536/1547249211,http://abs.twimg.com/images/themes/theme10/bg.gif,1027992,1285,27,1,0,10,2021-11-05T19:00:18.000-07:00
1456779095426097155,1457127525625184259,2021-11-06T23:27:28.000-07:00,"","","","","To anyone looking for a job, Salesforce is hiring for a bunch of remote positions. Customer service, EA’s, tech, everything","","",1038268214885724161,Chanellica 🍯,carmendeezy,false,http://pbs.twimg.com/profile_images/1341115881758322688/EZYsLsv9_normal.jpg,https://pbs.twimg.com/profile_banners/1038268214885724161/1631038600,"",143,211,195,3,4,154,2021-11-06T00:22:56.000-07:00
1456900303001952258,1457128541733195778,2021-11-06T23:31:31.000-07:00,"","","",['https://www.jobs.ac.uk/job/CKN886/spanish-lecturer-a-b'],We are hiring - permanent teaching &amp; research Spanish post @SurreySLL |Please share away!||Spanish Lecturer A/B at University of Surrey https://t.co/PU50Dm61mM,"",['SurreySLL'],861830652,Constance Bantman,ConnieLorene,false,http://pbs.twimg.com/profile_images/1437365921430089732/oCtYnlJQ_normal.jpg,https://pbs.twimg.com/profile_banners/861830652/1630844967,http://abs.twimg.com/images/themes/theme1/bg.png,1321,960,11,0,0,15,2021-11-06T08:24:34.000-07:00
1456982715601801219,1457128571978219523,2021-11-06T23:31:38.000-07:00,https://twitter.com/complyapplyjobs/status/1456982715601801219,"","",['http://dlvr.it/SC19GF'],"Now Hiring: Specialist I, Compliance at Emergent BioSolutions (Baltimore (Bayview), MD, US, 21224) https://t.co/fzQxvdNnFg #risk #compliance #compliancejobs","['risk', 'compliance', 'compliancejobs']","",1299165644856930309,ComplyApply.com,complyapplyjobs,false,http://pbs.twimg.com/profile_images/1384637538820820992/jnIltX_X_normal.png,https://pbs.twimg.com/profile_banners/1299165644856930309/1619264851,"",86,578,1,0,0,0,2021-11-06T13:52:03.000-07:00
1456996459451191299,1457116826941501440,2021-11-06T22:44:58.000-07:00,https://twitter.com/taabaman/status/1456996459451191299/photo/1,"['http://pbs.twimg.com/media/FDhKjW0XEAoATbQ.jpg', 'http://pbs.twimg.com/media/FDhKjvZWUAEXxqy.jpg']","['photo', 'photo']","",The Immunology Graduate Group @IGGPenn retreat yesterday was AMAZING! I got to meet most of the first year students. What a great group of young scholars. Also passed by the lab and we are on schedule to open in January 2022! We are hiring at all levels. https://t.co/3QfFc06OZM,"",['IGGPenn'],898025573905256448,Cornelius Taabazuing,taabaman,false,http://pbs.twimg.com/profile_images/1311016206359580678/m-VIwJoA_normal.jpg,https://pbs.twimg.com/profile_banners/898025573905256448/1568760986,"",1355,1326,76,0,3,9,2021-11-06T14:46:40.000-07:00
1456999889670443009,1457120012037132290,2021-11-06T22:57:37.000-07:00,https://twitter.com/ncdalliance/status/1456999889670443009/photo/1,['http://pbs.twimg.com/media/FDhNrD0XMAE1bNU.jpg'],['photo'],['http://bit.ly/3jnHzVl'],"🎉We're #hiring a policy and advocacy manager. If you'd like to lead prevention policy and advocacy activities, engage with governments and international institutions on priority global health and development issues, apply today! 🤩https://t.co/ckD0jON7lE #jobs https://t.co/SdkQXRWWso","['hiring', 'jobs']","",242496394,NCD Alliance,ncdalliance,false,http://pbs.twimg.com/profile_images/1336672702736764928/eK5Xuiuc_normal.png,"",http://abs.twimg.com/images/themes/theme1/bg.png,26212,1857,13,0,0,9,2021-11-06T15:00:18.000-07:00
1457014924937416704,1457122980459339789,2021-11-06T23:09:25.000-07:00,"","","",['https://grnh.se/57cd5e2c1us'],".@Ripple is #hiring a Senior Software Engineer, Machine Learning! Apply today https://t.co/WKkbhCsLJt via @greenhouse #jobs #fintech","['hiring', 'jobs', 'fintech']","['Ripple', 'Greenhouse']",563268548,Jim Chauncey-Kelly,JChaunceyKelly,false,http://pbs.twimg.com/profile_images/1387833206209056775/n9dSCRO6_normal.jpg,https://pbs.twimg.com/profile_banners/563268548/1614902300,http://abs.twimg.com/images/themes/theme2/bg.gif,4492,550,22,0,1,10,2021-11-06T16:00:02.000-07:00
1457017443692552206,1457112532716511239,2021-11-06T22:27:54.000-07:00,https://twitter.com/ndeducation/status/1457017443692552206/photo/1,['http://pbs.twimg.com/media/FDhdpJsWYAk2jQr.jpg'],['photo'],['http://ow.ly/SEbC50Gv7p9'],"Ex-Education Professionals - are you missing teaching? ||We have a number of regular and flexible job opportunities in your local community, get in touch today and get back to doing what you love! ❤️||👉https://t.co/FcF4UXxJYt||#walesjobs #southwalesjobs #hiring #schools https://t.co/H6AWPhbn9U","['walesjobs', 'southwalesjobs', 'hiring', 'schools']","",57272932,New Directions Education,ndeducation,false,http://pbs.twimg.com/profile_images/1429754431466348544/W7Rtc1hc_normal.jpg,https://pbs.twimg.com/profile_banners/57272932/1629714996,http://abs.twimg.com/images/themes/theme1/bg.png,2437,2550,0,0,0,1,2021-11-06T16:10:03.000-07:00
1457023861581656067,1457112108114526208,2021-11-06T22:26:13.000-07:00,https://twitter.com/subhaairan/status/1457023861581656067,['http://pbs.twimg.com/media/FDhjesXXMAMC4G7.jpg'],['photo'],"",Morning activity while drinking coffee today: Learning how to make sure we bring in the best talent possible at @CareAlignAI. ||Which means…we are #hiring! Looking for a clinician interested in customer engagement. DM me if interested!||#MedGrind #medtwitter #nursetwitter https://t.co/2o2KNhoPS4,"['hiring', 'MedGrind', 'medtwitter', 'nursetwitter']",['CareAlignAI'],51392360,Subha Airan-Javia (she/her),subhaairan,false,http://pbs.twimg.com/profile_images/1406602117171879937/az9G0lY5_normal.jpg,https://pbs.twimg.com/profile_banners/51392360/1426817015,http://abs.twimg.com/images/themes/theme5/bg.gif,2715,4978,5,0,0,2,2021-11-06T16:35:33.000-07:00
1457030279042932736,1457108016839512070,2021-11-06T22:09:57.000-07:00,https://twitter.com/MPSEnfield/status/1457030279042932736/photo/1,['http://pbs.twimg.com/tweet_video_thumb/FDhpUKTWEAMSj3D.jpg'],['animated_gif'],['http://ow.ly/VMxi50GAZEZ'],Ready to apply as a #policeofficer but want some support? ||Attend an insight session at a community venue with the recruitment team #Enfield #Edmonton #Tottenham ||BOOK EARLY &gt;&gt;https://t.co/p3eKenlPqX https://t.co/auGslhCMh5,"['policeofficer', 'Enfield', 'Edmonton', 'Tottenham']","",507266833,Enfield MPS,MPSEnfield,true,http://pbs.twimg.com/profile_images/1455294793492439044/RFVqoaiZ_normal.jpg,https://pbs.twimg.com/profile_banners/507266833/1635228026,http://abs.twimg.com/images/themes/theme1/bg.png,21988,598,1,0,0,1,2021-11-06T17:01:03.000-07:00
1457040896214515712,1457106837644484609,2021-11-06T22:05:16.000-07:00,"","","",['https://careers.pnnl.gov/jobs/2636?lang=en-us#.YYa-Wm2xXI4.twitter'],🚨 Job Alert 🚨 ||@PNNLab is hiring for a Nonproliferation Policy and Law Analyst at multiple locations. Application window closes November 13th. | https://t.co/f0VwaaCDd2,"",['PNNLab'],764868661396008960,Sara Beth Marchert,sbmarchert,false,http://pbs.twimg.com/profile_images/1372294734580838400/0ZIbtYUY_normal.jpg,https://pbs.twimg.com/profile_banners/764868661396008960/1568652114,"",926,775,3,0,0,4,2021-11-06T17:43:14.000-07:00
1457045589426855938,1457102647878631425,2021-11-06T21:48:37.000-07:00,https://twitter.com/FballFunFactory/status/1457045589426855938/photo/1,['http://pbs.twimg.com/media/FDh3GSPXEAEo6il.jpg'],['photo'],['https://uk.indeed.com/job/business-development-consultant-c5768aa1f42b881c'],"💼 THE FFF ARE HIRING! We pride ourselves on delivering outstanding service to children and parents and the same levels of service internally to our franchisees.||With this in mind, we are recruiting for the new role of ‘Business Development Consultant’.||https://t.co/f3r2cU4hba https://t.co/4drr582a5X","","",885129142378930176,Football Fun Factory®,FballFunFactory,false,http://pbs.twimg.com/profile_images/1418548936260964357/ekU68QN4_normal.jpg,https://pbs.twimg.com/profile_banners/885129142378930176/1614789157,http://abs.twimg.com/images/themes/theme1/bg.png,6339,1057,6,0,0,2,2021-11-06T18:01:53.000-07:00
1457100813554397184,1457100813554397184,2021-11-06T21:41:20.000-07:00,"","","","",like the starbucks nearby has huge signs everywhere that are like “hiring now blahblahblah” but like.... i tried to apply there multiple times and got nothing back. |i feel like a conspiracy theorist or something but i feel like its more like places dont feel like hiring lol,"","",988542296030351366,donna 𝄇,nearthirdimpact,false,http://pbs.twimg.com/profile_images/1451016392824786947/XyXzRD24_normal.jpg,https://pbs.twimg.com/profile_banners/988542296030351366/1634093910,"",853,528,0,0,0,0,2021-11-06T21:41:20.000-07:00
1457100844722110467,1457102613204275202,2021-11-06T21:48:29.000-07:00,"","","","","I really don’t like where this is all going, Travis and co. definitely have the money to paint drugs as the sole cause of last nights tragedy &amp; the proposed solution to that is just gonna be normalizing hiring cops to search (harass) attendees.","","",976716906290864129,Anti-Fascist Gilly ☭ 🇵🇸,MangosForAll,false,http://pbs.twimg.com/profile_images/1398324313833443328/q0fyZrCM_normal.jpg,https://pbs.twimg.com/profile_banners/976716906290864129/1630382685,"",899,798,1,0,1,1,2021-11-06T21:41:27.000-07:00
1457100960078073856,1457100960078073856,2021-11-06T21:41:55.000-07:00,"","","",['https://bit.ly/3EUXIu6'],"We're hiring! Click to apply: Assistant Land Project Manager - https://t.co/j3W7PVX3eQ #Construction #Riverside, CA","['Construction', 'Riverside']","",27311047,TMJ-CAO Constr Jobs,tmj_cao_constru,false,http://pbs.twimg.com/profile_images/685245201598648320/mv03hAoJ_normal.jpg,https://pbs.twimg.com/profile_banners/27311047/1452210163,http://abs.twimg.com/images/themes/theme1/bg.png,254,148,0,0,0,0,2021-11-06T21:41:55.000-07:00
1457101058925285376,1457101058925285376,2021-11-06T21:42:18.000-07:00,"","","","","@MetaversePlayer Thank you, that is incredibly kind of you to say.  It is definitely something that I am considering.  Not only putting myself out there when groups are hiring, but creating a project of my (our) own.  I appreciate you!","",['MetaversePlayer'],1095866033431285760,Mama Bucks NFT,scrunchysaurash,false,http://pbs.twimg.com/profile_images/1455888396430319622/2zWEwS0__normal.jpg,https://pbs.twimg.com/profile_banners/1095866033431285760/1633912712,"",1220,847,0,0,0,0,2021-11-06T21:42:18.000-07:00
1457101087459057667,1457101087459057667,2021-11-06T21:42:25.000-07:00,"","","",['https://bit.ly/3o6rFQN'],"Want to work at FedEx Express? We're hiring in #Ontario, CA! Click for details: https://t.co/oMMLEDlbgZ #SkilledTrade","['Ontario', 'SkilledTrade']","",120113859,TMJ-CAO Skl. Trades,tmj_CAO_skltrd,false,http://pbs.twimg.com/profile_images/705156097686933504/yxEYsRnU_normal.jpg,https://pbs.twimg.com/profile_banners/120113859/1456957291,http://abs.twimg.com/images/themes/theme1/bg.png,271,253,0,0,0,0,2021-11-06T21:42:25.000-07:00
1457101472844300290,1457101472844300290,2021-11-06T21:43:57.000-07:00,"","","",['https://bit.ly/3o3Pwkn'],"We're hiring! Click to apply: Quality Manager (Off Campus ED's) - https://t.co/ACCimKW6aB #Healthcare #Tacoma, WA","['Healthcare', 'Tacoma']","",803258279392645121,Emerus Careers,EmerusCareers,false,http://pbs.twimg.com/profile_images/803260143899004932/8V1wKV_y_normal.jpg,https://pbs.twimg.com/profile_banners/803258279392645121/1485469640,http://abs.twimg.com/images/themes/theme1/bg.png,1203,82,0,0,0,0,2021-11-06T21:43:57.000-07:00
1457101592746811394,1457101592746811394,2021-11-06T21:44:26.000-07:00,"","","","","We're hiring in #Indianapolis, IN! Click the link in our bio to apply to this job and more: Senior Clinical Scientist / Medical Monitor - Oncology at Labcorp Drug Development #clinical","['Indianapolis', 'clinical']","",128530283,TMJ-IND Gen. Science,tmj_IND_gensci,false,http://pbs.twimg.com/profile_images/708971485038153728/7ICUnQHL_normal.jpg,https://pbs.twimg.com/profile_banners/128530283/1457866950,http://abs.twimg.com/images/themes/theme1/bg.png,258,240,0,0,0,0,2021-11-06T21:44:26.000-07:00
1457101629547765762,1457101629547765762,2021-11-06T21:44:34.000-07:00,"","","",['https://ift.tt/3qec3NZ'],New job opportunity at Hacker News: Replit (YC W18) Is Hiring IDE Hackers and Designers https://t.co/1cCyNHqlNr,"","",1181711391130099713,IS DOOM ETERNAL OUT?,FanaticDoom,false,http://pbs.twimg.com/profile_images/1181711909495754752/udZ8y7RI_normal.jpg,"","",5,3,0,0,0,0,2021-11-06T21:44:34.000-07:00
1457101736351604738,1457101736351604738,2021-11-06T21:45:00.000-07:00,https://twitter.com/betterware/status/1457101736351604738/photo/1,['http://pbs.twimg.com/media/FDher1iXEAQvQgE.png'],['photo'],['http://go.betterware.co.uk'],"Worried about the cost of #Christmas?🎄||With #Betterware you can: work from anywhere, with any device that has an internet connection, and commit to as many hours as you decide.||To join or find out more visit:|https://t.co/ms0W7y5JBh||#workforyourself #recruitment #saturday https://t.co/pWIZa86Ylc","['Christmas', 'Betterware', 'workforyourself', 'recruitment', 'saturday']","",271044669,Betterware Official,betterware,false,http://pbs.twimg.com/profile_images/1090571574862925825/zSkxOTwU_normal.jpg,https://pbs.twimg.com/profile_banners/271044669/1632995911,http://abs.twimg.com/images/themes/theme1/bg.png,721,587,0,0,0,0,2021-11-06T21:45:00.000-07:00
1457101761978593281,1457101822322266120,2021-11-06T21:45:20.000-07:00,"","","",['https://bit.ly/3wn9fyW'],"We're hiring! Read about our latest job opening here: Full-time - Sr. Professional Staff Nurse, BSN - High Level Care - https://t.co/GnD7oPWTC5 #Cumberland, MD #Nursing","['Cumberland', 'Nursing']","",836646335659016192,WMHS Careers,WMHS_Careers,false,http://pbs.twimg.com/profile_images/839206161203212288/BYPEH-78_normal.jpg,https://pbs.twimg.com/profile_banners/836646335659016192/1488917387,"",19,0,0,0,0,1,2021-11-06T21:45:06.000-07:00
1457101894178988036,1457101894178988036,2021-11-06T21:45:37.000-07:00,"","","","","@MattDeBary We are hiring, that Kearis special team spot and CB 'Help Wanted'.","",['MattDeBary'],387405339,Dwagspeed,johnadams8888,false,http://pbs.twimg.com/profile_images/1206995453293846529/MoQZB5ku_normal.jpg,"",http://abs.twimg.com/images/themes/theme1/bg.png,40,482,0,0,0,0,2021-11-06T21:45:37.000-07:00
1457101925086814208,1457101925086814208,2021-11-06T21:45:45.000-07:00,"","","",['https://riverpoint.myavionte.com/staff/compas_sharejob.aspx?rID=RM28732428&rpid=467675&uID=27995'],RiverPoint is hiring!  Apply now for the position of IT Support Technician https://t.co/msh73ulbRk,"","",32580025,Becky Maresco,rmaresco,false,http://abs.twimg.com/sticky/default_profile_images/default_profile_normal.png,"",http://abs.twimg.com/images/themes/theme6/bg.gif,314,3,0,0,0,0,2021-11-06T21:45:45.000-07:00
1457102162631213067,1457102162631213067,2021-11-06T21:46:41.000-07:00,https://twitter.com/RealtorRHaynes/status/1457102162631213067/photo/1,['http://pbs.twimg.com/media/FDiqsg3XoAAL6DS.jpg'],['photo'],['https://cpix.me/a/132754947'],Discover what costs you can expect to pay when hiring a home stager. #sellyourhome #REtips  https://t.co/FEvfbogUze https://t.co/qAjD2wBJd7,"['sellyourhome', 'REtips']","",1451555422897381376,Rebecca Haynes,RealtorRHaynes,false,http://pbs.twimg.com/profile_images/1451555543009607683/NSFVelPj_normal.jpg,"","",1,0,0,0,0,0,2021-11-06T21:46:41.000-07:00
1457102189336219649,1457102189336219649,2021-11-06T21:46:48.000-07:00,"","","",['https://bit.ly/3mNsI90'],"We're hiring! Click to apply: Call Center - Phoenix - Full Time - https://t.co/3n5A95DHnI #CustomerService #Phoenix, AZ","['CustomerService', 'Phoenix']","",135299948,GTE Financial,GTEFinancial,false,http://pbs.twimg.com/profile_images/1450069202451243019/VXfMgR3C_normal.jpg,https://pbs.twimg.com/profile_banners/135299948/1634558414,http://abs.twimg.com/images/themes/theme1/bg.png,1600,574,0,0,0,0,2021-11-06T21:46:48.000-07:00
1457102351899115522,1457102351899115522,2021-11-06T21:47:27.000-07:00,"","","","","Career tip for landing jobs like 'Patient Care Technician - PCT' in #Antioch, TN. Go on informational interviews. The best way to get a meeting with a hiring manager is to ask for an informational meeting. #PatientCare","['Antioch', 'PatientCare']","",21729295,TMJ- BNA Health Jobs,tmj_bna_health,false,http://pbs.twimg.com/profile_images/669476277011677184/XJJ2PdZu_normal.jpg,https://pbs.twimg.com/profile_banners/21729295/1448450559,http://abs.twimg.com/images/themes/theme1/bg.png,199,49,0,0,0,0,2021-11-06T21:47:27.000-07:00
1457102728744689669,1457102728744689669,2021-11-06T21:48:56.000-07:00,"","","","","Career tip for landing jobs like 'Senior International Tax' in #Waltham, MA. Go on informational interviews. The best way to get a meeting with a hiring manager is to ask for an informational meeting. #Finance","['Waltham', 'Finance']","",34245383,TMJ-RIP Finance Jobs,tmj_rip_finance,false,http://pbs.twimg.com/profile_images/690313501521260545/MuGZz1U__normal.jpg,https://pbs.twimg.com/profile_banners/34245383/1453418540,http://abs.twimg.com/images/themes/theme1/bg.png,282,188,0,0,0,0,2021-11-06T21:48:56.000-07:00
1457102732699922434,1457102732699922434,2021-11-06T21:48:57.000-07:00,"","","",['https://bit.ly/3qsPghJ'],"We're hiring! Click to apply: Customer Experience Journey Manager/Project Manager - https://t.co/8BKQifU63I #ProjectMgmt #Englewood, CO","['ProjectMgmt', 'Englewood']","",22392352,Denver IT-PM/BA Jobs,tmj_den_itpm,false,http://pbs.twimg.com/profile_images/675500789683511296/notf1M03_normal.jpg,https://pbs.twimg.com/profile_banners/22392352/1449886914,http://abs.twimg.com/images/themes/theme1/bg.png,275,140,0,0,0,0,2021-11-06T21:48:57.000-07:00
1457102855706345474,1457102855706345474,2021-11-06T21:49:27.000-07:00,"","","",['https://bit.ly/3wltRro'],"We're hiring! Read about our latest job opening here: Outside Sales Rep A - https://t.co/JTqvEWExQG #Sales #Omaha, NE","['Sales', 'Omaha']","",219874756,Omaha Sales,tmj_NEO_sales,false,http://pbs.twimg.com/profile_images/671877245124788224/9dDbLkuH_normal.jpg,https://pbs.twimg.com/profile_banners/219874756/1449022994,http://abs.twimg.com/images/themes/theme1/bg.png,357,248,0,0,0,0,2021-11-06T21:49:27.000-07:00
1457103043015716870,1457121263365787650,2021-11-06T23:02:35.000-07:00,"","","","","@D3Deplorable They are already paying the majority of the taxes and hiring workers!! Don’t they get any reward fir busting their asses?! Just claim to be an illegal, criminal alien and make a f ton of money! What about our homeless and starving Americans?! BS","",['D3Deplorable'],1207747779541504000,♥️2HRH2Cupid’sMom,KathiCupidsmom,false,http://pbs.twimg.com/profile_images/1348768252298719237/8DVgcs5C_normal.jpg,https://pbs.twimg.com/profile_banners/1207747779541504000/1589494018,"",22463,21345,2,0,1,3,2021-11-06T21:50:11.000-07:00
