org_id,samp_id,samp_datetime,org_url,org_media_url,org_media_type,org_attached_links,org_text,org_hashtags,org_user_metions,user_id,user_name,user_screen_name,user_verified,user_profile_image_url,user_profile_banner_url,user_profile_background_image_url,user_followers_count,user_friends_count,org_favorite_count,org_quote_count,org_reply_count,org_retweet_count,org_datetime
1451549195270242309,1452168363812216835,2021-10-24T07:01:32.000-07:00,https://twitter.com/IcavTech/status/1451549195270242309/photo/1,['http://pbs.twimg.com/media/FCTwTQuWEAgZIc-.png'],['photo'],['http://ow.ly/pUsT50GvgVL'],We are looking for Embedded Systems Engineer. It is a Remote role and hiring office is located in Bangalore/Bengaluru. |Click here for more info: https://t.co/rRUtMYBejQ||#hiring #ICAVTech #Embeddedsystems #jobsalert https://t.co/pnfeV3obKa,"['hiring', 'ICAVTech', 'Embeddedsystems', 'jobsalert']","",1420659167279292420,ICAV Tech,IcavTech,false,http://pbs.twimg.com/profile_images/1420684915247509507/Y8aoVSYV_normal.png,https://pbs.twimg.com/profile_banners/1420659167279292420/1627553001,"",117,298,1,0,0,2,2021-10-22T14:01:11.000-07:00
1451805592805261313,1452196995016368134,2021-10-24T08:55:18.000-07:00,https://twitter.com/leicspolice/status/1451805592805261313/photo/1,['http://pbs.twimg.com/media/FCSfKjHX0AsZchE.jpg'],['photo'],['http://bit.ly/2WwTtj6'],Did you know that we are hiring? 🤔 We are hiring for a number of support staff positions and a volunteering role. Come join #TeamLeicestershire and help keep your community safe! 🤗 Check out our website for more information: https://t.co/leW1x1m4Mu https://t.co/QeyPLW9gIh,['TeamLeicestershire'],"",87028400,Leicestershire Police,leicspolice,true,http://pbs.twimg.com/profile_images/1384063998757261314/02GfBUqy_normal.jpg,https://pbs.twimg.com/profile_banners/87028400/1608645672,http://abs.twimg.com/images/themes/theme1/bg.png,119762,999,6,1,0,4,2021-10-23T07:00:01.000-07:00
1451850540237869058,1452166388563464193,2021-10-24T06:53:41.000-07:00,"","","","","In all your entitlement, know that employers are taking big risks by hiring you. Not just that DJ but everyone. It’s not a 1 way street","","",63200840,Thomas Mɛwɔw,wofa_slayzie,false,http://pbs.twimg.com/profile_images/1392043010611990530/wpHmWuR__normal.jpg,https://pbs.twimg.com/profile_banners/63200840/1595078379,http://abs.twimg.com/images/themes/theme15/bg.png,14003,4748,25,0,2,28,2021-10-23T09:58:37.000-07:00
1451853858393796608,1452187027554848768,2021-10-24T08:15:42.000-07:00,https://twitter.com/cynixy/status/1451853858393796608/photo/1,['http://pbs.twimg.com/media/FCYFQvnWQAYOMV2.jpg'],['photo'],['https://www.workwithindies.com/careers/impossible-writer'],"Game writers! Impossible studio is hiring a remote writer for Été, 'a relaxing exploration game where you play as a painter who visits Montreal for a summer.' Bilingual French-English required. FT, contract #GameWriting #GameDevJobs https://t.co/WP3GO8khIh https://t.co/uJphOjXdxd","['GameWriting', 'GameDevJobs']","",366222792,Anna Me Ghoul,cynixy,false,http://pbs.twimg.com/profile_images/1166405602127601666/yt71VbnO_normal.jpg,https://pbs.twimg.com/profile_banners/366222792/1566927742,http://abs.twimg.com/images/themes/theme1/bg.png,14269,1472,91,0,3,43,2021-10-23T10:11:48.000-07:00
1451941007793303552,1452164279105318918,2021-10-24T06:45:18.000-07:00,"","","","","Holiday season is coming soon and I never been at such a low point. Since losing my last home last year, i struggled to make much money back. Hardly anyone is hiring, i barely have enough experience, and i was screwed over the stimulus. So all i can ask for now is donations(1/2)","","",2910302902,Beautifully dead inside🔮(Commissions Open),Mistyvampyric,false,http://pbs.twimg.com/profile_images/1357146277176348677/UJctEj7w_normal.jpg,https://pbs.twimg.com/profile_banners/2910302902/1560059564,http://abs.twimg.com/images/themes/theme1/bg.png,85,196,1,1,1,3,2021-10-23T15:58:06.000-07:00
1451957654117502979,1452193694082379778,2021-10-24T08:42:11.000-07:00,"","","",['https://jobs.lever.co/metalpay'],"Did you know that Metal employees can opt to receive some of their paycheck in $XPR? Our team figured how to handle the taxes, making it easier for employees to be paid in crypto - if they want.||Looking for a job? We're hiring! View openings here:|https://t.co/G4V0NkHOan","","",3111739836,Metal Pay,metalpaysme,false,http://pbs.twimg.com/profile_images/1283481158144139266/OhKZl3KU_normal.jpg,https://pbs.twimg.com/profile_banners/3111739836/1620236761,http://abs.twimg.com/images/themes/theme10/bg.gif,61812,684,285,11,19,79,2021-10-23T17:04:15.000-07:00
1452001989454401541,1452173847344689152,2021-10-24T07:23:19.000-07:00,"","","",['https://iosdevjobs.com/jobs/aa90f43b-cc25-42ec-bc31-03bc02364e5c'],Judo is hiring SwiftUI developers (multiplatform) to work on our server-driven UI platform. Looking for seasoned Apple developers with a passion to sharpen their SwiftUI skills. Remote. via @judoapp https://t.co/RYK9Gk2xyz,"",['judoapp'],1019494461494169601,iOS Dev Jobs,iOSDevJobsHQ,false,http://pbs.twimg.com/profile_images/1089588699426373632/hppj1GAz_normal.jpg,https://pbs.twimg.com/profile_banners/1019494461494169601/1548613088,http://abs.twimg.com/images/themes/theme1/bg.png,5341,2,6,0,0,1,2021-10-23T20:00:25.000-07:00
1452013147309674500,1452192988449357824,2021-10-24T08:39:23.000-07:00,https://twitter.com/MansourLab/status/1452013147309674500/photo/1,['http://pbs.twimg.com/media/FCaWP-HWUAcjDuJ.jpg'],['photo'],"",The Mansour lab is hiring! We are looking for talented scientists for Lab Manager and/or postdoc positions to work on @ERC_Research-funded project to interrogate neurodegeneration using iPSCs and brain organoid technologies. DM if you're interested. https://t.co/FCp2waGypt,"",['ERC_Research'],1364276001019219968,Mansour Lab,MansourLab,false,http://abs.twimg.com/sticky/default_profile_images/default_profile_normal.png,"","",15,77,20,1,1,17,2021-10-23T20:44:46.000-07:00
1452016036665036807,1452177190620221443,2021-10-24T07:36:37.000-07:00,"","","",['https://atsv7.wcn.co.uk/search_engine/jobs.cgi?SID=amNvZGU9MTg3NjU1NyZ2dF90ZW1wbGF0ZT05NjUmb3duZXI9NTA0MTE3OCZvd25lcnR5cGU9ZmFpciZicmFuZF9pZD0wJnZhY194dHJhNTA0MTE3OC41MF81MDQxMTc4PTkyNzg2JnZhY3R5cGU9MTI3NyZwb3N0aW5nX2NvZGU9MjI0'],@UCLChemistry is hiring a Transmission Electron Microscopy Facility Manager. Closing date is soon - 27th October so hurry and get your application in and come join us! Please retweet.||https://t.co/uoOWff7IEW,"",['UCLChemistry'],260884909,Claire Carmalt,ClaireCarmalt,false,http://pbs.twimg.com/profile_images/865976700122918912/2Slzz2Ax_normal.jpg,"",http://abs.twimg.com/images/themes/theme1/bg.png,866,753,1,0,0,2,2021-10-23T20:56:14.000-07:00
1452037153140219906,1452183067422904321,2021-10-24T07:59:58.000-07:00,"","","","","@AubreyGilleran What this means: Teenagers whose parents can afford to shell out $$$$$ for “college counseling” (hiring a professional to write their college essays) will get into UCLA and Berkeley. Can’t afford that, you’re SOL","",['AubreyGilleran'],31667539,Christina Pushaw 🐊,ChristinaPushaw,true,http://pbs.twimg.com/profile_images/1449207654300229636/WKGiVk0Y_normal.jpg,https://pbs.twimg.com/profile_banners/31667539/1634840822,http://abs.twimg.com/images/themes/theme1/bg.png,52703,7102,361,1,17,37,2021-10-23T22:20:09.000-07:00
1452053918133927939,1452195934851543046,2021-10-24T08:51:06.000-07:00,https://twitter.com/PvamuTv/status/1452053918133927939/photo/1,['http://pbs.twimg.com/media/FCa7V5bXoAgnfNJ.jpg'],['photo'],"",ATTENTION #PVAMU STUDENTS: PVAMU-TV is hiring! Interested in developing skills in tv production? Have experience editing video? Apply at PVAMU careers page on the university website. |Application deadline: Oct 27!  |Positions pay $11-$12/hr. |Student Hourly: 20 hr work week. https://t.co/4QgA45HU2z,['PVAMU'],"",1042804252782092289,PVAMU_TV,PvamuTv,false,http://pbs.twimg.com/profile_images/1042804452506316800/nUk38FNf_normal.jpg,https://pbs.twimg.com/profile_banners/1042804252782092289/1537464692,"",574,492,35,0,0,10,2021-10-23T23:26:46.000-07:00
1452119472454586371,1452177026866040841,2021-10-24T07:35:58.000-07:00,https://twitter.com/dkswithdandanie/status/1452119472454586371/photo/1,['http://pbs.twimg.com/media/FCb29U-UUAQ8-5o.jpg'],['photo'],['https://docs.google.com/forms/d/1E8VBmbwfa-KBVRnXNZ6Cgi6DUzFsZXz4ZSRGwOwuQmc/edit?usp=drivesdk'],✨ WE ARE HIRING! ✨||Looking for new admins WITH or WITHOUT any fanbase experience for support Doh Kyungsoo's upcoming schedule as a singer and actor!||Let's be a part of our team!| |📌  https://t.co/ac1xQ1SfXQ https://t.co/T08bmgFEBC,"","",1199372879135010816,🌹 DKS DANDAN MY 🇲🇾,dkswithdandanie,false,http://pbs.twimg.com/profile_images/1451939999742509059/Mcb4oRmk_normal.jpg,https://pbs.twimg.com/profile_banners/1199372879135010816/1635004467,"",1951,56,19,0,0,14,2021-10-24T03:47:15.000-07:00
1452155426976395270,1452184617344139267,2021-10-24T08:06:07.000-07:00,"","","","","@MOHW_Taiwan we are #fhshtwt, a group of enthusiastic high school individuals who are fluent in both Chinese and English. We know exactly what the younger generation likes, and we love your dog photos. Please consider hiring us as interns for your PR department",['fhshtwt'],['MOHW_Taiwan'],829294366636253186,viv//junior year suffer arc,vivianhuang0803,false,http://pbs.twimg.com/profile_images/1400642774295142404/afTuqgoD_normal.jpg,https://pbs.twimg.com/profile_banners/829294366636253186/1606153249,http://abs.twimg.com/images/themes/theme1/bg.png,59,88,10,1,3,2,2021-10-24T06:10:08.000-07:00
1452163610059362309,1452164224776560640,2021-10-24T06:45:05.000-07:00,https://twitter.com/diana_spink/status/1452163610059362309/photo/1,['http://pbs.twimg.com/media/FCcfG8tXMAUmbaK.jpg'],['photo'],['https://workfor.us/lhcgroup/5zl3v'],"#LHCGroup is hiring a RN Visit #Nurse -  #PartTime, apply now! (#OshkoshWisconsinUnitedStates) #job https://t.co/Xaq3Ot0Czb https://t.co/i9Um6fq3XG","['LHCGroup', 'Nurse', 'PartTime', 'OshkoshWisconsinUnitedStates', 'job']","",803567766460628992,Diana Spink,diana_spink,false,http://pbs.twimg.com/profile_images/1304162712285597704/WXGPDfLE_normal.jpg,https://pbs.twimg.com/profile_banners/803567766460628992/1599771596,http://abs.twimg.com/images/themes/theme1/bg.png,52,284,0,0,0,1,2021-10-24T06:42:39.000-07:00
1452164189141745665,1452164189141745665,2021-10-24T06:44:57.000-07:00,https://twitter.com/Paghdjob/status/1452164189141745665/photo/1,['http://pbs.twimg.com/media/E7haSvMVUAYFk14.jpg'],['photo'],['https://www.paghd.com/job/ci-cd-devops-engineer'],"Hello, We are hiring ci/cd devops engineer, job link - https://t.co/HSua994gEW  #job #hire  #continuousintegration #scrum #agile #Delft #Netherlands #employees #recruiter #employeebenefits #jobsearch https://t.co/RxlUmhbkAN","['job', 'hire', 'continuousintegration', 'scrum', 'agile', 'Delft', 'Netherlands', 'employees', 'recruiter', 'employeebenefits', 'jobsearch']","",1420260812342448135,paghd.com,Paghdjob,false,http://pbs.twimg.com/profile_images/1420261510761250820/9o5B7fW7_normal.jpg,https://pbs.twimg.com/profile_banners/1420260812342448135/1627623108,"",43,901,0,0,0,0,2021-10-24T06:44:57.000-07:00
1452164583645491203,1452164583645491203,2021-10-24T06:46:31.000-07:00,"","","",['https://bit.ly/3m681EX'],"[Now Hiring] Associate, Talent Mobility Partner - BlackRock - Wilmington, DE https://t.co/TA7tBxx2cr","","",398158831,L&D Community,atdlearndev,false,http://pbs.twimg.com/profile_images/1148283900164214785/kW1rn8bP_normal.png,https://pbs.twimg.com/profile_banners/398158831/1432918750,http://abs.twimg.com/images/themes/theme14/bg.gif,4961,3968,0,0,0,0,2021-10-24T06:46:31.000-07:00
1452164654008987652,1452188221203525632,2021-10-24T08:20:26.000-07:00,"","","",['https://www.remotetechjobs.com/*/78594'],"PJS &amp; Co. CPAs is hiring: Marketing Assistant (PT)||PJS &amp; Co. CPAs is looking for a professional marketing assistant who can help us with a variety of tasks focused on improving profit, growth, and lifestyle...||https://t.co/2EcAqfZlrP|#Remote #wordpress #Jobs","['Remote', 'wordpress', 'Jobs']","",1298682524235739136,Remote Tech Jobs,RemoteTechJobs0,false,http://pbs.twimg.com/profile_images/1357528431328718848/KxyAQegS_normal.png,https://pbs.twimg.com/profile_banners/1298682524235739136/1612495889,"",360,1,0,0,0,1,2021-10-24T06:46:48.000-07:00
1452164663093780490,1452165283217559559,2021-10-24T06:49:18.000-07:00,"","","",['https://www.remotetechjobs.com/*/78601'],Agiloft is hiring: SaaS Implementation Specialist III||The Job: Implementer III You will be responsible for designing and implementing software configurations to meet the needs of customers ranging in...||https://t.co/FRfjFdg5yL|#Remote #customer-support #Jobs,"['Remote', 'customer', 'Jobs']","",1298682524235739136,Remote Tech Jobs,RemoteTechJobs0,false,http://pbs.twimg.com/profile_images/1357528431328718848/KxyAQegS_normal.png,https://pbs.twimg.com/profile_banners/1298682524235739136/1612495889,"",360,1,0,0,0,1,2021-10-24T06:46:50.000-07:00
1452165634549161990,1452169262127271936,2021-10-24T07:05:06.000-07:00,https://twitter.com/AttemptFirst/status/1452165634549161990/photo/1,['http://pbs.twimg.com/media/FCcg8qBUYAUeDy5.jpg'],['photo'],"","We are #hiring for Teleperformance |Technical Support Executive||Job details||Salary|₹21,000 - ₹27,000 a month|Job Type|Full-time|Walk-In|Number of hires for this role|On-going need to fill this role|#firstattempt  #teamfirstattempt #careers #jobinjaipur #jobsearch https://t.co/YLZNjTwMxf","['hiring', 'firstattempt', 'teamfirstattempt', 'careers', 'jobinjaipur', 'jobsearch']","",1244652219825131520,First Attempt,AttemptFirst,false,http://pbs.twimg.com/profile_images/1389457026636337152/8L_DuIDR_normal.jpg,https://pbs.twimg.com/profile_banners/1244652219825131520/1618834011,"",64,457,0,0,0,1,2021-10-24T06:50:41.000-07:00
1452166482662723584,1452166482662723584,2021-10-24T06:54:04.000-07:00,"","","","",@JewSwell @QuisitiveInvest It’s hard to run a restaurant without help. Customers tend to go to competitors who have more people with more skills. They attract and keep those people by paying more than others. There is a way to get by hiring only one person: a bankruptcy lawyer.,"","['JewSwell', 'QuisitiveInvest']",447095489,Michael Olenick,michael_olenick,false,http://pbs.twimg.com/profile_images/1193995547323052033/NEl7K-qu_normal.jpg,https://pbs.twimg.com/profile_banners/447095489/1593076869,http://abs.twimg.com/images/themes/theme1/bg.png,459,198,0,0,0,0,2021-10-24T06:54:04.000-07:00
1452166715781967875,1452166715781967875,2021-10-24T06:54:59.000-07:00,https://twitter.com/jibpalomar/status/1452166715781967875/photo/1,['http://pbs.twimg.com/media/FCch7NNVQAEAeKl.jpg'],['photo'],"","Connect with something bigger!||Starbucks Allegro Center, Makati is now hiring FULL TIME And PART TIME BARISTAS||We welcome passionate, friendly and dedicated people of all backgrounds who can showcase their passion for service. 😊||DM me for details. https://t.co/4TF5dxc4G8","","",1325344985068171266,Jib Palomar,jibpalomar,false,http://pbs.twimg.com/profile_images/1398966415852380163/IgIBO6U0_normal.jpg,https://pbs.twimg.com/profile_banners/1325344985068171266/1604835216,"",226,157,0,0,0,0,2021-10-24T06:54:59.000-07:00
1452167987033776136,1452167987033776136,2021-10-24T07:00:02.000-07:00,https://twitter.com/vxiph/status/1452167987033776136/photo/1,['http://pbs.twimg.com/media/FCcjFreWQAUFJqj.jpg'],['photo'],"","2021 is soon drawing to a close, but here in VXI, the HIRING SIMPLY WON'T STOP. Our only wish? To have you join our team in MOA and welcome 2022 together! #VXIPH #HiringNeverStops #MagnificentMOA https://t.co/PEvyhjr2eL","['VXIPH', 'HiringNeverStops', 'MagnificentMOA']","",2282893454,VXI PH,vxiph,true,http://pbs.twimg.com/profile_images/727106703372619776/vvG2SC3l_normal.jpg,https://pbs.twimg.com/profile_banners/2282893454/1631764370,http://abs.twimg.com/images/themes/theme15/bg.png,1585,15,0,0,0,0,2021-10-24T07:00:02.000-07:00
1452167987603988491,1452167987603988491,2021-10-24T07:00:02.000-07:00,"","","",['https://bit.ly/3Dr9tbB'],Lancaster is hiring: Personal Support Worker - PSW https://t.co/NpBIOSPQ0G #job #Lancaster,"['job', 'Lancaster']","",1306613903133151234,Shannon Clark,LTCandRETJobs,false,http://abs.twimg.com/sticky/default_profile_images/default_profile_normal.png,"","",1,17,0,0,0,0,2021-10-24T07:00:02.000-07:00
1452167996445577219,1452168046907379717,2021-10-24T07:00:17.000-07:00,"","","",['https://bit.ly/3Alw9rE'],Cedarvale Terrace is hiring: Registered Nurse - [RN] https://t.co/FOyg7zzBxs #job #Toronto,"['job', 'Toronto']","",1306613903133151234,Shannon Clark,LTCandRETJobs,false,http://abs.twimg.com/sticky/default_profile_images/default_profile_normal.png,"","",1,17,0,0,0,1,2021-10-24T07:00:04.000-07:00
1452168250033324036,1452168250033324036,2021-10-24T07:01:05.000-07:00,"","","",['https://ift.tt/3b61zY8'],"New top story on Hacker News: Generally Intelligent Is Hiring Machine Learning Research Engineers (Remote, SF) https://t.co/uEcFFPFCqA","","",713744899279945728,NewsVogue,newsvogueindia,false,http://pbs.twimg.com/profile_images/1241446736360398848/pniPgmMX_normal.jpg,https://pbs.twimg.com/profile_banners/713744899279945728/1584802092,"",46,6,0,0,0,0,2021-10-24T07:01:05.000-07:00
1452168353364135944,1452168353364135944,2021-10-24T07:01:30.000-07:00,"","","",['https://bit.ly/3m6j94I'],"Looking to grow your career in healthcare? Merritt Hawkins is hiring in TX, click here to apply today: https://t.co/jbnfcOuSWo #PhysicianJobs #MedicalDoctor","['PhysicianJobs', 'MedicalDoctor']","",1196885483747282944,Health eCareers Jobs Feed,HeC_Jobs,false,http://pbs.twimg.com/profile_images/1196885619814760448/Wlkuefxh_normal.png,https://pbs.twimg.com/profile_banners/1196885483747282944/1606857514,"",1343,116,0,0,0,0,2021-10-24T07:01:30.000-07:00
1452171121722159108,1452171121722159108,2021-10-24T07:12:30.000-07:00,"","","","","Want to land a job like 'Product Lifecycle Lead' at Thermo Fisher Scientific? Applicant tracking systems look for specific keywords. Use the right keywords and get your resume in front of the hiring manager. #Manufacturing #Charleroi, WAL","['Manufacturing', 'Charleroi']","",39248326,TMJ-BEL Manuf Jobs,tmj_bel_manuf,false,http://pbs.twimg.com/profile_images/690434386924322817/OeEsujm3_normal.jpg,https://pbs.twimg.com/profile_banners/39248326/1453447362,http://abs.twimg.com/images/themes/theme1/bg.png,140,106,0,0,0,0,2021-10-24T07:12:30.000-07:00
1452173012246089728,1452173012246089728,2021-10-24T07:20:00.000-07:00,https://twitter.com/admin_job/status/1452173012246089728/photo/1,['http://pbs.twimg.com/media/FCcnqMDX0AMFDbS.jpg'],['photo'],['https://ift.tt/3B6DRFL'],"Opportunities for Administrative Assistant in Florence, KY #Florence #AdminAssistant #AdminJobs #adminjob #hiring #opportunity Apply: https://t.co/WBPEv06uAS https://t.co/rYGTKZtvC6","['Florence', 'AdminAssistant', 'AdminJobs', 'adminjob', 'hiring', 'opportunity']","",1026528994454327296,Admin Job Finder,admin_job,false,http://pbs.twimg.com/profile_images/1026530020439846913/KPMMCq6L_normal.jpg,https://pbs.twimg.com/profile_banners/1026528994454327296/1533578888,http://abs.twimg.com/images/themes/theme1/bg.png,53,19,0,0,0,0,2021-10-24T07:20:00.000-07:00
1452173788364173320,1452173788364173320,2021-10-24T07:23:05.000-07:00,"","","",['https://globaljobalert.com/?p=3905'],"Toggl is #hiring for #Frontend_Developer – #Work_from_Anywhere. For more information, please check this link – https://t.co/1p6kHqJrk4","['hiring', 'Frontend_Developer', 'Work_from_Anywhere']","",1233748002692571136,Global Job Alert,JobBroadcast,false,http://pbs.twimg.com/profile_images/1233795623247384577/djEW8tyk_normal.jpg,"","",672,4861,0,0,0,0,2021-10-24T07:23:05.000-07:00
1452174288203747336,1452191217744232461,2021-10-24T08:32:21.000-07:00,https://twitter.com/KEP1er_VOTE/status/1452174288203747336/photo/1,['http://pbs.twimg.com/media/FCco0ZjXMAEz81v.jpg'],['photo'],['https://docs.google.com/forms/d/e/1FAIpQLScGldYagumm7al0WtYg7-_P0EJsGwf_hbFRlh99K-6QDlbIjw/viewform?usp=sf_link'],🔔 - [RECRUITMENT]||Kep1er Voting Team recruitment !||We're looking for :|• GFX EDITORS |• APP/SITE VOTE REMINDS |• SNS MANAGERS ||🗓 - END : 2021.11.02|🖇 : https://t.co/Fd5WIaDzHZ||#Kep1er #케플러 https://t.co/1lSLYVSHtE,"['Kep1er', '케플러']","",1405144166355644422,KEP1ER VOTE,KEP1er_VOTE,false,http://pbs.twimg.com/profile_images/1451573530684973061/lN_3jlhJ_normal.jpg,https://pbs.twimg.com/profile_banners/1405144166355644422/1634917073,"",4044,31,13,0,0,8,2021-10-24T07:25:05.000-07:00
1452175028791939073,1452175028791939073,2021-10-24T07:28:01.000-07:00,"","","",['https://tinyurl.com/yfta5te4'],Now Hiring! #kcjobs Fostering Prevention Specialist -  https://t.co/6QC4qlOMgh,['kcjobs'],"",49798813,Nonprofit Connect,npconnect,false,http://pbs.twimg.com/profile_images/524986088528433152/QV9hWq07_normal.png,https://pbs.twimg.com/profile_banners/49798813/1507660371,http://abs.twimg.com/images/themes/theme9/bg.gif,6458,2766,0,0,0,0,2021-10-24T07:28:01.000-07:00
1452175651952230400,1452175651952230400,2021-10-24T07:30:30.000-07:00,"","","",['https://m.youtube.com/watch?v=miomuSGoPzI'],"Now hiring an experienced Marketing Account Manager rockstar for my favorite marketing outsourcing firm. Message me if interested, but only if you can appreciate this https://t.co/6f70bU6T08||#nowhiring #marketing #experience #hiring #marketingmanager #accountmanager","['nowhiring', 'marketing', 'experience', 'hiring', 'marketingmanager', 'accountmanager']","",6609072,Patrick Byers,patrickbyers,false,http://pbs.twimg.com/profile_images/1416160207642660867/gLdFzEXh_normal.jpg,https://pbs.twimg.com/profile_banners/6609072/1626473879,http://abs.twimg.com/images/themes/theme1/bg.png,21367,9659,0,0,0,0,2021-10-24T07:30:30.000-07:00
1452175669245272067,1452175669245272067,2021-10-24T07:30:34.000-07:00,"","","",['https://www.jobs2careers.com/click.php?jid=423aee9766ddb4ee7651b04de&ri=94b538d39dab4a3a91c2043b3badccf0&job_loc=Los+Angeles%2CCA&q=&spl=M5ZQ0nzavt0zVugL%3ALhmzkf%2BOrwktxKnOS3t1pg%3D%3D%3A24dCSAYY7INK2P37zZ6%2FGqItdADB%2FIxj4vqlsPHF0eQEhEWC0vo%2FOGtv0WAbPPwOwFgu32LOhg%3D%3D&encrypt=0&l=USA'],Addison Group is hiring in Los Angeles for a WEB - Elixir Engineer (2) Remote. Click now to apply! |https://t.co/iHbKAvg5k7||#losangeles #remotework #jobhunt #jobseekers #jobsearching #vacancies,"['losangeles', 'remotework', 'jobhunt', 'jobseekers', 'jobsearching', 'vacancies']","",1289004009270005768,remote_work_jobs_bot,BotRemote,false,http://pbs.twimg.com/profile_images/1289004849888137217/3q4Cy15h_normal.jpg,"","",17,0,0,0,0,0,2021-10-24T07:30:34.000-07:00
1452176536229093381,1452176536229093381,2021-10-24T07:34:01.000-07:00,https://twitter.com/JobSpotph/status/1452176536229093381/photo/1,['http://pbs.twimg.com/media/FCcq3S-WYAQNyKy.png'],['photo'],['https://loom.ly/-D0-SqI'],Here's where to start searching for Developer jobs.  We're hiring!  https://t.co/dcqlfpnMhZ #IT #Tech #ITJobs #hiring #employment #jobopening #jobopportunities https://t.co/QpNaWmB6vF,"['IT', 'Tech', 'ITJobs', 'hiring', 'employment', 'jobopening', 'jobopportunities']","",68935066,JobSpot,JobSpotph,false,http://pbs.twimg.com/profile_images/1145510117145624578/Gg7rJRwM_normal.png,https://pbs.twimg.com/profile_banners/68935066/1593583109,http://abs.twimg.com/images/themes/theme1/bg.png,479,150,0,0,0,0,2021-10-24T07:34:01.000-07:00
1452176723215372290,1452176723215372290,2021-10-24T07:34:45.000-07:00,"","","",['https://ift.tt/3b61zY8'],"Generally Intelligent Is Hiring Machine Learning Research Engineers (Remote, SF) https://t.co/MvGWqjMYSh |1","","",3242877525,Dian Zoltan,InfernalZoltan,false,http://pbs.twimg.com/profile_images/596887851771437056/n-Fg89wr_normal.jpg,https://pbs.twimg.com/profile_banners/3242877525/1524168933,http://abs.twimg.com/images/themes/theme1/bg.png,423,7,0,0,0,0,2021-10-24T07:34:45.000-07:00
1452177851181060098,1452177874249732097,2021-10-24T07:39:20.000-07:00,https://twitter.com/Paghdjob/status/1452177851181060098/photo/1,['http://pbs.twimg.com/media/E7haSvMVUAYFk14.jpg'],['photo'],['https://www.paghd.com/job/cloud-engineer-linux.1'],"Hello, We are hiring cloud engineer linux, job link - https://t.co/VcYkmDAHrS  #job #hire  #linux #kubernetes #Python #puppet #MYSQL #Rotterdam #Netherlands #employees #recruiter #employeebenefits #jobsearch https://t.co/7vRvY5hz34","['job', 'hire', 'linux', 'kubernetes', 'Python', 'puppet', 'MYSQL', 'Rotterdam', 'Netherlands', 'employees', 'recruiter', 'employeebenefits', 'jobsearch']","",1420260812342448135,paghd.com,Paghdjob,false,http://pbs.twimg.com/profile_images/1420261510761250820/9o5B7fW7_normal.jpg,https://pbs.twimg.com/profile_banners/1420260812342448135/1627623108,"",43,901,0,0,0,1,2021-10-24T07:39:14.000-07:00
1452177921825775618,1452177921825775618,2021-10-24T07:39:31.000-07:00,"","","",['http://app.jobvite.com/m?3QuL6mw2'],"Lurie, LLP is hiring!  Check out our job openings: 2022 Assurance Services Intern. |https://t.co/eFr6Rt3GU5 #job",['job'],"",875474274508820481,Amy Jongerius,AmyJongerius,false,http://pbs.twimg.com/profile_images/905147803407589376/x6e_CyLI_normal.jpg,https://pbs.twimg.com/profile_banners/875474274508820481/1504639179,http://abs.twimg.com/images/themes/theme1/bg.png,32,70,0,0,0,0,2021-10-24T07:39:31.000-07:00
1452178002079588354,1452178002079588354,2021-10-24T07:39:50.000-07:00,"","","",['http://app.jobvite.com/m?3SuL6mw4'],"Advanced Technology Services, Inc. is #hiring for Traveling Maintenance Planner Scheduler. #maintenancecareers #makeithappen #2021|https://t.co/I71A4p2fpy #job","['hiring', 'maintenancecareers', 'makeithappen', 'job']","",955786455716114432,Katie Griffith,ATSrecruiterKG,false,http://pbs.twimg.com/profile_images/1146474152246857730/iMtxrn_0_normal.png,https://pbs.twimg.com/profile_banners/955786455716114432/1516714579,"",45,44,0,0,0,0,2021-10-24T07:39:50.000-07:00
