org_id,samp_id,samp_datetime,org_url,org_media_url,org_media_type,org_attached_links,org_text,org_hashtags,org_user_metions,user_id,user_name,user_screen_name,user_verified,user_profile_image_url,user_profile_banner_url,user_profile_background_image_url,user_followers_count,user_friends_count,org_favorite_count,org_quote_count,org_reply_count,org_retweet_count,org_datetime
1453324459939663872,1454600227026051080,2021-10-31T00:04:53.000-07:00,https://twitter.com/stephkanavy/status/1453324459939663872,"","",['https://www.paycomonline.net/v4/ats/web.php/jobs/ViewJobDetails?job=20296&clientkey=E86E7B5A50F7166F4A47173978DA4F79'],"Hey journo kids, @lancasteronline is hiring an education reporter at #LNP. You'd report to my direct report in a subscription-based, reader-focused, metrics-informed newsroom at a family-owned outlet. #journalismjobs #journalism #education #reporting https://t.co/v4miKytqSj","['LNP', 'journalismjobs', 'journalism', 'education', 'reporting']",['LancasterOnline'],19383064,Stephanie Sadowski,stephkanavy,true,http://pbs.twimg.com/profile_images/1345558407298899970/gZnR8-X3_normal.jpg,https://pbs.twimg.com/profile_banners/19383064/1619318390,http://abs.twimg.com/images/themes/theme7/bg.gif,1977,3400,7,2,0,4,2021-10-27T11:35:27.000-07:00
1453415211122106370,1454593227281952769,2021-10-30T23:37:05.000-07:00,"","","",['http://dlvr.it/SBPtwz'],"Now Hiring: Attorney Advisor at Bureau of the Fiscal Service (Washington, D.C.) https://t.co/RmX95kxnwJ #legaljobs #lawjobs","['legaljobs', 'lawjobs']","",49049693,GoInhouse®,goinhouse,false,http://pbs.twimg.com/profile_images/992508612273635328/74DREEkY_normal.jpg,https://pbs.twimg.com/profile_banners/49049693/1590205232,http://abs.twimg.com/images/themes/theme6/bg.gif,7701,3770,0,0,0,1,2021-10-27T17:36:04.000-07:00
1453415216662728711,1454593232571023361,2021-10-30T23:37:06.000-07:00,"","","",['http://dlvr.it/SBPtx9'],"Now Hiring: Senior Corporate Counsel, SEC Reporting at Inspirato (Denver, CO) https://t.co/x5JA1nwMWw #lawjobs #corporatecounsel","['lawjobs', 'corporatecounsel']","",49049693,GoInhouse®,goinhouse,false,http://pbs.twimg.com/profile_images/992508612273635328/74DREEkY_normal.jpg,https://pbs.twimg.com/profile_banners/49049693/1590205232,http://abs.twimg.com/images/themes/theme6/bg.gif,7701,3770,0,0,0,1,2021-10-27T17:36:05.000-07:00
1453422894772408322,1454600776500666372,2021-10-31T00:07:04.000-07:00,"","","",['http://dlvr.it/SBPzNT'],"Now Hiring: Associate General Counsel at Wright State University (Dayton, OH) https://t.co/QxhPRqxBwj #lawtwitter #inhousetwitter","['lawtwitter', 'inhousetwitter']","",49049693,GoInhouse®,goinhouse,false,http://pbs.twimg.com/profile_images/992508612273635328/74DREEkY_normal.jpg,https://pbs.twimg.com/profile_banners/49049693/1590205232,http://abs.twimg.com/images/themes/theme6/bg.gif,7700,3770,0,0,0,1,2021-10-27T18:06:36.000-07:00
1453431082724904964,1454609204178669570,2021-10-31T00:40:34.000-07:00,"","","",['http://dlvr.it/SBQ4K6'],"Now Hiring: Licensing/Reg Compliance Counsel at PCV Murcor (Pomona, CA) https://t.co/Lj3Iwuyfub #corporatecounsel #inhousecounsel","['corporatecounsel', 'inhousecounsel']","",49049693,GoInhouse®,goinhouse,false,http://pbs.twimg.com/profile_images/992508612273635328/74DREEkY_normal.jpg,https://pbs.twimg.com/profile_banners/49049693/1590205232,http://abs.twimg.com/images/themes/theme6/bg.gif,7700,3770,0,0,0,1,2021-10-27T18:39:08.000-07:00
1453680191864254466,1454588966280183812,2021-10-30T23:20:09.000-07:00,"","","","",to be clear there is plenty of blame on the producers for 1) making the armorer double as asst prop person and 2) hiring someone who would take that double gig and 3) she should have been canned the instant she was muzzle sweeping people,"","",1245808133840211972,your friend,debdrens,false,http://pbs.twimg.com/profile_images/1245869449623867392/-ocMjDCn_normal.jpg,"","",8941,1044,5929,4,17,246,2021-10-28T11:09:00.000-07:00
1453949806087340033,1454590743641735174,2021-10-30T23:27:12.000-07:00,"","","","","As it turns out, the person didn’t get the internship. And they and a few other people felt some type of way about it and let us know that. And it’s like… that public discussion of an opaque hiring process was necessarily going to disappoint a lot of people.","","",87359651,Tyrese Vaxey.,GeeDee215,true,http://pbs.twimg.com/profile_images/1448134064813207560/aZ2o0pWb_normal.jpg,"",http://abs.twimg.com/images/themes/theme14/bg.gif,104080,4990,152,1,2,5,2021-10-29T05:00:21.000-07:00
1454034220595171330,1454615788128714761,2021-10-31T01:06:44.000-07:00,https://twitter.com/JermaineJupiter/status/1454034220595171330/photo/1,['http://pbs.twimg.com/media/FC3EaypX0AI6ACG.jpg'],['photo'],"",There's a labor shortage in Tech but everyone wants to hire senior and no one wants to invest in the future.||We need to do better. We need to be more accessible. Who is hiring for Junior Talent? Can I introduce some Jr. Black Developers to you? https://t.co/kAlRG8wqpx,"","",1031293757759610880,Jermaine Jupiter | Career Coach & Tech Recruiter,JermaineJupiter,false,http://pbs.twimg.com/profile_images/1246094561698615298/ML6dCmxV_normal.jpg,https://pbs.twimg.com/profile_banners/1031293757759610880/1585926693,http://abs.twimg.com/images/themes/theme1/bg.png,14478,4152,1651,44,71,444,2021-10-29T10:35:47.000-07:00
1454101644107567104,1454597912273559552,2021-10-30T23:55:42.000-07:00,https://twitter.com/umichalzheimers/status/1454101644107567104,['http://pbs.twimg.com/media/FC4BWNfWQAMljNH.jpg'],['photo'],['https://medicine.umich.edu/dept/neurology/about-us/faculty-recruitment'],"Join us! U-M Neurology is recruiting for the endowed Elinor Levine Professor in Dementia Research. Applicants from underrepresented backgrounds are encouraged to apply. More information about the position, how to apply, and living in Ann Arbor at: https://t.co/kA5cvYO2Pk https://t.co/nxswKhFXrV","","",2900715323,U-M Alzheimer's Disease Center,umichalzheimers,false,http://pbs.twimg.com/profile_images/1402731105069973505/0VPc7hNK_normal.jpg,https://pbs.twimg.com/profile_banners/2900715323/1617128751,http://abs.twimg.com/images/themes/theme1/bg.png,897,602,3,1,0,3,2021-10-29T15:03:42.000-07:00
1454187898224484353,1454604239313903617,2021-10-31T00:20:50.000-07:00,"","","",['https://www.erewhonbooks.com/jobs-editorial-assistant'],"We're hiring! Erewhon Books seeks an Editorial Assistant to join our team, someone enthusiastic about adult &amp; YA literary speculative fiction!||Remote-friendly, full benefits, $40K/year. We encourage candidates from underrepresented backgrounds to apply.||https://t.co/ms7ztQuhRd","","",1009190743049756676,Erewhon Books,ErewhonBooks,false,http://pbs.twimg.com/profile_images/1138139243279241218/KM8lonbI_normal.png,https://pbs.twimg.com/profile_banners/1009190743049756676/1560188496,"",4096,478,554,32,18,352,2021-10-29T20:46:27.000-07:00
1454189965642928130,1454615469827166209,2021-10-31T01:05:28.000-07:00,"","","",['https://hr.wwu.edu/careers-staff?job=499075'],We're hiring a General Chemistry Lab Coordinator! Applications are due November 11. Come work with us! #chemjobs||https://t.co/JtAxkYeXZV,['chemjobs'],"",992116554404843522,WWU CHEM Department,WWUChem,false,http://pbs.twimg.com/profile_images/992126505579790336/7SqzG-MX_normal.jpg,https://pbs.twimg.com/profile_banners/992116554404843522/1525375233,"",95,169,3,1,0,3,2021-10-29T20:54:40.000-07:00
1454193228584931329,1454603529293901826,2021-10-31T00:18:01.000-07:00,"","","","",Howard is hiring all these high-profile professors and deans while the dorms have mold wallpaper and no working water. These students should be raising hell.,"","",23223046,MoneybaggHo,KirkWrites79,true,http://pbs.twimg.com/profile_images/1452673271640453125/DujqMFHl_normal.jpg,https://pbs.twimg.com/profile_banners/23223046/1587143824,http://abs.twimg.com/images/themes/theme1/bg.png,32389,4978,193,3,5,40,2021-10-29T21:07:37.000-07:00
1454334010281373697,1454598393418817538,2021-10-30T23:57:36.000-07:00,"","","","","if you’re gonna tell me number of citations/publications don’t matter for hiring currently I’m sorry but I find that hard to believe, that may be something you want to work towards but it’s not the current reality that most junior ppl are experiencing","","",747222475461656577,Dr. Spook-jana Curtis! 🎃,sanjanacurtis,false,http://pbs.twimg.com/profile_images/1426751975887048714/KBjcUEa0_normal.jpg,https://pbs.twimg.com/profile_banners/747222475461656577/1624254124,"",20790,2229,36,0,3,3,2021-10-30T06:27:02.000-07:00
1454425188813049860,1454612752367030277,2021-10-31T00:54:40.000-07:00,"","","","","Do you know anyone who is hiring for analyst interns? Someone I know is looking for an internship role. 👀||Startups founder in my network, let me know if you're hiring!!","","",1343450217417359361,Ishant Juyal,juyal_ishant,false,http://pbs.twimg.com/profile_images/1343450458463989761/o067DKzx_normal.jpg,https://pbs.twimg.com/profile_banners/1343450217417359361/1632646093,"",1967,325,85,0,10,6,2021-10-30T12:29:21.000-07:00
1454473230039670790,1454606441881477124,2021-10-31T00:29:35.000-07:00,https://twitter.com/cardio_femme/status/1454473230039670790/photo/1,['http://pbs.twimg.com/media/FC9Sa2NVUAoFdnt.jpg'],['photo'],"",We're hiring both a staff research scientist and a postdoc to study mechanobiology in cardiovascular development! Please RT. https://t.co/e2pUOMrvec,"","",1315598975689465857,Dr. Stephanie Lindsey,cardio_femme,false,http://pbs.twimg.com/profile_images/1315602886169161729/-eSW8DLe_normal.jpg,"","",370,424,13,0,1,9,2021-10-30T15:40:15.000-07:00
1454493635098124292,1454609082602696704,2021-10-31T00:40:05.000-07:00,"","","","",Looking for a job? Hiring? My followers are mostly recruiters and jobseekers.||Drop a note below and introduce yourself…let everyone know what kind of job you’re looking for or what roles you’re hiring for (and where).||Last time I did this a couple of people landed jobs :),"","",433350023,Adam Karpiak,Adam_Karpiak,false,http://pbs.twimg.com/profile_images/1323104104294526977/kiYVzaAR_normal.jpg,https://pbs.twimg.com/profile_banners/433350023/1552521855,http://abs.twimg.com/images/themes/theme1/bg.png,21367,347,355,2,113,82,2021-10-30T17:01:20.000-07:00
1454497576930070528,1454593090270937088,2021-10-30T23:36:32.000-07:00,https://twitter.com/ComparativeEduc/status/1454497576930070528/photo/1,['http://pbs.twimg.com/media/FCoyQElWUAcry40.jpg'],['photo'],['https://www.depts.ttu.edu/education/our-people/faculty-and-staff-resources/documents/EPOL-faculty-position-announcement-fall-2021.pdf'],#Tenure-track #faculty position w focus on #Latinx #education #policy! NOW HIRING||Come be our colleague! https://t.co/oIlP0cyPWV https://t.co/hhxeF0Jv8r,"['Tenure', 'faculty', 'Latinx', 'education', 'policy']","",578948451,Alexander W. Wiseman,ComparativeEduc,false,http://pbs.twimg.com/profile_images/1232878050020331520/yKNZnz0T_normal.jpg,https://pbs.twimg.com/profile_banners/578948451/1623954027,http://abs.twimg.com/images/themes/theme1/bg.png,1034,1018,2,0,0,2,2021-10-30T17:17:00.000-07:00
1454499694214799366,1454612730770563074,2021-10-31T00:54:35.000-07:00,https://twitter.com/CISAJen/status/1454499694214799366/video/1,['http://pbs.twimg.com/ext_tw_video_thumb/1454499595950698498/pu/img/Ll_7-agYGhvALiMS.jpg'],['video'],['http://cisa.gov/careers'],Working at @CISAgov is kind of like solving a hard puzzle or conquering a game except you are solving national security problems. Sound intriguing? We’re hiring: https://t.co/jUaLhfwMGY https://t.co/fbFH7HgCeZ,"",['CISAgov'],1414656419861864452,Jen Easterly,CISAJen,true,http://pbs.twimg.com/profile_images/1451654868318441472/JGwA37Vd_normal.jpg,https://pbs.twimg.com/profile_banners/1414656419861864452/1635516100,"",18206,160,91,0,5,30,2021-10-30T17:25:25.000-07:00
1454518728134115334,1454595475273887746,2021-10-30T23:46:01.000-07:00,"","","","","@Pelgridge @nypost You don’t realize people are sick of being used by corrupt politicians, police and other city workers are asked to do so much with no support, and they are fed up, the best are leaving, all Nypd/fd are hiring now are legit people with criminal records cuz no one wants the job","","['Pelgridge', 'nypost']",344478376,JOBU TRADING,jetsgonjet,false,http://pbs.twimg.com/profile_images/1451283185564897286/qUkCo4PO_normal.jpg,https://pbs.twimg.com/profile_banners/344478376/1624189333,http://abs.twimg.com/images/themes/theme1/bg.png,659,731,6,0,0,1,2021-10-30T18:41:03.000-07:00
1454553774958153728,1454594911165198338,2021-10-30T23:43:46.000-07:00,"","","","",TA / Recruiting;|#talentacquisition #STEM #branding #talentpartner #technicalrecruiting #tech #fintech #IoT #OpenSource #ATS #Greenhouse #Lever #sourcing #jobs #hiring #HRIS #AI #MachineLearning #Ruby #React #Angular #Python #EQ #recruiting #socialmedia #developers #SDET #SRE,"['talentacquisition', 'STEM', 'branding', 'talentpartner', 'technicalrecruiting', 'tech', 'fintech', 'IoT', 'OpenSource', 'ATS', 'Greenhouse', 'Lever', 'sourcing', 'jobs', 'hiring', 'HRIS', 'AI', 'MachineLearning', 'Ruby', 'React', 'Angular', 'Python', 'EQ', 'recruiting', 'socialmedia', 'developers', 'SDET', 'SRE']","",369705071,Paul G. 👊👊🏿👊🏻🌈,TalentGeek2,false,http://pbs.twimg.com/profile_images/1307858912863944709/Bh7YSC0Z_normal.jpg,https://pbs.twimg.com/profile_banners/369705071/1631824292,http://abs.twimg.com/images/themes/theme1/bg.png,8322,8046,4,0,0,5,2021-10-30T21:00:18.000-07:00
1454554451793022977,1454606863517904898,2021-10-31T00:31:16.000-07:00,"","","",['https://komonews.com/news/local/durkan-issues-executive-order-to-allow-hiring-incentives-for-seattle-police-dispatchers'],"Seattle Mayor Jenny Durkan issued an emergency order Friday to allow SPD and the Community Safety and Communications Center to offer hiring bonuses of up to $25,000 for lateral hires and up to $10,000 for new hires.|https://t.co/vFnh56XdTA","","",16086928,KOMO News,komonews,true,http://pbs.twimg.com/profile_images/877320559352086529/P4ou7Rul_normal.jpg,https://pbs.twimg.com/profile_banners/16086928/1626977850,http://abs.twimg.com/images/themes/theme4/bg.gif,442570,2316,21,2,19,5,2021-10-30T21:03:00.000-07:00
1454588454398935041,1454588454398935041,2021-10-30T23:18:07.000-07:00,"","","",['https://bit.ly/3bqVXbd'],"Want to work at U.S. Bank? We're hiring in #Pleasanton, CA! Click for details: https://t.co/x3OCulKBwP #branchbanking","['Pleasanton', 'branchbanking']","",21712326,TMJ - SJC Bank Jobs,tmj_sjc_banking,false,http://pbs.twimg.com/profile_images/673195565644013570/au0qZ558_normal.jpg,https://pbs.twimg.com/profile_banners/21712326/1449337306,http://abs.twimg.com/images/themes/theme1/bg.png,343,292,0,0,0,0,2021-10-30T23:18:07.000-07:00
1454588659294822403,1454588659294822403,2021-10-30T23:18:55.000-07:00,"","","","","Ericsson is hiring in #SantaClara, CA! Read about our latest #ProductMgmt job opening via the link in our bio: Senior Graphics Engineer, Digital Humans","['SantaClara', 'ProductMgmt']","",71668801,TMJ-SJC PM Jobs,tmj_sjc_prod,false,http://pbs.twimg.com/profile_images/696931914641489925/RYGJ6kaL_normal.jpg,https://pbs.twimg.com/profile_banners/71668801/1454996494,http://abs.twimg.com/images/themes/theme1/bg.png,108,63,0,0,0,0,2021-10-30T23:18:55.000-07:00
1454589080289701893,1454589080289701893,2021-10-30T23:20:36.000-07:00,"","","",['https://bit.ly/3ByGpg2'],"Want to work at SAS Retail Services? We're hiring in #ForestLake, MN! Click for details: https://t.co/JmTmTX4X1w #Retail","['ForestLake', 'Retail']","",1283530134083874817,SAS Retail MN Jobs,SASRetailMNJobs,false,http://pbs.twimg.com/profile_images/1285618754148159493/wVVbv30f_normal.jpg,https://pbs.twimg.com/profile_banners/1283530134083874817/1595350418,"",11,16,0,0,0,0,2021-10-30T23:20:36.000-07:00
1454589376772521990,1454589376772521990,2021-10-30T23:21:47.000-07:00,"","","",['https://bit.ly/3nPmtRw'],"We're hiring! Read about our latest job opening here: Float Client Relationship Consultant - Corona/Riverside area branches - https://t.co/RJKvrh8CFG #branchbanking #Corona, CA","['branchbanking', 'Corona']","",27307631,TMJ-CAO Bank Jobs,tmj_cao_banking,false,http://pbs.twimg.com/profile_images/685234772457553920/iHWKEG-v_normal.jpg,https://pbs.twimg.com/profile_banners/27307631/1452207676,http://abs.twimg.com/images/themes/theme1/bg.png,381,286,0,0,0,0,2021-10-30T23:21:47.000-07:00
1454589435773964293,1454589435773964293,2021-10-30T23:22:01.000-07:00,"","","",['https://dailyremote.com/remote-job/full-stack-ruby-on-rails-developer-938671'],👋 Helpjuice is hiring remotely for a Full Stack (Ruby on Rails) Developer.|    |    #RemoteJob #RemoteWork  #Jobtype: |    Apply now! 👇|    https://t.co/4TR3Tt4wOw,"['RemoteJob', 'RemoteWork', 'Jobtype']","",1162776078089244678,DailyRemote,daily_remote,false,http://pbs.twimg.com/profile_images/1162776493409202176/KVcURq7s_normal.png,https://pbs.twimg.com/profile_banners/1162776078089244678/1567103646,"",5861,844,0,0,0,0,2021-10-30T23:22:01.000-07:00
1454589730096549891,1454589730096549891,2021-10-30T23:23:11.000-07:00,"","","",['https://www.coindesk.com/business/2021/10/12/stripe-is-hiring-a-crypto-team-3-years-after-ending-its-bitcoin-support/'],"The tide is turning - Stripe Is Hiring a Crypto Team 3 Years After Ending Bitcoin Support “Crypto is a brand new team at Stripe,” one job post says.||https://t.co/s7J4dIq5ST","","",1107631,Tom Parish,tparish,false,http://pbs.twimg.com/profile_images/1414251108768288771/TUUdzD3-_normal.jpg,https://pbs.twimg.com/profile_banners/1107631/1516623554,http://abs.twimg.com/images/themes/theme14/bg.gif,1625,610,0,0,0,0,2021-10-30T23:23:11.000-07:00
1454589795523465216,1454589795523465216,2021-10-30T23:23:26.000-07:00,"","","",['https://bit.ly/3bqMjWc'],"Want to work at The Stepping Stones Group? We're hiring in #SanLeandro, CA! Click for details: https://t.co/pCOOgb2Up3 #Speech","['SanLeandro', 'Speech']","",21836590,TMJ-SJC Educ. Jobs,tmj_sjc_edu,false,http://pbs.twimg.com/profile_images/673940548709777408/ctwaPeNy_normal.jpg,https://pbs.twimg.com/profile_banners/21836590/1449514924,http://abs.twimg.com/images/themes/theme1/bg.png,336,211,0,0,0,0,2021-10-30T23:23:26.000-07:00
1454590019591680007,1454590019591680007,2021-10-30T23:24:20.000-07:00,"","","","","@SjwSpiderman Didn't this guy call her an ugly woman, and called Disney woke &amp; SJW just for hiring someone of her body type, only just a few years ago?","",['SjwSpiderman'],55488884,Moggy,Mognet_T,false,http://pbs.twimg.com/profile_images/1447773779271237634/-1Tx3-JG_normal.jpg,https://pbs.twimg.com/profile_banners/55488884/1634011172,http://abs.twimg.com/images/themes/theme1/bg.png,77,585,0,0,0,0,2021-10-30T23:24:20.000-07:00
1454590788889825282,1454597930447294464,2021-10-30T23:55:46.000-07:00,"","","","","One of the most important values we practice @sosimplified “People is P0”.||It's amazing how's impacting our hiring, customer support; product development, investor relationship; UI/UX","",['sosimplified'],112019826,KD,Koustubha_D,false,http://pbs.twimg.com/profile_images/1345105877913636865/G68QfBZJ_normal.jpg,https://pbs.twimg.com/profile_banners/112019826/1609365133,http://abs.twimg.com/images/themes/theme7/bg.gif,832,1303,0,0,0,1,2021-10-30T23:27:23.000-07:00
1454590943043141633,1454613236536446979,2021-10-31T00:56:35.000-07:00,"","","",['https://www.energy.gov/ne/articles/job-opportunity-general-engineer'],"JOB OPPORTUNITY: We’re hiring general engineers to work with us in advancing nuclear energy science and technology to meet U.S. energy, environmental, and economic needs. ||Positions are available at all GS levels and areas. More info ⬇️ |https://t.co/XDHb1hflbq","","",1100064156504543233,Office of Nuclear Energy,GovNuclear,true,http://pbs.twimg.com/profile_images/1100078320027398144/hH4jpcxp_normal.jpg,https://pbs.twimg.com/profile_banners/1100064156504543233/1551117167,"",18723,280,17,0,1,4,2021-10-30T23:28:00.000-07:00
1454591096147922945,1454607507838603267,2021-10-31T00:33:49.000-07:00,"","","","","@TheOnlyRealR2D2 @JackPosobiec Pulling a trigger is not an accident.  Allowing live rounds on set isn't an accident.  Hiring a rookie, isn't an accident. Aiming a gun isn't an accident.","","['TheOnlyRealR2D2', 'JackPosobiec']",1319036785012387845,OldDvlDog,DvlOld,false,http://pbs.twimg.com/profile_images/1411057757176872964/1kmNKEPE_normal.jpg,"","",16,76,1,0,0,1,2021-10-30T23:28:36.000-07:00
1454591393419063297,1454591393419063297,2021-10-30T23:29:47.000-07:00,"","","","","Shaw Industries is hiring in #Tempe, AZ! Click the link in our bio to apply: Project Manager Spectra Contract #Sales","['Tempe', 'Sales']","",219873774,Scottsdale Sales,tmj_AZS_sales,false,http://pbs.twimg.com/profile_images/713969315326926848/U4rYznOl_normal.jpg,https://pbs.twimg.com/profile_banners/219873774/1459058527,http://abs.twimg.com/images/themes/theme1/bg.png,396,250,0,0,0,0,2021-10-30T23:29:47.000-07:00
1454591448565919753,1454591448565919753,2021-10-30T23:30:00.000-07:00,"","","",['https://cryptocurrencyjobs.co/startups/rolla/'],Rolla is hiring remote for the following roles:||👉 Senior Frontend Engineer|👉 Senior React Native Engineer|👉 Smart Contract Engineer||Apply now 👇|https://t.co/J7iOp35I8n|#blockchainjobs #cryptojobs,"['blockchainjobs', 'cryptojobs']","",919314949909958658,Cryptocurrency Jobs,jobsincrypto,false,http://pbs.twimg.com/profile_images/999432230567997440/jFuy4WRo_normal.jpg,"","",12552,517,0,0,0,0,2021-10-30T23:30:00.000-07:00
1454591451409563655,1454591557798092805,2021-10-30T23:30:27.000-07:00,https://twitter.com/KeithmorganJr1/status/1454591451409563655/photo/1,['http://pbs.twimg.com/media/FC-_N4rX0AA2xXB.jpg'],['photo'],['https://workfor.us/biglots/j4xf'],"#BigLots is hiring! Freight #Processing #Lead in #SanBernardino, apply now! #job https://t.co/UeiqksWLol https://t.co/SHBBXdvODe","['BigLots', 'Processing', 'Lead', 'SanBernardino', 'job']","",865457956719964160,Shake_D 2point0,KeithmorganJr1,false,http://pbs.twimg.com/profile_images/1051348774080016384/EyM5KiD9_normal.jpg,https://pbs.twimg.com/profile_banners/865457956719964160/1539496123,http://abs.twimg.com/images/themes/theme1/bg.png,117,344,0,0,0,1,2021-10-30T23:30:01.000-07:00
1454591544770564100,1454591544770564100,2021-10-30T23:30:23.000-07:00,"","","",['https://www.jobs2careers.com/click.php?jid=4081c271a81db4ee5de37e21e&ri=94c2a1fd62174135b5f62b71459874f5&job_loc=Beverly+Hills%2CCA&q=&spl=RATE251hV3autqU7%3AM%2BlEhNoX%2F31piSdB%2BlogXA%3D%3D%3AYyyYolrndQaDyLJxLBraOfrVN4T3XzObijqpi%2FHciK9E6IfUpGtNTKeF%2BL0dQX7YeePLlekr%2Bw%3D%3D&encrypt=0&l=Los+Angeles%2CCA'],Grubhub is hiring in Beverly Hills for a Earn Big &amp; Keep 100% of Your Tips - Grubhub Delivery Driver!. Click now to apply! |https://t.co/9c7hNEoInL||#beverlyhills #LA #jobposting #cv #coronavirus #vacancy,"['beverlyhills', 'LA', 'jobposting', 'cv', 'coronavirus', 'vacancy']","",1287241305530064905,socal_jobs_bot,bot_socal,false,http://pbs.twimg.com/profile_images/1287246208491126784/bLWIFYa0_normal.jpg,https://pbs.twimg.com/profile_banners/1287241305530064905/1595738525,"",4,0,0,0,0,0,2021-10-30T23:30:23.000-07:00
1454591613288607745,1454591613288607745,2021-10-30T23:30:40.000-07:00,"","","",['https://dribbble.com/jobs/100660-Principal-Designer?source=twitter'],"The Brigade is hiring for a position of Principal Designer in Portland, OR https://t.co/JamKkV7Yl0","","",374296895,Dribbble Jobs,dribbblejobs,false,http://pbs.twimg.com/profile_images/3511273691/e5450a01e6df1bb22507286b8e511c8a_normal.png,https://pbs.twimg.com/profile_banners/374296895/1375821734,http://abs.twimg.com/images/themes/theme1/bg.png,3694,1,0,0,0,0,2021-10-30T23:30:40.000-07:00
1454591645291188225,1454591645291188225,2021-10-30T23:30:47.000-07:00,"","","",['https://bit.ly/3CzVI9F'],"We're hiring! Click to apply: Chaplain, Registry - https://t.co/nec2cHtKhx #HealthWelfare #Chicago, IL","['HealthWelfare', 'Chicago']","",1114265593744588806,UChicago Medicine Careers,UChicagoMedJobs,false,http://pbs.twimg.com/profile_images/1134138620481327105/8wozWCHI_normal.png,https://pbs.twimg.com/profile_banners/1114265593744588806/1559234770,http://abs.twimg.com/images/themes/theme1/bg.png,1461,62,0,0,0,0,2021-10-30T23:30:47.000-07:00
1454591819241644035,1454591841114988548,2021-10-30T23:31:34.000-07:00,"","","",['https://www.datayoshi.com/offer/621999/data-scientist-claims'],Carbon Health has a new Data Scientist open position||#hiring #datasciencejobs #datayoshi #Python||⬇️⬇️ Apply here ⬇️⬇️||https://t.co/ysnROclUGw,"['hiring', 'datasciencejobs', 'datayoshi', 'Python']","",1280052985473744896,datayoshi_jobs,Datayoshi_jobs,false,http://pbs.twimg.com/profile_images/1280053358020222976/EQgafP7B_normal.jpg,"","",105,94,0,0,0,1,2021-10-30T23:31:29.000-07:00
1454591984639700996,1454591984639700996,2021-10-30T23:32:08.000-07:00,"","","",['https://bit.ly/3Cv0LIv'],"Want to work at Rexel Energy Solutions? We're hiring in #Brockton, MA! Click for details: https://t.co/s8t83kbvs4 #innovation","['Brockton', 'innovation']","",763461510152785921,RexelUSACareers,RexelUSACareers,false,http://pbs.twimg.com/profile_images/767739808827473920/pqQaEsxG_normal.jpg,https://pbs.twimg.com/profile_banners/763461510152785921/1470947518,"",1345,63,0,0,0,0,2021-10-30T23:32:08.000-07:00
1454592584001675266,1454592584001675266,2021-10-30T23:34:31.000-07:00,"","","","",@tylerperry Are you hiring at your Studio in Atlanta,"",['tylerperry'],1349763228029644800,Darrell McQueen,DarrellMcQuee19,false,http://pbs.twimg.com/profile_images/1349763576488206337/VMx5PNbX_normal.jpg,"","",14,138,0,0,0,0,2021-10-30T23:34:31.000-07:00
