org_id,samp_id,samp_datetime,org_url,org_media_url,org_media_type,org_attached_links,org_text,org_hashtags,org_user_metions,user_id,user_name,user_screen_name,user_verified,user_profile_image_url,user_profile_banner_url,user_profile_background_image_url,user_followers_count,user_friends_count,org_favorite_count,org_quote_count,org_reply_count,org_retweet_count,org_datetime
1451861704002863104,1451861704002863104,2021-10-23T10:42:59.000-07:00,"","","","","Want to land a job like 'Warehouse Clerk' at UPS? Applicant tracking systems look for specific keywords. Use the right keywords and get your resume in front of the hiring manager. #SupplyChain #BuryStEdmunds, England","['SupplyChain', 'BuryStEdmunds']","",182106728,Cambridge Manuf.,tmj_CAM_manuf,false,http://pbs.twimg.com/profile_images/700933229633638400/0nkr0jj7_normal.jpg,https://pbs.twimg.com/profile_banners/182106728/1455950480,http://abs.twimg.com/images/themes/theme1/bg.png,198,131,0,0,0,0,2021-10-23T10:42:59.000-07:00
1451862125337583620,1451862125337583620,2021-10-23T10:44:39.000-07:00,"","","","","@RodrigNaska @bubble @upgraded_dev Hello Rodrig.|My name is Diana and I am Hiring manager at WLNC.|We are the biggest No-Code marketplace and 5000+ No-Code developers. We have a lot of experienced bubble devs.|Also we are looking for Sheet2Site specialist for our projects :)|Contact me, if you're interested.","","['RodrigNaska', 'bubble', 'upgraded_dev']",1444977230405410816,Diana Lazarieva,LazarievaDiana,false,http://pbs.twimg.com/profile_images/1444977284537065476/ZZiQ6-dq_normal.jpg,"","",0,2,0,0,0,0,2021-10-23T10:44:39.000-07:00
1451862311484805125,1451862311484805125,2021-10-23T10:45:24.000-07:00,"","","","",when will @TwitterU start hiring for blockchain roles ;_;,"",['TwitterU'],1410669056206655489,Anmol,nmolcodes,false,http://pbs.twimg.com/profile_images/1430785858580344832/giZrKaDl_normal.jpg,https://pbs.twimg.com/profile_banners/1410669056206655489/1627902024,"",33,190,0,0,0,0,2021-10-23T10:45:24.000-07:00
1451862423711805445,1451862423711805445,2021-10-23T10:45:50.000-07:00,"","","",['https://www.remotetechjobs.com/*/78534'],"Bank of America is hiring: Python Developer - Bank of America||PLS SEND ME YOUR RESUME ASAP Hi, This is Omkar from Norgate Technology, Inc. We are DIRECT VENDORS (NO LAYERS BETWEEN NORGATE AND THE CLIENT) with...||https://t.co/w0V5TUgu88|#Remote #python #Jobs","['Remote', 'python', 'Jobs']","",1298682524235739136,Remote Tech Jobs,RemoteTechJobs0,false,http://pbs.twimg.com/profile_images/1357528431328718848/KxyAQegS_normal.png,https://pbs.twimg.com/profile_banners/1298682524235739136/1612495889,"",358,1,0,0,0,0,2021-10-23T10:45:50.000-07:00
1243393187026063360,1451851328431349767,2021-10-23T10:01:45.000-07:00,"","","","","After all, you were already prepared, with the projects, ordering the equipment, hiring the labor, the water and sewage network, the prefabricated building materials and stocked in an impressive volume.||4. Cause chaos in the world, starting with Europe.||3/n","","",1299906942,Sajid Yousuf Shah,TheSkandar,false,http://pbs.twimg.com/profile_images/1451182347353669643/F1Y7DpFu_normal.jpg,https://pbs.twimg.com/profile_banners/1299906942/1612779568,http://abs.twimg.com/images/themes/theme12/bg.gif,90347,686,3430,7,24,1558,2020-03-27T04:23:31.000-07:00
1427659412819349507,1451843779380477957,2021-10-23T09:31:45.000-07:00,https://twitter.com/glassnode/status/1427659412819349507/photo/1,['http://pbs.twimg.com/media/E9AO5rBWYAEl3TR.png'],['photo'],['http://studio.glassnode.com/careers'],Looking to advance your career in #Bitcoin and digital assets?||Glassnode is hiring! 🤝||We're looking for:||- Backend (Golang | Remote)|- Frontend (React | Remote)|- Growth Manager (US)|- Operations Manager (Berlin)||Apply here 👉 https://t.co/KyNYx0xr7A https://t.co/QTltf4wuoY,['Bitcoin'],"",1022821051187822593,glassnode,glassnode,false,http://pbs.twimg.com/profile_images/1131508935343714305/YkGsrtMa_normal.png,https://pbs.twimg.com/profile_banners/1022821051187822593/1603732736,http://abs.twimg.com/images/themes/theme1/bg.png,359316,87,371,10,132,309,2021-08-17T15:51:43.000-07:00
1435494754389798914,1451841515773435907,2021-10-23T09:22:45.000-07:00,https://twitter.com/ttscientific/status/1435494754389798914/photo/1,['http://pbs.twimg.com/media/E-vm3q-XoAEVzgP.jpg'],['photo'],"",We are interviewing for the Director of Quality Assurance at T&amp;T Scientific. Contact me if you are interested or know anyone who might be interested in this great opportunity.||#director #qualityassurance #interviewing #hiring #jobs #recruitment #recruiting #careers #job #career https://t.co/oKTDjTVyme,"['director', 'qualityassurance', 'interviewing', 'hiring', 'jobs', 'recruitment', 'recruiting', 'careers', 'job', 'career']","",3293110662,T&T Scientific,ttscientific,false,http://pbs.twimg.com/profile_images/1429686451160166400/qqCsVrkI_normal.jpg,https://pbs.twimg.com/profile_banners/3293110662/1631505414,http://abs.twimg.com/images/themes/theme15/bg.png,677,3634,2,0,0,3,2021-09-08T06:46:34.000-07:00
1447376013474680832,1451850608231673856,2021-10-23T09:58:53.000-07:00,"","","",['http://discord.gg/5jm7m7EhNj'],"Come join us on our discord!😉|If you are active here, your chances of hiring will increase😆🔥|And you can watch me and scholar's gameplay streaming, watch coaching, discuss and interact with others!💪||https://t.co/HYpyPunETr||#AxieInfinity #AxieScholarship","['AxieInfinity', 'AxieScholarship']","",1404643918801620997,Slime@Axie_Scholarship,AxieScholarshi3,false,http://pbs.twimg.com/profile_images/1411564397584011264/YL9Kqovy_normal.jpg,https://pbs.twimg.com/profile_banners/1404643918801620997/1625575064,"",16074,82,81,1,13,40,2021-10-11T01:38:27.000-07:00
1448302636172709890,1451859900167036936,2021-10-23T10:35:49.000-07:00,https://twitter.com/UHEAS/status/1448302636172709890,"","",['https://uhs.taleo.net/careersection/ex2_uhf/jobdetail.ftl?job=FAC001997&tz=GMT-05:00&tzname=America/Chicago'],"We are hiring! EAS is looking to hire an assistant professor in Climate Dynamics/Modeling, as part of the UH Presidential Frontier Faculty program. Applications received by Nov. 1 will receive the fullest consideration. ||More info at https://t.co/JUrh7NKnaA.","","",1217524882394812416,UH Dept. of Earth and Atmospheric Sciences,UHEAS,false,http://pbs.twimg.com/profile_images/1217596307403169792/BWO7n1xV_normal.jpg,https://pbs.twimg.com/profile_banners/1217524882394812416/1579116724,"",224,39,10,2,0,6,2021-10-13T15:00:31.000-07:00
1449365629379624960,1451850129560915968,2021-10-23T09:56:59.000-07:00,https://twitter.com/Cosmosapiensnft/status/1449365629379624960/photo/1,['http://pbs.twimg.com/media/FB0uW71VEAANAge.jpg'],['photo'],"",We are hiring✅||RT and share the word to your creative friends 🙌||Drop your interests here📧nft@cosmosapiens.io ||#Cosmosapiens #hiring #freelance #illustration #contentcreators #3Danimation #animations #VisualArt #CreativeSociety https://t.co/V5NPXHLZiM,"['Cosmosapiens', 'hiring', 'freelance', 'illustration', 'contentcreators', '3Danimation', 'animations', 'VisualArt', 'CreativeSociety']","",1419766430212390912,Cosmosapiens,Cosmosapiensnft,false,http://pbs.twimg.com/profile_images/1443678090782150658/ZpX3U_nG_normal.jpg,https://pbs.twimg.com/profile_banners/1419766430212390912/1631157989,"",438,592,8,0,1,7,2021-10-16T13:24:28.000-07:00
1450415036489342980,1451845698400374790,2021-10-23T09:39:23.000-07:00,"","","","","#आईटीआई_इंस्ट्रक्टर_भर्ती_adv_12_2019_पूरी_करो Instructors on DC Rate want to hang recruitment, disregarding the order of Hon'ble Supreme Court. We request the government to get the final result of recruitment and get the selected candidate to join soon!|@HSSCorg_in @OPDhankar",['आईटीआई_इंस्ट्रक्टर_भर्ती_adv_12_2019_पूरी_करो'],"['HSSCorg_in', 'OPDhankar']",4634789178,KESHAV GIRDHAR,keshavgirdhar,false,http://pbs.twimg.com/profile_images/1417751419495407616/F1y4Kz-__normal.jpg,https://pbs.twimg.com/profile_banners/4634789178/1626853308,"",32,48,9,0,0,18,2021-10-19T10:54:26.000-07:00
1450425281542512645,1451858012331593737,2021-10-23T10:28:19.000-07:00,https://twitter.com/nctdw127_genie/status/1450425281542512645,"","",['https://docs.google.com/forms/d/e/1FAIpQLSfKFCRdrwfWoviCHZWNVb_RHMz1wZDBARZKHb2X3kgIZdveYQ/viewform'],"💚GENIE STREAMING |TEAM RECRUITMENT 💚||🗓 Recruitment period : Oct 12th 2021 - D-2 Comeback.||If you interested to join our team, please fill form below and pick your best schedule/s.||https://t.co/rhLCJ96AEn","","",1189047908122820609,NCT 127 Project 📌,nctdw127_genie,false,http://pbs.twimg.com/profile_images/1308403272563200010/RTFP48N6_normal.jpg,https://pbs.twimg.com/profile_banners/1189047908122820609/1586667510,"",18395,10,7,0,1,6,2021-10-19T11:35:09.000-07:00
1451079894591361025,1451859966977986563,2021-10-23T10:36:05.000-07:00,https://twitter.com/BP_VotingTeam/status/1451079894591361025/photo/1,['http://pbs.twimg.com/media/FCNFeMLUYAc9Jfe.jpg'],['photo'],"","📢 [AAA Voting Team Recruitment]||In order to be more organize during mass voting and special announcement purposes, we are recruiting members for our GC (Project Inkisang: AAA) Just DM @BP_VotingTeam2 to join.||#BLACKPINK @BLACKPINK https://t.co/rJMWltVIkC",['BLACKPINK'],"['BP_VotingTeam2', 'BLACKPINK']",942579754481229824,BLΛCKPIИK Voting Team,BP_VotingTeam,false,http://pbs.twimg.com/profile_images/1396011917387337731/s7EmdWwk_normal.jpg,https://pbs.twimg.com/profile_banners/942579754481229824/1621671229,http://abs.twimg.com/images/themes/theme1/bg.png,155790,156,631,2,4,255,2021-10-21T06:56:21.000-07:00
1451096746784956418,1451851178791346177,2021-10-23T10:01:09.000-07:00,https://twitter.com/balbirdance/status/1451096746784956418/photo/1,['http://pbs.twimg.com/media/FCNUzDAXIAAT6vk.jpg'],['photo'],"",We’re hiring. Paid opportunity for an apprentice dancer to join the company - we are open to all styles of dancing. See the details below 👇 ⬇️ 💃 🕺 https://t.co/j6p0a9rbYd,"","",247225088,Balbir Singh Dance Co,balbirdance,false,http://pbs.twimg.com/profile_images/1451154847097671680/CFwh-Sv4_normal.jpg,https://pbs.twimg.com/profile_banners/247225088/1634817252,http://abs.twimg.com/images/themes/theme1/bg.png,2940,4066,20,1,2,16,2021-10-21T08:03:19.000-07:00
1451142872682663943,1451843467043295234,2021-10-23T09:30:31.000-07:00,"","","","['http://Quickwit.io', 'https://quickwit.io/jobs/distributed-software-engineer/']",We are hiring at https://t.co/kwHBjxfnxj  @RustBerlin @rustlang @RustLondon_ @ThisWeekInRust  https://t.co/jaaZu4FeZx,"","['RustBerlin', 'rustlang', 'RustLondon_', 'ThisWeekInRust']",84808813,Evance Soumaoro,evanxg852000,false,http://pbs.twimg.com/profile_images/1286734791862300673/UJuBBcWt_normal.jpg,https://pbs.twimg.com/profile_banners/84808813/1597956819,http://abs.twimg.com/images/themes/theme1/bg.png,391,337,13,0,0,8,2021-10-21T11:06:36.000-07:00
1451193332638502921,1451860668081188871,2021-10-23T10:38:52.000-07:00,"","","",['https://www.jobs.manchester.ac.uk/displayjob.aspx?isPreview=Yes&jobid=21139'],"We're hiring! ||Interested in deep subsurface microbiology? Have anaerobic cultivation &amp; bioinformatics experience? Want to work @ interface of microb. ecology, energy industry &amp; biotech? 3yr postdoc on C-cycling in geological CO2 storage in @UoMMIB 👇 |https://t.co/AIplTvoyuw","",['UoMMIB'],167431421,Sophie Nixon,SophieLNixon,false,http://pbs.twimg.com/profile_images/1450221975088009217/fVNHQaEI_normal.jpg,https://pbs.twimg.com/profile_banners/167431421/1631182341,http://abs.twimg.com/images/themes/theme19/bg.gif,1325,1220,70,1,0,68,2021-10-21T14:27:07.000-07:00
1451227094143447052,1451835818490875905,2021-10-23T09:00:07.000-07:00,"","","",['https://www.jobs.ac.uk/job/CJV812/senior-strategist'],"Dear followers, I'm introducing Faculty for a Future - set up to help academics who care about the future of the planet to speak out more effectively, and as a group rather than all by themselves. We're now hiring: https://t.co/AieX3fB4fL","","",47631826,Wolfgang Knorr,w_knorr,false,http://pbs.twimg.com/profile_images/1171075806912815104/a_mWlvyA_normal.jpg,"",http://abs.twimg.com/images/themes/theme1/bg.png,928,158,74,5,5,38,2021-10-21T16:41:16.000-07:00
1451244717870616584,1451830832394424320,2021-10-23T08:40:18.000-07:00,https://twitter.com/tweetgloveworld/status/1451244717870616584,"","","",We are currently hiring employees. Reply if you want a job at Glove World!,"","",1357801460294115330,Glove World!,tweetgloveworld,false,http://pbs.twimg.com/profile_images/1450487032502001671/chgKDKGb_normal.jpg,https://pbs.twimg.com/profile_banners/1357801460294115330/1634661200,"",110,27,33,3,30,3,2021-10-21T17:51:18.000-07:00
1451347381648338947,1451837550797234183,2021-10-23T09:07:00.000-07:00,"","","","",Still hiring :||- 📈 Marketers||- 👩🏼‍💻 Senior Solidity Devs||- 👨‍💻 Web3 DevOps||- 🪶 Technical Writers||- ⚙️ Developer Advocates||$DSLA||DM pujarw on Telegram!,"","",112416103,Wilhem Pujar💡,WilhemPujar,false,http://pbs.twimg.com/profile_images/1057044081619165185/JV8M72u6_normal.jpg,https://pbs.twimg.com/profile_banners/112416103/1435073199,http://abs.twimg.com/images/themes/theme14/bg.gif,3059,3278,67,0,3,26,2021-10-22T00:39:15.000-07:00
1451467012308447232,1451846020275576832,2021-10-23T09:40:39.000-07:00,"","","","","@pierredevos So we can start discriminating against &amp; stop hiring HIV+ people, then.||Slippery slope, Pierre.||If you can discriminate against my medical status, I can with yours.||We rejected a 2-tier society. Any way, shape or form.||Try to catch up.","",['pierredevos'],2373756190,Lady Harry Killinger,trestrange,false,http://pbs.twimg.com/profile_images/1415773325792583683/3qZrWAX8_normal.jpg,https://pbs.twimg.com/profile_banners/2373756190/1626521158,http://abs.twimg.com/images/themes/theme1/bg.png,2657,3371,23,2,3,3,2021-10-22T08:34:37.000-07:00
1451474286225641483,1451858644539162625,2021-10-23T10:30:49.000-07:00,"","","","",1) a lot of hiring managers are looking for a few key skills but primarily the biggest thing is behaviours. They’d rather take someone on who has great behaviours but lacks some knowledge and develop them.,"","",797164916297920512,Fourens,Fourens__,false,http://pbs.twimg.com/profile_images/1395840813523951626/Y5SJWNH0_normal.jpg,https://pbs.twimg.com/profile_banners/797164916297920512/1625679945,"",9244,929,218,4,1,46,2021-10-22T09:03:31.000-07:00
1451490830842204193,1451842761456590848,2021-10-23T09:27:42.000-07:00,https://twitter.com/PowerTheFightUK/status/1451490830842204193,['http://pbs.twimg.com/media/FCS7NyfWUAMtbvG.jpg'],['photo'],['https://jobs.theguardian.com/job/7453898/clinical-lead/'],WE ARE HIRING🎉⁠|⁠|-Clinical Lead⁠|-Full-time or part-time (4 days per week)⁠|-3 year contract⁠|⁠|These roles are subject to an Enhanced DBS check.⁠|⁠|To apply or read the full job description click here 👉 https://t.co/9FyE2wS1nj https://t.co/wXK8SFij2H,"","",928655937249906688,POWER THE FIGHT,PowerTheFightUK,false,http://pbs.twimg.com/profile_images/1445410669302587403/L-5Cr24u_normal.jpg,https://pbs.twimg.com/profile_banners/928655937249906688/1527711161,http://abs.twimg.com/images/themes/theme1/bg.png,1844,174,8,1,0,8,2021-10-22T10:09:16.000-07:00
1451559435504062474,1451850248951898120,2021-10-23T09:57:28.000-07:00,"","","",['https://www.economia.unipd.it/Lavora-con-noi/home-lavora-con-noi/bandi-di-ricerca/assegni-di-ricerca?fbclid=IwAR2ry7Ck5ZfjUaRo5kUEhu39eO3ClrVHQXh43wKTyy8sMiAN8Np2450JcSI'],We are #hiring a #research #fellow to work with me on a project on #smartcities @dSEA_Unipd Apply here: https://t.co/TQUqdJqJxm,"['hiring', 'research', 'fellow', 'smartcities']",['dSEA_Unipd'],737351530836332544,Silvia Rita Sedita,SilviaSedita,false,http://pbs.twimg.com/profile_images/1332081344982159364/fbYUoktl_normal.jpg,https://pbs.twimg.com/profile_banners/737351530836332544/1586899715,"",277,252,5,0,0,6,2021-10-22T14:41:52.000-07:00
1451565517572132876,1451853083781308416,2021-10-23T10:08:43.000-07:00,"","","",['https://ayr.app/l/BgCo'],Do you want to move to Germany?| |LeanIX is hiring a Cloud Software Engineer - Remote in Europe| |⚙️ Tech stack: #API #AWS #Azure #Backend #Cloud #GCP| |Take your chance: https://t.co/U3immpvY2k| |#VisaSponsorship #Developers #GermanTechJobs,"['API', 'AWS', 'Azure', 'Backend', 'Cloud', 'GCP', 'VisaSponsorship', 'Developers', 'GermanTechJobs']","",1253050714454097920,GermanTechJobs.de,GermanTechJobs,false,http://pbs.twimg.com/profile_images/1253051122828410880/DfXKKjKz_normal.png,https://pbs.twimg.com/profile_banners/1253050714454097920/1604512305,"",275,374,0,0,0,3,2021-10-22T15:06:02.000-07:00
1451584391231283325,1451848894682259461,2021-10-23T09:52:05.000-07:00,https://twitter.com/CropTrust/status/1451584391231283325/photo/1,['http://pbs.twimg.com/media/FCUQT0_XoBIbasi.jpg'],['photo'],['https://buff.ly/2Z4WGdv'],We are hiring!||We're looking for a Director of Programs who will supervise a team of scientists and project managers and coordinate and oversee the implementation of strategic projects designed to support the organizational mandate.||Learn more &amp; apply 👉 https://t.co/06dUQp09vZ https://t.co/J5SXoTZISv,"","",177214413,The Crop Trust,CropTrust,true,http://pbs.twimg.com/profile_images/1258316059431579651/syoF75ZH_normal.jpg,https://pbs.twimg.com/profile_banners/177214413/1630323300,http://abs.twimg.com/images/themes/theme1/bg.png,13333,1437,5,0,0,4,2021-10-22T16:21:02.000-07:00
1451594465710333953,1451847949189885953,2021-10-23T09:48:19.000-07:00,"","","",['https://dysonfarming.com/vacancy/beef-herdsperson/'],An exciting opportunity has arisen for an enthusiastic and self-motivated Beef Herdsperson to join the Dyson Farming team in Gloucestershire.||For more information or to apply please contact recruitment@dysonfarming.com or visit our website below.||https://t.co/sghViBh9Ra,"","",3352493452,Dyson Farming,DysonFarming,false,http://pbs.twimg.com/profile_images/1373926613855965199/ZpmHSf-j_normal.jpg,https://pbs.twimg.com/profile_banners/3352493452/1600501446,http://abs.twimg.com/images/themes/theme1/bg.png,8335,53,16,0,0,14,2021-10-22T17:01:04.000-07:00
1451606601903771650,1451832964283879424,2021-10-23T08:48:47.000-07:00,https://twitter.com/reggieschirm73/status/1451606601903771650/photo/1,['http://pbs.twimg.com/media/FCUkgeCXoAMFYVP.jpg'],['photo'],"",UPS is hiring!!!!  Start your career today!  💰 🤎@jrindafernshaw @TimPope007 @thuberb22 @ericgriffin86 @joshcrosser98 @AustinCollins39 @NP_UPSers @dan_mouw @unbarneveable https://t.co/GnhZHqmu1J,"","['jrindafernshaw', 'TimPope007', 'thuberb22', 'ericgriffin86', 'joshcrosser98', 'AustinCollins39', 'NP_UPSers', 'dan_mouw', 'unbarneveable']",745690004538564609,Reggie,reggieschirm73,false,http://pbs.twimg.com/profile_images/1440871086858584065/KNSd2uIV_normal.jpg,https://pbs.twimg.com/profile_banners/745690004538564609/1632365412,"",263,665,13,0,0,3,2021-10-22T17:49:18.000-07:00
1451609890405900288,1451833139253424128,2021-10-23T08:49:28.000-07:00,https://twitter.com/reggieschirm73/status/1451609890405900288/video/1,['http://pbs.twimg.com/ext_tw_video_thumb/1451609854603300869/pu/img/r5GSc4-KR6bXub29.jpg'],['video'],"",We’re Hiring! Stickers coming together in Hiawatha!  @jrindafernshaw @TimPope007 @thuberb22 @ericgriffin86 @joshcrosser98 @AustinCollins39 @NP_UPSers @unbarneveable https://t.co/TpO7obxOd3,"","['jrindafernshaw', 'TimPope007', 'thuberb22', 'ericgriffin86', 'joshcrosser98', 'AustinCollins39', 'NP_UPSers', 'unbarneveable']",745690004538564609,Reggie,reggieschirm73,false,http://pbs.twimg.com/profile_images/1440871086858584065/KNSd2uIV_normal.jpg,https://pbs.twimg.com/profile_banners/745690004538564609/1632365412,"",263,665,8,0,1,2,2021-10-22T18:02:22.000-07:00
1451616385650495488,1451861678400880640,2021-10-23T10:42:53.000-07:00,"","","","","Aspire Academy is hiring in Gary, IN! Click the link in our bio to apply: Substitute Teacher #Education #Teacher","['Education', 'Teacher']","",181424554,Indiana Education,tmj_IN_EDU,false,http://pbs.twimg.com/profile_images/712449209320939520/rK8K1U4W_normal.jpg,https://pbs.twimg.com/profile_banners/181424554/1458696104,http://abs.twimg.com/images/themes/theme1/bg.png,332,197,0,0,0,1,2021-10-22T18:28:10.000-07:00
1451617481429172228,1451845473980108801,2021-10-23T09:38:29.000-07:00,"","","","",Want to land a job like 'Achievement and Behavior Support Specialist' at Brooklyn Scholars Academy? Applicant tracking systems look for specific keywords. Use the right keywords and get your resume in front of the hiring manager. #Education #Teacher,"['Education', 'Teacher']","",21800431,NYC Education Jobs,tmj_nyc_edu,false,http://pbs.twimg.com/profile_images/673749279819759620/OVWG6fj1_normal.jpg,https://pbs.twimg.com/profile_banners/21800431/1449469322,http://abs.twimg.com/images/themes/theme1/bg.png,760,207,0,0,0,1,2021-10-22T18:32:31.000-07:00
1451618558396489738,1451857753996238848,2021-10-23T10:27:17.000-07:00,"","","","",*Job Title:  FINANCE OFFICER*|*Location: Ibadan*|*Job Type: Full Time*|*Industry: Agro-Processing*|*Salary: 150k*||*Interested and Qualified candidates should forward their CV to recruitment@phillipsoutsourcing.net using Finance Officer as Subject of the mail.*,"","",561118162,Damilola,hanit001,false,http://pbs.twimg.com/profile_images/1450163366920704007/eP54oBdD_normal.jpg,https://pbs.twimg.com/profile_banners/561118162/1608997629,http://abs.twimg.com/images/themes/theme1/bg.png,21724,7647,7,0,0,15,2021-10-22T18:36:48.000-07:00
1451663685164875777,1451847056998469634,2021-10-23T09:44:47.000-07:00,"","","",['https://www.careers.ualberta.ca/Competition/A104946495/'],We are hiring for a tenure track Assistant/Associate Prof in physical organic chemistry @ualbertachem ! (Jul 2022 start)||@Chemjobber #chemfaculty #chemtwitter|https://t.co/8M5Ra27BiS,"['chemfaculty', 'chemtwitter']","['ualbertachem', 'Chemjobber']",1358619074,Christopher Cairo,Cairo_Lab,false,http://pbs.twimg.com/profile_images/512089255196119040/y5-IfVWH_normal.jpeg,https://pbs.twimg.com/profile_banners/1358619074/1558626790,http://abs.twimg.com/images/themes/theme1/bg.png,700,476,18,3,0,14,2021-10-22T21:36:07.000-07:00
1451685141554896909,1451861858277810179,2021-10-23T10:43:35.000-07:00,https://twitter.com/strongholdpay/status/1451685141554896909,['http://pbs.twimg.com/media/FCVr8YcWYAQU9iW.jpg'],['photo'],['https://hubs.li/H0ZXSvF0'],Stronghold is #hiring a Head of Marketing!||Are you a team player who wants to join a fast-growing company building the future of #payments and #fintech?||Apply today at  https://t.co/2S0pPzbQ6B https://t.co/ljCfOvcAwQ,"['hiring', 'payments', 'fintech']","",80364416,Stronghold,strongholdpay,false,http://pbs.twimg.com/profile_images/1395379043269107715/neB2XQ-j_normal.jpg,https://pbs.twimg.com/profile_banners/80364416/1619796733,http://abs.twimg.com/images/themes/theme1/bg.png,6636,54,86,20,4,41,2021-10-22T23:01:23.000-07:00
1451696887636049928,1451835255346827267,2021-10-23T08:57:53.000-07:00,https://twitter.com/infosec_jobsCOM/status/1451696887636049928/photo/1,['http://pbs.twimg.com/media/FCV2oBBXIAULq82.jpg'],['photo'],['https://infosec-jobs.com/job/6027-cyber-security-analyst-3449-info/'],"HIRING: Cyber Security Analyst (3449-INFO) / Seneca Falls, NY -&gt; https://t.co/7JD8fmWHJv #InfoSec #infosecjobs #CyberSecurity #CyberCareer #cyberjobs #cybertalents #security #jobsearch #techjobs #hiringnow #CEH #Kali #Linux #Metasploit #Nmap #Python #SIEM #Hydra #threathunting https://t.co/u4zuLBx7fo","['InfoSec', 'infosecjobs', 'CyberSecurity', 'CyberCareer', 'cyberjobs', 'cybertalents', 'security', 'jobsearch', 'techjobs', 'hiringnow', 'CEH', 'Kali', 'Linux', 'Metasploit', 'Nmap', 'Python', 'SIEM', 'Hydra', 'threathunting']","",1089175267581538304,infosec-jobs.com,infosec_jobsCOM,false,http://pbs.twimg.com/profile_images/1089185605911752705/e8j99QcU_normal.jpg,https://pbs.twimg.com/profile_banners/1089175267581538304/1548662842,"",1503,38,3,0,0,10,2021-10-22T23:48:03.000-07:00
1451706096897466369,1451841970771566593,2021-10-23T09:24:34.000-07:00,"","","",['https://news.yahoo.com/alec-baldwin-rust-camera-crew-193409810.html?soc_src=social-sh&soc_trk=tw&tsrc=twtr'],@almostjes yes apparently he was against firing union members and hiring non union members since it was one of the other producers who ordered the union members to leave the set and threatened to call security to remove them if they didn't leave voluntarily. https://t.co/GBdyDKtHUS,"",['almostjes'],39630126,𝐵𝑒𝒸𝒸𝒶,MJFINESSELOVER,false,http://pbs.twimg.com/profile_images/1401224543407120388/3BHFc9y9_normal.jpg,https://pbs.twimg.com/profile_banners/39630126/1632347497,http://abs.twimg.com/images/themes/theme1/bg.png,20757,4400,31,1,1,3,2021-10-23T00:24:39.000-07:00
1451724670366109697,1451844025464594434,2021-10-23T09:32:44.000-07:00,"","","",['https://g.co/kgs/mhcEJt'],We are hiring in multiple areas in Mechanical Engineering and Applied Mechanics (MEAM) https://t.co/1TCAAFemH9,"","",1360818644,Doug Jerolmack,dougsjunkdrawer,false,http://pbs.twimg.com/profile_images/1422302095084949532/s30Pd-v-_normal.jpg,"",http://abs.twimg.com/images/themes/theme1/bg.png,1182,247,8,0,1,6,2021-10-23T01:38:27.000-07:00
