org_id,samp_id,samp_datetime,org_url,org_media_url,org_media_type,org_attached_links,org_text,org_hashtags,org_user_metions,user_id,user_name,user_screen_name,user_verified,user_profile_image_url,user_profile_banner_url,user_profile_background_image_url,user_followers_count,user_friends_count,org_favorite_count,org_quote_count,org_reply_count,org_retweet_count,org_datetime
1452285119545368591,1452285119545368591,2021-10-24T14:45:29.000-07:00,"","","",['https://bit.ly/3CcyupQ'],"We're hiring! Click to apply: Account Executive (NA) - https://t.co/sqn1jzJY68 #Sales #Louisville, KY","['Sales', 'Louisville']","",21730742,TMJ - SDF Sales Jobs,tmj_sdf_sales,false,http://pbs.twimg.com/profile_images/671444127892959232/RfVle__1_normal.jpg,https://pbs.twimg.com/profile_banners/21730742/1448919731,http://abs.twimg.com/images/themes/theme1/bg.png,399,261,0,0,0,0,2021-10-24T14:45:29.000-07:00
1452285119830630407,1452285119830630407,2021-10-24T14:45:29.000-07:00,"","","","","We're hiring in #StLouis, MO! Click the link in our bio to apply to this job and more: Social Worker - Hospital / Hospice at BJC Home Care #hospice","['StLouis', 'hospice']","",904453002,MO Social Science,tmj_mo_socsci,false,http://pbs.twimg.com/profile_images/721191936439103488/BzZyeHO1_normal.jpg,https://pbs.twimg.com/profile_banners/904453002/1460780533,http://abs.twimg.com/images/themes/theme1/bg.png,79,49,0,0,0,0,2021-10-24T14:45:29.000-07:00
1452285402547638274,1452285402547638274,2021-10-24T14:46:36.000-07:00,"","","","","Career tip for landing jobs like 'Senior Analytics Consultant' in Woonsocket, RI. Go on informational interviews. The best way to get a meeting with a hiring manager is to ask for an informational meeting. #HealthCareAnalytics #ComputerScience","['HealthCareAnalytics', 'ComputerScience']","",25082896,TMJ-CTE IT PM Jobs,tmj_cte_itpm,false,http://pbs.twimg.com/profile_images/683221875833479168/pNTu4yAV_normal.jpg,https://pbs.twimg.com/profile_banners/25082896/1451727765,http://abs.twimg.com/images/themes/theme1/bg.png,159,148,0,0,0,0,2021-10-24T14:46:36.000-07:00
1452285777925316614,1452285777925316614,2021-10-24T14:48:06.000-07:00,"","","","","Career tip for landing jobs like 'Communications Sales Representative' in #Warwick, RI. Go on informational interviews. The best way to get a meeting with a hiring manager is to ask for an informational meeting. #Sales","['Warwick', 'Sales']","",22054638,TMJ-RI Sales Jobs,tmj_ri_sales,false,http://pbs.twimg.com/profile_images/695306540559958016/8e7truyt_normal.jpg,https://pbs.twimg.com/profile_banners/22054638/1454608974,http://abs.twimg.com/images/themes/theme1/bg.png,318,254,0,0,0,0,2021-10-24T14:48:06.000-07:00
1452286150526345230,1452286150526345230,2021-10-24T14:49:35.000-07:00,"","","",['http://dlvr.it/SBC85k'],"Now Hiring: Assistant Attorney General, Environmental Section (00217) at Commonwealth Of Virginia (Richmond, VA) https://t.co/cGYRYARBAS #lawyers #inhousetwitter","['lawyers', 'inhousetwitter']","",49049693,GoInhouse®,goinhouse,false,http://pbs.twimg.com/profile_images/992508612273635328/74DREEkY_normal.jpg,https://pbs.twimg.com/profile_banners/49049693/1590205232,http://abs.twimg.com/images/themes/theme6/bg.gif,7697,3761,0,0,0,0,2021-10-24T14:49:35.000-07:00
1452286331850199041,1452286331850199041,2021-10-24T14:50:18.000-07:00,"","","","",Now hiring for 30 #security job opportunities in #AnnArborMI. Click the link in our bio to see them.,"['security', 'AnnArborMI']","",119811662,TMJ-MIN Security Job,tmj_MIN_secure,false,http://pbs.twimg.com/profile_images/706766742450601985/PbcAV5kU_normal.jpg,https://pbs.twimg.com/profile_banners/119811662/1457341298,http://abs.twimg.com/images/themes/theme1/bg.png,202,179,0,0,0,0,2021-10-24T14:50:18.000-07:00
1452286376737705987,1452286376737705987,2021-10-24T14:50:29.000-07:00,https://twitter.com/jo_secure/status/1452286376737705987/photo/1,['http://pbs.twimg.com/media/FCeOw37XsAAlGal.png'],['photo'],['https://tinyurl.com/RTPSwDev'],"Join a winning team! Broadcom Mainframe Software Division is hiring worldwide, including many software development positions in RTP.  https://t.co/iYbifoH5vP https://t.co/JH2cgnbf3x","","",177683530,Jo Secure,jo_secure,false,http://pbs.twimg.com/profile_images/992161016711704578/gAI5La0i_normal.jpg,"",http://abs.twimg.com/images/themes/theme14/bg.gif,224,178,0,0,0,0,2021-10-24T14:50:29.000-07:00
1452286721274548230,1452286721274548230,2021-10-24T14:51:51.000-07:00,https://twitter.com/SwanGlobalQA/status/1452286721274548230/photo/1,['http://pbs.twimg.com/media/FCePD5uXIAkiQCZ.jpg'],['photo'],"",Share CV/references at jobs@swan.qa  Or WhatsApp at +974 55932731||#Nowhiring #Qatar #Qatarhiring #Qatarjobs #Jobsinqatar #Hiringandpromotion #InstrumentTechnician #Swanglobal #Swan #hiring #applytoday https://t.co/ayP17DyIB4,"['Nowhiring', 'Qatar', 'Qatarhiring', 'Qatarjobs', 'Jobsinqatar', 'Hiringandpromotion', 'InstrumentTechnician', 'Swanglobal', 'Swan', 'hiring', 'applytoday']","",1138178234250477568,Swan Global,SwanGlobalQA,false,http://pbs.twimg.com/profile_images/1444528251792027650/Xo4IXIgu_normal.jpg,https://pbs.twimg.com/profile_banners/1138178234250477568/1633236994,"",55,12,0,0,0,0,2021-10-24T14:51:51.000-07:00
1452287136955346955,1452287136955346955,2021-10-24T14:53:30.000-07:00,"","","","",Things I’ve learned while interviewing for tech jobs.||Companies eyes glaze over if I mention I’ve worked in the ER during the pandemic. They don’t care.||I helped a company rebrand and they got acquired by Docusign. Crickets when I tell the hiring manager.,"","",2364309430,emmett naughton,EmmettNaughton,false,http://pbs.twimg.com/profile_images/1296425733020176385/tcO9mjan_normal.jpg,https://pbs.twimg.com/profile_banners/2364309430/1575302282,http://abs.twimg.com/images/themes/theme1/bg.png,3440,5001,0,0,0,0,2021-10-24T14:53:30.000-07:00
1452287157591289860,1452287157591289860,2021-10-24T14:53:35.000-07:00,"","","","",@SpursITKhub I will never forgive spurs for throwing Fonseca aside and hiring Nuno.,"",['SpursITKhub'],703592163179888641,Will,wrlittleford,false,http://pbs.twimg.com/profile_images/1430497651406123009/bZ4b1Wkn_normal.jpg,https://pbs.twimg.com/profile_banners/703592163179888641/1629892650,"",212,61,0,0,0,0,2021-10-24T14:53:35.000-07:00
1452287378496925697,1452287378496925697,2021-10-24T14:54:27.000-07:00,"","","","","We're hiring in #Richland, WA! Click the link in our bio to apply to this job and more: Cost Estimator-Sr at Tetra Tech #ProjectMgmt","['Richland', 'ProjectMgmt']","",113422225,TMJ-WAR IT Jobs,tmj_WAR_it,false,http://pbs.twimg.com/profile_images/703696372751437824/F9Gs0V6I_normal.jpg,https://pbs.twimg.com/profile_banners/113422225/1456609265,http://abs.twimg.com/images/themes/theme1/bg.png,319,248,0,0,0,0,2021-10-24T14:54:27.000-07:00
1452287584743399427,1452287584743399427,2021-10-24T14:55:17.000-07:00,"","","","",@kazumaneetking @itsoguH_ @TerrificTD @AlanRMacLeod @Plague_Y2K How are they supposed to move if they can't even afford groceries that week? 🤔 your logic is flawed there. Average rent here is $1100 and work places are hiring for $7.50. Just because your area is offering that doesn't mean all of them are.,"","['kazumaneetking', 'itsoguH_', 'TerrificTD', 'AlanRMacLeod', 'Plague_Y2K']",3142735323,Riot 🔪,MooPigRiot,false,http://pbs.twimg.com/profile_images/1440984514529005568/8ygVxiih_normal.jpg,https://pbs.twimg.com/profile_banners/3142735323/1534893045,http://abs.twimg.com/images/themes/theme1/bg.png,425,1415,0,0,0,0,2021-10-24T14:55:17.000-07:00
1452287772413280258,1452287772413280258,2021-10-24T14:56:01.000-07:00,"","","",['https://apli.us/bvEy'],"Want to work at One Steamboat Place!? We're hiring in Steamboat Springs, CO! https://t.co/34O5GssBdR Payrollclerkjobs","","",1101270461986496512,Nationwide Job Search,NWJS_jobs,false,http://pbs.twimg.com/profile_images/1167161335009800192/dVU4C0up_normal.jpg,https://pbs.twimg.com/profile_banners/1101270461986496512/1567107922,"",365,23,0,0,0,0,2021-10-24T14:56:01.000-07:00
1452288008393306116,1452288008393306116,2021-10-24T14:56:58.000-07:00,"","","",['https://bit.ly/2XEdp8M'],We're hiring! Click to apply: OR COOPER RN - https://t.co/r9iPXnwwBY #midlandmi #FlintMI,"['midlandmi', 'FlintMI']","",801064725605916674,Covenant Careers,Covenant_Jobs,false,http://pbs.twimg.com/profile_images/806951485397352449/Wz1CvrJh_normal.jpg,https://pbs.twimg.com/profile_banners/801064725605916674/1481227046,"",59,377,0,0,0,0,2021-10-24T14:56:58.000-07:00
1452288269597745167,1452288269597745167,2021-10-24T14:58:00.000-07:00,"","","",['https://bit.ly/3GjDThi'],We're hiring! Click to apply: Store Manager - https://t.co/HVvuUEmxY4 #TMXCareerLove #TMXCareers,"['TMXCareerLove', 'TMXCareers']","",321406129,TMX Companies Careers,TMXCareers,false,http://pbs.twimg.com/profile_images/1344395073795010561/Su8t-7Ke_normal.jpg,https://pbs.twimg.com/profile_banners/321406129/1628861058,http://abs.twimg.com/images/themes/theme16/bg.gif,1184,404,0,0,0,0,2021-10-24T14:58:00.000-07:00
1452288557033394188,1452288557033394188,2021-10-24T14:59:08.000-07:00,"","","","",Now hiring for 25 #SkilledTrade job opportunities in #Ontario. Click the link in our bio to see them.,"['SkilledTrade', 'Ontario']","",161918324,Ontario Skl. Trades,tmj_ON_skltrd,false,http://pbs.twimg.com/profile_images/710858971586793472/YzFvKIa2_normal.jpg,https://pbs.twimg.com/profile_banners/161918324/1458316962,http://abs.twimg.com/images/themes/theme1/bg.png,284,232,0,0,0,0,2021-10-24T14:59:08.000-07:00
1452288723748544522,1452288723748544522,2021-10-24T14:59:48.000-07:00,"","","","","Want to work at UPS? We're hiring in #Elkridge, MD! Click the link in our bio for details on this job and more: Seasonal Personal Vehicle Package Driver #Transportation","['Elkridge', 'Transportation']","",149398899,TMJ-VAL Transport.,tmj_VAL_transp,false,http://pbs.twimg.com/profile_images/711125572013809664/s4bGKJWH_normal.jpg,https://pbs.twimg.com/profile_banners/149398899/1458380525,http://abs.twimg.com/images/themes/theme1/bg.png,282,245,0,0,0,0,2021-10-24T14:59:48.000-07:00
1452288780648554502,1452288780648554502,2021-10-24T15:00:02.000-07:00,https://twitter.com/uiuxjobsboard/status/1452288780648554502/photo/1,['http://pbs.twimg.com/tweet_video_thumb/FCeQ8uCX0AMioz0.jpg'],['animated_gif'],['https://uiuxjobsboard.com/job/537521-remote-ux-designer'],Jenzabar is seeking📣 UX Designer ||👇👇👇 |https://t.co/z7K2hJevk2 ||#jobs #hiring #ux #ui https://t.co/UfNNOMrAaV,"['jobs', 'hiring', 'ux', 'ui']","",1067152700285034496,UIUXjobsboard,uiuxjobsboard,false,http://pbs.twimg.com/profile_images/1234924821504577536/gODcfuD1_normal.jpg,https://pbs.twimg.com/profile_banners/1067152700285034496/1583263997,http://abs.twimg.com/images/themes/theme1/bg.png,498,0,0,0,0,0,2021-10-24T15:00:02.000-07:00
1452288782368133124,1452288782368133124,2021-10-24T15:00:02.000-07:00,https://twitter.com/MukeshShah/status/1452288782368133124/photo/1,['http://pbs.twimg.com/media/FCeQ8ygXEAAVT6X.jpg'],['photo'],['https://buff.ly/3jqZxp7'],"Career seekers special.|We do pros career stories, and it works. We put your career stories on your resume instead of a summary, objectives, or profile usually you have.||You will interest hiring managers with your career story. You should check https://t.co/FX33RZbJyG https://t.co/rl6P26NlrK","","",16261477,Mukesh,MukeshShah,false,http://pbs.twimg.com/profile_images/1153766418/MHS_Black_T_normal.jpg,"",http://abs.twimg.com/images/themes/theme4/bg.gif,87,97,0,0,0,0,2021-10-24T15:00:02.000-07:00
1452288802618216457,1452288802618216457,2021-10-24T15:00:07.000-07:00,https://twitter.com/NCAPAtweets/status/1452288802618216457/photo/1,['http://pbs.twimg.com/media/FCeQ9_HX0A0Spq_.jpg'],['photo'],"",Our members are HIRING! Our members do so much important work for the #AAPI community and are looking for people to join their team. Join the NCAPA community and become a part of #WhoWeAre! @APIAVote @AAPCHOtweets @NAPAWF @SEARAC https://t.co/H66zNP5pAr,"['AAPI', 'WhoWeAre']","['APIAVote', 'AAPCHOtweets', 'NAPAWF', 'SEARAC']",507529506,NCAPA | National Council of Asian Pacific American,NCAPAtweets,true,http://pbs.twimg.com/profile_images/1414605246471540743/_Cz6arE__normal.png,https://pbs.twimg.com/profile_banners/507529506/1615301188,http://abs.twimg.com/images/themes/theme1/bg.png,9809,2859,0,0,0,0,2021-10-24T15:00:07.000-07:00
1452288854287949836,1452288854287949836,2021-10-24T15:00:19.000-07:00,https://twitter.com/CynthiaSHospice/status/1452288854287949836/photo/1,['http://pbs.twimg.com/media/FCeRAwRWEAIJRjU.jpg'],['photo'],['https://uk.indeed.com/jobs?q=cynthia%20spencer%20hospice&l=northamptonshire&ts=1621248802881&rq=1&rsIdx=0&fromage=last&newcount=2&vjk=21150d286a13e53b'],"We’re hiring! Want a role that will make a difference? Working with our administration, fundraising and retail team the Charity Administration Assistant ensures our patients, families and supporters receive the best care and support from our charity https://t.co/Sr3K6lon9M https://t.co/3ktGYwZYyW","","",351467349,Cynthia Spencer,CynthiaSHospice,false,http://pbs.twimg.com/profile_images/1346007368761569282/Pf24dH2p_normal.jpg,https://pbs.twimg.com/profile_banners/351467349/1633419181,http://abs.twimg.com/images/themes/theme1/bg.png,1519,751,0,0,0,0,2021-10-24T15:00:19.000-07:00
1452288897120186376,1452288897120186376,2021-10-24T15:00:29.000-07:00,https://twitter.com/VoluntaryImpact/status/1452288897120186376/photo/1,['http://pbs.twimg.com/media/FCeRDjIXoAgW6Ds.jpg'],['photo'],['http://ow.ly/S0RA50GiyJq'],We are hiring!  |Resident Engagement &amp; Wellbeing Officer.|To find out more about the role and to apply visit our website - https://t.co/Kru4Wq8vdA https://t.co/cPYEzLtX2B,"","",21794185,Vol Impact Northants,VoluntaryImpact,false,http://pbs.twimg.com/profile_images/484270011813351424/5ILHWaq__normal.jpeg,https://pbs.twimg.com/profile_banners/21794185/1622535513,http://abs.twimg.com/images/themes/theme16/bg.gif,2982,993,0,0,0,0,2021-10-24T15:00:29.000-07:00
1452289288754941966,1452289288754941966,2021-10-24T15:02:03.000-07:00,"","","","","@yongfook The public financial aspect of #BuildingInPublic is my only reservation. At some point people may reach a threshold where it isn’t helpful anymore. What’s still helpful is sharing details like hiring process, management styles, business decisions, which you’re already doing! 😃",['BuildingInPublic'],['yongfook'],1160897259967590400,Jacob Neterer,jacobneterer,false,http://pbs.twimg.com/profile_images/1451923507185524736/SG001LOA_normal.png,https://pbs.twimg.com/profile_banners/1160897259967590400/1635050332,"",77,229,0,0,0,0,2021-10-24T15:02:03.000-07:00
1452289440261476356,1452289440261476356,2021-10-24T15:02:39.000-07:00,"","","","","Want to work at Wine Rack, a division of Arterra Wines Canada? We're hiring in Toronto, ON, Canada! Click the link in our bio for details on this job and more: Sales Associate - Wine Merchant (Augusta &amp; College - Kensington Market) #Sales #Retail","['Sales', 'Retail']","",21480221,"Toronto,CA Sale Jobs",tmj_gta_sales,false,http://pbs.twimg.com/profile_images/671434236075728897/WwyQOW_a_normal.jpg,https://pbs.twimg.com/profile_banners/21480221/1448917372,http://abs.twimg.com/images/themes/theme1/bg.png,770,285,0,0,0,0,2021-10-24T15:02:39.000-07:00
1452289482129125382,1452289482129125382,2021-10-24T15:02:49.000-07:00,"","","","",Now hiring for 54 #IT job opportunities in #ScottsdaleAZ. Click the link in our bio to see them.,"['IT', 'ScottsdaleAZ']","",100003539,TMJ-AZS IT Adm. Jobs,tmj_AZS_adm,false,http://pbs.twimg.com/profile_images/699715211415068672/LIb67Kyt_normal.jpg,https://pbs.twimg.com/profile_banners/100003539/1455660082,http://abs.twimg.com/images/themes/theme1/bg.png,227,183,0,0,0,0,2021-10-24T15:02:49.000-07:00
1452289522327343111,1452289522327343111,2021-10-24T15:02:59.000-07:00,"","","",['https://cutt.ly/JRYvno0'],Mem is hiring a #Mobile Engineer!||🧠 Challenge the way that knowledge is stored and shared|✅ Polish various UX elements|🛠 Build custom animations and screens||#Swift #GraphQL #DevJobs|https://t.co/0SuCaX3uwX,"['Mobile', 'Swift', 'GraphQL', 'DevJobs']","",354131767,Gun.io,GUNdotIO,false,http://pbs.twimg.com/profile_images/1446798760999206912/shdsiOua_normal.jpg,https://pbs.twimg.com/profile_banners/354131767/1633928038,http://abs.twimg.com/images/themes/theme1/bg.png,9347,2944,0,0,0,0,2021-10-24T15:02:59.000-07:00
1436240779119316995,1452268645304963080,2021-10-24T13:40:01.000-07:00,"","","",['http://bit.ly/3hl67NN'],"Now hiring across the UK!  ||Come and work for a family business and an award-winning team! Find your next career, browse our job vacancies today! https://t.co/ZiPiBIDyqr","","",588136658,Brewers Decorator Centres,Brewerspaints,false,http://pbs.twimg.com/profile_images/1415636463786635266/PxOLqhKz_normal.jpg,https://pbs.twimg.com/profile_banners/588136658/1630597906,http://abs.twimg.com/images/themes/theme1/bg.png,14215,3571,9,1,0,11,2021-09-10T08:11:00.000-07:00
1440508047634288650,1452275618310144002,2021-10-24T14:07:44.000-07:00,https://twitter.com/K3TripleR/status/1440508047634288650/photo/1,['http://pbs.twimg.com/media/E_22QptVIAEMloI.jpg'],['photo'],['https://www.hamradio.com/hro-florida.cfm'],"Looking for work in FL?||We're hiring for our new Winter Springs, Florida location!|Do you have what it takes to become an important member of the Ham Radio Outlet team?|Follow the link to start your application process: https://t.co/aL06QKZLcB https://t.co/W56M1J2ssy","","",2776806351,K3RRR,K3TripleR,false,http://pbs.twimg.com/profile_images/1372069653002993665/Z6vYyNUs_normal.jpg,https://pbs.twimg.com/profile_banners/2776806351/1544896481,http://abs.twimg.com/images/themes/theme15/bg.png,4276,4609,8,0,1,6,2021-09-22T02:47:36.000-07:00
1443575889745174538,1452286133937885193,2021-10-24T14:49:31.000-07:00,https://twitter.com/torproject/status/1443575889745174538/photo/1,['http://pbs.twimg.com/media/FAicI9FUYAAb4kH.png'],['photo'],['https://www.torproject.org/about/jobs/software-engineer-applications-team/'],We're hiring! 👋|📱🖥️Software Engineers for Applications Team||We are looking for two developers to join our team to help us with both Tor Browser development and mobile app development.||https://t.co/9qoarTuMQ0 https://t.co/67YPIOwKGj,"","",18466967,The Tor Project,torproject,true,http://pbs.twimg.com/profile_images/1413546418841608194/eKqpZMpV_normal.jpg,https://pbs.twimg.com/profile_banners/18466967/1611961785,http://abs.twimg.com/images/themes/theme1/bg.png,421271,1696,213,5,14,229,2021-09-30T13:58:07.000-07:00
1450230202936840195,1452287141074120712,2021-10-24T14:53:31.000-07:00,"","","","",I was spiked last month in a club in Glasgow and the bouncers watched as my friends dragged me outside as I couldn’t see and could barely breath n then they refused to let my pal bring me out a cup of water :) Clubs need to do better and that starts with hiring the right staff.,"","",4796267793,Rachael Orr,rachael_orrr,false,http://pbs.twimg.com/profile_images/1427919339315945473/HoEDYV02_normal.jpg,https://pbs.twimg.com/profile_banners/4796267793/1624715185,"",320,339,15439,66,42,1236,2021-10-18T22:39:59.000-07:00
1450964009818144770,1452282033745580046,2021-10-24T14:33:13.000-07:00,"","","","","its so exciting to announce that we're hiring again at @SoaRGaming ||we have some job postings on hitmarker &amp; indeed, if you think you fit the role please apply 😤","",['SoaRGaming'],858780679,SoaR Mak,makz,true,http://pbs.twimg.com/profile_images/1404553025209913350/UhlMNsPS_normal.jpg,https://pbs.twimg.com/profile_banners/858780679/1613494753,http://abs.twimg.com/images/themes/theme14/bg.gif,115291,996,552,3,70,22,2021-10-20T23:15:52.000-07:00
1451259268334858245,1452273022434488322,2021-10-24T13:57:25.000-07:00,"","","",['https://www.uvmjobs.com/postings/48082'],My dept @UVMCALS is hiring!  TT Assistant prof in nutrition/epi.  Please share widely! https://t.co/jaojJco7In,"",['UVMCALS'],829738610,Meredith Niles,MeredithNiles1,false,http://pbs.twimg.com/profile_images/1338289988249726978/22EsUHPK_normal.jpg,https://pbs.twimg.com/profile_banners/829738610/1607908390,http://abs.twimg.com/images/themes/theme1/bg.png,1171,120,18,1,0,16,2021-10-21T18:49:07.000-07:00
1451287772669505589,1452282494963834888,2021-10-24T14:35:03.000-07:00,https://twitter.com/mrp/status/1451287772669505589/photo/1,['http://pbs.twimg.com/media/FCQCfPGVcAIcOfZ.jpg'],['photo'],['https://jobs.lever.co/trustly?location=Lisbon%2C%20Portugal'],"🇵🇹@Trustly has opened its newest office in Lisbon!||Interested in joining a FinTech unicorn with global reach?||We're hiring Software Architects, Software Engineers, Quality Engineers, Product Managers, Business Analysts, and more. ||JOIN OUR TEAM: https://t.co/DEtJqyLNwP https://t.co/3IEoc8rmDl","",['Trustly'],111417386,Ron Pragides,mrp,true,http://pbs.twimg.com/profile_images/768680563381153792/KQoXDUOv_normal.jpg,https://pbs.twimg.com/profile_banners/111417386/1512613592,http://abs.twimg.com/images/themes/theme1/bg.png,6338,772,39,1,0,9,2021-10-21T20:42:23.000-07:00
1451526996010340355,1452289058298896394,2021-10-24T15:01:08.000-07:00,https://twitter.com/kcbbankug/status/1451526996010340355/photo/1,"['http://pbs.twimg.com/media/FCTb8L3XIAwQYp3.jpg', 'http://pbs.twimg.com/media/FCTcBpAXsAUS1yA.jpg', 'http://pbs.twimg.com/media/FCTcFlEWUAMvGop.jpg']","['photo', 'photo', 'photo']",['https://ug.kcbgroup.com/about/careers'],WE ARE HIRING! Click this link to see if you are the right fit for these opportunities. |#KCBGoAhead |https://t.co/DsF1lYE5gO https://t.co/JpeIO7q2kv,['KCBGoAhead'],"",832704734,KCB BANK UGANDA,kcbbankug,false,http://pbs.twimg.com/profile_images/1448922828271652894/dlKHhzbR_normal.jpg,https://pbs.twimg.com/profile_banners/832704734/1634285099,http://abs.twimg.com/images/themes/theme1/bg.png,6901,928,100,0,1,12,2021-10-22T12:32:58.000-07:00
1451625579703414784,1452271100143063041,2021-10-24T13:49:46.000-07:00,https://twitter.com/ICPSR/status/1451625579703414784,['http://pbs.twimg.com/media/FCU1xZFWEAA0CSC.jpg'],['photo'],['http://myumi.ch/nbmEZ'],"ICPSR is #hiring! We are seeking a Data #ProjectManager to oversee the management of a project to build a new Social, Behavioral, and Economic Research on COVID-19 Consortium Coordinating Center (SBECCC) for COVID-19 related research. Apply by 11/05: https://t.co/umP5H0fsPD https://t.co/T0FwxaJXk4","['hiring', 'ProjectManager']","",31466910,ICPSR,ICPSR,false,http://pbs.twimg.com/profile_images/1267681822189604865/SGZBy2td_normal.png,https://pbs.twimg.com/profile_banners/31466910/1601308516,http://abs.twimg.com/images/themes/theme6/bg.gif,8058,1115,8,1,0,9,2021-10-22T19:04:42.000-07:00
1451760926923710465,1452270710651510794,2021-10-24T13:48:13.000-07:00,https://twitter.com/farahhh_ibrahim/status/1451760926923710465/photo/1,['http://pbs.twimg.com/media/FCWw3glUUAUzsKa.jpg'],['photo'],"",Urgent!! We are hiring for Litigation Lawyer Post. Kindly submit your CV/Resume to Mr Fazreen and Mr Steven. ||Please RT untuk sesiapa yang memerlukan. https://t.co/vuORm0SoDb,"","",129171053,𝕬𝖉𝖆 𝖘𝖍𝖊𝖑𝖇𝖞,farahhh_ibrahim,false,http://pbs.twimg.com/profile_images/1401772790441644032/RI5Yi-M2_normal.jpg,https://pbs.twimg.com/profile_banners/129171053/1574055707,http://abs.twimg.com/images/themes/theme14/bg.gif,1527,460,19,1,0,65,2021-10-23T04:02:32.000-07:00
1451918499941478409,1452285937803841543,2021-10-24T14:48:44.000-07:00,https://twitter.com/CharismaBIph/status/1451918499941478409/photo/1,['http://pbs.twimg.com/media/FCY_FciVIAgQbuf.jpg'],['photo'],['https://khb2.carrd.co/#vt-recruitment'],🆔NOTICE: VOTING TEAM RECRUITMENT||We are now opening the recruitment to all IDs who want to be part of our Voting Team. Please do join the team and support all voting activities for B.I and 'Cosmos'.||Apply here: https://t.co/MHCpz3Vkk4||#HANBIN #비아이 @shxx131bi131 https://t.co/XXivqNMmSd,"['HANBIN', '비아이']",['shxx131bi131'],2194100815,🆔️CHARISMA B.I PHILIPPINES,CharismaBIph,false,http://pbs.twimg.com/profile_images/1446447186804305920/4r8gWvSR_normal.jpg,https://pbs.twimg.com/profile_banners/2194100815/1633694857,http://abs.twimg.com/images/themes/theme1/bg.png,6397,108,139,4,2,88,2021-10-23T14:28:40.000-07:00
1451984224135884801,1452284644494397446,2021-10-24T14:43:36.000-07:00,https://twitter.com/DuchessTheLover/status/1451984224135884801/photo/1,['http://pbs.twimg.com/tweet_video_thumb/FCZ78zCXsAQVqMZ.jpg'],['animated_gif'],"",@MelReneeStyles ARE THEY HIRING? https://t.co/El7VUNUFUy,"",['MelReneeStyles'],284334615,LOVERGIRL✨❤️,DuchessTheLover,false,http://pbs.twimg.com/profile_images/1424563199353966594/RK90ntXH_normal.jpg,https://pbs.twimg.com/profile_banners/284334615/1628265155,http://abs.twimg.com/images/themes/theme1/bg.png,797,1252,1465,1,0,59,2021-10-23T18:49:50.000-07:00
1452053775557005315,1452281637799092229,2021-10-24T14:31:39.000-07:00,https://twitter.com/dowellvest/status/1452053775557005315/photo/1,['http://pbs.twimg.com/media/FCa7NlnXsAE8Or4.jpg'],['photo'],"",ATTENTION #PVAMU STUDENTS: PVAMU-TV is hiring! Interested in developing skills in tv production? Have experience editing video? Apply at PVAMU careers page on the university website. |Application deadline: Oct 27!  |Positions pay $11-$12/hr. |Student Hourly: 20 hr work week. https://t.co/rl928LEFfA,['PVAMU'],"",23233999,"Terésa Dowell-Vest, M.F.A. 🏳️‍🌈🇸🇱🇱🇷🇬🇼",dowellvest,false,http://pbs.twimg.com/profile_images/966493204454363136/r1r7IQwi_normal.jpg,https://pbs.twimg.com/profile_banners/23233999/1519264886,http://abs.twimg.com/images/themes/theme2/bg.gif,2244,3339,59,1,1,31,2021-10-23T23:26:12.000-07:00
