org_id,samp_id,samp_datetime,org_url,org_media_url,org_media_type,org_attached_links,org_text,org_hashtags,org_user_metions,user_id,user_name,user_screen_name,user_verified,user_profile_image_url,user_profile_banner_url,user_profile_background_image_url,user_followers_count,user_friends_count,org_favorite_count,org_quote_count,org_reply_count,org_retweet_count,org_datetime
1346573190940782592,1457120912197685249,2021-11-06T23:01:12.000-07:00,"","","",['https://jobs.lever.co/Uniswap'],🌐 Do you want to help build the future of decentralized finance?||4⃣The Uniswap dev team is hiring for 4 engineering roles!||🦄 Senior Frontend Engineer|🦄 Smart Contract Engineer|🦄 Full Stack Engineer|🦄 Software Engineer Intern||Learn more and apply:|https://t.co/d3IERsnQsE,"","",984188226826010624,Uniswap Labs 🦄,Uniswap,true,http://pbs.twimg.com/profile_images/1242184851152928769/wG2eTAfD_normal.jpg,https://pbs.twimg.com/profile_banners/984188226826010624/1584988310,http://abs.twimg.com/images/themes/theme1/bg.png,696205,90,3691,191,3807,1208,2021-01-05T21:44:01.000-08:00
1389645389637238796,1457111436694630412,2021-11-06T22:23:32.000-07:00,"","","","","#2. Don't Hire the First Advisor You Meet. Working with a financial advisor is a crucial component of any retirement plan, so most people follow these 7 secrets when hiring one.","","",353838102,SmartAsset,smartasset,true,http://pbs.twimg.com/profile_images/1101592165807984640/YBF7NqKq_normal.png,https://pbs.twimg.com/profile_banners/353838102/1551717383,http://abs.twimg.com/images/themes/theme14/bg.gif,34692,1400,10240,227,1314,1946,2021-05-04T18:17:33.000-07:00
1440071495359733760,1457121043013779456,2021-11-06T23:01:43.000-07:00,https://twitter.com/MullinsLab/status/1440071495359733760,['http://pbs.twimg.com/media/E_wpSRzVIAE2pEk.jpg'],['photo'],['https://aprecruit.ucsf.edu/JPF03576'],UCSF is now hiring new tenure-track faculty. This is a cross-departmental search for one (or more) people working in the basic sciences. Come join us!|https://t.co/m6Sr9KvxH9 https://t.co/QTLkrmZOt4,"","",2680341006,Dyche Mullins et al.,MullinsLab,false,http://pbs.twimg.com/profile_images/492763859115974656/kJq97q_G_normal.jpeg,https://pbs.twimg.com/profile_banners/2680341006/1406334704,http://abs.twimg.com/images/themes/theme1/bg.png,3686,1223,103,9,0,87,2021-09-20T21:52:54.000-07:00
1441416884075728899,1457130052995403778,2021-11-06T23:37:31.000-07:00,https://twitter.com/whitehousecea/status/1441416884075728899,"","",['https://www.whitehouse.gov/cea/work-for-us/'],The Council of Economic Advisers is hiring Staff Economists and Research Assistants for the upcoming year (starting in summer of 2022). Please visit our website to learn more or apply: https://t.co/DTKWUTe9NO,"","",1356633759123197956,Council of Economic Advisers,WhiteHouseCEA,true,http://pbs.twimg.com/profile_images/1356638436350918657/l4jIoFOu_normal.jpg,https://pbs.twimg.com/profile_banners/1356633759123197956/1612282865,"",16979,11,259,33,5,146,2021-09-24T14:59:00.000-07:00
1445674022969090048,1457122839165816832,2021-11-06T23:08:51.000-07:00,"","","",['https://jobs.soton.ac.uk/Vacancy.aspx?ref=1409121BJ-R'],"We are hiring a postdoc in cell biology||We are investigating new mechanisms of cell division using the mammary epithelium as a powerful mammalian model system||Our team is diverse, talented, and supportive||Come join us||Please RT 🙏||https://t.co/OkHNfk79TY","","",1191757274911522816,Salah Elias,theeliaslab,false,http://pbs.twimg.com/profile_images/1342174608485715969/pm5FDy0w_normal.jpg,https://pbs.twimg.com/profile_banners/1191757274911522816/1604701362,"",619,491,77,3,0,67,2021-10-06T08:55:21.000-07:00
1447754902407553028,1457128520119767046,2021-11-06T23:31:25.000-07:00,"","","","","As mentioned in the recruitment statement, we are planning to increase the number of Scalars again in the near future, so please join us. We are always accepting reply &amp; DM messages to tweets, so we are waiting for you.😊|#AxieInfinity |#AxieScholarship","['AxieInfinity', 'AxieScholarship']","",1446006895127318529,Axie Infinity,AxieInfinity888,false,http://pbs.twimg.com/profile_images/1456895419762753537/f62QmH3d_normal.jpg,https://pbs.twimg.com/profile_banners/1446006895127318529/1635295915,"",844,4,77,0,16,30,2021-10-12T02:44:01.000-07:00
1455508444186914821,1457119288821747712,2021-11-06T22:54:45.000-07:00,https://twitter.com/CareersUsps/status/1455508444186914821/photo/1,['http://pbs.twimg.com/media/FDL-dZrWEAYrH4w.jpg'],['photo'],"","USPS is Hiring! Join us for a Career Fair at 2 Federal Square, Newark, NJ, November 5, 2021 from 10am-2pm.#hiring #nowhiring #Veterans #Career #CareerOpportunities #HIRINGNOW #Jobs #Job #JobSearch #Employment #NewJersey #work #cdl #TruckDriver https://t.co/i0G34Oy7fU","['hiring', 'nowhiring', 'Veterans', 'Career', 'CareerOpportunities', 'HIRINGNOW', 'Jobs', 'Job', 'JobSearch', 'Employment', 'NewJersey', 'work', 'cdl', 'TruckDriver']","",1118263370665353224,USPS_Careers,CareersUsps,false,http://pbs.twimg.com/profile_images/1118263600450297856/QkT_j-iB_normal.jpg,https://pbs.twimg.com/profile_banners/1118263370665353224/1555449909,"",194,263,2,0,0,3,2021-11-02T12:13:49.000-07:00
1455601927530717193,1457110594444660736,2021-11-06T22:20:12.000-07:00,https://twitter.com/wwsweets/status/1455601927530717193,['http://pbs.twimg.com/media/FDNWPQEWYAAIr6w.jpg'],['photo'],['https://buff.ly/3jZYNsa'],"We're hiring summer interns for the 2022 season!||If you would like to gain experience and to work in baseball, we are now accepting applications for the 2022 season.||Ways to apply:|LinkedIn - https://t.co/YY89X3460S|OR|Email resume and cover letter to info@wallawallasweets.com https://t.co/z6ZxrWWUQ4","","",88099580,Walla Walla Sweets,WWSweets,false,http://pbs.twimg.com/profile_images/1345922267394367488/hYyupaM7_normal.jpg,https://pbs.twimg.com/profile_banners/88099580/1598657596,http://abs.twimg.com/images/themes/theme16/bg.gif,3482,336,4,1,1,2,2021-11-02T18:25:17.000-07:00
1455715240297918464,1457111046250905604,2021-11-06T22:21:59.000-07:00,"","","",['https://tinyurl.com/ftz4dkus'],"Monash Bioethics Centre is hiring! Continuing Lecturer position available for exceptional candidate with expertise in ethical, social and regulatory aspects of biomedical technologies and healthcare. Details: https://t.co/qUYHzwuMoX","","",1873906147,Catherine Mills,reprotechethics,false,http://pbs.twimg.com/profile_images/1390293413166084097/4RQWXTXs_normal.jpg,"",http://abs.twimg.com/images/themes/theme1/bg.png,191,122,48,5,0,38,2021-11-03T01:55:33.000-07:00
1455927638451580932,1457105777726918656,2021-11-06T22:01:03.000-07:00,"","","",['http://dlvr.it/SBqWvm'],Now Hiring: Public Finance Associate at Best Best &amp; Krieger LLP (Multiple Locations) https://t.co/RciXCpVKyW #lawfirms #legaljobs,"['lawfirms', 'legaljobs']","",145843395,gobiglaw.com,gobiglaw,false,http://pbs.twimg.com/profile_images/556151734465073152/27maVNfk_normal.png,https://pbs.twimg.com/profile_banners/145843395/1421427460,http://abs.twimg.com/images/themes/theme1/bg.png,4998,4067,0,0,0,1,2021-11-03T15:59:33.000-07:00
1455927648639602690,1457105800158085121,2021-11-06T22:01:09.000-07:00,"","","",['http://dlvr.it/SBqWzG'],Now Hiring: Head of Legal at BetterWorks (TELECOMMUTE) https://t.co/o9VXYVmLyU #lawtwitter #lawyers,"['lawtwitter', 'lawyers']","",49049693,GoInhouse®,goinhouse,false,http://pbs.twimg.com/profile_images/992508612273635328/74DREEkY_normal.jpg,https://pbs.twimg.com/profile_banners/49049693/1590205232,http://abs.twimg.com/images/themes/theme6/bg.gif,7691,3768,0,0,0,1,2021-11-03T15:59:35.000-07:00
1455927654251597826,1457105783926104068,2021-11-06T22:01:05.000-07:00,"","","",['http://dlvr.it/SBqWzl'],"Now Hiring: Bankruptcy and Consumer Finance Regulatory Senior Counsel at Capital One (Arlington, VA) https://t.co/bDBXveKVhZ #legaljobs #lawtwitter","['legaljobs', 'lawtwitter']","",49049693,GoInhouse®,goinhouse,false,http://pbs.twimg.com/profile_images/992508612273635328/74DREEkY_normal.jpg,https://pbs.twimg.com/profile_banners/49049693/1590205232,http://abs.twimg.com/images/themes/theme6/bg.gif,7691,3768,1,0,0,1,2021-11-03T15:59:37.000-07:00
1455936832428937219,1457114971117076486,2021-11-06T22:37:35.000-07:00,"","","",['http://dlvr.it/SBqfFC'],"Now Hiring: Clinical Supervising Attorney, Racial Justice Project, and Lecturer in Law at Stanford University (Stanford, CA) https://t.co/JFK3OVmCoW #lawjobs #corporatecounsel","['lawjobs', 'corporatecounsel']","",49049693,GoInhouse®,goinhouse,false,http://pbs.twimg.com/profile_images/992508612273635328/74DREEkY_normal.jpg,https://pbs.twimg.com/profile_banners/49049693/1590205232,http://abs.twimg.com/images/themes/theme6/bg.gif,7693,3768,0,0,0,1,2021-11-03T16:36:05.000-07:00
1455946137534300166,1457124273550606337,2021-11-06T23:14:33.000-07:00,"","","",['http://dlvr.it/SBqmHr'],"Now Hiring: Legal Counsel - Real Estate at Transform Holdco LLC (Chicago, IL) https://t.co/VgzcosoR7E #legaljobs #corporatecounsel","['legaljobs', 'corporatecounsel']","",49049693,GoInhouse®,goinhouse,false,http://pbs.twimg.com/profile_images/992508612273635328/74DREEkY_normal.jpg,https://pbs.twimg.com/profile_banners/49049693/1590205232,http://abs.twimg.com/images/themes/theme6/bg.gif,7691,3768,0,0,0,1,2021-11-03T17:13:04.000-07:00
1455982039505653763,1457110739848732676,2021-11-06T22:20:46.000-07:00,https://twitter.com/COStateFire/status/1455982039505653763/video/1,['http://pbs.twimg.com/ext_tw_video_thumb/1455981629059387396/pu/img/jYiS3veG-MVOG76z.jpg'],['video'],['http://dfpc.colorado.gov/careers'],"We are hiring multiple wildland firefighting positions including helitack, engine and module firefighters. Check out the listings at https://t.co/C1G2NozOM7 #cofire https://t.co/F3AYFx4BkC",['cofire'],"",1071971822,COFirePrev&Control,COStateFire,true,http://pbs.twimg.com/profile_images/1030224086457184256/cWbJK-Ke_normal.jpg,https://pbs.twimg.com/profile_banners/1071971822/1590084533,http://abs.twimg.com/images/themes/theme1/bg.png,8697,570,8,1,0,6,2021-11-03T19:35:43.000-07:00
1456092072256028676,1457123736868384772,2021-11-06T23:12:25.000-07:00,https://twitter.com/ulfschmitz/status/1456092072256028676/photo/1,['http://pbs.twimg.com/media/FDUTvNGVIAoFb8t.jpg'],['photo'],['http://www.seek.com.au/job/54700599'],"We’re hiring! Please RT: ||~ Computational Biologist ~||(PostDoc, 3yrs, 1 FTE, @jcu @CTBMB_JCU @CPHMVS_JCU).||We work on cool projects in #RNACancerBiology, #AlternativeSplicing, #MultiOmics.||Join our great team in beautiful #NorthQueensland.|Apply here: https://t.co/zuZAObx5Dq https://t.co/olZE8nPQXA","['RNACancerBiology', 'AlternativeSplicing', 'MultiOmics', 'NorthQueensland']","['jcu', 'CTBMB_JCU', 'CPHMVS_JCU']",312616509,Ulf Schmitz,ulfschmitz,false,http://pbs.twimg.com/profile_images/1308613752166604802/DiGuzS3n_normal.jpg,https://pbs.twimg.com/profile_banners/312616509/1600832807,http://abs.twimg.com/images/themes/theme1/bg.png,249,403,25,3,0,18,2021-11-04T02:52:57.000-07:00
1456280177453961219,1457121920822956036,2021-11-06T23:05:12.000-07:00,https://twitter.com/WalthamPSchools/status/1456280177453961219/photo/1,['http://pbs.twimg.com/media/FDW_FE4XsAISB5t.jpg'],['photo'],"","Come work with a group of talented employees and diverse, innovative young learners. Waltham Public Schools is hiring. Scan the QR Code for more info #WorkinWalthamPS #JoinWalthamPS #EmploymentOpportunities https://t.co/VgYKuyTIig","['WorkinWalthamPS', 'JoinWalthamPS', 'EmploymentOpportunities']","",1447909964408922114,Waltham Public Schools Official,WalthamPSchools,false,http://pbs.twimg.com/profile_images/1447913852495175684/zPWRhjHS_normal.jpg,https://pbs.twimg.com/profile_banners/1447909964408922114/1634045215,"",34,84,3,0,0,5,2021-11-04T15:20:25.000-07:00
1456305333702430721,1457105422943408133,2021-11-06T21:59:39.000-07:00,https://twitter.com/glen_eden/status/1456305333702430721/photo/1,['http://pbs.twimg.com/media/FDXV-qVWYAY2vtt.jpg'],['photo'],['https://gleneden.on.ca/snow-school/career-opportunities/'],"Glen Eden is hiring for all seasonal positions and offering a bunch of new perks! 🎉🎉 Not only are we paying more than minimum wage for all entry-level positions—we are also offering an hours-of-work incentive, a free season pass, and more! 💸💸 https://t.co/4I2GOH0NH4 https://t.co/rvdt91ZPqS","","",224659112,Glen Eden,glen_eden,false,http://pbs.twimg.com/profile_images/535094874773929984/aOlH3EeH_normal.jpeg,https://pbs.twimg.com/profile_banners/224659112/1578327106,http://abs.twimg.com/images/themes/theme1/bg.png,6861,342,15,0,2,8,2021-11-04T17:00:23.000-07:00
1456640685046583303,1457129194161377285,2021-11-06T23:34:06.000-07:00,"","","",['http://franklin.uga.edu/environmentalAI/machine-learning-marine-microbial-ecology'],Exciting news 🥳 My department @UGA_MarineSci is hiring an Assistant Professor in Marine Microbial Ecology!! Soft deadline Dec. 31. Please reach out if you have any questions! #AcademicJobs #oceanjobs #DiversityandInclusion https://t.co/CNTZrxxLFL,"['AcademicJobs', 'oceanjobs', 'DiversityandInclusion']",['UGA_MarineSci'],1048987156981661697,Natalie Cohen,oceanatalie1,false,http://pbs.twimg.com/profile_images/1312757543928836103/ZXXAA4kR_normal.jpg,https://pbs.twimg.com/profile_banners/1048987156981661697/1601821169,"",387,431,29,0,0,33,2021-11-05T15:12:57.000-07:00
1456663231498317824,1457104330369142786,2021-11-06T21:55:18.000-07:00,https://twitter.com/GaryLaybourne/status/1456663231498317824/photo/1,['http://pbs.twimg.com/media/FDcbCogX0Aoibd6.jpg'],['photo'],['https://www.charityjob.co.uk/jobs/coach-core/fundraising-officer/785521?tsId=8'],WE'RE HIRING!|We have an exciting position in our fundraising team in what will be a BIG 2022 for the charity!||We hope that the offer of qualifications as well as the position @WeAreCoachCore will be of interest to those looking for a career in our sector|https://t.co/F733ZU1u2c https://t.co/2TYDjnM3nr,"",['WeAreCoachCore'],495209110,Gary Laybourne,GaryLaybourne,false,http://pbs.twimg.com/profile_images/1075900986084995072/-eWD2RYL_normal.jpg,https://pbs.twimg.com/profile_banners/495209110/1550307140,http://abs.twimg.com/images/themes/theme1/bg.png,1421,1085,9,2,0,10,2021-11-05T16:42:32.000-07:00
1456681911376494593,1457101749580406787,2021-11-06T21:45:03.000-07:00,https://twitter.com/ilovetexture/status/1456681911376494593,['http://pbs.twimg.com/media/FDcsekFUcAYwYdM.jpg'],['photo'],['https://careers.viacomcbs.com'],#StarTrekProdigy is hiring in the CG department. Come work with us🖖||https://t.co/h9Yj4f1BrF https://t.co/bsOAF4nmq4,['StarTrekProdigy'],"",412511607,Nikie Monteleone,iLoveTexture,false,http://pbs.twimg.com/profile_images/1453820369446465557/BG2kL5iQ_normal.jpg,https://pbs.twimg.com/profile_banners/412511607/1631390331,http://abs.twimg.com/images/themes/theme1/bg.png,2937,691,278,28,15,122,2021-11-05T17:56:46.000-07:00
1456686751993446405,1457116195241578496,2021-11-06T22:42:27.000-07:00,https://twitter.com/rustybrick/status/1456686751993446405/photo/1,['http://pbs.twimg.com/media/FDWIBBgWUAMmaMF.jpg'],['photo'],['https://www.seroundtable.com/google-hiring-a-spam-fighter-32350.html'],ICYMI: Google is hiring a “spam fighter” search quality analyst - this is your chance to penalize your enemies :P  https://t.co/cyQVLlnu3d https://t.co/kzXGJlGPl6,"","",922011,Barry Schwartz,rustybrick,true,http://pbs.twimg.com/profile_images/1433030583144390668/FKJ9JkUA_normal.jpg,https://pbs.twimg.com/profile_banners/922011/1630545230,http://abs.twimg.com/images/themes/theme1/bg.png,156764,1819,9,0,0,3,2021-11-05T18:16:00.000-07:00
1456692064071176202,1457114085716156422,2021-11-06T22:34:04.000-07:00,https://twitter.com/joeykrug/status/1456692064071176202,"","","","@eco is also hiring a smart contract engineer, seriously the most exciting smart contract opportunity in the space right now imo!","",['eco'],1098681096,Joey Krug,joeykrug,false,http://pbs.twimg.com/profile_images/378800000217786714/bd08945a85223f74c209a30130dd9535_normal.jpeg,https://pbs.twimg.com/profile_banners/1098681096/1430873903,http://abs.twimg.com/images/themes/theme1/bg.png,34866,1601,16,2,0,2,2021-11-05T18:37:06.000-07:00
1456698596284272640,1457117555735371798,2021-11-06T22:47:51.000-07:00,https://twitter.com/lsu_chemistry/status/1456698596284272640,['http://pbs.twimg.com/media/FDc675gVgAQZGIZ.jpg'],['photo'],['https://lsu.wd1.myworkdayjobs.com/LSU/job/0232-AR-Choppin-Hall---Chemistry/Assistant-Professor_R00061657'],WE’RE HIRING!!! #LSUChemistry is seeking a tenure-track faculty member in inorganic chemistry for an August 2022 start date. Apply Today &gt; https://t.co/QyNBY39cVA https://t.co/dAXF13gAII,['LSUChemistry'],"",83761325,LSU Chemistry,LSU_Chemistry,false,http://pbs.twimg.com/profile_images/1333804633995816960/rNw849rB_normal.jpg,https://pbs.twimg.com/profile_banners/83761325/1635780250,http://abs.twimg.com/images/themes/theme10/bg.gif,2254,443,21,2,0,13,2021-11-05T19:03:04.000-07:00
1456720864334991364,1457109047468044300,2021-11-06T22:14:03.000-07:00,https://twitter.com/sutton_impactu/status/1456720864334991364,"","","",$533M in dead money being paid to former collegiate football and basketball head coaches and assistants this year. Sounds like there should be some questions raised about hiring practices &amp; contract length and the people who offered the contracts,"","",1927507592,Bill Sutton,Sutton_ImpactU,false,http://pbs.twimg.com/profile_images/422526902667321344/yul56lEJ_normal.jpeg,https://pbs.twimg.com/profile_banners/1927507592/1544964085,http://abs.twimg.com/images/themes/theme14/bg.gif,5277,3196,49,4,5,11,2021-11-05T20:31:33.000-07:00
1456733501751971850,1457109208055357450,2021-11-06T22:14:41.000-07:00,https://twitter.com/gcsaa_jobboard/status/1456733501751971850,"","",['http://joburl.ws/15723358'],"Now Hiring: Golf Superintendent | Highland Springs Country Club: Springfield, Missouri | https://t.co/yyqknQ7pTV #jobs",['jobs'],"",295420084,GCSAA_JobBoard,GCSAA_JobBoard,false,http://pbs.twimg.com/profile_images/892476634183327745/yFCwQje__normal.jpg,https://pbs.twimg.com/profile_banners/295420084/1501617074,http://abs.twimg.com/images/themes/theme1/bg.png,2685,5,1,0,0,0,2021-11-05T21:21:46.000-07:00
1456803609891442695,1457116733475540993,2021-11-06T22:44:35.000-07:00,"","","",['https://cryptocurrencyjobs.co/startups/clabs/'],".@cLabs, the team working on the open source platform @CeloOrg, is hiring for the following roles!||⚡ Core Security Engineer|⚡ Developer Relations Engineer|⚡ Partner, Accounting|⚡ Smart Contracts Engineer|⚡ Sr Distributed Systems Engineer||Apply now👇|https://t.co/ouP0oc2sJ5","","['cLabs', 'CeloOrg']",919314949909958658,Cryptocurrency Jobs,jobsincrypto,false,http://pbs.twimg.com/profile_images/999432230567997440/jFuy4WRo_normal.jpg,"","",12936,524,11,0,0,4,2021-11-06T02:00:21.000-07:00
1456811781502996480,1457114553771302918,2021-11-06T22:35:56.000-07:00,"","","","","I think Whit Babcock is a very good AD but his FB hiring record is poor. He hired Tuberville at Cincy which is the worst hire there in 20 years, and now has overseen a disastrous tenure for Fuente in Blacksburg.||All 👀 on the next one for VT. #Hokies",['Hokies'],"",511945256,Mike McDaniel,MikeMcDanielSOS,false,http://pbs.twimg.com/profile_images/1433145550770167816/GwnfykAo_normal.jpg,https://pbs.twimg.com/profile_banners/511945256/1616621093,http://abs.twimg.com/images/themes/theme1/bg.png,3309,1170,131,2,19,9,2021-11-06T02:32:49.000-07:00
1456857060914581504,1457120596379140097,2021-11-06T22:59:56.000-07:00,"","","","",📣VOLUNTEER VOTERS NEEDED ASAP||•We are recruiting reveluvs who are willing to help with the MAMA voting. We will distribute email accounts for voting @RVsmtown only.||-DM @derysmilk or @perfectmarevelt for recruitment,"","['RVsmtown', 'derysmilk', 'perfectmarevelt']",1439570529627750406,ً,LuvieVote,false,http://pbs.twimg.com/profile_images/1456839665164914690/mKVAguFk_normal.jpg,https://pbs.twimg.com/profile_banners/1439570529627750406/1636193753,"",166,10,9,1,0,25,2021-11-06T05:32:45.000-07:00
1456919099309797382,1457121113876705280,2021-11-06T23:02:00.000-07:00,https://twitter.com/sekmi/status/1456919099309797382/photo/1,['http://pbs.twimg.com/media/FDgCJ-tWQAQDvUS.jpg'],['photo'],['http://lcbio.pl/jobs/'],"We are hiring postdocs and PhD students in peptide design project using structural #bioinformatics  #cheminformatics #machinelearning #drugdesign techniques, details: https://t.co/S8voIUxS3T https://t.co/ovVipjiqxX","['bioinformatics', 'cheminformatics', 'machinelearning', 'drugdesign']","",48984647,sebastian kmiecik,sekmi,false,http://pbs.twimg.com/profile_images/1403000597746380802/kOP2Ahv__normal.jpg,"",http://abs.twimg.com/images/themes/theme1/bg.png,12,174,34,0,0,13,2021-11-06T09:39:16.000-07:00
1456956998239625219,1457125112243576832,2021-11-06T23:17:53.000-07:00,"","","","",@KatoJustus4 @ChattJazz @glennkirschner2 @B52Malmet @CheriJacobus The short answer is Biden's worst mistake and one that may cost us democracy was hiring the wrong AG.  He picked a puppy dog when we needed a viper.  Half a dozen others immediately come to mind including  Glenn.,"","['KatoJustus4', 'ChattJazz', 'glennkirschner2', 'B52Malmet', 'CheriJacobus']",2385835621,rufuscetus53,jeffmarx53,false,http://pbs.twimg.com/profile_images/1445175230243254287/Tv1KnI4U_normal.jpg,https://pbs.twimg.com/profile_banners/2385835621/1596805877,http://abs.twimg.com/images/themes/theme1/bg.png,70,236,22,0,4,2,2021-11-06T12:09:51.000-07:00
1456958691756765191,1457101339033432064,2021-11-06T21:43:25.000-07:00,https://twitter.com/ijo_matcha/status/1456958691756765191/photo/1,['http://pbs.twimg.com/media/FDgoNIJVkAEsYoQ.jpg'],['photo'],"","IJO. KL is hiring! ||If you're interested to be a part of our team, send your resume at ijo.kualalumpur@gmail.com https://t.co/YFibh0rxXu","","",1380306667925987328,IJO. Matcha,ijo_matcha,false,http://pbs.twimg.com/profile_images/1380306845655461889/kvi54lAA_normal.jpg,https://pbs.twimg.com/profile_banners/1380306667925987328/1626689783,"",627,5,87,0,1,30,2021-11-06T12:16:35.000-07:00
1456962069933199367,1457119835494699017,2021-11-06T22:56:55.000-07:00,"","","",['https://careers.vodafone.com/Vodacom/job/Midrand-Portfolio-Manager-Digital-Retail/732701701/'],Vodacom-Portfolio Manager Digital Retail :Permanent Apply https://t.co/2xOnK2xCmP #jobportal #careerdevelopment #Hiring #Jobs Stage 4 Guy Fawkes Summer Walker Alfred,"['jobportal', 'careerdevelopment', 'Hiring', 'Jobs']","",1361035959479992324,Careers Portal South Africa #JobSeekersSA,careers_portal,false,http://pbs.twimg.com/profile_images/1361036303534592000/IYLFGwOh_normal.jpg,https://pbs.twimg.com/profile_banners/1361035959479992324/1613331462,"",1547,2359,1,0,0,2,2021-11-06T12:30:01.000-07:00
1456990480160407558,1457111841537150980,2021-11-06T22:25:09.000-07:00,"","","",['https://www.careers.luc.edu/postings/18108'],Loyola is hiring a TT NT professor! Come teach me things! (Also if you have any questions about the position I can point you in the correct direction) https://t.co/t2kW6tKk9f,"","",47207475,Megan Wines,MeganEddy,false,http://pbs.twimg.com/profile_images/1449213559150424068/NNkz86BR_normal.jpg,https://pbs.twimg.com/profile_banners/47207475/1555470136,http://abs.twimg.com/images/themes/theme6/bg.gif,506,832,17,0,0,7,2021-11-06T14:22:54.000-07:00
1457006337926189059,1457104254032912392,2021-11-06T21:55:00.000-07:00,"","","","",Now hiring for 29 #Engineering job opportunities in #Vancouver. Click the link in our bio to see them.,"['Engineering', 'Vancouver']","",23349895,TMJ-VAN Engin. Jobs,tmj_van_eng,false,http://pbs.twimg.com/profile_images/679612917990305792/hOnBwMxk_normal.jpg,https://pbs.twimg.com/profile_banners/23349895/1450867322,http://abs.twimg.com/images/themes/theme1/bg.png,229,160,0,0,0,1,2021-11-06T15:25:55.000-07:00
1457028416012623873,1457119712488275971,2021-11-06T22:56:26.000-07:00,"","","","",Thinking about how Disney weathered COVID by becoming a digital first company with Disney Plus and how easy yet hard it is to pull off.||Banks &amp; automakers struggle with digital transformation when hiring software people isn’t hard. The cultural change to give them free reign is.,"","",11336782,Dare Obasanjo,Carnage4Life,false,http://pbs.twimg.com/profile_images/1165282125295190016/h0lTAKvp_normal.jpg,https://pbs.twimg.com/profile_banners/11336782/1513005090,http://abs.twimg.com/images/themes/theme5/bg.gif,45110,926,53,0,5,7,2021-11-06T16:53:39.000-07:00
1457028642534412296,1457101986176843776,2021-11-06T21:45:59.000-07:00,"","","","","If you have any questions about how to break into tech or want to rant with me about how broken the hiring process is, reply to this tweet.||Also, my DMs are currently open!","","",1334735815142871041,Stephanie,selftaughtstph,false,http://pbs.twimg.com/profile_images/1417337282328031233/iQAHGrqS_normal.jpg,https://pbs.twimg.com/profile_banners/1334735815142871041/1607066311,"",2663,549,27,0,3,3,2021-11-06T16:54:33.000-07:00
1457030777959497734,1457119797104283651,2021-11-06T22:56:46.000-07:00,https://twitter.com/AshleyHearn/status/1457030777959497734,"","",['https://holidayhouse.com/wp-content/uploads/2021/11/Internship-Posting.pdf'],"🚨PAID PUBLISHING INTERNSHIP!🚨||The application is OPEN for @PeachtreePub, @HolidayHouseBks and @PixelandInkBks Spring 2022 internship program! We'll be hiring one intern in the NYC office and one in ATL!||Find out more here: https://t.co/aQo5P11N9h","","['PeachtreePub', 'HolidayHouseBks', 'PixelandInkBks']",133288229,Ashley Hearn 🌖🌗🌘,AshleyHearn,false,http://pbs.twimg.com/profile_images/1453366240681025537/sqaCx9kK_normal.jpg,https://pbs.twimg.com/profile_banners/133288229/1610465905,http://abs.twimg.com/images/themes/theme1/bg.png,5457,948,15,3,0,20,2021-11-06T17:03:02.000-07:00
