org_id,samp_id,samp_datetime,org_url,org_media_url,org_media_type,org_attached_links,org_text,org_hashtags,org_user_metions,user_id,user_name,user_screen_name,user_verified,user_profile_image_url,user_profile_banner_url,user_profile_background_image_url,user_followers_count,user_friends_count,org_favorite_count,org_quote_count,org_reply_count,org_retweet_count,org_datetime
1455786945628475394,1455786945628475394,2021-11-03T06:40:29.000-07:00,"","","","","@djstevemcgrath Had this exact conversation with my old man the other night. As good as prime Jose was, he's been going downwards since Inter. This is like hiring Jose 10/15 years ago","",['djstevemcgrath'],597237518,Glasgow RK Spurs,GlasgowRKSpurs,false,http://pbs.twimg.com/profile_images/1421749024349204484/YAwF83Ha_normal.jpg,https://pbs.twimg.com/profile_banners/597237518/1352718821,http://abs.twimg.com/images/themes/theme1/bg.png,1774,2376,0,0,0,0,2021-11-03T06:40:29.000-07:00
1455787166643146754,1455790444315652096,2021-11-03T06:54:23.000-07:00,"","","","","And I just cannot say how enraging it is to be asked to work full time for a campaign in addition to my day job when the party can’t use the money we give them to run ads. ||We have a huge Hollywood component, ask them for help. ||Stop hiring the same tired firms for marketing.","","",907036222442360833,Brienne of Snark🏳️‍🌈,BrienneOfSnark_,false,http://pbs.twimg.com/profile_images/1128271149002051584/xS-XHofv_normal.jpg,https://pbs.twimg.com/profile_banners/907036222442360833/1619659949,"",18993,11508,6,0,1,4,2021-11-03T06:41:22.000-07:00
1455788090216357889,1455788268734328833,2021-11-03T06:45:45.000-07:00,"","","",['http://ow.ly/NbfV30rZesU'],Security Officer for Marijuana Company in Walnut California! /// HIRING NOW @ https://t.co/nmYDxkS11C #420Jobs #Marijuana #Jobs #Cannabis #Careers #JobBoard #JobHunt #JobSearch #HiringNow #Job #Career #Work #CBD #Hemp #THC #Weed #MJCC,"['420Jobs', 'Marijuana', 'Jobs', 'Cannabis', 'Careers', 'JobBoard', 'JobHunt', 'JobSearch', 'HiringNow', 'Job', 'Career', 'Work', 'CBD', 'Hemp', 'THC', 'Weed', 'MJCC']","",834078393960321024,Marijuana Jobs Cannabis Careers,420JobsCareers,false,http://pbs.twimg.com/profile_images/1215464057190240256/RJDitKzM_normal.jpg,https://pbs.twimg.com/profile_banners/834078393960321024/1582739587,http://abs.twimg.com/images/themes/theme1/bg.png,259,2,0,0,0,1,2021-11-03T06:45:02.000-07:00
1455788093106266118,1455788093106266118,2021-11-03T06:45:03.000-07:00,https://twitter.com/ContentSourceEU/status/1455788093106266118/photo/1,['http://pbs.twimg.com/media/FDP_jmTXEAomCVt.png'],['photo'],['http://ow.ly/PZ7950Gt5tb'],"FUCHS PETROLUB SE is hiring a Corporate &amp; Group Controller (m/w/d) in Mannheim, Germany https://t.co/hAuhS8ITx1||#controlling #controller #accounting #financejobs #stellenangebot #stellenanzeige https://t.co/frcadKiPhO","['controlling', 'controller', 'accounting', 'financejobs', 'stellenangebot', 'stellenanzeige']","",320653389,Opportunities Europe,ContentSourceEU,false,http://pbs.twimg.com/profile_images/791600871821938688/4gnwPNZF_normal.jpg,https://pbs.twimg.com/profile_banners/320653389/1422287466,http://abs.twimg.com/images/themes/theme5/bg.gif,2421,1256,0,0,0,0,2021-11-03T06:45:03.000-07:00
1455788156637392896,1455788156637392896,2021-11-03T06:45:18.000-07:00,https://twitter.com/polymash/status/1455788156637392896/photo/1,['http://pbs.twimg.com/media/FDP_nSWXIAITd5B.jpg'],['photo'],['https://bit.ly/3BF0jWV'],Stripe Is Hiring a Crypto Team 3 Years After Ending Bitcoin Support https://t.co/mGgB8VqScL There are possibilities and implications for podcasters with membership sites or premium content. https://t.co/NaxQPxrHOa,"","",192941117,Juergen Berkessel,polymash,false,http://pbs.twimg.com/profile_images/1150440574723534853/EfRHkWuB_normal.png,https://pbs.twimg.com/profile_banners/192941117/1611378348,http://abs.twimg.com/images/themes/theme14/bg.gif,12507,10671,0,0,0,0,2021-11-03T06:45:18.000-07:00
1455789011583258626,1455789011583258626,2021-11-03T06:48:42.000-07:00,"","","","","New on Discord: I'm hiring a Community Manager for an NFT Project, purely to focus on Discord and Telegram","","",1432292437280632834,Walzay Crypto,WalzayCrypto,false,http://pbs.twimg.com/profile_images/1432296806541524995/teVtG0x__normal.jpg,https://pbs.twimg.com/profile_banners/1432292437280632834/1630321592,"",55,314,0,0,0,0,2021-11-03T06:48:42.000-07:00
1455789014489780226,1455789014489780226,2021-11-03T06:48:42.000-07:00,"","","",['https://bit.ly/2ZGDDrX'],"We're hiring! Click to apply: Assoc. Distribution Services &amp; Product Supply Rep - https://t.co/AJd1jdS2aQ #Rosemead, CA #SupplyChain","['Rosemead', 'SupplyChain']","",1566388423,Panda Careers,PandaCareers,false,http://pbs.twimg.com/profile_images/920436292952891392/vLKVhQ-w_normal.jpg,https://pbs.twimg.com/profile_banners/1566388423/1451415155,http://abs.twimg.com/images/themes/theme1/bg.png,1018,43,0,0,0,0,2021-11-03T06:48:42.000-07:00
1455789679358320645,1455789679358320645,2021-11-03T06:51:21.000-07:00,"","","","","After a bit more than 6 years, you're a millionaire. Yet I hope we don't think being a doctor is exploitation when you aren't hiring an underling but providing a valued service. It's your labor.","","",1224817156551892992,Shimrra Shai,ShakinShimmy,false,http://pbs.twimg.com/profile_images/1224817982053867520/bQdQ4C0K_normal.png,https://pbs.twimg.com/profile_banners/1224817156551892992/1586481856,"",364,353,0,0,0,0,2021-11-03T06:51:21.000-07:00
1455790124520943617,1455790124520943617,2021-11-03T06:53:07.000-07:00,"","","",['https://ift.tt/2ZR6utW'],Daily uae jobs Updates|Anantara Jobs in Abu Dhabi - Reservations Agent - Area Reservations Office https://t.co/XGxdqR1XYF||#jobsearching #careertips #careeradvice #unemployment #jobs #hiring #ajiranawe #Africa #Scholarships #food #foodie,"['jobsearching', 'careertips', 'careeradvice', 'unemployment', 'jobs', 'hiring', 'ajiranawe', 'Africa', 'Scholarships', 'food', 'foodie']","",1185961975509143552,AjiraNawe Updates,AjiraNawe,false,http://pbs.twimg.com/profile_images/1345291371616337921/h9zsvihi_normal.png,https://pbs.twimg.com/profile_banners/1185961975509143552/1600867963,"",319,27,0,0,0,0,2021-11-03T06:53:07.000-07:00
1455790539442249730,1455790539442249730,2021-11-03T06:54:46.000-07:00,"","","",['https://www.girikon.com/blog/jobopenings/sr-mulesoft-developer-phoenix-az-anywhere-in-usa-girik979/'],"Girikon is looking for Full time “Sr. MuleSoft Developer” ||Location – Phoenix, AZ / Anywhere in USA||Interested candidates can submit their resume at “hrusa@girikon.com”||https://t.co/wONBYc5QF2||#Girikon #hiring ||#mulesoftdeveloper #mulesoftdevelopers","['Girikon', 'hiring', 'mulesoftdeveloper', 'mulesoftdevelopers']","",3012239804,Girikon,GirikonInc,false,http://pbs.twimg.com/profile_images/1369296298210365442/2wPHeJJr_normal.jpg,https://pbs.twimg.com/profile_banners/3012239804/1615300615,http://abs.twimg.com/images/themes/theme1/bg.png,2387,1514,0,0,0,0,2021-11-03T06:54:46.000-07:00
1455790675316805633,1455790675316805633,2021-11-03T06:55:18.000-07:00,https://twitter.com/GlitchProtocol/status/1455790675316805633/photo/1,['http://pbs.twimg.com/media/FDQB50gVcAMSjkp.jpg'],['photo'],"",Calling all Project Managers. We're hiring!||📝 Project Manager (Remote FT/PT)||Join a quickly growing team of 24+ and help us create a rewarding blockchain ecosystem for all.||Interested? Send an email with your resume attached to talent@glitch.finance. #CryptoJobs #Hiring https://t.co/MnZvxkl5U0,"['CryptoJobs', 'Hiring']","",1308249412255145984,Glitch,GlitchProtocol,false,http://pbs.twimg.com/profile_images/1308266399442169856/LbPf9TQ3_normal.jpg,https://pbs.twimg.com/profile_banners/1308249412255145984/1631523691,"",16835,63,0,0,0,0,2021-11-03T06:55:18.000-07:00
1407312230060904456,1455789772694245380,2021-11-03T06:51:43.000-07:00,https://twitter.com/FSG_Map/status/1407312230060904456/photo/1,"['http://pbs.twimg.com/media/E4fG1cjXMAAv-HT.jpg', 'http://pbs.twimg.com/media/E4fG1fmXoAYS4qK.jpg', 'http://pbs.twimg.com/media/E4fG1a5WYAAgLSq.jpg']","['photo', 'photo', 'photo']",['https://forms.gle/Sx4ukyo3QZWCze5z5'],"Guess what! The FSG Team is hiring: We are looking for new Addons Developers, Mappers, and 3D Artists. If you're willing to help the team, head over to: https://t.co/MkL4YTkepb and fill out the form. Good luck everybody! 😉 https://t.co/A4MTUbfi3S","","",1253669062237773826,FSG Map,FSG_Map,false,http://pbs.twimg.com/profile_images/1253669130072461313/e-o32lOa_normal.jpg,https://pbs.twimg.com/profile_banners/1253669062237773826/1587733535,"",148,8,8,0,0,2,2021-06-22T12:19:16.000-07:00
1421229657731395584,1455761957856940039,2021-11-03T05:01:12.000-07:00,"","","",['http://angellist.com/careers/engineering'],"What's it like to be an engineer at AngelList? Hear from Vanessa, Xinran, Thibaut, and Matt.||We’re hiring engineers who want to do the work that founders do. Join us https://t.co/8eTnREvMhm","","",94682674,AngelList,AngelList,true,http://pbs.twimg.com/profile_images/1401975199281520656/OseQ_Vz6_normal.jpg,https://pbs.twimg.com/profile_banners/94682674/1498801622,http://abs.twimg.com/images/themes/theme1/bg.png,387329,54,87,5,18,7,2021-07-30T22:02:10.000-07:00
1451918499941478409,1455783596023705601,2021-11-03T06:27:11.000-07:00,https://twitter.com/CharismaBIph/status/1451918499941478409,['http://pbs.twimg.com/media/FCY_FciVIAgQbuf.jpg'],['photo'],['https://khb2.carrd.co/#vt-recruitment'],🆔NOTICE: VOTING TEAM RECRUITMENT||We are now opening the recruitment to all IDs who want to be part of our Voting Team. Please do join the team and support all voting activities for B.I and 'Cosmos'.||Apply here: https://t.co/MHCpz3Vkk4||#HANBIN #비아이 @shxx131bi131 https://t.co/XXivqNMmSd,"['HANBIN', '비아이']",['shxx131bi131'],2194100815,🆔️CHARISMA B.I PHILIPPINES,CharismaBIph,false,http://pbs.twimg.com/profile_images/1452305045731614735/JPEu7wFQ_normal.jpg,https://pbs.twimg.com/profile_banners/2194100815/1635091479,http://abs.twimg.com/images/themes/theme1/bg.png,6429,109,145,4,2,89,2021-10-23T14:28:40.000-07:00
1453304809650630657,1455784580019998721,2021-11-03T06:31:05.000-07:00,https://twitter.com/TechBitsDigital/status/1453304809650630657/photo/1,['http://pbs.twimg.com/media/FCss9nFX0Aohhdd.jpg'],['photo'],['https://technobitsdigital.com/career'],"We are Hiring for multiple positions.|Apply on: https://t.co/S5toMclefC||Grab the opportunity by attending the Walk-In-Interview, as the address mentioned in Image.||#vadodara #internship #jobalert #opportunity #contentwriter #developers #graphicdesigner #videoeditor #career https://t.co/FZ8F1jGQnm","['vadodara', 'internship', 'jobalert', 'opportunity', 'contentwriter', 'developers', 'graphicdesigner', 'videoeditor', 'career']","",912655522062524416,Evol TechnoBits Digital Pvt. Ltd.,TechBitsDigital,false,http://pbs.twimg.com/profile_images/912657535785615361/SaszyUvT_normal.jpg,https://pbs.twimg.com/profile_banners/912655522062524416/1613217598,"",1347,274,50,0,0,26,2021-10-27T10:17:22.000-07:00
1454254229707755529,1455769152346419211,2021-11-03T05:29:47.000-07:00,"","","","",@AlaskaAir is planning on aggressive #pilot hiring in the midst of one of the most competitive pilot markets in decades. Our pilot #union is concerned the company cannot meet its goals with the current pilot contract. #DoTheRightThing #ValueAlaskaPilots #iFlyAlaska,"['pilot', 'union', 'DoTheRightThing', 'ValueAlaskaPilots', 'iFlyAlaska']",['AlaskaAir'],1887660200,Alaska Airlines Pilots,AlaskaPilots,true,http://pbs.twimg.com/profile_images/1438578092587438085/RTreeU_z_normal.jpg,https://pbs.twimg.com/profile_banners/1887660200/1634566675,http://abs.twimg.com/images/themes/theme1/bg.png,2084,324,25,0,6,6,2021-10-30T01:10:01.000-07:00
1455205181046460420,1455790541824614407,2021-11-03T06:54:47.000-07:00,https://twitter.com/andreajanereid/status/1455205181046460420/photo/1,['http://pbs.twimg.com/media/FDHryhhVQAklZZP.jpg'],['photo'],['https://ubc.wd10.myworkdayjobs.com/ubcstaffjobs/job/UBC-Vancouver-Campus/Administrative-Coordinator--Centre-for-Indigenous-Fisheries_JR4819'],"Please RT to spread the word that we're HIRING an admin coordinator to help GROW our Centre for Indigenous Fisheries in the right way 🐟 This person will help build our Indigenous Advisory Council, Annual Partners' Gathering, Artist-in-Residency &amp; more! https://t.co/dtgZyDV08l https://t.co/1etciwGamg","","",928625976866570241,Andrea Reid,andreajanereid,false,http://pbs.twimg.com/profile_images/1354462034943897606/Z5JAkq-Y_normal.jpg,https://pbs.twimg.com/profile_banners/928625976866570241/1589229402,http://abs.twimg.com/images/themes/theme1/bg.png,3447,1197,247,2,2,264,2021-11-01T16:08:46.000-07:00
1455213030837424130,1455785008367472644,2021-11-03T06:32:47.000-07:00,"","","",['https://andrewchen.com/hiring-head-of-growth/'],"👇 New essay:|What to look for when you’re hiring a Head of Growth||tldr;|- it depends :)|- pre-scale, you want hustle/generalist skillset|- eventually, specific growth expertise (but less people management)|- then a team builder who can build a strategy||https://t.co/mSDrctPgnJ","","",3283901,Andrew Chen 🇺🇸,andrewchen,false,http://pbs.twimg.com/profile_images/1395588769370103808/4pr-KrfY_normal.jpg,https://pbs.twimg.com/profile_banners/3283901/1614820854,http://abs.twimg.com/images/themes/theme9/bg.gif,227966,10244,308,14,11,37,2021-11-01T16:39:57.000-07:00
1455372733773058062,1455789964151562246,2021-11-03T06:52:29.000-07:00,https://twitter.com/ANGRYSISIWNIKEN/status/1455372733773058062/photo/1,['http://pbs.twimg.com/media/FDKFyb2XsAMc_ES.jpg'],['photo'],"","Because of your overwhelming support, we are now opening for GDM 5. This will be the LAST RECRUITMENT for this year. If you're interested kindly dm us and be part of our growing family! 😌🤘||@SB19Official #SB19|@keun16308352 https://t.co/I3lWRJVDY5",['SB19'],"['SB19Official', 'keun16308352']",1317985267475574785,ANGRY SISIW Official,ANGRYSISIWNIKEN,false,http://pbs.twimg.com/profile_images/1438841030372061190/DDDzhfY0_normal.jpg,https://pbs.twimg.com/profile_banners/1317985267475574785/1635770562,"",1200,44,193,15,6,95,2021-11-02T03:14:33.000-07:00
1455445743087411202,1455760880512094211,2021-11-03T04:56:55.000-07:00,https://twitter.com/BABLEINDIA/status/1455445743087411202/photo/1,['http://pbs.twimg.com/media/FDLIClmVQAUEQpa.jpg'],['photo'],"",We Are Hiring!|Apply Today! https://t.co/TXEYeEEINX,"","",3193591216,B-ABLE (दक्ष भवः),BABLEINDIA,false,http://pbs.twimg.com/profile_images/839035731502895105/sh6fCDyD_normal.jpg,https://pbs.twimg.com/profile_banners/3193591216/1488877367,http://abs.twimg.com/images/themes/theme1/bg.png,2874,204,10,0,0,1,2021-11-02T08:04:40.000-07:00
1455476509150482433,1455777019740971009,2021-11-03T06:01:03.000-07:00,https://twitter.com/mazzonna81/status/1455476509150482433,['http://pbs.twimg.com/media/FDLkJQZXoAQFPYK.jpg'],['photo'],['https://econjobmarket.org/positions/7935'],"Please RT: Join us at  @USI_en |We're #hiring a (tenured or tenure-track assistant) Professor in Applied Economics. DM/mail me, if you have questions. Please apply here:|https://t.co/Cirwo8m5dJ|#EconTwitter https://t.co/ELKvcXSJ7R","['hiring', 'EconTwitter']",['USI_en'],320233314,Fabrizio Mazzonna,mazzonna81,false,http://pbs.twimg.com/profile_images/1246144278453276672/8_7RhJWw_normal.jpg,https://pbs.twimg.com/profile_banners/320233314/1540836224,http://abs.twimg.com/images/themes/theme1/bg.png,476,504,43,3,1,33,2021-11-02T10:06:55.000-07:00
1455490160376827909,1455779785309925378,2021-11-03T06:12:02.000-07:00,https://twitter.com/SGAC/status/1455490160376827909,['http://pbs.twimg.com/media/FDLwlmvXoAIyUKA.jpg'],['photo'],['http://ow.ly/7Vqs50GCC6t'],Join SGAC and @Space_Leaders for SGx2022 at the #SATELLITE2022 conference! We're hiring for:|- Communications &amp; Publications Team |- Programs Team|All team members will receive complimentary registration to SGx 2022 and to SATELLITE 2022|https://t.co/ISxsC5iFEd https://t.co/GgR3zTy31L,['SATELLITE2022'],['Space_Leaders'],11228702,SGAC,SGAC,false,http://pbs.twimg.com/profile_images/1746180685/logo_sgac_normal.jpg,https://pbs.twimg.com/profile_banners/11228702/1587141907,http://abs.twimg.com/images/themes/theme1/bg.png,16023,1327,19,3,0,7,2021-11-02T11:01:10.000-07:00
1455498316125442051,1455777085318852614,2021-11-03T06:01:18.000-07:00,"","","",['https://bit.ly/3pZqSnt'],JOURNALISM JOB ALERT @FT is hiring a China business &amp; finance reporter in Hong Kong. Great job in a fabulous city. Details here: https://t.co/bluydG7mw6||Contact @RobinBHarding for more details.,"","['FT', 'RobinBHarding']",59936143,Demetri Sevastopulo,Dimi,true,http://pbs.twimg.com/profile_images/1223987571962843137/RkT5osr7_normal.jpg,https://pbs.twimg.com/profile_banners/59936143/1581317107,http://abs.twimg.com/images/themes/theme1/bg.png,53545,16847,9,3,2,14,2021-11-02T11:33:35.000-07:00
1455515773275820037,1455790697760505859,2021-11-03T06:55:24.000-07:00,"","","",['https://jankibaat.com/2021/11/01/we-are-hiring-jan-ki-baat-is-hiring-for-elections-2022/'],"WE ARE HIRING FOR|1. FIELD INVESTIGATORS|2. POLITICAL ANALYSTS |3. DATA RESEARCHERS|4. ENGLISH CONTENT WRITERS.( BASED IN DELHI)|LOCATION: UP, PUNJAB, GOA, UTTARAKHAND, MANIPUR.|APPLY ON jankibaat2@gmail.com|LAST DATE : NOV 5|@pradip103|#Elections2022|https://t.co/YOz99zyI61",['Elections2022'],['pradip103'],4456498874,Jan Ki Baat,jankibaat1,true,http://pbs.twimg.com/profile_images/809693720954052608/jgL1lm2__normal.jpg,https://pbs.twimg.com/profile_banners/4456498874/1620294383,http://abs.twimg.com/images/themes/theme1/bg.png,78075,259,120,1,5,32,2021-11-02T12:42:57.000-07:00
1455520266788999175,1455776688470638592,2021-11-03T05:59:44.000-07:00,https://twitter.com/NextLevel_NW/status/1455520266788999175/photo/1,['http://pbs.twimg.com/media/FDML-ByWUAYa01K.jpg'],['photo'],['http://www.elkgrove.org/jobfair'],"Now Hiring! Enjoy a free lunch at our job fair on November 5th at the Elk Grove Park District Pavilion, 11 am - 3:00 pm, and learn why @EGVBusinessPark is known as a great place to live, work, and play. ||Meet employers. Schedule interviews. Get hired. https://t.co/goGXoiKhr9 https://t.co/kbCnq5EbBD","",['EGVBusinessPark'],1207325643341488128,NextLevelNorthwest,NextLevel_NW,false,http://pbs.twimg.com/profile_images/1207325835058921472/5gE0uivf_normal.png,https://pbs.twimg.com/profile_banners/1207325643341488128/1578339884,"",16,162,3,0,0,2,2021-11-02T13:00:48.000-07:00
1455530739429171213,1455790532748185607,2021-11-03T06:54:44.000-07:00,"","","",['https://bit.ly/KILTcareers'],".@Kiltprotocol is hiring dev &amp; community roles!||As a protocol focused on identity and privacy, our mission is universal and applies to web users everywhere. We encourage people from all identities and walks of life to apply and join our team: |https://t.co/H2zNvzI2IC","",['Kiltprotocol'],189263900,Christine Mohan,christinemohan,false,http://pbs.twimg.com/profile_images/1417939026665934849/k_hNg6TL_normal.jpg,https://pbs.twimg.com/profile_banners/189263900/1624200167,http://abs.twimg.com/images/themes/theme1/bg.png,4150,5001,165,5,3,59,2021-11-02T13:42:25.000-07:00
1455537383613599746,1455789178705219584,2021-11-03T06:49:22.000-07:00,"","","",['https://www.economist.com/china/2021/11/02/wanted-a-new-china-writer'],We are hiring a China correspondent. Come join us!  https://t.co/jT7n9Qg68G,"","",24674124,Gady Epstein,gadyepstein,true,http://pbs.twimg.com/profile_images/1360060892201836544/_r42BF8Z_normal.jpg,https://pbs.twimg.com/profile_banners/24674124/1427188919,http://abs.twimg.com/images/themes/theme1/bg.png,68040,3971,103,6,12,66,2021-11-02T14:08:49.000-07:00
1455540122829602821,1455775902072287232,2021-11-03T05:56:36.000-07:00,"","","",['https://bit.ly/2Y8Vfwh'],#FixTheCountryNow|#FixTheCountry|#DearGhana||Nestle is #hiring! SOCIAL MEDIA LISTENING ANALYST #jobtube #ghana #vacancy #jobseekers #jobsearch||👉https://t.co/FV865Ankhn||(✔Please exercise due diligence in your job hunt and always treat your personal safety as a top priority),"['FixTheCountryNow', 'FixTheCountry', 'DearGhana', 'hiring', 'jobtube', 'ghana', 'vacancy', 'jobseekers', 'jobsearch']","",235647698,JobTube Ghana || Your #1 Job Hunting Partner,espioj,false,http://pbs.twimg.com/profile_images/1434908623453495297/mS6DuqiH_normal.jpg,https://pbs.twimg.com/profile_banners/235647698/1630943789,http://abs.twimg.com/images/themes/theme1/bg.png,8890,181,2,0,0,4,2021-11-02T14:19:42.000-07:00
1455559448890523655,1455761178492235779,2021-11-03T04:58:06.000-07:00,https://twitter.com/getme_hired/status/1455559448890523655/photo/1,['http://pbs.twimg.com/media/FDMvmw7VQAIXKKJ.jpg'],['photo'],['https://www.jobstreet.com.my/en/job/4706783'],"❕Honda is HIRING❕||📌 Executive, Strategic Planning (Sales)||👨🏻‍🎓 Fresh Graduates are encouraged to apply ||✅ Apply now at:|https://t.co/BKWSksDwGx https://t.co/S1o3csfiXL","","",1104400659959275520,GetMe Hired 🚀,getme_hired,false,http://pbs.twimg.com/profile_images/1423259445321109510/3693Xx6k_normal.jpg,https://pbs.twimg.com/profile_banners/1104400659959275520/1635914510,"",15058,89,6,0,0,6,2021-11-02T15:36:30.000-07:00
1455560044049731587,1455782434243588099,2021-11-03T06:22:34.000-07:00,"","","",['https://www.uu.nl/organisatie/werken-bij-de-universiteit-utrecht/vacatures/assistant-professor-in-early-modern-cultural-history-of-knowledge-10-fte'],Job Klaxon! Our Cultural History section is hiring an Assistant Professor in Early Modern Cultural History. Come and work with us @HumanitiesUU and become part of the largest cultural history group in Europe. @CulturalHistUU @_KNHG |https://t.co/PZnfu4eRoR,"","['HumanitiesUU', 'CulturalHistUU', '_KNHG']",570806578,Gertjan Plets,GertjanPlets,false,http://pbs.twimg.com/profile_images/2340493645/8p211k0q71xhtf25ui0g_normal.jpeg,"",http://abs.twimg.com/images/themes/theme1/bg.png,205,123,5,1,0,5,2021-11-02T15:38:52.000-07:00
1455565385399406595,1455763633288499202,2021-11-03T05:07:51.000-07:00,https://twitter.com/JoinTheForce/status/1455565385399406595/photo/1,['http://pbs.twimg.com/media/FDM1ADeXIAo1eLk.jpg'],['photo'],['http://di.sn/6013JnnWR'],Lucasfilm is #hiring for a Diversity &amp; Inclusion Coordinator! Interested? Apply now and #JointheForce: 🔗 https://t.co/4TErIaJVM5 https://t.co/tEA5GA0Yol,"['hiring', 'JointheForce']","",3223742785,Lucasfilm Recruiting,JoinTheForce,true,http://pbs.twimg.com/profile_images/1145741517786513408/-R6mWkh6_normal.jpg,https://pbs.twimg.com/profile_banners/3223742785/1432337914,http://abs.twimg.com/images/themes/theme14/bg.gif,22729,43,93,10,11,39,2021-11-02T16:00:05.000-07:00
1455585749609365505,1455761177464610822,2021-11-03T04:58:06.000-07:00,"","","","","sc dev: 'do you know if any projects are hiring?'||me: 'dude, I don't know of any projects NOT hiring'","","",789299,mariano.eth ✨ᕙ༼💦༽ᕗ✨ | 🦇🔊,nanexcool,false,http://pbs.twimg.com/profile_images/1454201378096570369/oM0W-lCU_normal.jpg,https://pbs.twimg.com/profile_banners/789299/1633315128,http://abs.twimg.com/images/themes/theme14/bg.gif,42743,1103,137,2,9,8,2021-11-02T17:21:00.000-07:00
1455600185808130062,1455786495764226053,2021-11-03T06:38:42.000-07:00,https://twitter.com/laraj66/status/1455600185808130062/photo/1,"['http://pbs.twimg.com/media/FDNUDRyWYAgWmya.jpg', 'http://pbs.twimg.com/media/FDNUJU9XoAQST0d.jpg']","['photo', 'photo']","","My lab is hiring 2 techs for our Cerulean Warbler research in southern Indiana! Duties include nest searching, point counts, and banding. Perks include getting to work with a state-endangered species and experiencing a huge diversity of migrating warblers. Link below -&gt; https://t.co/oBO0nfovZ7","","",552295125,Lara,laraj66,false,http://pbs.twimg.com/profile_images/1209137565808431104/c3Ze52DU_normal.jpg,https://pbs.twimg.com/profile_banners/552295125/1588887852,http://abs.twimg.com/images/themes/theme6/bg.gif,1595,382,289,3,3,73,2021-11-02T18:18:22.000-07:00
1455626136831070216,1455768249732317189,2021-11-03T05:26:12.000-07:00,"","","",['http://ow.ly/ln1C50GBsJh'],"Join our team! We are hiring a Director of Policy, who will be responsible for strategic leadership and management of a high-performing policy directorate. Learn more here: |https://t.co/EZi7kr0FHU","","",361352431,IPC Ontario | CIPVP Ontario,IPCinfoprivacy,false,http://pbs.twimg.com/profile_images/883480112242585600/Ix37i41a_normal.jpg,https://pbs.twimg.com/profile_banners/361352431/1499473022,http://abs.twimg.com/images/themes/theme1/bg.png,4548,1112,3,1,0,4,2021-11-02T20:01:29.000-07:00
1455665323529617409,1455771167814406145,2021-11-03T05:37:47.000-07:00,"","","",['https://rb.gy/nzlqqu'],Who are the best operators you know? I want to meet them! We are hiring a Biz Ops Lead at @farm_raise to  transform farming and scale regenerative agriculture through fintech. Whom should we recruit?|https://t.co/uJTMZuNVnC||#fintech #farmtech #hiring #startup,"['fintech', 'farmtech', 'hiring', 'startup']",['farm_raise'],316524006,Jayce Hafner,JayceHafner,false,http://pbs.twimg.com/profile_images/1325323511754182657/a38KfAJ5_normal.jpg,https://pbs.twimg.com/profile_banners/316524006/1606153266,http://abs.twimg.com/images/themes/theme17/bg.gif,395,309,5,1,0,4,2021-11-02T22:37:12.000-07:00
