org_id,samp_id,samp_datetime,org_url,org_media_url,org_media_type,org_attached_links,org_text,org_hashtags,org_user_metions,user_id,user_name,user_screen_name,user_verified,user_profile_image_url,user_profile_banner_url,user_profile_background_image_url,user_followers_count,user_friends_count,org_favorite_count,org_quote_count,org_reply_count,org_retweet_count,org_datetime
1117143215185039361,1452183097965953024,2021-10-24T08:00:05.000-07:00,https://twitter.com/goddessisabel11/status/1117143215185039361/photo/1,['http://pbs.twimg.com/media/D4Dj1HiXoAAPMEH.jpg'],['photo'],"",Your wife realised you were running a little low on cash and decided to get a second job😈||What a coincidence at the exact same time I was hiring a PA😂||Now your wife works for me on minimum wage doing whatever I dictate👏🏽||Just so that you can send me back the money👸🏽|#Findom https://t.co/bl1e8WYHGG,['Findom'],"",901605065802297344,𝑮𝑶𝑫𝑫𝑬𝑺𝑺 𝑰𝑺𝑨𝑩𝑬𝑳,goddessisabel11,false,http://pbs.twimg.com/profile_images/1424843038795382784/ANPQYXY0_normal.jpg,https://pbs.twimg.com/profile_banners/901605065802297344/1619713479,"",13420,1832,44,0,2,19,2019-04-13T19:11:12.000-07:00
1376901399867441156,1452183309761515523,2021-10-24T08:00:55.000-07:00,"","","","","Please consider moving to Starbase or greater Brownsville/South Padre area in Texas &amp; encourage friends to do so! ||SpaceX’s hiring needs for engineers, technicians, builders &amp; essential support personnel of all kinds are growing rapidly.","","",44196397,Elon Musk,elonmusk,true,http://pbs.twimg.com/profile_images/1442634650703237120/mXIcYtIs_normal.jpg,https://pbs.twimg.com/profile_banners/44196397/1576183471,http://abs.twimg.com/images/themes/theme1/bg.png,61269986,106,173393,4205,14700,17055,2021-03-30T14:17:29.000-07:00
1389645389637238796,1452172254813380611,2021-10-24T07:17:00.000-07:00,"","","","","#2. Don't Hire the First Advisor You Meet. Working with a financial advisor is a crucial component of any retirement plan, so most people follow these 7 secrets when hiring one.","","",353838102,SmartAsset,smartasset,true,http://pbs.twimg.com/profile_images/1101592165807984640/YBF7NqKq_normal.png,https://pbs.twimg.com/profile_banners/353838102/1551717383,http://abs.twimg.com/images/themes/theme14/bg.gif,34217,1404,9633,214,1234,1829,2021-05-04T18:17:33.000-07:00
1442428811669352448,1452181817419698181,2021-10-24T07:55:00.000-07:00,https://twitter.com/BoBoiBoy/status/1442428811669352448/photo/1,['http://pbs.twimg.com/media/FAQbS4aVIAUW3XQ.jpg'],['photo'],"",LIGHTING &amp; RENDER ARTIST NEEDED💡‼️ ||Apply NOW👇 |career@animonsta(dot)com||#BoBoiBoy #Mechamato #Monsta #recruitment #kerjakosong https://t.co/0j2eEUu3K0,"['BoBoiBoy', 'Mechamato', 'Monsta', 'recruitment', 'kerjakosong']","",81798113,BoBoiBoy,BoBoiBoy,true,http://pbs.twimg.com/profile_images/1451369721379491840/1UcxTFQs_normal.jpg,https://pbs.twimg.com/profile_banners/81798113/1634868833,http://abs.twimg.com/images/themes/theme9/bg.gif,57381,8,232,2,3,68,2021-09-27T10:00:02.000-07:00
1447955291820240904,1452190990228459529,2021-10-24T08:31:27.000-07:00,https://twitter.com/stancity44/status/1447955291820240904/photo/1,['http://pbs.twimg.com/media/FBgrqNZXoAU7Y_8.jpg'],['photo'],"",Biafrans don't let anyone Decieved you there's nothing like Biafra army  or recruitment of Biafra army by IPOB||Bear in hrt dat Nigeria DSS agents are lokng for a way to get hold of sme of Biafrans youths ||Stay awy frm anybody telling U he is recruiting men for Biafra Army . https://t.co/KE6iBsUlhD,"","",1248946823701639168,STANCITY🌎WORLD#MNK™©Media 📝,stancity44,false,http://pbs.twimg.com/profile_images/1338007695463501824/ooH6Nbni_normal.jpg,https://pbs.twimg.com/profile_banners/1248946823701639168/1593512874,"",4413,465,60,5,3,116,2021-10-12T16:00:17.000-07:00
1448717435696189446,1452196876464398344,2021-10-24T08:54:50.000-07:00,https://twitter.com/Salem4Congress/status/1448717435696189446/photo/1,['http://pbs.twimg.com/media/FBrg1EOWUAMRbrV.jpg'],['photo'],"",Kellogg’s is openly “pre-hiring for strike replacement workers” who will “cross the picket line”.||Don’t cross the picket line. Protect the unions. Protect the workers. https://t.co/oEXyIN8R2F,"","",1200665885482127360,Salem Snow,Salem4Congress,true,http://pbs.twimg.com/profile_images/1428123128140636164/uMTJuvr3_normal.jpg,https://pbs.twimg.com/profile_banners/1200665885482127360/1620136370,"",9203,7184,106469,1826,776,31529,2021-10-14T18:28:47.000-07:00
1450117613560860679,1452194216046641154,2021-10-24T08:44:16.000-07:00,"","","",['https://careers.hrm.northeastern.edu/en-us/job/507969/assistant-professor'],Northeastern University is hiring Assistant Professors as part of their INVEST search! Applicants are welcome in all College of Science departments (including psych).||https://t.co/E77xVETxFR,"","",540928787,Ajay Satpute,AjayBSatpute,false,http://pbs.twimg.com/profile_images/1236141771228409856/SRsIMvwS_normal.jpg,https://pbs.twimg.com/profile_banners/540928787/1583554140,http://abs.twimg.com/images/themes/theme1/bg.png,1005,822,40,1,1,26,2021-10-18T15:12:35.000-07:00
1450754679185498114,1452192440853704704,2021-10-24T08:37:12.000-07:00,https://twitter.com/healthhistories/status/1450754679185498114,"","",['https://www.jobs.ac.uk/job/CJZ128/research-fellow'],"We're hiring 📢 a 3.5-year #postdoc, working with @DrAnneHanley in @UoB_IAHR on #oralhistory and #publicengagement for our #UKRIFLF #sexualhealth project. Open to applicants from any field in health, the humanities or social sciences. #histSTM #postdocjobs|https://t.co/Rii2zyFTbE","['postdoc', 'oralhistory', 'publicengagement', 'UKRIFLF', 'sexualhealth', 'histSTM', 'postdocjobs']","['DrAnneHanley', 'UoB_IAHR']",1393210491720327173,Sexual Health in Britain,HealthHistories,false,http://pbs.twimg.com/profile_images/1425582602619170824/Cvv72QOl_normal.jpg,https://pbs.twimg.com/profile_banners/1393210491720327173/1631110045,"",96,109,40,1,2,41,2021-10-20T09:24:03.000-07:00
1450827026085003271,1452175346577534981,2021-10-24T07:29:17.000-07:00,"","","","","We are HIRING! a postdoc to study climate-mitigation potential via enhancing soil carbon in ag lands. PD will develop original research &amp; contribute to a major, DOE-commissioned report outlining pathways to carbon neutrality across the USA. Contact me or @ESlessarev Please RT!","",['ESlessarev'],1648459686,Dr. Jennifer Pett-Ridge,Jeffinerca,false,http://pbs.twimg.com/profile_images/668431047919403009/5GrbAvzZ_normal.jpg,https://pbs.twimg.com/profile_banners/1648459686/1589236989,http://abs.twimg.com/images/themes/theme1/bg.png,3373,1441,218,3,4,202,2021-10-20T14:11:32.000-07:00
1450837810886422529,1452184328612499464,2021-10-24T08:04:58.000-07:00,https://twitter.com/A_W_M_B/status/1450837810886422529,['http://pbs.twimg.com/media/FCJpTAeXIAIkQ6v.jpg'],['photo'],"",We are hiring! ||Looking for a freelance kick ass project manager! ||Details 👇🏽👇🏽👇🏽👇🏽 https://t.co/H5Zinf3B5V,"","",2471497028,AsianWomenMeanBusiness,A_W_M_B,false,http://pbs.twimg.com/profile_images/1450191655949176836/jwyI3_7T_normal.jpg,https://pbs.twimg.com/profile_banners/2471497028/1634587877,http://abs.twimg.com/images/themes/theme1/bg.png,4544,1063,13,1,2,8,2021-10-20T14:54:24.000-07:00
1450849854071132168,1452191618048614401,2021-10-24T08:33:56.000-07:00,"","","",['https://www.realclearinvestigations.com/articles/2021/10/19/coming_into_focus_hillarys_secretive_russiagate-flogging_pair_of_super-lawyers_799168.html'],"Now the Clinton lawyer who hired CrowdStrike, Michael Sussmann, is accused of lying to FBI while pushing a fake Trump-Russia tie. ||My story reveals Sussmann's key role not only in hiring CrowdStrike, but promoting &amp; overseeing its Russian hacking claims. https://t.co/B08qj5Em8X","","",153517357,Aaron Maté,aaronjmate,true,http://pbs.twimg.com/profile_images/1291905873938448384/gnjEYxct_normal.jpg,https://pbs.twimg.com/profile_banners/153517357/1623177765,http://abs.twimg.com/images/themes/theme1/bg.png,165791,2770,179,1,6,70,2021-10-20T15:42:15.000-07:00
1451235704567058434,1452179235200774144,2021-10-24T07:44:44.000-07:00,"","","",['https://www.csustan.edu/biology'],"My department (Biology at Cal State Stanislaus) is hiring four TT assistant professors in Vert Zool, Evolution, Microbial Genomics, and Genetics! Please share! |https://t.co/B5Do3E6wGc |Plus, why I appreciate (not love) my job, a thread","","",2895209718,Matt Cover,matthewrcover,false,http://pbs.twimg.com/profile_images/1296130793736036352/_BkLZ8ag_normal.jpg,https://pbs.twimg.com/profile_banners/2895209718/1585342645,http://abs.twimg.com/images/themes/theme1/bg.png,2508,2418,115,3,2,134,2021-10-21T17:15:29.000-07:00
1451540860072509449,1452195441177767937,2021-10-24T08:49:08.000-07:00,"","","",['https://novaramedia.com/about/jobs/'],". ⁦@novaramedia⁩ are presently hiring FIVE new staff members, as well as looking for freelancers. ||Help us continue to rapidly grow in 2022, and create a media for a different politics!  https://t.co/byVl91ip2Z","",['novaramedia'],63082578,Aaron Bastani,AaronBastani,false,http://pbs.twimg.com/profile_images/1238129881269051393/5Wu3KtXX_normal.jpg,https://pbs.twimg.com/profile_banners/63082578/1631221570,http://abs.twimg.com/images/themes/theme1/bg.png,94682,1647,523,8,36,147,2021-10-22T13:28:04.000-07:00
1451556216140873751,1452190413578805250,2021-10-24T08:29:09.000-07:00,https://twitter.com/irishmigrants/status/1451556216140873751/photo/1,['http://pbs.twimg.com/media/FCTxaWCWQBsf72v.jpg'],['photo'],['https://buff.ly/3jrHgsF'],We're hiring! Are you interested in helping people make informed decisions &amp; get access to supports for their needs? We've an opportunity to join our team as Information &amp; Advocacy Officer to support people emigrating from or returning to Ireland. |https://t.co/UNgOvcM4Qi https://t.co/z0oEW7tldV,"","",164239478,Crosscare Migrant Project,irishmigrants,false,http://pbs.twimg.com/profile_images/568753717730504704/hgBBbqq-_normal.png,https://pbs.twimg.com/profile_banners/164239478/1571086775,http://abs.twimg.com/images/themes/theme1/bg.png,3116,2377,10,3,0,4,2021-10-22T14:29:05.000-07:00
1451565118957895684,1452166216844410888,2021-10-24T06:53:00.000-07:00,https://twitter.com/horisummerjoy/status/1451565118957895684,"","","",She send me a voice note telling me that we might get a chance for this job as they are currently hiring a few part-timers for a huge event starting next week. I'm just here waiting for a confirmation call or text from the workplace. 🤞🏻,"","",1238137151407017987,𝐄𝐫𝐮🦙,horisummerjoy,false,http://pbs.twimg.com/profile_images/1450780818419249156/FxsF20KO_normal.jpg,https://pbs.twimg.com/profile_banners/1238137151407017987/1633978968,"",290,299,1,0,1,0,2021-10-22T15:04:27.000-07:00
1451579583887814657,1452177323919347718,2021-10-24T07:37:08.000-07:00,https://twitter.com/OHAIRElab/status/1451579583887814657/photo/1,['http://pbs.twimg.com/media/FCUL1H-XoBMqe35.jpg'],['photo'],['https://vet.purdue.edu/chab/ohaire/opportunities.php'],"The OHAIRE Lab is hiring! Positions include:|- Research and Operations Manager|- Lab Manager|- Research Assistant |- Postdoctoral Research Fellow||To learn more about each position and how to apply, visit:|https://t.co/BFvJn8Hgy0||#humananimalinteraction #HAI #hiring #jobs https://t.co/0mNMcBk4dp","['humananimalinteraction', 'HAI', 'hiring', 'jobs']","",833075298312806401,ohairelab,OHAIRElab,false,http://pbs.twimg.com/profile_images/1333530578717716481/X8n2hWSN_normal.jpg,https://pbs.twimg.com/profile_banners/833075298312806401/1606773441,"",1194,477,14,0,1,16,2021-10-22T16:01:56.000-07:00
1451592118993133591,1452185565957345282,2021-10-24T08:09:53.000-07:00,https://twitter.com/rickstercdn/status/1451592118993133591,['http://pbs.twimg.com/media/FCUXMb3XoBcSmNh.jpg'],['photo'],['https://careers.microsoft.com/us/en/job/1189721/Senior-Cloud-Advocate'],I am hiring the next Operations / IT Pro focused Cloud Advocate to join my team. Are you passionate about solving problems with technology solutions? Like to create content that helps people with modern hybrid environments? ||#GlobalRemoteRole #azOps ||https://t.co/PuPZiXdMAV https://t.co/yxOznmLFSo,"['GlobalRemoteRole', 'azOps']","",3352471,Rick Claus makin' the most of 2021,RicksterCDN,false,http://pbs.twimg.com/profile_images/1397399241425702915/4AeJfRA9_normal.jpg,https://pbs.twimg.com/profile_banners/3352471/1596822443,http://abs.twimg.com/images/themes/theme1/bg.png,11608,679,161,16,9,65,2021-10-22T16:51:45.000-07:00
1451765487885590532,1452177439879217155,2021-10-24T07:37:36.000-07:00,https://twitter.com/BryanDawsonUSA/status/1451765487885590532/photo/1,['http://pbs.twimg.com/media/FCW1BF1XEAIJKC1.jpg'],['photo'],"","Tax cuts for those that have everything do NOTHING to grow economy. Corporations aren’t magical job creators. ONLY DEMAND creates jobs. Cut taxes on working families to circulate dollars, spur demand, force hiring &amp; wage growth. Rich get richer anyway||#TrickleUp #BuildBackBetter https://t.co/MKWUFNNZ3a","['TrickleUp', 'BuildBackBetter']","",997682274,Bryan Dawson,BryanDawsonUSA,false,http://pbs.twimg.com/profile_images/1254478555339243520/PAfPDft7_normal.jpg,https://pbs.twimg.com/profile_banners/997682274/1442695988,http://abs.twimg.com/images/themes/theme1/bg.png,95221,54378,311,8,7,122,2021-10-23T04:20:39.000-07:00
1451879245018324996,1452188569536241664,2021-10-24T08:21:49.000-07:00,https://twitter.com/PiyushGoyal/status/1451879245018324996/photo/1,['http://pbs.twimg.com/media/FCYcePUVQAkw56t.jpg'],['photo'],"",Indian Job Market Turns Bullish! 📈||Labour Participation Rate jumps to ~41% in Sep'21 ― highest in the past 12 months.||The PLI scheme &amp; business friendly policies launched by the Govt. is encouraging growth in hiring activity with a boom in demand &amp; market confidence. https://t.co/obuaBClzuQ,"","",1324334436,Piyush Goyal,PiyushGoyal,true,http://pbs.twimg.com/profile_images/1409373770716905477/DmfWfsij_normal.jpg,https://pbs.twimg.com/profile_banners/1324334436/1634811690,http://abs.twimg.com/images/themes/theme14/bg.gif,10449027,547,919,7,27,193,2021-10-23T11:52:41.000-07:00
1451892202620215302,1452178248146751493,2021-10-24T07:40:49.000-07:00,"","","",['https://www.ssrn.com/index.cfm/en/janda/job/?id=9554'],"We are HIRING at all levels (Assistant, Associate, and Full Professor) in the Finance department at @HandelshoyskBI. Join me and my great colleagues in the beautiful and intellectually vibrant Oslo. ||https://t.co/iBWZshhXgR","",['HandelshoyskBI'],111648595,Federico Gavazzoni,fgavazzoni,false,http://pbs.twimg.com/profile_images/3644343934/f1db63779b2f36067e236151cefc907e_normal.jpeg,https://pbs.twimg.com/profile_banners/111648595/1629295899,http://abs.twimg.com/images/themes/theme1/bg.png,2766,1114,12,0,2,3,2021-10-23T12:44:10.000-07:00
1451892328139051011,1452188096640991242,2021-10-24T08:19:57.000-07:00,"","","",['https://link.medium.com/IuBWXQ8zAkb'],We're hiring more remote digital roles at @RNID. I've written this blog about the roles and how you can apply. https://t.co/r3npijdBTC,"",['RNID'],165203681,Michael Wilkinson,ThatMichaelW,true,http://pbs.twimg.com/profile_images/1451905338068905986/05-o9GlL_normal.jpg,https://pbs.twimg.com/profile_banners/165203681/1616425226,http://abs.twimg.com/images/themes/theme15/bg.png,3980,1424,22,2,0,7,2021-10-23T12:44:40.000-07:00
1451931278773825540,1452188281127510022,2021-10-24T08:20:41.000-07:00,https://twitter.com/VictoriaMYoung/status/1451931278773825540/photo/1,['http://pbs.twimg.com/media/FCZLs6RWUAwnE36.jpg'],['photo'],"",My wonderful department @USTArtHist is hiring! Tenure Track with a Museum Studies emphasis. https://t.co/WoOyoARtJx,"",['USTArtHist'],35325383,Victoria Young,VictoriaMYoung,false,http://pbs.twimg.com/profile_images/1213820812911923203/lftX8TYQ_normal.jpg,https://pbs.twimg.com/profile_banners/35325383/1446020061,http://abs.twimg.com/images/themes/theme2/bg.gif,1976,4917,17,0,1,11,2021-10-23T15:19:27.000-07:00
1451951492848623632,1452167121274814466,2021-10-24T06:56:36.000-07:00,"","","",['http://bit.ly/3m89rP7'],We are hiring - RTs welcome📣 Exciting Postdoctoral Fellow position in the Thoracic Oncology Research Group @TCDTMI @CancerInstIRE to work on an immuno-oncology project in collaboration with @RemedyBio Further details https://t.co/Nz2yPLjAEL,"","['TCDTMI', 'CancerInstIRE', 'RemedyBio']",1000858279747178497,Kathy Gately,kathygately1,false,http://pbs.twimg.com/profile_images/1232783801388093440/BiAjDInV_normal.jpg,https://pbs.twimg.com/profile_banners/1000858279747178497/1582753538,"",307,536,11,1,0,13,2021-10-23T16:39:46.000-07:00
1451961334824898571,1452196516156870658,2021-10-24T08:53:24.000-07:00,"","","","",Remember this when you are hiring:||The people #Hacking your organization.. doesn't have any certificates!||Don't lose a good talent for the wrong reasons.||#InformationSecurityManagement|#CyberSecurityManagement|#InformationSecurity|#CyberSecurity|#CISO,"['Hacking', 'InformationSecurityManagement', 'CyberSecurityManagement', 'InformationSecurity', 'CyberSecurity', 'CISO']","",1413416797039173632,Noureldin Ehab,Nouureldin_Ehab,false,http://pbs.twimg.com/profile_images/1413423938672136192/dlZ8xxqk_normal.jpg,https://pbs.twimg.com/profile_banners/1413416797039173632/1625821344,"",330,1093,9,0,1,5,2021-10-23T17:18:53.000-07:00
1451986833714421761,1452176840307593216,2021-10-24T07:35:13.000-07:00,https://twitter.com/FullMeasureNews/status/1451986833714421761/video/1,['http://pbs.twimg.com/ext_tw_video_thumb/1451985547547877382/pu/img/ROIM-5iFPAquOhGH.jpg'],['video'],"","Tomorrow on Full Measure — We’re in Puerto Rico where the power grid is on the verge of collapse after billions of U.S. tax dollars spent, and the hiring of a private company, LUMA. https://t.co/mnglg2n560","","",3434177986,Full Measure News,FullMeasureNews,true,http://pbs.twimg.com/profile_images/1300466876062076928/vveF0Fd9_normal.jpg,https://pbs.twimg.com/profile_banners/3434177986/1599962870,http://abs.twimg.com/images/themes/theme1/bg.png,67565,300,104,2,3,52,2021-10-23T19:00:12.000-07:00
1451999332992000000,1452193236840329223,2021-10-24T08:40:22.000-07:00,"","","","","@DaveAtherton20 When they are hiring diversity managers on £70k while nurses are on £25k they are not underfunded, just very badly managed.","",['DaveAtherton20'],337966079,Ian Hilton,hilton_ian,false,http://pbs.twimg.com/profile_images/1345137589691559936/iGHHrkC7_normal.jpg,https://pbs.twimg.com/profile_banners/337966079/1608651596,http://abs.twimg.com/images/themes/theme1/bg.png,858,1394,135,2,4,32,2021-10-23T19:49:52.000-07:00
1452036450715770886,1452197017619415042,2021-10-24T08:55:24.000-07:00,https://twitter.com/EunwooVoteTeam/status/1452036450715770886/photo/1,['http://pbs.twimg.com/media/FCardMBUUAIc5fh.jpg'],['photo'],"",📢VOTERS RECRUITMENT||[AAA 2021 - Global &amp; Japan RET Popularity Awards] ||🔍We’re looking for more active voters. Accounts will be provided. DM @EunwooVoteTeam.||Let's work together and win this for Eunwoo!!!||#CHAEUNWOO #차은우 #ASTRO #아스트로 https://t.co/l4RGjfCR6k,"['CHAEUNWOO', '차은우', 'ASTRO', '아스트로']",['EunwooVoteTeam'],1278186014490546179,CHA EUNWOO VOTING SUPPORT TEAM 💫,EunwooVoteTeam,false,http://pbs.twimg.com/profile_images/1417445508310732804/IhFDezsq_normal.jpg,https://pbs.twimg.com/profile_banners/1278186014490546179/1632039188,"",979,17,25,2,0,19,2021-10-23T22:17:22.000-07:00
1452114945550667781,1452192622441811977,2021-10-24T08:37:56.000-07:00,"","","","","if you're looking for a job, mention it to everybody that you come in contact with. you never know whose sister's neighbor's uncle is hiring.","","",1412596378878898188,✪ ᴍᴇɢᴀᴛ ʟᴀᴡ (ムス) ‎,megatlaw_,false,http://pbs.twimg.com/profile_images/1412597541309325314/IxGDo0fn_normal.jpg,https://pbs.twimg.com/profile_banners/1412596378878898188/1625624875,"",1541,232,7,0,0,1,2021-10-24T03:29:16.000-07:00
1452115883447488516,1452180380392513539,2021-10-24T07:49:17.000-07:00,https://twitter.com/NOAAFish_NEFSC/status/1452115883447488516/photo/1,['http://pbs.twimg.com/media/FCZFh2BXsAYVrPK.jpg'],['photo'],"['https://bit.ly/3vGZCuW', 'https://bit.ly/3CbjmsK']",We’re #hiring for a Research Fish Biologist ZP3. Location: #WoodsHole MA. Direct hire! Apps due: 10/25. Public/Career trans fed: https://t.co/KzoU2P6smh. Protected Species Branch info: https://t.co/yoVtLfIk6i. #Jobs https://t.co/EPTnJbAlI8,"['hiring', 'WoodsHole', 'Jobs']","",829347876635545600,NOAAFish_NEFSC,NOAAFish_NEFSC,false,http://pbs.twimg.com/profile_images/1359197860902948869/gLdQuGV2_normal.jpg,https://pbs.twimg.com/profile_banners/829347876635545600/1634058413,"",3254,638,3,0,0,2,2021-10-24T03:33:00.000-07:00
1452162886361501699,1452171053510258696,2021-10-24T07:12:13.000-07:00,"","","","","BREAKING: #SEBI is hiring financial content writer interns with a stipend of ₹45,000 per month.||Last date to apply is Oct 30. Duration of the internship program will be 12 months from the date of appointment.",['SEBI'],"",1173809603752026113,Save Invest Repeat 📈,InvestRepeat,false,http://pbs.twimg.com/profile_images/1247532288176345098/mLd8tTrZ_normal.jpg,https://pbs.twimg.com/profile_banners/1173809603752026113/1578685598,"",9514,1,4,0,0,3,2021-10-24T06:39:46.000-07:00
1452164201653293067,1452175481256697856,2021-10-24T07:29:49.000-07:00,https://twitter.com/CNBCTV18News/status/1452164201653293067/video/1,['http://pbs.twimg.com/media/FB_HZNpVIAkCa04.jpg'],['video'],"","India's top 4 IT companies are looking to hire over 1.6 L freshers this fiscal, this is double of what they recruited last fiscal. Hiring targets are indicative of the rise in demand. But, it is a much-needed measure to offset attrition. @Reematendulkar with details. #TalentWars https://t.co/d4aJwpS8et",['TalentWars'],['Reematendulkar'],631810714,CNBC-TV18,CNBCTV18News,true,http://pbs.twimg.com/profile_images/843653112103682049/E0CibaYX_normal.jpg,https://pbs.twimg.com/profile_banners/631810714/1632116446,http://abs.twimg.com/images/themes/theme1/bg.png,979659,188,22,0,0,5,2021-10-24T06:45:00.000-07:00
1452164659285401605,1452164659285401605,2021-10-24T06:46:49.000-07:00,"","","",['https://www.remotetechjobs.com/*/78598'],Agiloft is hiring: CLM/CRM Implementer III||The Job: Implementer III You will be responsible for designing and implementing software configurations to meet the needs of customers ranging in size from...||https://t.co/ZpjRieGd8c|#Remote #customer-support #Jobs,"['Remote', 'customer', 'Jobs']","",1298682524235739136,Remote Tech Jobs,RemoteTechJobs0,false,http://pbs.twimg.com/profile_images/1357528431328718848/KxyAQegS_normal.png,https://pbs.twimg.com/profile_banners/1298682524235739136/1612495889,"",360,1,0,0,0,0,2021-10-24T06:46:49.000-07:00
1452164667950854148,1452164667950854148,2021-10-24T06:46:51.000-07:00,"","","",['https://www.remotetechjobs.com/*/78605'],"ByteForza is hiring: Mid Level .NET Developer(US Citizens Only)||ByteForza Inc, a proudly woman owned organization and a Microsoft Gold Certified Partner, is looking for an experienced mid-level .NET developer to...||https://t.co/ykyn4U3U7t|#Remote #dot-net #Jobs","['Remote', 'dot', 'Jobs']","",1298682524235739136,Remote Tech Jobs,RemoteTechJobs0,false,http://pbs.twimg.com/profile_images/1357528431328718848/KxyAQegS_normal.png,https://pbs.twimg.com/profile_banners/1298682524235739136/1612495889,"",360,1,0,0,0,0,2021-10-24T06:46:51.000-07:00
1452164670312222721,1452164670312222721,2021-10-24T06:46:51.000-07:00,"","","",['https://www.remotetechjobs.com/*/78607'],"Knit is hiring: Strategist||Who we’re looking for… Role: Strategist Team: Customer Success Reports To: VP of Operations Supervisory Responsibility: This role will not have direct reports, unless occasionally...||https://t.co/mtQpAq68oZ|#Remote #data-mining #Jobs","['Remote', 'data', 'Jobs']","",1298682524235739136,Remote Tech Jobs,RemoteTechJobs0,false,http://pbs.twimg.com/profile_images/1357528431328718848/KxyAQegS_normal.png,https://pbs.twimg.com/profile_banners/1298682524235739136/1612495889,"",360,1,0,0,0,0,2021-10-24T06:46:51.000-07:00
1452165192188563456,1452165192188563456,2021-10-24T06:48:56.000-07:00,https://twitter.com/Paghdjob/status/1452165192188563456/photo/1,['http://pbs.twimg.com/media/E7haSvMVUAYFk14.jpg'],['photo'],['https://www.paghd.com/job/nodejs-backend-developer.1'],"Hello, We are hiring nodejs backend developer, job link - https://t.co/BRb2Ob2hBP  #job #hire  #nodejs #tdd #restify #Veghel #Netherlands #employees #recruiter #employeebenefits #jobsearch https://t.co/7kSsfNPRPq","['job', 'hire', 'nodejs', 'tdd', 'restify', 'Veghel', 'Netherlands', 'employees', 'recruiter', 'employeebenefits', 'jobsearch']","",1420260812342448135,paghd.com,Paghdjob,false,http://pbs.twimg.com/profile_images/1420261510761250820/9o5B7fW7_normal.jpg,https://pbs.twimg.com/profile_banners/1420260812342448135/1627623108,"",43,901,0,0,0,0,2021-10-24T06:48:56.000-07:00
1452165966733922306,1452167069546553346,2021-10-24T06:56:23.000-07:00,"","","",['https://buff.ly/2sV6Hb7'],"Hi! #objectsecurity is #hiring talented Senior Software Engineers: Work #remote with world-leading scientists and engineers to develop innovative products related to cybersecurity, #AI/ML, supply chain at #objectsecurity.  https://t.co/VHPyQVx4ch August 26, 20 16:10 - enjoy!","['objectsecurity', 'hiring', 'remote', 'AI', 'objectsecurity']","",1100326831,OpenPMF,openpmf,false,http://pbs.twimg.com/profile_images/3123734373/ba6ac58206dc0a73cc641fed39187ebd_normal.png,"",http://abs.twimg.com/images/themes/theme1/bg.png,24,1,0,0,0,2,2021-10-24T06:52:01.000-07:00
