org_id,samp_id,samp_datetime,org_url,org_media_url,org_media_type,org_attached_links,org_text,org_hashtags,org_user_metions,user_id,user_name,user_screen_name,user_verified,user_profile_image_url,user_profile_banner_url,user_profile_background_image_url,user_followers_count,user_friends_count,org_favorite_count,org_quote_count,org_reply_count,org_retweet_count,org_datetime
1454615396540043267,1454615658629505026,2021-10-31T01:06:13.000-07:00,"","","",['http://dlvr.it/SBc91T'],Flexport Is Hiring Engineers to Help Us Uncork Global Supply Chains https://t.co/e9wEpyWrUd,"","",1643123766,Umair,akbarth3great,false,http://pbs.twimg.com/profile_images/1340928058019225601/8_jMhNPt_normal.jpg,https://pbs.twimg.com/profile_banners/1643123766/1609393780,http://abs.twimg.com/images/themes/theme1/bg.png,13030,58,0,0,0,3,2021-10-31T01:05:10.000-07:00
1454615764481286144,1454615764481286144,2021-10-31T01:06:38.000-07:00,"","","","",@Longhorn824 @chrisha2001 @AnwarRichardson Well that’s what you get for hiring a career .500 coach and expecting him to win you championships,"","['Longhorn824', 'chrisha2001', 'AnwarRichardson']",1454463040062119937,Brandon Quinlan,BQ_Sports,false,http://pbs.twimg.com/profile_images/1454470395386544138/5R3anmzj_normal.jpg,https://pbs.twimg.com/profile_banners/1454463040062119937/1635606761,"",11,155,0,0,0,0,2021-10-31T01:06:38.000-07:00
1454616906766462979,1454616906766462979,2021-10-31T01:11:10.000-07:00,"","","","['https://www.linkedin.com/in/pandyatejas/', 'http://app.jobvite.com/m?39qz7mw6']",Automation Anywhere is looking for Sr. RPA Program Manager (remote). ||Please refer to job description &amp; location before applying. Refer to https://t.co/mPB9GUlRsR for more job vacancies.||#JobSearch #hiring|https://t.co/JR3fQKhm2O #job,"['JobSearch', 'hiring', 'job']","",790557085,Tejas Pandya,TejasVPandya,false,http://pbs.twimg.com/profile_images/807785092739461120/A21vdcdb_normal.jpg,https://pbs.twimg.com/profile_banners/790557085/1424741429,http://abs.twimg.com/images/themes/theme1/bg.png,96,568,0,0,0,0,2021-10-31T01:11:10.000-07:00
1454618328358555652,1454618328358555652,2021-10-31T01:16:49.000-07:00,"","","",['https://bit.ly/3EvJsYh'],"Want to work at Mind Springs Health? We're hiring in #GrandJunction, CO! Click for details: https://t.co/vTRqbhCLml #Clinician","['GrandJunction', 'Clinician']","",888472045981323264,Mind Springs Jobs,MindSpringsJobs,false,http://pbs.twimg.com/profile_images/889893527785689088/1dmy2ZgC_normal.jpg,https://pbs.twimg.com/profile_banners/888472045981323264/1501008972,"",16,6,0,0,0,0,2021-10-31T01:16:49.000-07:00
1299129893008048135,1454617850807734273,2021-10-31T01:14:55.000-07:00,"","","",['https://www.instagram.com/p/CEaVvS-l7hv/?igshid=beuodfddez2j'],"We are hiring Digital marketer...||Skills required: Social media management, and Graphic Design||#digitalmarketer #digitalmarketing #jobs #hiringnow #hiring @ Bangalore, India https://t.co/7T8KaxTPkH","['digitalmarketer', 'digitalmarketing', 'jobs', 'hiringnow', 'hiring']","",278346157,Sreenatha Reddy K R⚡,SreenathReddyK,false,http://pbs.twimg.com/profile_images/1072297458145865728/O39E0UTW_normal.jpg,https://pbs.twimg.com/profile_banners/278346157/1595408262,http://abs.twimg.com/images/themes/theme8/bg.gif,511,1489,3,0,1,2,2020-08-27T23:41:17.000-07:00
1442394654696083457,1454591218747207682,2021-10-30T23:29:06.000-07:00,https://twitter.com/NUPEsupreme/status/1442394654696083457/photo/1,['http://pbs.twimg.com/media/FARqOW8VkAM8Fc1.jpg'],['photo'],"",Seeing lots of businesses with 'help wanted' (now hiring) signs around town. I've heard that folks are answering the calls with salary requirements (NO min. wage). Stop saying that people don't want to work. They just want adequate pay for their labor. FAIR!!! 👏|#EndPovertyWages https://t.co/pZPEFCdNZj,['EndPovertyWages'],"",240619680,Deuce,NUPEsupreme,false,http://pbs.twimg.com/profile_images/950069823341436928/Wxgp5UgG_normal.jpg,https://pbs.twimg.com/profile_banners/240619680/1419140238,http://abs.twimg.com/images/themes/theme4/bg.gif,3531,3086,0,0,0,2,2021-09-27T07:44:18.000-07:00
1443412784012791809,1454614104694480899,2021-10-31T01:00:02.000-07:00,"","","",['http://ziprecruiter.com/tja/29b7c224'],"We are #hiring Video Production Manager in Gainesville, FL https://t.co/gy1XaGIrWz #jobs #Gainesville","['hiring', 'jobs', 'Gainesville']","",959482362781413377,Big Daddy Unlimited,UnlimitedDaddy,false,http://pbs.twimg.com/profile_images/1353801398773809154/vf2QjjWD_normal.jpg,https://pbs.twimg.com/profile_banners/959482362781413377/1611606349,"",409,42,0,0,0,2,2021-09-30T03:09:59.000-07:00
1445267352568795137,1454604913573384193,2021-10-31T00:23:31.000-07:00,https://twitter.com/ZYXSupportTeam/status/1445267352568795137/photo/1,['http://pbs.twimg.com/media/FA6e_w3VQAQJsYI.jpg'],['photo'],['https://forms.gle/iR1sw24K7fCYDA9R9'],"📢 [SPOTIFY AND YOUTUBE TEAM RECRUITMENT] 📢||We are open recruitment for streaming team for Yixing's New EP. If you are interested to join, please fill up your application in the following form.|🖇️ https://t.co/3lBhsWfS2C||#YIXINGISCOMING |#LAY #张艺兴 #레이 #엑소레이 @layzhang https://t.co/dcvclqYjBk","['YIXINGISCOMING', 'LAY', '张艺兴', '레이', '엑소레이']",['layzhang'],1429042894090895363,ZYXSupport,ZYXSupportTeam,false,http://pbs.twimg.com/profile_images/1447591457817186305/Osw5jTap_normal.jpg,https://pbs.twimg.com/profile_banners/1429042894090895363/1629973701,"",521,60,491,26,4,306,2021-10-05T05:59:23.000-07:00
1447668721640693760,1454599369731280902,2021-10-31T00:01:29.000-07:00,https://twitter.com/CityOfNOLA/status/1447668721640693760/photo/1,"['http://pbs.twimg.com/media/FBcnBgdXMAMuhEc.jpg', 'http://pbs.twimg.com/media/FBcnBgcXEAY91JL.jpg', 'http://pbs.twimg.com/media/FBcnBgaX0AAEafu.jpg', 'http://pbs.twimg.com/media/FBcnBggXEAI_Q0S.jpg']","['photo', 'photo', 'photo', 'photo']","","NOW HIRING‼️|The City of New Orleans is seeking applicants for the position of Grounds Patrol Officer. ⚜️||This position is responsible for facility security and asset protection at municipal facilities, properties, and other public areas. https://t.co/hetYeX6mk6","","",1029778320328667136,The City Of New Orleans,CityOfNOLA,true,http://pbs.twimg.com/profile_images/1114241900637249536/hfyOoGa0_normal.jpg,https://pbs.twimg.com/profile_banners/1029778320328667136/1628891835,"",31603,988,20,1,3,10,2021-10-11T21:01:34.000-07:00
1449639735689875457,1454605847649263625,2021-10-31T00:27:14.000-07:00,https://twitter.com/Jessica08331719/status/1449639735689875457/video/1,['http://pbs.twimg.com/ext_tw_video_thumb/1449639658606968832/pu/img/wk4_f7ao5UY-x8LJ.jpg'],['video'],"",this might be why black names are passed over during the hiring process https://t.co/bpP1pnEmCB,"","",1289622423243980800,Jessica Rabbit 🐇,Jessica08331719,false,http://pbs.twimg.com/profile_images/1411892843078111232/zgY2jlqe_normal.jpg,https://pbs.twimg.com/profile_banners/1289622423243980800/1629117658,"",221,508,3,0,0,3,2021-10-17T07:33:40.000-07:00
1453411062661877761,1454588950132056064,2021-10-30T23:20:05.000-07:00,"","","",['http://dlvr.it/SBPrjk'],"Now Hiring: Missouri State Public Defender System Legal Assistant at Missouri State University (Springfield, MO) https://t.co/MWVRPWWpBj #inhousetwitter #legaljobs","['inhousetwitter', 'legaljobs']","",49049693,GoInhouse®,goinhouse,false,http://pbs.twimg.com/profile_images/992508612273635328/74DREEkY_normal.jpg,https://pbs.twimg.com/profile_banners/49049693/1590205232,http://abs.twimg.com/images/themes/theme6/bg.gif,7701,3770,0,0,0,1,2021-10-27T17:19:35.000-07:00
1453419103624908802,1454596994798796804,2021-10-30T23:52:03.000-07:00,"","","",['http://dlvr.it/SBPwyd'],"Now Hiring: Assistant Corporation Counsel, Tort at NYC LAW DEPARTMENT (New York, NY) https://t.co/yy0g4SDWP1 #legaljobs #lawtwitter","['legaljobs', 'lawtwitter']","",49049693,GoInhouse®,goinhouse,false,http://pbs.twimg.com/profile_images/992508612273635328/74DREEkY_normal.jpg,https://pbs.twimg.com/profile_banners/49049693/1590205232,http://abs.twimg.com/images/themes/theme6/bg.gif,7701,3770,0,0,0,1,2021-10-27T17:51:32.000-07:00
1453419109442490378,1454597000213581825,2021-10-30T23:52:04.000-07:00,"","","",['http://dlvr.it/SBPwzy'],"Now Hiring: Compact Negotiation and Tribal Legal Affairs Coordinator - Tax Policy Specialist 4 (TPS4) at State of Washington (Tumwater, WA) https://t.co/aAdCv1mz3o #inhousecounsel #legaljobs","['inhousecounsel', 'legaljobs']","",49049693,GoInhouse®,goinhouse,false,http://pbs.twimg.com/profile_images/992508612273635328/74DREEkY_normal.jpg,https://pbs.twimg.com/profile_banners/49049693/1590205232,http://abs.twimg.com/images/themes/theme6/bg.gif,7701,3770,0,0,0,1,2021-10-27T17:51:33.000-07:00
1453431076437651460,1454609198663098371,2021-10-31T00:40:32.000-07:00,"","","",['http://dlvr.it/SBQ4J3'],"Now Hiring: REMOTE PART-TIME ON CALL ATTORNEY 60933260 at Department of Management Services - State of Florida (Tampa, FL) https://t.co/32zRf62JXe #lawtwitter #lawyers","['lawtwitter', 'lawyers']","",49049693,GoInhouse®,goinhouse,false,http://pbs.twimg.com/profile_images/992508612273635328/74DREEkY_normal.jpg,https://pbs.twimg.com/profile_banners/49049693/1590205232,http://abs.twimg.com/images/themes/theme6/bg.gif,7700,3770,0,0,0,1,2021-10-27T18:39:06.000-07:00
1453434968336523264,1454612982718087173,2021-10-31T00:55:35.000-07:00,"","","",['http://dlvr.it/SBQ6LH'],"Now Hiring: Counsel, Music Business &amp; Legal Affairs at NBCUniversal (Los Angeles, CA) https://t.co/9QhUv7RK0d #lawyers #corporatecounsel","['lawyers', 'corporatecounsel']","",49049693,GoInhouse®,goinhouse,false,http://pbs.twimg.com/profile_images/992508612273635328/74DREEkY_normal.jpg,https://pbs.twimg.com/profile_banners/49049693/1590205232,http://abs.twimg.com/images/themes/theme6/bg.gif,7700,3770,0,0,0,1,2021-10-27T18:54:34.000-07:00
1453716829709291527,1454609593158545419,2021-10-31T00:42:07.000-07:00,https://twitter.com/AE_Konkel/status/1453716829709291527,"","",['https://www.hiringlab.org/2021/10/28/job-seeker-interest-shifting-toward-higher-wage-jobs/'],"We’ve already seen this happening with the leisure &amp; hospitality workers’ wages. Of course, not all employers can raise wages enough to attract the workers they need. For them, hiring struggles will likely continue. ||https://t.co/fSyOHKacRX||/End","","",976932221943730176,AnnElizabeth Konkel,AE_Konkel,false,http://pbs.twimg.com/profile_images/1435980538200870917/LbMTQyus_normal.jpg,https://pbs.twimg.com/profile_banners/976932221943730176/1521755076,"",1397,335,1,1,0,0,2021-10-28T13:34:35.000-07:00
1453853591656181793,1454601674971045889,2021-10-31T00:10:39.000-07:00,"","","","",Willing to nickel and dime the people who put hours upon hours of work into multi-character audio dramas with beautiful prose written by new writers —but unwilling to listen to them when they say “Don’t hire a nonce” followed by “don’t double down on hiring a nonce”,"","",3292314393,Jacob the Grey,NoNotTheMemes,false,http://pbs.twimg.com/profile_images/834986984737239041/q2dkMyb4_normal.jpg,https://pbs.twimg.com/profile_banners/3292314393/1604283930,http://abs.twimg.com/images/themes/theme15/bg.png,335,1108,10,0,0,1,2021-10-28T22:38:02.000-07:00
1454012657674117124,1454602258075820034,2021-10-31T00:12:58.000-07:00,https://twitter.com/booy4ren/status/1454012657674117124/photo/1,"['http://pbs.twimg.com/media/FC2wyuaWQAI_4ji.jpg', 'http://pbs.twimg.com/media/FC2wzCDWYAAPsH0.jpg', 'http://pbs.twimg.com/media/FC2wzU9WUAYjrbH.jpg', 'http://pbs.twimg.com/media/FC2wzm-XMAANGnD.jpg']","['photo', 'photo', 'photo', 'photo']","",!!!EMERGENCY COMMISSIONS!!!|Our landlord wants us to move because he decided to sell the house my parents are so build up with hiring a lawyer and stuff and I want to help out at least. I am sorry if these are expensive. more info on the thread and dms https://t.co/xe62TdPxoQ,"","",1285878769652293635,spookyaren 🕯🎃 | COMMISSIONS PINNED,booy4ren,false,http://pbs.twimg.com/profile_images/1454148291965378565/VtRLDm7U_normal.jpg,https://pbs.twimg.com/profile_banners/1285878769652293635/1633443307,"",6131,1445,302,4,4,134,2021-10-29T09:10:06.000-07:00
1454083599037132800,1454598413530632194,2021-10-30T23:57:41.000-07:00,https://twitter.com/ComparativeEduc/status/1454083599037132800/photo/1,['http://pbs.twimg.com/media/FCo6WoPXMAQu2Ok.jpg'],['photo'],['https://www.depts.ttu.edu/education/our-people/faculty-and-staff-resources/documents/EPOL-faculty-position-announcement-fall-2021.pdf'],"We're hiring a tenure track assistant professor focused on #education #policy in #Latinx and/or #rural communities to start in August 2022! ||Please share, apply, &amp; come work with us &amp; the amazing people @TTUEducation @TexasTech https://t.co/oIlP0cyPWV @LatinoEdu @LatinxPolicy https://t.co/2JRtqcsIUj","['education', 'policy', 'Latinx', 'rural']","['TTUEducation', 'TexasTech', 'LatinoEdu', 'LatinxPolicy']",578948451,Alexander W. Wiseman,ComparativeEduc,false,http://pbs.twimg.com/profile_images/1232878050020331520/yKNZnz0T_normal.jpg,https://pbs.twimg.com/profile_banners/578948451/1623954027,http://abs.twimg.com/images/themes/theme1/bg.png,1034,1018,7,0,0,5,2021-10-29T13:52:00.000-07:00
1454089622418563073,1454602975784079363,2021-10-31T00:15:49.000-07:00,"","","",['https://boards.greenhouse.io/buzzfeed/jobs/3605789?gh_jid=3605789'],❗@BuzzFeedNews is hiring an internet culture reporter https://t.co/eWnCbykT56,"",['BuzzFeedNews'],17614726,Brandon Wall,Walldo,true,http://pbs.twimg.com/profile_images/1449400301425942537/4wNirMZr_normal.jpg,"",http://abs.twimg.com/images/themes/theme1/bg.png,25079,5019,21,1,0,18,2021-10-29T14:15:56.000-07:00
1454092264666550275,1454617571173429250,2021-10-31T01:13:49.000-07:00,"","","",['https://www.h-net.org/jobs/job_display.php?id=62126'],hey...my department is hiring - historian of British Empire (19th-20th century). 2-2 teaching. application deadline Dec. 1 - feel free to reach out if you have questions||https://t.co/x5urCZkO4W,"","",571380845,Brian Connolly,BrianConnolly74,false,http://pbs.twimg.com/profile_images/1184813421151293440/VF2G5I3f_normal.jpg,"",http://abs.twimg.com/images/themes/theme1/bg.png,356,351,86,6,3,68,2021-10-29T14:26:26.000-07:00
1454118934261735427,1454614993106657287,2021-10-31T01:03:34.000-07:00,"","","","","Oh hey, new postings aren’t up yet but 18F/TTS is about to grow a *lot*. we’re gonna be hiring engineers, product managers, project managers, designers, content strategists, and everything in between—maybe get started on updating those federal resumes?","","",10776522,mx cordelia yu 余典鴻,thebestsophist,false,http://pbs.twimg.com/profile_images/1159926953404706817/AkMKnKJn_normal.jpg,https://pbs.twimg.com/profile_banners/10776522/1462935369,http://abs.twimg.com/images/themes/theme3/bg.gif,3913,1836,193,11,6,77,2021-10-29T16:12:24.000-07:00
1454167375574675461,1454605533101666305,2021-10-31T00:25:59.000-07:00,"","","",['https://facultyjobs.ua.edu/postings/49342'],Reminder: GRS is hiring! The position refers to sociology but we're broadly interested in folks using quant/qual methods to address issues of gender and race. Check out the ad and apply by 11/15.  https://t.co/tLLM9iQpW7,"","",725349642980986880,GRS at UA,GenderRaceUA,false,http://pbs.twimg.com/profile_images/1175981629334052865/RjdXHPQC_normal.jpg,https://pbs.twimg.com/profile_banners/725349642980986880/1569210978,http://abs.twimg.com/images/themes/theme1/bg.png,240,305,8,2,0,7,2021-10-29T19:24:54.000-07:00
1454175341841244162,1454613498147729408,2021-10-31T00:57:38.000-07:00,"","","",['https://careersearch.stanford.edu/jobs/academic-technology-specialist-14815'],"I recently got a more senior role and Stanford is hiring for my current role as an Academic Technology Specialist! https://t.co/Yp8E3VD2HM Great job for someone #withaphd #postac #altac, and/or with an #edtech background. Happy to answer questions!","['withaphd', 'postac', 'altac', 'edtech']","",1712817055,Beth Seltzer,beth_seltzer,false,http://pbs.twimg.com/profile_images/640636220935131136/kgHyznSs_normal.jpg,https://pbs.twimg.com/profile_banners/1712817055/1467311921,http://abs.twimg.com/images/themes/theme15/bg.png,998,757,12,0,0,9,2021-10-29T19:56:33.000-07:00
1454233587469877251,1454595567594598404,2021-10-30T23:46:23.000-07:00,"","","","","Twitter hive mind! A friend of mine is looking for a new position - they’re great at climate communications, crisis communications, social media strategy, content strategy, etc. ||Does anyone know of anything either remote or in the #yeg area hiring?",['yeg'],"",6352662,Beth Allan,adolwyn,false,http://pbs.twimg.com/profile_images/988497389198561280/8zvga_O6_normal.jpg,https://pbs.twimg.com/profile_banners/6352662/1426472560,http://abs.twimg.com/images/themes/theme15/bg.png,9107,854,9,0,3,11,2021-10-29T23:48:00.000-07:00
1454259511896674307,1454601783913762824,2021-10-31T00:11:05.000-07:00,https://twitter.com/Cryptecca/status/1454259511896674307/photo/1,['http://pbs.twimg.com/media/FC6LH-XVgAI36pH.jpg'],['photo'],"","Top tier investors- they raised $5m from the likes of @hiFramework and @Delphi_Digital in March. With A16z’s recent investment in @AxieInfinity at a 3b valuation, and Illuvium’s rate of hiring, I wouldn’t be surprised to see the team raise from larger institutions very soon. /4 https://t.co/OUgu4JsbFV","","['hiFramework', 'Delphi_Digital', 'AxieInfinity']",4560487154,"Cryptecca (☢️,☢️)",Cryptecca,false,http://pbs.twimg.com/profile_images/1453126793771237376/S3xWqpSA_normal.jpg,https://pbs.twimg.com/profile_banners/4560487154/1635574969,http://abs.twimg.com/images/themes/theme1/bg.png,1282,1245,33,0,1,4,2021-10-30T01:31:01.000-07:00
1454388603102982150,1454609891876868096,2021-10-31T00:43:18.000-07:00,https://twitter.com/HazzadorGamin/status/1454388603102982150,['http://pbs.twimg.com/tweet_video_thumb/FC8GuMmVIAQAzQc.jpg'],['animated_gif'],['https://vgc.news/news/id-software-is-hiring-for-a-long-running-iconic-action-fps/'],ID Software is hiring for ‘a long running 'Iconic action FPS’ with sci-fi and fantasy elements #XboxBethesda ||https://t.co/Svfu2sxu6N https://t.co/WEF36w5yNM,['XboxBethesda'],"",1116963904481980416,"🐉🎮HazzadorGamin, Dragon Of Dojima Gamin🎮🐉",HazzadorGamin,false,http://pbs.twimg.com/profile_images/1343561657692262400/ka2kyiAe_normal.jpg,https://pbs.twimg.com/profile_banners/1116963904481980416/1626049991,http://abs.twimg.com/images/themes/theme1/bg.png,4903,367,211,11,13,11,2021-10-30T10:03:58.000-07:00
1454415975483334658,1454591188498010119,2021-10-30T23:28:58.000-07:00,"","","","","@thedailybeast Their choice, their consequences. Don’t care. There are places hiring, go find other employment.","",['thedailybeast'],1661392340,Daily,daily_brenda,false,http://pbs.twimg.com/profile_images/1051642587038265344/TPch1apD_normal.jpg,https://pbs.twimg.com/profile_banners/1661392340/1539566024,http://abs.twimg.com/images/themes/theme1/bg.png,76,649,52,1,5,3,2021-10-30T11:52:44.000-07:00
1454444624790032385,1454602748763131905,2021-10-31T00:14:55.000-07:00,https://twitter.com/TedMartin1775/status/1454444624790032385/video/1,['http://pbs.twimg.com/ext_tw_video_thumb/1454444563372908546/pu/img/2CHCttgSMApusCiP.jpg'],['video'],"","You know what there is a lot of at 🇺🇸@FortLeavenworth ? Kids 👶, puppies 🐶, and PREDICTABLY😀||The AIM2 market place is open &amp; we are hiring. Please consider this a personal invitation to join us at  @usacac , @usacactraining , @USArmyMCCoE or @USACGSC ⬅️⬅️⬅️|#ARMY https://t.co/pl7MEmRpaa",['ARMY'],"['FortLeavenworth', 'usacac', 'usacactraining', 'USArmyMCCoE', 'USACGSC']",1222905336845213696,LTG Ted Martin,TedMartin1775,true,http://pbs.twimg.com/profile_images/1223325390803959808/-tj7bo_f_normal.jpg,https://pbs.twimg.com/profile_banners/1222905336845213696/1600461683,http://abs.twimg.com/images/themes/theme1/bg.png,29661,1242,101,0,7,12,2021-10-30T13:46:35.000-07:00
1454449762011385857,1454591015374008329,2021-10-30T23:28:17.000-07:00,https://twitter.com/BTSARMYJobBoard/status/1454449762011385857/photo/1,"['http://pbs.twimg.com/media/FCaM4AVXMAsOuWs.jpg', 'http://pbs.twimg.com/media/FCaM6-0XIAQRA8m.jpg']","['photo', 'photo']",['https://careers.hybecorp.com/job/%EC%84%9C%EC%9A%B8-Weverse-Company-Senior-Tech-Recruiter-%ED%95%9C%EA%B5%AD/4296144/'],.@weverseofficial is hiring for Senior Tech Recruiter 🤗||Practice wisdom while applying. 💜||https://t.co/ytANcaeiML||#BAJBSouthKorea #BAJBHR ||*Rough translation via google translate https://t.co/sbuBmPl3eh,"['BAJBSouthKorea', 'BAJBHR']",['weverseofficial'],1316187143820066816,BTS ARMY Job Board ⁷,BTSARMYJobBoard,false,http://pbs.twimg.com/profile_images/1438780430434504704/zaFjH7qg_normal.jpg,https://pbs.twimg.com/profile_banners/1316187143820066816/1633883424,"",35676,143,13,0,0,13,2021-10-30T14:07:00.000-07:00
1454466960016637955,1454596994035552262,2021-10-30T23:52:03.000-07:00,"","","","","@GOPLeader STOP with the LIE!   If you have 10,000+ annually flow in or out ABOVE your wages, int, div or reportable income, you “could” be flagged for an audit.  This exists today, ask any ebay seller. Separately hiring more IRS agents means your phone call gets answered","",['GOPLeader'],2217242544,kathleen,kmdoubleu,false,http://abs.twimg.com/sticky/default_profile_images/default_profile_normal.png,"",http://abs.twimg.com/images/themes/theme1/bg.png,33,26,17,0,0,2,2021-10-30T15:15:20.000-07:00
1454475389028298758,1454616591778271232,2021-10-31T01:09:55.000-07:00,"","","",['https://docs.google.com/spreadsheets/d/1foKdQSF_yRrU8WAyCIZuWuo98cnrrUdkBj2jtWx_XxM/edit?usp=drivesdk'],🧞‍♂️ RECRUITMENT 🧞‍♂️||We are looking for GENIE STREAMERS and DOWNLOADERS. ||If you want to participate pls check the spreadsheet and put the necessary informations. ||Thank you! |👇👇👇|https://t.co/E5f1Rv13Ye||#ASTRO #아스트로 #MJ #HappyVirus #GetSetYo,"['ASTRO', '아스트로', 'MJ', 'HappyVirus', 'GetSetYo']","",1134401657666588672,astromjph,astromjph,false,http://pbs.twimg.com/profile_images/1224001321923047425/QB7GExrf_normal.jpg,https://pbs.twimg.com/profile_banners/1134401657666588672/1625086812,"",684,41,43,0,0,56,2021-10-30T15:48:50.000-07:00
1454485811089616902,1454590569188143106,2021-10-30T23:26:31.000-07:00,"","","",['http://ow.ly/8AWm50GB36b'],📢 We're boosting this Production Crew Callout for iconic animation studio @aardman 📢||The Bristol-based studio that created Wallace &amp; Gromit are hiring across a range of roles for stop frame animation projects. Click the link to find out more!||➡️https://t.co/yWfTsoeDuX,"",['aardman'],1182364279,Creative Access,_CreativeAccess,true,http://pbs.twimg.com/profile_images/799666944463015936/0DEbjDCu_normal.jpg,https://pbs.twimg.com/profile_banners/1182364279/1568731309,http://abs.twimg.com/images/themes/theme1/bg.png,26628,657,4,0,0,3,2021-10-30T16:30:15.000-07:00
1454516879263997961,1454613974763413507,2021-10-31T00:59:31.000-07:00,"","","","","The quality of this Spurs squad is nowhere near as bad as performances this season suggest. Romero, Emerson &amp; Gil was smart recruitment to join Kane, Son, Højbjerg and others. A coach who can actually control parts of a game in possession, will undoubtedly extract more from them.","","",737984539130265600,Premier League Panel,PremLeaguePanel,false,http://pbs.twimg.com/profile_images/1305251478156783617/zPOA7pFP_normal.jpg,https://pbs.twimg.com/profile_banners/737984539130265600/1600182641,"",115986,41428,1672,30,39,185,2021-10-30T18:33:42.000-07:00
1454519744028102668,1454599911219941378,2021-10-31T00:03:38.000-07:00,https://twitter.com/citizenactionny/status/1454519744028102668/photo/1,['http://pbs.twimg.com/media/FC99_zTWYAcBXRI.jpg'],['photo'],['http://citizenactionny.org/jobs'],"Come fight for justice with us! We're hiring a Deputy Communications Director, a Digital Associate, &amp; other exciting positions. Do you have the experience, skills, &amp; desire to shape a more just &amp; equitable New York? Visit https://t.co/024Cj5Mlzu to learn more &amp; apply. https://t.co/iyOG29X2b9","","",20064655,Citizen Action of NY,citizenactionny,false,http://pbs.twimg.com/profile_images/1070334535181717506/ktS_oaKk_normal.jpg,https://pbs.twimg.com/profile_banners/20064655/1617112566,http://abs.twimg.com/images/themes/theme1/bg.png,20300,2219,3,0,0,1,2021-10-30T18:45:05.000-07:00
1454523540208771073,1454591617197907976,2021-10-30T23:30:41.000-07:00,https://twitter.com/frickers/status/1454523540208771073/photo/1,['http://pbs.twimg.com/media/FC-Bc4AXIAMizh8.jpg'],['photo'],['https://recruiting.ultipro.com/FRI1005FRUS/JobBoard/974653cd-f0af-417e-bb4c-e8a02c4252aa/?q=&o=postedDateDesc&w=&wc=&we=&wpst='],"Do you enjoy working with people in a FUN, fast-paced environment? Are you hard working, upbeat and motivated? Do you love the roar of the crowd during a big game? If so, we want you on our team! Fricker's is hiring for all positions, apply here: https://t.co/efkqHIv15d #Frickers https://t.co/OnbJtOZu2e",['Frickers'],"",402967018,Frickers Restaurants,frickers,false,http://pbs.twimg.com/profile_images/2138186025/Fricker_s-Cool-Chick-Red-Background_normal.jpg,https://pbs.twimg.com/profile_banners/402967018/1459456432,http://abs.twimg.com/images/themes/theme1/bg.png,1025,44,2,0,0,1,2021-10-30T19:00:10.000-07:00
1454564927230730242,1454589269486411782,2021-10-30T23:21:21.000-07:00,"","","",['https://bit.ly/315uLN9'],We're hiring! Click to apply: Technical Program Manager - https://t.co/dnCkrlo5sQ #Nintendo #SoftwareDevelopment,"['Nintendo', 'SoftwareDevelopment']","",1137290828,Nintendo of America Careers,jobsatnintendo,true,http://pbs.twimg.com/profile_images/774314785122902016/KX_v8DhO_normal.jpg,https://pbs.twimg.com/profile_banners/1137290828/1405030038,http://abs.twimg.com/images/themes/theme1/bg.png,16211,62,2,0,0,1,2021-10-30T21:44:37.000-07:00
