org_id,samp_id,samp_datetime,org_url,org_media_url,org_media_type,org_attached_links,org_text,org_hashtags,org_user_metions,user_id,user_name,user_screen_name,user_verified,user_profile_image_url,user_profile_banner_url,user_profile_background_image_url,user_followers_count,user_friends_count,org_favorite_count,org_quote_count,org_reply_count,org_retweet_count,org_datetime
1346573190940782592,1451888429348712450,2021-10-23T12:29:10.000-07:00,https://twitter.com/Uniswap/status/1346573190940782592,"","",['https://jobs.lever.co/Uniswap'],🌐 Do you want to help build the future of decentralized finance?||4⃣The Uniswap dev team is hiring for 4 engineering roles!||🦄 Senior Frontend Engineer|🦄 Smart Contract Engineer|🦄 Full Stack Engineer|🦄 Software Engineer Intern||Learn more and apply:|https://t.co/d3IERsnQsE,"","",984188226826010624,Uniswap Labs 🦄,Uniswap,true,http://pbs.twimg.com/profile_images/1242184851152928769/wG2eTAfD_normal.jpg,https://pbs.twimg.com/profile_banners/984188226826010624/1584988310,http://abs.twimg.com/images/themes/theme1/bg.png,669248,89,3581,183,3547,1163,2021-01-05T21:44:01.000-08:00
1445959119249109000,1451875807295512580,2021-10-23T11:39:01.000-07:00,https://twitter.com/valensagency/status/1445959119249109000,"","",['https://docs.google.com/forms/d/e/1FAIpQLScsE7oRfjEXNaFMjuzTha237xfbrpHvG3x7C-7g1U3UHNcP0w/viewform?usp=sf_link'],MARKETING STAFF APPLICATION FORM|https://t.co/V5K3TDoPFh,"","",1414586455700115461,Valens Agency.,valensagency,false,http://pbs.twimg.com/profile_images/1429677630630944769/UtXeQzih_normal.jpg,https://pbs.twimg.com/profile_banners/1414586455700115461/1629696682,"",91,92,89,1,1,86,2021-10-07T03:48:13.000-07:00
1446126233457029128,1451863084092563464,2021-10-23T10:48:28.000-07:00,https://twitter.com/ClimateOutreach/status/1446126233457029128,"","",['https://climateoutreach.org/get-involved/jobs-volunteering/'],"📣We're hiring! |We're looking for two new colleagues to join our growing team:|👉a Researcher|👉a Project Manager |Both preferably based in our Oxford UK office, although flexible &amp; remote working is available for the right candidate|https://t.co/YVhvKC1iHr","","",107101086,Climate Outreach,ClimateOutreach,false,http://pbs.twimg.com/profile_images/983296604634583040/dLcDC0K7_normal.jpg,https://pbs.twimg.com/profile_banners/107101086/1632927625,http://abs.twimg.com/images/themes/theme1/bg.png,15949,3320,20,7,1,21,2021-10-07T14:52:16.000-07:00
1448681587646902275,1451885689667309569,2021-10-23T12:18:17.000-07:00,"","","",['https://boards.greenhouse.io/axios/jobs/3553747'],Are you a data viz designer who lives and breathes for finance? We want to talk to you! @axios|is hiring now!||https://t.co/iOEQe6zP2X,"",['axios'],250287517,Dan-Hell🔥 Alberti,DanielleAlberti,true,http://pbs.twimg.com/profile_images/1218350265180528641/3VvpRdrQ_normal.jpg,https://pbs.twimg.com/profile_banners/250287517/1455826389,http://abs.twimg.com/images/themes/theme8/bg.gif,3727,1687,19,1,1,6,2021-10-14T16:06:20.000-07:00
1450099346259816451,1451871127039586307,2021-10-23T11:20:25.000-07:00,https://twitter.com/Elemental_io/status/1450099346259816451/photo/1,['http://pbs.twimg.com/media/FB_Jq8WWQAgPjJc.png'],['photo'],['https://bit.ly/3FTGC0J'],We've just announced some new amazing opportunities to join a crew of pretty cool people. :) Check out our open positions!|https://t.co/0TNctWiB1S|#joinus #hiring #lifesciences #biotechnology #research #AI #ML #data #wearefamily #Elemental https://t.co/It10f9eFhi,"['joinus', 'hiring', 'lifesciences', 'biotechnology', 'research', 'AI', 'ML', 'data', 'wearefamily', 'Elemental']","",4572081197,Elemental Machines,Elemental_io,false,http://pbs.twimg.com/profile_images/1394758963590311952/1O7sHIsO_normal.jpg,https://pbs.twimg.com/profile_banners/4572081197/1631638812,"",730,679,3,0,0,2,2021-10-18T14:00:00.000-07:00
1450512720927895560,1451885751067570183,2021-10-23T12:18:32.000-07:00,https://twitter.com/BrownCSDept/status/1450512720927895560/photo/1,['http://pbs.twimg.com/media/FCFBbi4XIAYbZbF.jpg'],['photo'],['https://cs.brown.edu/about/positions'],"@BrownCSDept is hiring multiple tenure-track faculty members at the level of Assistant Professor and one at the rank of Lecturer, Senior Lecturer, or Distinguished Senior Lecturer. To learn more and to apply, please see https://t.co/rN4KyWwPLD. https://t.co/X1w0RxXbTA","",['BrownCSDept'],108316299,Brown CS,BrownCSDept,false,http://pbs.twimg.com/profile_images/518118700411412480/gOiYoaIg_normal.jpeg,https://pbs.twimg.com/profile_banners/108316299/1418827893,http://abs.twimg.com/images/themes/theme15/bg.png,2333,373,11,4,0,8,2021-10-19T17:22:36.000-07:00
1450805618403684356,1451867878039379974,2021-10-23T11:07:31.000-07:00,"","","",['http://www.thetutortrust.org/how-to-apply'],"The Tutor Trust are hiring. You can earn £19 per hour and help disadvantaged primary and secondary students through tuition. Full training given and no previous experience required! If interested, have a look at https://t.co/dZxEjg4CrW|@ManchesterJobs @JCPinManchester @JobsinMCR","","['ManchesterJobs', 'JCPinManchester', 'JobsinMCR']",1392853874,sara,sarawhittaker_,false,http://pbs.twimg.com/profile_images/1402577303180283906/r-nuJMXq_normal.jpg,https://pbs.twimg.com/profile_banners/1392853874/1464027978,http://abs.twimg.com/images/themes/theme1/bg.png,456,441,5,0,0,3,2021-10-20T12:46:28.000-07:00
1451177967208513540,1451877287746576386,2021-10-23T11:44:54.000-07:00,"","","","",Lancaster County Prison Warden Cheryl Steberger says that the facility is down 84 correctional officer. That is an increase of 20 since a hiring and retention bonus package was implemented Sept. 1.,"","",3670207282,Carter Walker,CarterLNP,false,http://pbs.twimg.com/profile_images/1267859158533111810/saObKkW8_normal.jpg,https://pbs.twimg.com/profile_banners/3670207282/1544499374,http://abs.twimg.com/images/themes/theme1/bg.png,1242,399,12,1,2,5,2021-10-21T13:26:03.000-07:00
1451219487492083722,1451875730044985345,2021-10-23T11:38:43.000-07:00,https://twitter.com/people_in_need/status/1451219487492083722/photo/1,['http://pbs.twimg.com/media/FCPEbrkWQAgucOI.jpg'],['photo'],['https://buff.ly/3awP0EV'],Hiring alert! 🚨 ||We're looking for a Programs Director in #Iraq. Have at least 4 years of management experience of emergency and multi-sector projects? Interested in playing a lead role in expansion and development of PIN’s regional programming?||Apply: https://t.co/DcyYG34lWk https://t.co/h1YOazJMyO,['Iraq'],"",2776046834,People in Need,people_in_need,false,http://pbs.twimg.com/profile_images/1381904520096198658/Sr7gr8O7_normal.jpg,https://pbs.twimg.com/profile_banners/2776046834/1629188732,http://abs.twimg.com/images/themes/theme1/bg.png,4898,2398,3,1,0,3,2021-10-21T16:11:02.000-07:00
1451287020446248986,1451886373275795456,2021-10-23T12:21:00.000-07:00,"","","",['https://pngtree.com/freepng/we-are-hiring-vector-png-design-template_5481682.html?share=1'],We Are Hiring Vector Png Design Template https://t.co/G67AJ9jo7m,"","",46612530,shazzadul,shazzadul,false,http://pbs.twimg.com/profile_images/1188554712892637189/02YT35RZ_normal.jpg,https://pbs.twimg.com/profile_banners/46612530/1552206563,http://abs.twimg.com/images/themes/theme9/bg.gif,1316,5003,1,0,0,1,2021-10-21T20:39:23.000-07:00
1451508580188831750,1451878855841517570,2021-10-23T11:51:08.000-07:00,https://twitter.com/DrAmyMilton/status/1451508580188831750/photo/1,['http://pbs.twimg.com/tweet_video_thumb/FCTLW2AXoAcsRfh.jpg'],['animated_gif'],"['https://tinyurl.com/yzhbaczp', 'https://tinyurl.com/vyz4zkkj']",Are you interested in translational research? We are hiring! @MoreinLab and I have two postdoc positions for a fully translational project funded by @BBSRC. Trained in human or rodent research? We'd love to hear from you!|https://t.co/no3sFir46X|https://t.co/8yPWSkGeQi https://t.co/cVH9rrJs9c,"","['MoreinLab', 'BBSRC']",970150152,Dr Amy Milton,DrAmyMilton,false,http://pbs.twimg.com/profile_images/1351994968974483464/BM8QvIf__normal.jpg,"",http://abs.twimg.com/images/themes/theme1/bg.png,1512,1610,37,1,0,29,2021-10-22T11:19:47.000-07:00
1451515128000696320,1451867522534449153,2021-10-23T11:06:06.000-07:00,"","","",['https://getin4.com/job/front-office-supervisor-radisson-blu/'],"Hospitality #Job Opportunity in Nairobi, Kenya|Check out the details in the link below.|Front Office Supervisor Radisson Blu https://t.co/HRDFypHaKn via @getin41 #Career #IkoKaziKE #hiring","['Job', 'Career', 'IkoKaziKE', 'hiring']",['Getin41'],1329368040392241155,Getin4,Getin41,false,http://pbs.twimg.com/profile_images/1427199903390912517/eVXUIhI6_normal.jpg,https://pbs.twimg.com/profile_banners/1329368040392241155/1629106605,"",446,607,2,2,0,2,2021-10-22T11:45:49.000-07:00
1451540860072509449,1451868337063989248,2021-10-23T11:09:20.000-07:00,https://twitter.com/AaronBastani/status/1451540860072509449,"","",['https://novaramedia.com/about/jobs/'],". ⁦@novaramedia⁩ are presently hiring FIVE new staff members, as well as looking for freelancers. ||Help us continue to rapidly grow in 2022, and create a media for a different politics!  https://t.co/byVl91ip2Z","",['novaramedia'],63082578,Aaron Bastani,AaronBastani,false,http://pbs.twimg.com/profile_images/1238129881269051393/5Wu3KtXX_normal.jpg,https://pbs.twimg.com/profile_banners/63082578/1631221570,http://abs.twimg.com/images/themes/theme1/bg.png,94676,1646,507,8,35,143,2021-10-22T13:28:04.000-07:00
1451541297974628353,1451886198109220864,2021-10-23T12:20:19.000-07:00,https://twitter.com/CarryMe_Bikes/status/1451541297974628353/photo/1,['http://pbs.twimg.com/media/FCTpHX1WEAUW-3a.jpg'],['photo'],"",Please l👀k out for our @RidgebackBikes MK5 e-cargobike which was STOLEN yesterday 21/10 from the Hackney E8 area. Our customer who was hiring it is gutted. And so are we! @StolenRide  @hackney_cycling please re-tweet 🙏🏼😬😔😭😠😤 https://t.co/pA1gzmsSCs,"","['RidgebackBikes', 'StolenRide', 'hackney_cycling']",350382498,CarryMe Bikes C.I.C.,CarryMe_Bikes,false,http://pbs.twimg.com/profile_images/1661253826/Carry_Me_Bikes_logo_PNG_small_normal.png,https://pbs.twimg.com/profile_banners/350382498/1415033976,http://abs.twimg.com/images/themes/theme1/bg.png,2695,869,12,1,2,30,2021-10-22T13:29:48.000-07:00
1451541544910004226,1451884956267921417,2021-10-23T12:15:22.000-07:00,"","","","","Ok, so on the radio driving to work the story is : Pandemic benefits end Sat. Food banks are bracing for impact. ||As I see more “WERE HIRING” signs than I’ve ever seen in my life. From Truck drivers to food service workers. What am I missing here 🤔","","",904647037,Mike,Midnightrider98,false,http://pbs.twimg.com/profile_images/1276917143569747969/qftgL-sd_normal.jpg,https://pbs.twimg.com/profile_banners/904647037/1634046840,http://abs.twimg.com/images/themes/theme1/bg.png,4150,1532,436,8,95,90,2021-10-22T13:30:47.000-07:00
1451556442926891031,1451865896339787778,2021-10-23T10:59:38.000-07:00,https://twitter.com/cybersafehq/status/1451556442926891031/photo/1,"['http://pbs.twimg.com/media/FCT234VWQCokhS_.jpg', 'http://pbs.twimg.com/media/FCT234eX0AE8cHM.jpg', 'http://pbs.twimg.com/media/FCT234XWUAsZSlP.jpg', 'http://pbs.twimg.com/media/FCT234XXIAUuQcd.jpg']","['photo', 'photo', 'photo', 'photo']","",Will you like to join our team?||See the graphic for more information.||Tag a friend who you think has what it takes to function in any of these roles.||#cybersafe #vacancy #digitalmarketing #jobvacancy #hiring #jobsinnigeria https://t.co/Ur9RBJaK27,"['cybersafe', 'vacancy', 'digitalmarketing', 'jobvacancy', 'hiring', 'jobsinnigeria']","",1304112559935696901,Cybersafe Foundation,cybersafehq,false,http://pbs.twimg.com/profile_images/1304116725504528384/DDHFklHM_normal.jpg,https://pbs.twimg.com/profile_banners/1304112559935696901/1624978439,"",727,13,6,0,1,9,2021-10-22T14:29:59.000-07:00
1451558603093995522,1451884720044666885,2021-10-23T12:14:26.000-07:00,"","","",['https://recruiting2.ultipro.com/SAL1013SIBS/JobBoard/e9f055e1-a105-4f91-9a67-21aea61655fa/Opportunity/OpportunityDetail?opportunityId=63576aed-a718-483e-b5ba-01a4f260a8c3'],We are hiring a new Light Microscopy Specialist to join our growing team. Please spread the word!|https://t.co/mpZ6KUFnaW,"","",2927031541,Uri Manor,manorlaboratory,false,http://pbs.twimg.com/profile_images/714130090137878528/AXzJPm6n_normal.jpg,https://pbs.twimg.com/profile_banners/2927031541/1553484780,http://abs.twimg.com/images/themes/theme1/bg.png,8276,6594,101,3,0,82,2021-10-22T14:38:34.000-07:00
1451582078479384579,1451871740334952451,2021-10-23T11:22:52.000-07:00,"","","",['https://www.carres.uk/blog/?pid=10&nid=2&storyid=19'],Please share far and wide! Great opportunity ⁦@RobertCarreMAT⁩ ⁦@carresgrammar⁩⁩ ⁦@KSHSSA⁩ where we are recruiting for the post of Director of Finance &amp; Resources #education #finance #recruitment  https://t.co/bWnm8I56lH,"['education', 'finance', 'recruitment']","['RobertCarreMAT', 'carresgrammar', 'KSHSSA']",771356258,Ben Wills,BenW360Rural,false,http://pbs.twimg.com/profile_images/1447516217678471172/9ZrJ8cLJ_normal.jpg,https://pbs.twimg.com/profile_banners/771356258/1633949499,http://abs.twimg.com/images/themes/theme1/bg.png,1245,1166,5,0,0,3,2021-10-22T16:11:51.000-07:00
1451589566377467913,1451887661057249286,2021-10-23T12:26:07.000-07:00,https://twitter.com/NavigatorsScot/status/1451589566377467913/photo/1,['http://pbs.twimg.com/media/FCUVArcXoA8x2JL.jpg'],['photo'],['http://www.MAV.scot/jobs'],WE’RE HIRING!||We’re looking for a new @NavigatorsScot for @NHSTayside at Ninewells Hospital. ||To apply go to https://t.co/ogyJbJYWta |We’d love to hear from you! ||Closing 12th November @4pm https://t.co/rZ0syMBaqn,"","['NavigatorsScot', 'NHSTayside', '4pm']",713062612574068736,Navigator Scotland,NavigatorsScot,false,http://pbs.twimg.com/profile_images/1332977962795347968/aAoLyRKR_normal.jpg,https://pbs.twimg.com/profile_banners/713062612574068736/1617151143,http://abs.twimg.com/images/themes/theme1/bg.png,3738,1202,11,1,1,10,2021-10-22T16:41:36.000-07:00
1451589708727951388,1451886329797689344,2021-10-23T12:20:50.000-07:00,https://twitter.com/Anna_M_Johnson/status/1451589708727951388,"","","",Most of the towns and cities in Wake County have elections this fall. ||These mayors and council members set your property tax rate. They oversee the hiring of your police officers and firefighters. They decide on zoning and transportation issues. #wakepol,['wakepol'],"",23662741,Apparition 👻 Johnson,Anna_M_Johnson,true,http://pbs.twimg.com/profile_images/1445064400222801922/Jl0YBtNK_normal.jpg,https://pbs.twimg.com/profile_banners/23662741/1554478365,http://abs.twimg.com/images/themes/theme7/bg.gif,3629,2578,13,2,2,6,2021-10-22T16:42:10.000-07:00
1451592118993133591,1451885823050321926,2021-10-23T12:18:49.000-07:00,https://twitter.com/RicksterCDN/status/1451592118993133591/photo/1,['http://pbs.twimg.com/media/FCUXMb3XoBcSmNh.jpg'],['photo'],['https://careers.microsoft.com/us/en/job/1189721/Senior-Cloud-Advocate'],I am hiring the next Operations / IT Pro focused Cloud Advocate to join my team. Are you passionate about solving problems with technology solutions? Like to create content that helps people with modern hybrid environments? ||#GlobalRemoteRole #azOps ||https://t.co/PuPZiXdMAV https://t.co/yxOznmLFSo,"['GlobalRemoteRole', 'azOps']","",3352471,Rick Claus makin' the most of 2021,RicksterCDN,false,http://pbs.twimg.com/profile_images/1397399241425702915/4AeJfRA9_normal.jpg,https://pbs.twimg.com/profile_banners/3352471/1596822443,http://abs.twimg.com/images/themes/theme1/bg.png,11605,679,143,14,8,57,2021-10-22T16:51:45.000-07:00
1451598141057290252,1451883593291206657,2021-10-23T12:09:57.000-07:00,"","","",['https://amp.cnn.com/cnn/2021/10/22/politics/house-investigators-target-the-money-trail-behind-january-6-rally/index.html?__twitter_impression=true'],"@visionsurreal @capitolhunters @PiperK @RepRiggleman “…understands financial evidence &amp; the investigative pathways,'…she has previously worked on asset forfeiture issues and was a long-time trial attorney at DOJ.”||“Wick's hiring is a sign the committee is looking deeply at the financial issues.” https://t.co/Mhe6iSpgTm","","['visionsurreal', 'capitolhunters', 'PiperK', 'RepRiggleman']",901046351319846913,jonn mccly,JMccly,false,http://pbs.twimg.com/profile_images/1135901794876428289/RLHRhpQR_normal.png,https://pbs.twimg.com/profile_banners/901046351319846913/1591463589,"",296,346,29,2,2,7,2021-10-22T17:15:40.000-07:00
1451610012099518464,1451887851772260359,2021-10-23T12:26:53.000-07:00,https://twitter.com/OfficialBARCHQ/status/1451610012099518464/photo/1,['http://pbs.twimg.com/media/FCUnnJkXMAEdEHm.jpg'],['photo'],['https://www.barc.net/job-vacancy-barc-event-manager/'],WE’RE HIRING! ||We have a really exciting opportunity for the right candidate to join the British Automobile Racing Club within an expanded Competitions Department as an Event Manager for 2022.||Find out more here ➡️ https://t.co/zJ6o9wqPlu||#BARC https://t.co/rT2YXtqAuH,['BARC'],"",2335401582,BARC,OfficialBARCHQ,false,http://pbs.twimg.com/profile_images/1113728089152991232/ZpY-AlZr_normal.jpg,https://pbs.twimg.com/profile_banners/2335401582/1575385021,http://abs.twimg.com/images/themes/theme1/bg.png,11556,89,9,1,0,6,2021-10-22T18:02:51.000-07:00
1451613683843571712,1451883391138234373,2021-10-23T12:09:09.000-07:00,"","","",['https://bayrising.org/jobs/'],"Are you or someone you know looking to join a team with a collaborative and supportive work environment committed to organizing for low-income and working-class immigrant, Black, Latinx, Asian, and Pacific Islander communities? We're hiring! https://t.co/CQrez5JN2U","","",786689594708336640,Bay Rising,_BayRising,false,http://pbs.twimg.com/profile_images/955964351348748288/oNE9MIGA_normal.jpg,https://pbs.twimg.com/profile_banners/786689594708336640/1589647858,http://abs.twimg.com/images/themes/theme1/bg.png,2766,646,0,0,0,1,2021-10-22T18:17:26.000-07:00
1451618340120715268,1451888424504504324,2021-10-23T12:29:09.000-07:00,"","","",['https://careers.tiktok.com/m/position/7020742777475811621/detail'],"Tik Tok is hiring a Public Policy Manager for Sub-Saharan Africa. Ability to read and write French, and an understanding of Francophone Africa are requirements. ||Apply here: https://t.co/6oLKUOmdnc","","",156625228,Rufai,Sir_Ruffy,false,http://pbs.twimg.com/profile_images/1447608435592384518/_rWkFrO4_normal.jpg,https://pbs.twimg.com/profile_banners/156625228/1627753634,http://abs.twimg.com/images/themes/theme4/bg.gif,20974,1539,20,1,1,51,2021-10-22T18:35:56.000-07:00
1451621133619449859,1451869449863274501,2021-10-23T11:13:45.000-07:00,https://twitter.com/TruRating/status/1451621133619449859/photo/1,['http://pbs.twimg.com/media/FCUxuW6WYAk35U3.jpg'],['photo'],['https://apply.workable.com/trurating/j/CBA363CBE6/'],"TruRating London is hiring - if you consider yourself technically savvy and infrastructurally secure, we might just have the dream job for you - get those applications in stat!  #hiring #devops #devlife https://t.co/qaSAViyz3p https://t.co/6ca42Hlx69","['hiring', 'devops', 'devlife']","",1727904870,TruRating,TruRating,false,http://pbs.twimg.com/profile_images/1080398583000633345/qwFLWNM3_normal.jpg,https://pbs.twimg.com/profile_banners/1727904870/1577110682,http://abs.twimg.com/images/themes/theme1/bg.png,1214,2139,0,0,0,2,2021-10-22T18:47:02.000-07:00
1451643609418190855,1451875791869026308,2021-10-23T11:38:57.000-07:00,"","","",['https://www.uwo.ca/facultyrelations/careers/pdf/Science_Earth-Science_Sedimentary-Geology_2021.pdf'],Please share widely! Our department is hiring an Assistant Professor in Sedimentary Geology https://t.co/YYEPGTyXu3 #AcademicTwitter @westernuSpace @westernuEarth #planetaryscience,"['AcademicTwitter', 'planetaryscience']","['westernuSpace', 'westernuEarth']",420555022,Gordon Oz Osinski,drcrater,false,http://pbs.twimg.com/profile_images/1018659789893701633/o1P561_9_normal.jpg,https://pbs.twimg.com/profile_banners/420555022/1531702351,http://abs.twimg.com/images/themes/theme15/bg.png,5023,2965,25,1,0,22,2021-10-22T20:16:21.000-07:00
1451646993714008076,1451885488869085189,2021-10-23T12:17:29.000-07:00,https://twitter.com/alasdairroberts/status/1451646993714008076,"","","",".@YorkUSPPA is hiring, tenure-track appointment in Indigenous governance and justice in Canada","",['YorkUSPPA'],16641837,Alasdair Roberts,AlasdairRoberts,false,http://pbs.twimg.com/profile_images/1281659474768547848/Z3PIH6dx_normal.jpg,https://pbs.twimg.com/profile_banners/16641837/1433626771,http://abs.twimg.com/images/themes/theme1/bg.png,2953,529,4,1,0,2,2021-10-22T20:29:48.000-07:00
1451652132210421761,1451884887796027403,2021-10-23T12:15:06.000-07:00,"","","","","If you're looking for a multinational gaming organization to represent we would love to speak w/ you. ||Full creative freedom, free editing and graphic service, and so much more. ||Bang our recruitment line @D6Recruiting ||#WeAre #StrongerAsONE ||@SGH_RTs @BlazedRTs @GamerGalsRT","['WeAre', 'StrongerAsONE']","['D6Recruiting', 'SGH_RTs', 'BlazedRTs', 'GamerGalsRT']",1050232443465334784,Team Deep Six,DeepSixGaming,false,http://pbs.twimg.com/profile_images/1444092789298454528/I_RMnbDQ_normal.jpg,https://pbs.twimg.com/profile_banners/1050232443465334784/1633133526,"",450,40,4,0,1,5,2021-10-22T20:50:13.000-07:00
1451668798713516041,1451871007858434049,2021-10-23T11:19:57.000-07:00,"","","","","Parliament is usually a quiet place on a Friday.||Except today, every Tory minister made sure they were in the house to vote, so that unscrupulous employers can carry on firing their workers and then re-hiring them for less pay.||Just let that sink in.","","",633066595,Lisa Forbes,LisaForbes_,false,http://pbs.twimg.com/profile_images/1295857921272815616/WXGHPXr2_normal.jpg,https://pbs.twimg.com/profile_banners/633066595/1620626925,http://abs.twimg.com/images/themes/theme9/bg.gif,8755,2153,18,0,1,9,2021-10-22T21:56:26.000-07:00
1451679960876257280,1451878910929502215,2021-10-23T11:51:21.000-07:00,https://twitter.com/ddiakopoulos/status/1451679960876257280/photo/1,['http://pbs.twimg.com/media/FCVm6B_UYAMcMEZ.jpg'],['photo'],['https://jobs.apple.com/en-us/details/200222899/ar-vr-research-engineer'],"My team is hiring another AR/VR Research Engineer... come work with me at Apple! This role is at the intersection of research, prototyping, and technical art. https://t.co/XHq7H66eQi https://t.co/2MAdVNT8A1","","",326451628,Dimitri Diakopoulos,ddiakopoulos,false,http://pbs.twimg.com/profile_images/1351248933998104576/j-zZQl3t_normal.jpg,https://pbs.twimg.com/profile_banners/326451628/1543712101,http://abs.twimg.com/images/themes/theme9/bg.gif,6705,2889,155,3,3,61,2021-10-22T22:40:48.000-07:00
1451765487885590532,1451886232682835969,2021-10-23T12:20:27.000-07:00,https://twitter.com/BryanDawsonUSA/status/1451765487885590532/photo/1,['http://pbs.twimg.com/media/FCW1BF1XEAIJKC1.jpg'],['photo'],"","Tax cuts for those that have everything do NOTHING to grow economy. Corporations aren’t magical job creators. ONLY DEMAND creates jobs. Cut taxes on working families to circulate dollars, spur demand, force hiring &amp; wage growth. Rich get richer anyway||#TrickleUp #BuildBackBetter https://t.co/MKWUFNNZ3a","['TrickleUp', 'BuildBackBetter']","",997682274,Bryan Dawson,BryanDawsonUSA,false,http://pbs.twimg.com/profile_images/1254478555339243520/PAfPDft7_normal.jpg,https://pbs.twimg.com/profile_banners/997682274/1442695988,http://abs.twimg.com/images/themes/theme1/bg.png,95211,54370,31,1,1,20,2021-10-23T04:20:39.000-07:00
1451799022323175430,1451878539842654209,2021-10-23T11:49:53.000-07:00,"","","","",@GabbbarSingh I want to know if Siddhartha's dad is hiring. Asking for a friend.,"",['GabbbarSingh'],1454197429,Praava,Praava97,false,http://pbs.twimg.com/profile_images/1368863982107250691/XV3ooqz8_normal.jpg,https://pbs.twimg.com/profile_banners/1454197429/1615197663,http://abs.twimg.com/images/themes/theme1/bg.png,83,911,24,0,0,2,2021-10-23T06:33:54.000-07:00
1451805229289197573,1451869379042422784,2021-10-23T11:13:29.000-07:00,"","","","",@brendora85 And join us next week as we look at how Pyromaniacs can fill the gap in Fire and Rescue recruitment,"",['brendora85'],110503577,Joe,onekinghenrik,false,http://pbs.twimg.com/profile_images/1445858799462457347/Q9Q6DHl0_normal.jpg,"",http://abs.twimg.com/images/themes/theme1/bg.png,1740,1401,8,0,0,1,2021-10-23T06:58:34.000-07:00
1451810370180423684,1451872911028019201,2021-10-23T11:27:31.000-07:00,https://twitter.com/artukdotorg/status/1451810370180423684/photo/1,['http://pbs.twimg.com/media/FCTokBaXIAMJSjq.jpg'],['photo'],['https://artuk.org/about/jobs'],"Are you 16–24, on universal credit and looking to get experience in an arts charity?||Thanks to @charityworksUK we're hiring for the role of Editorial and Communications Assistant, as part of the government's #Kickstart scheme||Details 👉 https://t.co/yVqDHw3tr4 https://t.co/sATcWZSkLO",['Kickstart'],['charityworksUK'],278096867,Art UK,artukdotorg,true,http://pbs.twimg.com/profile_images/1214847052993183744/8icCCU6M_normal.jpg,https://pbs.twimg.com/profile_banners/278096867/1584455239,http://abs.twimg.com/images/themes/theme1/bg.png,53873,16838,6,0,0,9,2021-10-23T07:19:00.000-07:00
