org_id,samp_id,samp_datetime,org_url,org_media_url,org_media_type,org_attached_links,org_text,org_hashtags,org_user_metions,user_id,user_name,user_screen_name,user_verified,user_profile_image_url,user_profile_banner_url,user_profile_background_image_url,user_followers_count,user_friends_count,org_favorite_count,org_quote_count,org_reply_count,org_retweet_count,org_datetime
1449048951907364868,1451865794997063683,2021-10-23T10:59:14.000-07:00,"","","",['https://getin4.com/job/payroll-deployment-specialist-maersk/'],Job opportunity at Maersk Kenya|Payroll Deployment Specialist – Maersk https://t.co/wFWzaWqTp8 via @getin41 #JobSearch #hiring  #Career #Careers,"['JobSearch', 'hiring', 'Career', 'Careers']",['Getin41'],1329368040392241155,Getin4,Getin41,false,http://pbs.twimg.com/profile_images/1427199903390912517/eVXUIhI6_normal.jpg,https://pbs.twimg.com/profile_banners/1329368040392241155/1629106605,"",446,607,1,0,0,3,2021-10-15T16:26:06.000-07:00
1449949890834931712,1451885451766161411,2021-10-23T12:17:21.000-07:00,https://twitter.com/MonstaOfficial_/status/1449949890834931712/photo/1,['http://pbs.twimg.com/media/FB9AOw_VQAQPq7v.jpg'],['photo'],"",[‼️] #Monsta is HIRING!|🔸3D Render &amp; Lighting Artist|🔸3D Modeller &amp; Rigger|🔸3D Layout Artist|🔸3D Animator|🔸Concept Artist|🔸Compositor|🔸Producer||Email us👉 career@animonsta(dot)com|[‼️] Kindly RT for others!||#AniMy #BoBoiBoy #Mechamato #PapaPipi #FlyWithYaya #Recruitment https://t.co/m2RRQUjWee,"['Monsta', 'AniMy', 'BoBoiBoy', 'Mechamato', 'PapaPipi', 'FlyWithYaya', 'Recruitment']","",1215088614712856576,Monsta™,MonstaOfficial_,false,http://pbs.twimg.com/profile_images/1409370970662457346/DJdi3jWi_normal.jpg,https://pbs.twimg.com/profile_banners/1215088614712856576/1589513782,"",6827,88,209,4,0,106,2021-10-18T04:06:07.000-07:00
1450202535235489792,1451863128233365505,2021-10-23T10:48:38.000-07:00,"","","",['https://jobs.lever.co/islands'],"@IslandsXYZ are you hard working, constantly curious, and interested in working in web3?||we're hiring for many roles!||🥷 chief of staff, biz dev manager|🤠 community manager, social media|🛠 head of engineering, frontend, infra, iOS, crypto, product designer||https://t.co/uG1d2WooP2","",['IslandsXYZ'],2458844640,TZ 🏝️,TZhongg,true,http://pbs.twimg.com/profile_images/1430349955449847815/tVxDcRQN_normal.jpg,https://pbs.twimg.com/profile_banners/2458844640/1615068563,http://abs.twimg.com/images/themes/theme17/bg.gif,41697,2,270,13,61,78,2021-10-18T20:50:02.000-07:00
1450415036489342980,1451871185130508288,2021-10-23T11:20:39.000-07:00,"","","","","#आईटीआई_इंस्ट्रक्टर_भर्ती_adv_12_2019_पूरी_करो Instructors on DC Rate want to hang recruitment, disregarding the order of Hon'ble Supreme Court. We request the government to get the final result of recruitment and get the selected candidate to join soon!|@HSSCorg_in @OPDhankar",['आईटीआई_इंस्ट्रक्टर_भर्ती_adv_12_2019_पूरी_करो'],"['HSSCorg_in', 'OPDhankar']",4634789178,KESHAV GIRDHAR,keshavgirdhar,false,http://pbs.twimg.com/profile_images/1417751419495407616/F1y4Kz-__normal.jpg,https://pbs.twimg.com/profile_banners/4634789178/1626853308,"",32,48,9,0,0,19,2021-10-19T10:54:26.000-07:00
1450425281542512645,1451882994529013760,2021-10-23T12:07:35.000-07:00,https://twitter.com/nctdw127_genie/status/1450425281542512645,"","",['https://docs.google.com/forms/d/e/1FAIpQLSfKFCRdrwfWoviCHZWNVb_RHMz1wZDBARZKHb2X3kgIZdveYQ/viewform'],"💚GENIE STREAMING |TEAM RECRUITMENT 💚||🗓 Recruitment period : Oct 12th 2021 - D-2 Comeback.||If you interested to join our team, please fill form below and pick your best schedule/s.||https://t.co/rhLCJ96AEn","","",1189047908122820609,NCT 127 Project 📌,nctdw127_genie,false,http://pbs.twimg.com/profile_images/1308403272563200010/RTFP48N6_normal.jpg,https://pbs.twimg.com/profile_banners/1189047908122820609/1586667510,"",18392,10,7,0,1,6,2021-10-19T11:35:09.000-07:00
1450768278843006976,1451882635425427462,2021-10-23T12:06:09.000-07:00,https://twitter.com/LevelsetPymtCom/status/1450768278843006976/photo/1,['http://pbs.twimg.com/media/FCIqD6TWYAU1DZJ.jpg'],['photo'],"","*HIRING*|Looking for a Credit Manager for a construction supplier in Addison, TX. Entry level to experienced.|Strong company, top in their field with great benefits and room to grow!!|DM me for more information |#credit #leadership #construction #Management #creditmanager #hiring https://t.co/uUPuJgta12","['credit', 'leadership', 'construction', 'Management', 'creditmanager', 'hiring']","",1378474937950863360,"Lori J Drake, CBA",LevelsetPymtCom,false,http://pbs.twimg.com/profile_images/1391553094052352003/7CbS8prX_normal.jpg,https://pbs.twimg.com/profile_banners/1378474937950863360/1634856040,"",80,859,0,0,0,1,2021-10-20T10:18:06.000-07:00
1451079894591361025,1451873653818155023,2021-10-23T11:30:28.000-07:00,https://twitter.com/BP_VotingTeam/status/1451079894591361025/photo/1,['http://pbs.twimg.com/media/FCNFeMLUYAc9Jfe.jpg'],['photo'],"","📢 [AAA Voting Team Recruitment]||In order to be more organize during mass voting and special announcement purposes, we are recruiting members for our GC (Project Inkisang: AAA) Just DM @BP_VotingTeam2 to join.||#BLACKPINK @BLACKPINK https://t.co/rJMWltVIkC",['BLACKPINK'],"['BP_VotingTeam2', 'BLACKPINK']",942579754481229824,BLΛCKPIИK Voting Team,BP_VotingTeam,false,http://pbs.twimg.com/profile_images/1396011917387337731/s7EmdWwk_normal.jpg,https://pbs.twimg.com/profile_banners/942579754481229824/1621671229,http://abs.twimg.com/images/themes/theme1/bg.png,155800,156,631,2,4,256,2021-10-21T06:56:21.000-07:00
1451193332638502921,1451888651294683141,2021-10-23T12:30:03.000-07:00,"","","",['https://www.jobs.manchester.ac.uk/displayjob.aspx?isPreview=Yes&jobid=21139'],"We're hiring! ||Interested in deep subsurface microbiology? Have anaerobic cultivation &amp; bioinformatics experience? Want to work @ interface of microb. ecology, energy industry &amp; biotech? 3yr postdoc on C-cycling in geological CO2 storage in @UoMMIB 👇 |https://t.co/AIplTvoyuw","",['UoMMIB'],167431421,Sophie Nixon,SophieLNixon,false,http://pbs.twimg.com/profile_images/1450221975088009217/fVNHQaEI_normal.jpg,https://pbs.twimg.com/profile_banners/167431421/1631182341,http://abs.twimg.com/images/themes/theme19/bg.gif,1325,1220,72,1,0,71,2021-10-21T14:27:07.000-07:00
1451227094143447052,1451869229448302592,2021-10-23T11:12:53.000-07:00,"","","",['https://www.jobs.ac.uk/job/CJV812/senior-strategist'],"Dear followers, I'm introducing Faculty for a Future - set up to help academics who care about the future of the planet to speak out more effectively, and as a group rather than all by themselves. We're now hiring: https://t.co/AieX3fB4fL","","",47631826,Wolfgang Knorr,w_knorr,false,http://pbs.twimg.com/profile_images/1171075806912815104/a_mWlvyA_normal.jpg,"",http://abs.twimg.com/images/themes/theme1/bg.png,930,158,74,5,5,39,2021-10-21T16:41:16.000-07:00
1451287268342198279,1451886422432964608,2021-10-23T12:21:12.000-07:00,"","","",['https://pngtree.com/freepng/we-are-hiring-png-vector-design-template_5478766.html?share=1'],We Are Hiring Png Vector Design Template https://t.co/PiDLt41xAk,"","",46612530,shazzadul,shazzadul,false,http://pbs.twimg.com/profile_images/1188554712892637189/02YT35RZ_normal.jpg,https://pbs.twimg.com/profile_banners/46612530/1552206563,http://abs.twimg.com/images/themes/theme9/bg.gif,1316,5003,1,0,0,1,2021-10-21T20:40:23.000-07:00
1451314809211871242,1451876933894090754,2021-10-23T11:43:30.000-07:00,"","","","",My job is hiring. I like it. You need a Bachelors in psych. It’s full-time but not a 9-5 and salaried. I work with young moms and their babies to make sure everybody is on track (academically [mom] and developmentally [baby]). I can answer questions folks have.,"","",1031004306651209729,😘✊🏽,ThatGirlAly_,false,http://pbs.twimg.com/profile_images/1236505048135471105/Ux4JGyZT_normal.jpg,https://pbs.twimg.com/profile_banners/1031004306651209729/1534646090,http://abs.twimg.com/images/themes/theme1/bg.png,1019,2240,102,0,3,61,2021-10-21T22:29:49.000-07:00
1451431727059120153,1451874143004155910,2021-10-23T11:32:24.000-07:00,"","","","",@selinarashid @LotusPakistan That's advice friends get for free. My point wasn't to help you fix your bio but to fix the sense of entitlement. You're not hiring them. They're hiring you. You may teach them but you'll learn from them. Ability to hire someone is something sacred. Approach it with that respect,"","['selinarashid', 'LotusPakistan']",25535815,Habibullah Khan,Huk06,false,http://pbs.twimg.com/profile_images/1431300729537449984/Ih68wa0g_normal.jpg,https://pbs.twimg.com/profile_banners/25535815/1634812741,http://abs.twimg.com/images/themes/theme9/bg.gif,13351,7001,23,0,2,2,2021-10-22T06:14:24.000-07:00
1451490830842204193,1451864009804849152,2021-10-23T10:52:08.000-07:00,https://twitter.com/PowerTheFightUK/status/1451490830842204193,['http://pbs.twimg.com/media/FCS7NyfWUAMtbvG.jpg'],['photo'],['https://jobs.theguardian.com/job/7453898/clinical-lead/'],WE ARE HIRING🎉⁠|⁠|-Clinical Lead⁠|-Full-time or part-time (4 days per week)⁠|-3 year contract⁠|⁠|These roles are subject to an Enhanced DBS check.⁠|⁠|To apply or read the full job description click here 👉 https://t.co/9FyE2wS1nj https://t.co/wXK8SFij2H,"","",928655937249906688,POWER THE FIGHT,PowerTheFightUK,false,http://pbs.twimg.com/profile_images/1445410669302587403/L-5Cr24u_normal.jpg,https://pbs.twimg.com/profile_banners/928655937249906688/1527711161,http://abs.twimg.com/images/themes/theme1/bg.png,1845,174,8,1,0,8,2021-10-22T10:09:16.000-07:00
1451494423485878285,1451887072055382019,2021-10-23T12:23:47.000-07:00,https://twitter.com/SolarTaxiGh/status/1451494423485878285/photo/1,['http://pbs.twimg.com/media/FCS-eZhXMAEoW6p.jpg'],['photo'],"",Vacancy! Vacancy! Vacancy!!||There’s an open vacancy for a “Full Stack Developer”. ||Are you a resident in Accra?|Do you have the necessary skills and wish to join our company?|.|.|.|#solartaxi #hiring #solartaxigh #vacancy #software #softwaredeveloper #developer https://t.co/9VPO2zUWMB,"['solartaxi', 'hiring', 'solartaxigh', 'vacancy', 'software', 'softwaredeveloper', 'developer']","",1106527638292758529,SolarTaxi,SolarTaxiGh,false,http://pbs.twimg.com/profile_images/1356182444026847233/u8BT42UU_normal.jpg,https://pbs.twimg.com/profile_banners/1106527638292758529/1627897832,"",771,65,5,0,0,7,2021-10-22T10:23:32.000-07:00
1451513247119646732,1451867208066420739,2021-10-23T11:04:51.000-07:00,https://twitter.com/Getin41/status/1451513247119646732,"","",['https://getin4.com/job/fhi-360-finance-assistant/'],Accounting and Finance #Job |Check out the details below|FHI 360 Finance Assistant https://t.co/ikXryjpelM via @getin41 #Jobs #Career #hiring #IkoKaziKE,"['Job', 'Jobs', 'Career', 'hiring', 'IkoKaziKE']",['Getin41'],1329368040392241155,Getin4,Getin41,false,http://pbs.twimg.com/profile_images/1427199903390912517/eVXUIhI6_normal.jpg,https://pbs.twimg.com/profile_banners/1329368040392241155/1629106605,"",446,607,3,2,0,3,2021-10-22T11:38:20.000-07:00
1451516039578234889,1451867596467408899,2021-10-23T11:06:24.000-07:00,"","","",['https://getin4.com/job/youth-liaison-officer-usiu/'],Youth Liaison Officer USIU  https://t.co/ULGlCcfXxF via @getin41 |Job Opportunity at USIU #Career #IkoKaziKE #hiring,"['Career', 'IkoKaziKE', 'hiring']",['Getin41'],1329368040392241155,Getin4,Getin41,false,http://pbs.twimg.com/profile_images/1427199903390912517/eVXUIhI6_normal.jpg,https://pbs.twimg.com/profile_banners/1329368040392241155/1629106605,"",446,607,2,0,0,1,2021-10-22T11:49:26.000-07:00
1451541368602497024,1451863048319209475,2021-10-23T10:48:19.000-07:00,"","","","","@PnPCBC @CQualtro Qualtro just stepped in it big time. This is my area &amp; I assure you, she's completely out to lunch on this.|Conditions of Employment are determined DURING the hiring process. This is not a 'choice' either. It's an ultimatum.|🇨🇦 employment lawyers are going to make a killing.","","['PnPCBC', 'CQualtro']",1182673243095871493,Jodi 🇨🇦,jodisp2019,false,http://pbs.twimg.com/profile_images/1443270912426577930/WnXJz8f6_normal.jpg,https://pbs.twimg.com/profile_banners/1182673243095871493/1632280048,"",1721,1155,54,0,2,17,2021-10-22T13:30:05.000-07:00
1451567944526438402,1451883697708453891,2021-10-23T12:10:22.000-07:00,https://twitter.com/YSInow/status/1451567944526438402/photo/1,['http://pbs.twimg.com/media/FCUBI1VWQAkAdFK.jpg'],['photo'],"['http://www.activelink.ie/node/85757', 'http://www.activelink.ie/node/85758']","We're hiring for two exciting roles on our Communications Team! We are currently seeking a Digital Engagement &amp; Campaigns Coordinator (https://t.co/kJx3srdJsU) as well as a Communications, Marketing &amp; Experience Manager (https://t.co/wNhAN6Eq4A). Apply today! #jobfairy https://t.co/PWelqTKJYK",['jobfairy'],"",260341496,Young Social Innovators,YSInow,true,http://pbs.twimg.com/profile_images/1146001787129872384/HsXRWXfb_normal.png,https://pbs.twimg.com/profile_banners/260341496/1629718970,http://abs.twimg.com/images/themes/theme15/bg.png,8285,2759,5,0,0,4,2021-10-22T15:15:41.000-07:00
1451608946691633157,1451883066578849798,2021-10-23T12:07:52.000-07:00,"","","",['https://www.linkedin.com/jobs/view/2768738667/'],We are hiring a Postdoctoral Associate. | |https://t.co/eiIVwfW1QS||We have developed molecular tools to map and manipulate microRNA-target interactions in specific cell types of the brain.,"","",1000150819923050496,LippiLab,LippiLab,false,http://pbs.twimg.com/profile_images/1000858550518693888/gKfP7GTp_normal.jpg,https://pbs.twimg.com/profile_banners/1000150819923050496/1548729628,"",661,802,23,4,1,17,2021-10-22T17:58:37.000-07:00
1451618364787396611,1451868340721438722,2021-10-23T11:09:21.000-07:00,https://twitter.com/espioj/status/1451618364787396611/photo/1,"['http://pbs.twimg.com/media/FCUvMeWXoAUgEuM.jpg', 'http://pbs.twimg.com/media/FCUvM6-XMAQWMi0.jpg', 'http://pbs.twimg.com/media/FCUvNZRXMAIuhdk.jpg']","['photo', 'photo', 'photo']","",#FixTheCountry|#DearGhana||Rising Academy Network  is #hiring! BUSINESS &amp; MARKETING MANAGER #jobtube #ghana #vacancy #employment #jobseekers #jobsearch||(✔️Please exercise due diligence in all aspects of your job hunt and always treat your personal safety as a top priority) https://t.co/ByRdaK3dXj,"['FixTheCountry', 'DearGhana', 'hiring', 'jobtube', 'ghana', 'vacancy', 'employment', 'jobseekers', 'jobsearch']","",235647698,JobTube Ghana || Your #1 Job Hunting Partner,espioj,false,http://pbs.twimg.com/profile_images/1434908623453495297/mS6DuqiH_normal.jpg,https://pbs.twimg.com/profile_banners/235647698/1630943789,http://abs.twimg.com/images/themes/theme1/bg.png,8327,174,5,0,0,4,2021-10-22T18:36:02.000-07:00
1451620339784450048,1451885938003566595,2021-10-23T12:19:17.000-07:00,"","","","","👋 Hello! The Shortcuts team is hiring an intern for winter|spring|summer 2022 with some exp working on apps or frameworks for iOS, macOS, or watchOS. You’ll get to work with Obj-C, Swift, UIKit, AppKit, &amp; SwiftUI. If this sounds fun to you, please DM me your resume. Thanks! 😊","","",21150267,Ayaka Nonaka,ayanonagon,true,http://pbs.twimg.com/profile_images/788592417750605824/lfgK-ZoH_normal.jpg,https://pbs.twimg.com/profile_banners/21150267/1476850112,http://abs.twimg.com/images/themes/theme1/bg.png,21154,1022,208,6,10,71,2021-10-22T18:43:53.000-07:00
1451639512682086412,1451888693774626816,2021-10-23T12:30:14.000-07:00,https://twitter.com/TheElmTreeCoLLC/status/1451639512682086412/video/1,['http://pbs.twimg.com/ext_tw_video_thumb/1451639011076870149/pu/img/ozDAkC_wLFl84rkG.jpg'],['video'],['https://www.theelmtreehomesalespartycompanyllc.store/store'],#folloback #FollowFriday #followbackFriday #Followme and #Retweet #RT to #win a #free bottle of #Bodywash| |#Couponcode SHOPEARLY save 25% |https://t.co/NoxupBRlYw ||#Sale #christmas #shopping #shopfromhome #workfromhome #Hiring #Sales https://t.co/41jSV0toYo,"['folloback', 'FollowFriday', 'followbackFriday', 'Followme', 'Retweet', 'RT', 'win', 'free', 'Bodywash', 'Couponcode', 'Sale', 'christmas', 'shopping', 'shopfromhome', 'workfromhome', 'Hiring', 'Sales']","",1901778662,TheElmTreeComany,TheElmTreeCoLLC,false,http://pbs.twimg.com/profile_images/1436384810226831367/PoAmHg___normal.jpg,https://pbs.twimg.com/profile_banners/1901778662/1634941848,http://abs.twimg.com/images/themes/theme1/bg.png,452,1064,3,0,0,4,2021-10-22T20:00:04.000-07:00
1451640731001663495,1451868269741215747,2021-10-23T11:09:04.000-07:00,https://twitter.com/espioj/status/1451640731001663495/photo/1,['http://pbs.twimg.com/media/FCVDizxXMAQ8hKV.jpg'],['photo'],"",#FixTheCountryNow|#FixTheCountry|#DearGhana||Olam is #hiring! ENGINEERING STORES OFFICER #jobtube #ghana #vacancy #employment #jobseekers #jobsearch||(✔️Please exercise due diligence in all aspects of your job hunt and always treat your personal safety as a top priority) https://t.co/AaJEpaAgMC,"['FixTheCountryNow', 'FixTheCountry', 'DearGhana', 'hiring', 'jobtube', 'ghana', 'vacancy', 'employment', 'jobseekers', 'jobsearch']","",235647698,JobTube Ghana || Your #1 Job Hunting Partner,espioj,false,http://pbs.twimg.com/profile_images/1434908623453495297/mS6DuqiH_normal.jpg,https://pbs.twimg.com/profile_banners/235647698/1630943789,http://abs.twimg.com/images/themes/theme1/bg.png,8327,174,5,0,0,2,2021-10-22T20:04:55.000-07:00
1451640999814512643,1451886278300127233,2021-10-23T12:20:38.000-07:00,https://twitter.com/SpeakLifeUK/status/1451640999814512643,"","",['https://speaklife.org.uk/jobs/'],We're hiring! Do you have the vision and skills to help plan and build infrastructure around a growing and vibrant ministry? We're looking for a full time Operations Director for our Eastbourne office. Please RT and/or send to interested folk.||https://t.co/QKwAoGW52K,"","",22123666,Speak Life,SpeakLifeUK,false,http://pbs.twimg.com/profile_images/1189879770684755975/nEJq40fM_normal.jpg,https://pbs.twimg.com/profile_banners/22123666/1614960770,http://abs.twimg.com/images/themes/theme1/bg.png,3712,1075,2,1,0,2,2021-10-22T20:05:59.000-07:00
1451650454207746058,1451868011481157634,2021-10-23T11:08:02.000-07:00,"","","",['https://cutt.ly/WRWSAYn'],#FixTheCountry|#DearGhana||FAO is #hiring! YOUNG PROFESSIONAL OFFICER (Food Loss &amp; Waste) #jobtube #ghana #vacancy #jobseekers #jobsearch @FAOGhana||👉https://t.co/kpxJB3104e||(✔️Please exercise due diligence in your job hunt &amp; always treat your personal safety as a top priority),"['FixTheCountry', 'DearGhana', 'hiring', 'jobtube', 'ghana', 'vacancy', 'jobseekers', 'jobsearch']",['FAOGhana'],235647698,JobTube Ghana || Your #1 Job Hunting Partner,espioj,false,http://pbs.twimg.com/profile_images/1434908623453495297/mS6DuqiH_normal.jpg,https://pbs.twimg.com/profile_banners/235647698/1630943789,http://abs.twimg.com/images/themes/theme1/bg.png,8327,174,5,0,0,2,2021-10-22T20:43:33.000-07:00
1451663652017381385,1451877868594737155,2021-10-23T11:47:13.000-07:00,"","","",['https://app.trinethire.com/companies/35869-joshin/jobs/50059-finance-manager?source=twitter'],"Really excited to share this career opportunity with you all! Do you know someone who has experience in finance and is looking to join a fast-growing, mission-driven, VC-backed startup? @joshincare is hiring a Finance Manager:|https://t.co/hTJurVrxce","",['joshincare'],1099380374084505605,Melanie Fountaine,Mel_Fountaine,false,http://pbs.twimg.com/profile_images/1352575624599232515/diwITIex_normal.jpg,https://pbs.twimg.com/profile_banners/1099380374084505605/1590149974,http://abs.twimg.com/images/themes/theme1/bg.png,518,694,4,0,0,4,2021-10-22T21:35:59.000-07:00
1451669588043649028,1451881107121754117,2021-10-23T12:00:05.000-07:00,https://twitter.com/mattgonzalesmd/status/1451669588043649028,"","",['https://www.providenceiscalling.jobs/gardena-ca/director-informatics-institute-for-human-caring/102B790718634CE29D238FE39753539E/job/'],"Calling all #pallitech folks! As I transition into CMO role @Human_Caring, I'm going to be hiring a new Director of Informatics. This person will lead our EHR strategy for palliative and whole person care. Our team is great! Come join us! #hpm https://t.co/vBWNomq6u6","['pallitech', 'hpm']",['Human_Caring'],573020073,Matthew Gonzales,mattgonzalesmd,false,http://pbs.twimg.com/profile_images/855458993916989440/XybcyptW_normal.jpg,"",http://abs.twimg.com/images/themes/theme1/bg.png,1428,1087,15,2,2,7,2021-10-22T21:59:35.000-07:00
1451685141554896909,1451877441589362695,2021-10-23T11:45:31.000-07:00,https://twitter.com/strongholdpay/status/1451685141554896909,['http://pbs.twimg.com/media/FCVr8YcWYAQU9iW.jpg'],['photo'],['https://hubs.li/H0ZXSvF0'],Stronghold is #hiring a Head of Marketing!||Are you a team player who wants to join a fast-growing company building the future of #payments and #fintech?||Apply today at  https://t.co/2S0pPzbQ6B https://t.co/ljCfOvcAwQ,"['hiring', 'payments', 'fintech']","",80364416,Stronghold,strongholdpay,false,http://pbs.twimg.com/profile_images/1395379043269107715/neB2XQ-j_normal.jpg,https://pbs.twimg.com/profile_banners/80364416/1619796733,http://abs.twimg.com/images/themes/theme1/bg.png,6637,54,90,22,5,42,2021-10-22T23:01:23.000-07:00
1451696887636049928,1451863454793486336,2021-10-23T10:49:56.000-07:00,https://twitter.com/infosec_jobsCOM/status/1451696887636049928/photo/1,['http://pbs.twimg.com/media/FCV2oBBXIAULq82.jpg'],['photo'],['https://infosec-jobs.com/job/6027-cyber-security-analyst-3449-info/'],"HIRING: Cyber Security Analyst (3449-INFO) / Seneca Falls, NY -&gt; https://t.co/7JD8fmWHJv #InfoSec #infosecjobs #CyberSecurity #CyberCareer #cyberjobs #cybertalents #security #jobsearch #techjobs #hiringnow #CEH #Kali #Linux #Metasploit #Nmap #Python #SIEM #Hydra #threathunting https://t.co/u4zuLBx7fo","['InfoSec', 'infosecjobs', 'CyberSecurity', 'CyberCareer', 'cyberjobs', 'cybertalents', 'security', 'jobsearch', 'techjobs', 'hiringnow', 'CEH', 'Kali', 'Linux', 'Metasploit', 'Nmap', 'Python', 'SIEM', 'Hydra', 'threathunting']","",1089175267581538304,infosec-jobs.com,infosec_jobsCOM,false,http://pbs.twimg.com/profile_images/1089185605911752705/e8j99QcU_normal.jpg,https://pbs.twimg.com/profile_banners/1089175267581538304/1548662842,"",1504,38,4,0,0,11,2021-10-22T23:48:03.000-07:00
1451724670366109697,1451885537174896645,2021-10-23T12:17:41.000-07:00,"","","",['https://g.co/kgs/mhcEJt'],We are hiring in multiple areas in Mechanical Engineering and Applied Mechanics (MEAM) https://t.co/1TCAAFemH9,"","",1360818644,Doug Jerolmack,dougsjunkdrawer,false,http://pbs.twimg.com/profile_images/1422302095084949532/s30Pd-v-_normal.jpg,"",http://abs.twimg.com/images/themes/theme1/bg.png,1183,247,11,0,1,9,2021-10-23T01:38:27.000-07:00
1451815308390436867,1451863240699486214,2021-10-23T10:49:05.000-07:00,https://twitter.com/LucieNorel/status/1451815308390436867,['http://pbs.twimg.com/media/FCXiUm8XEAI6zIm.jpg'],['photo'],"",We are hiring a #PDRA in #chemistry to work with us at @chimie_ISCR on photoswitchable lanthanide complexes|Tight timeline (starts Dec. 1st) + the candidate should have worked outside of France for more than 1.5 year between May 2016 and June 2021. Still interested ? https://t.co/Rr4lzm0SQ1,"['PDRA', 'chemistry']",['chimie_ISCR'],1131654927665770502,Lucie Norel,LucieNorel,false,http://pbs.twimg.com/profile_images/1184030732009779201/C1p_F1nu_normal.jpg,https://pbs.twimg.com/profile_banners/1131654927665770502/1571129901,"",247,146,20,1,1,14,2021-10-23T07:38:37.000-07:00
1451817580356767750,1451875700537921544,2021-10-23T11:38:36.000-07:00,https://twitter.com/iShivamSingh12/status/1451451743691108356/photo/1,['http://pbs.twimg.com/media/FCSXqxSUcAEqyFO.jpg'],['photo'],"","With every sector opening up, demand for talent is outstripping supply in several areas. Companies have to look at new ways of hiring. There is an increasing demand for students of from top UG colleges.|Campus recruitment is booming again.|https://t.co/QyCyBVXjJl","","",210375740,प्रवीण कुमार दीक्षित🇮🇳,iPraveendixit,false,http://pbs.twimg.com/profile_images/1447458138626482178/HPq6U6WG_normal.jpg,https://pbs.twimg.com/profile_banners/210375740/1633578135,http://abs.twimg.com/images/themes/theme1/bg.png,52565,5962,6,0,0,6,2021-10-23T07:47:39.000-07:00
1451828460763054087,1451872437075914754,2021-10-23T11:25:38.000-07:00,"","","","",Hiring for #personality is more relevant than hiring for #experience.||Agree?||#Hiring #bot #100DaysOfCode #DigitalMarketing #java #Python #Crypto #23Oct #dolar10 #nftcollector #Dune #girlsplanets999 #LateLate #GFvip #OMG2,"['personality', 'experience', 'Hiring', 'bot', '100DaysOfCode', 'DigitalMarketing', 'java', 'Python', 'Crypto', '23Oct', 'dolar10', 'nftcollector', 'Dune', 'girlsplanets999', 'LateLate', 'GFvip', 'OMG2']","",1427610662922952710,Hirect India,hirect_india,false,http://pbs.twimg.com/profile_images/1427617148642332681/xEb6E2c__normal.jpg,https://pbs.twimg.com/profile_banners/1427610662922952710/1633072889,"",2867,34,4,0,0,12,2021-10-23T08:30:53.000-07:00
