org_id,samp_id,samp_datetime,org_url,org_media_url,org_media_type,org_attached_links,org_text,org_hashtags,org_user_metions,user_id,user_name,user_screen_name,user_verified,user_profile_image_url,user_profile_banner_url,user_profile_background_image_url,user_followers_count,user_friends_count,org_favorite_count,org_quote_count,org_reply_count,org_retweet_count,org_datetime
1346573190940782592,1455770158438354946,2021-11-03T05:33:47.000-07:00,"","","",['https://jobs.lever.co/Uniswap'],🌐 Do you want to help build the future of decentralized finance?||4⃣The Uniswap dev team is hiring for 4 engineering roles!||🦄 Senior Frontend Engineer|🦄 Smart Contract Engineer|🦄 Full Stack Engineer|🦄 Software Engineer Intern||Learn more and apply:|https://t.co/d3IERsnQsE,"","",984188226826010624,Uniswap Labs 🦄,Uniswap,true,http://pbs.twimg.com/profile_images/1242184851152928769/wG2eTAfD_normal.jpg,https://pbs.twimg.com/profile_banners/984188226826010624/1584988310,http://abs.twimg.com/images/themes/theme1/bg.png,689892,90,3666,189,3735,1197,2021-01-05T21:44:01.000-08:00
1381246447501316098,1455777200976711680,2021-11-03T06:01:46.000-07:00,"","","",['https://dotnet.careers/178837-shift-digital-.net-microservices-engineer'],Shift Digital is hiring a .NET Microservices Engineer.||#dotnetcore #aspnet #csharp #azure #kubernetes #jobs||Apply now: https://t.co/fcD0N1lMQr,"['dotnetcore', 'aspnet', 'csharp', 'azure', 'kubernetes', 'jobs']","",1149425974720782336,.NET Careers,dotnet_careers,false,http://pbs.twimg.com/profile_images/1219359916621615104/y_A9z9lj_normal.jpg,https://pbs.twimg.com/profile_banners/1149425974720782336/1564939759,"",3851,5001,18,0,0,252,2021-04-11T14:03:10.000-07:00
1389645389637238796,1455787737378926597,2021-11-03T06:43:38.000-07:00,"","","","","#2. Don't Hire the First Advisor You Meet. Working with a financial advisor is a crucial component of any retirement plan, so most people follow these 7 secrets when hiring one.","","",353838102,SmartAsset,smartasset,true,http://pbs.twimg.com/profile_images/1101592165807984640/YBF7NqKq_normal.png,https://pbs.twimg.com/profile_banners/353838102/1551717383,http://abs.twimg.com/images/themes/theme14/bg.gif,34594,1401,10085,223,1286,1915,2021-05-04T18:17:33.000-07:00
1411731534931968006,1455770789278470146,2021-11-03T05:36:17.000-07:00,https://twitter.com/APTNNews/status/1411731534931968006,['http://pbs.twimg.com/amplify_video_thumb/1411029431917977602/img/KiKA1uFddHhOcTwP.jpg'],['video'],['https://www.aptnnews.ca?p=177378'],"The grounds around the former MacKay Indian Residential School in Dauphin, Man., will soon be searched for unmarked graves.||The Church of Christ owns the building and says it’s hiring a private firm to conduct the search.||See more on this story: https://t.co/qcPNssfwx7 https://t.co/u90y7QS2Tc","","",69343363,APTN News,APTNNews,true,http://pbs.twimg.com/profile_images/781170989635887104/pv9F31vG_normal.jpg,https://pbs.twimg.com/profile_banners/69343363/1635795702,http://abs.twimg.com/images/themes/theme1/bg.png,95030,445,69,6,7,34,2021-07-04T17:00:01.000-07:00
1442663100784779266,1455762183518924803,2021-11-03T05:02:05.000-07:00,https://twitter.com/harrisonjaime/status/1442663100784779266?t=mhbbYMbhe2jv9MHJ7gJpyg&s=19,['http://pbs.twimg.com/media/FAVecbtX0AIXJ_E.jpg'],['photo'],['http://democrats.org/campaign-readiness-project'],We’re training and hiring folks that want to take part in protecting the vote in the midterms in our Campaign Readiness Project: Voter Protection Leadership Bootcamp! Find our more info at https://t.co/qDcm0Iu3bw.||Applications close on October 6! https://t.co/KjrTkjPg7N,"","",73754019,"Jaime Harrison, DNC Chair",harrisonjaime,true,http://pbs.twimg.com/profile_images/1420550208220450818/Dr0mMmb1_normal.jpg,https://pbs.twimg.com/profile_banners/73754019/1608304071,http://abs.twimg.com/images/themes/theme1/bg.png,753171,7615,303,6,12,170,2021-09-28T01:31:01.000-07:00
1445674022969090048,1455789457865592836,2021-11-03T06:50:28.000-07:00,"","","",['https://jobs.soton.ac.uk/Vacancy.aspx?ref=1409121BJ-R'],"We are hiring a postdoc in cell biology||We are investigating new mechanisms of cell division using the mammary epithelium as a powerful mammalian model system||Our team is diverse, talented, and supportive||Come join us||Please RT 🙏||https://t.co/OkHNfk79TY","","",1191757274911522816,Salah Elias,theeliaslab,false,http://pbs.twimg.com/profile_images/1342174608485715969/pm5FDy0w_normal.jpg,https://pbs.twimg.com/profile_banners/1191757274911522816/1604701362,"",615,489,76,3,0,66,2021-10-06T08:55:21.000-07:00
1446436895664214022,1455786318005293057,2021-11-03T06:38:00.000-07:00,"","","","",We've closed the slots for hiring today. Follow us to keep updated with new hiring for scholars which will be coming soon!!! |#AxieScholarship #AxieInfinity #AxieInfinityScholar #AxieScholarships #Axie #AxieScholars #axiescholarworld #AxieScholar #PlayToEarnGame #PlayToEarn,"['AxieScholarship', 'AxieInfinity', 'AxieInfinityScholar', 'AxieScholarships', 'Axie', 'AxieScholars', 'axiescholarworld', 'AxieScholar', 'PlayToEarnGame', 'PlayToEarn']","",1446028888706928641,InfinityFam,InfinityFam2,false,http://pbs.twimg.com/profile_images/1446029789945425921/eWz7y23x_normal.jpg,https://pbs.twimg.com/profile_banners/1446028888706928641/1633595343,"",184,289,36,0,8,13,2021-10-08T11:26:44.000-07:00
1453136956544610305,1455783679620304900,2021-11-03T06:27:31.000-07:00,https://twitter.com/LAUSDHR/status/1453136956544610305/photo/1,['http://pbs.twimg.com/media/FCqUXBWVgAICNfJ.jpg'],['photo'],"","Our colleagues in Classified HR (@lausdjobs) are hosting a special education trainee hiring event tomorrow, 10/27. ||Register ASAP! Link on pic! https://t.co/77XYA4pYkh","",['LAUSDjobs'],1380613897728577539,@LAUSDHR,LAUSDHR,false,http://pbs.twimg.com/profile_images/1380615406231060482/mXHITz-I_normal.jpg,https://pbs.twimg.com/profile_banners/1380613897728577539/1618001900,"",154,267,0,0,0,1,2021-10-26T23:10:23.000-07:00
1453141514536771588,1455765451221323776,2021-11-03T05:15:05.000-07:00,"","","",['https://app.beapplied.com/apply/p9suigw1uc'],"In addition to the four development jobs we’re hiring for, we’re also hiring a Digital Editorial Coordinator and a Campaigns and Partnerships Director! Spread the word and apply! https://t.co/ZrpuFAZ1Ob","","",18009802,elanabaurer,elanabaurer,false,http://pbs.twimg.com/profile_images/3156811483/fc13b01d19c622e7b40eb0fe618e7775_normal.jpeg,https://pbs.twimg.com/profile_banners/18009802/1353528356,http://abs.twimg.com/images/themes/theme1/bg.png,436,979,3,0,0,1,2021-10-26T23:28:29.000-07:00
1453274821698244608,1455784839026823168,2021-11-03T06:32:07.000-07:00,https://twitter.com/RamminaY/status/1453274821698244608/photo/1,['http://pbs.twimg.com/media/FCsRuw8WUAgXoen.jpg'],['photo'],['https://www.yorksandhumberdeanery.nhs.uk/recruitment/future-leaders-recruitment'],"Junior doctor or AHP in Yorkshire?||Y&amp;H Future Leaders Programme now recruiting new fellows.||I did this fellowship 5 years ago, it changed my career &amp; continues to open doors for me even to this day. ||Highly recommend. Apply now!||https://t.co/nyjTbsSNyf||@NHSHEE_NEY https://t.co/qiAFdvaTd4","",['NHSHEE_NEY'],3025378385,Rammina,RamminaY,false,http://pbs.twimg.com/profile_images/762573016882679808/ogyKx-ca_normal.jpg,"",http://abs.twimg.com/images/themes/theme1/bg.png,815,791,16,0,0,12,2021-10-27T08:18:12.000-07:00
1453901316678377490,1455766874063523841,2021-11-03T05:20:44.000-07:00,https://twitter.com/TELLlab/status/1453901316678377490/photo/1,['http://pbs.twimg.com/media/FC1LNhYWYAEWtdx.png'],['photo'],['https://members.capcsd.org/jobs/Details/postdoctoral-scholar-80361'],"We're #hiring at the TELL Lab. Reach out if you want to know more.  Looking for a postdoctoral scholar with CCC able to begin Jan 2022. CF considered, but please reach out first.  Best Consideration Nov 15th application deadline. https://t.co/YEAGfAzy9m https://t.co/jD6e7mHdVJ",['hiring'],"",84235167,Dr. Amanda Van Horne,TELLlab,false,http://pbs.twimg.com/profile_images/900798572458803203/W-xpWzsP_normal.jpg,https://pbs.twimg.com/profile_banners/84235167/1503599045,http://abs.twimg.com/images/themes/theme1/bg.png,1824,1580,12,1,1,13,2021-10-29T01:47:40.000-07:00
1454040400600047628,1455767730561355778,2021-11-03T05:24:08.000-07:00,https://twitter.com/OpenLeverage/status/1454040400600047628,['http://pbs.twimg.com/media/FC3F3SbUYAU7Dn-.jpg'],['photo'],['https://forms.gle/mDqEx5rZh9YRxbKr5'],📢 We're #Hiring Ambassadors!||The ideal candidate is fascinated and actively engaged within the #crypto &amp; #DeFi sector and has experience with social media &amp; community growth. Fluent English &amp; knowledge of one or several languages below.||Apply now: |📥 https://t.co/4Pb3xno9HE https://t.co/4eNMIuQAq2,"['Hiring', 'crypto', 'DeFi']","",1381887284497145864,OpenLeverage,OpenLeverage,false,http://pbs.twimg.com/profile_images/1418477140857614341/BnnZSPJU_normal.jpg,https://pbs.twimg.com/profile_banners/1381887284497145864/1630311624,"",15831,165,164,8,17,95,2021-10-29T11:00:20.000-07:00
1454270759447171072,1455786889680613381,2021-11-03T06:40:16.000-07:00,"","","","",@OGCEA @FdOdisha @gapg_dept @SecyChief @Naveen_Odisha @CMO_Odisha @pranabpdas @MoSarkar5T @vijaykbandhu @Vkpandianfancl1 @dr_arunsahoo @BJDDIGITALWING @sarojmedia @bada_khabar @jp_mohapatra @PMOIndia @rashtrapatibhvn Govt. Of Odisha harassing the youth by giving contractual appointment act 2013 those are posted through direct recruitment process by OSSC. It's openly Violation of Indian Constitution.. abolish It.Give counter affidavit for this WPC.,"","['OGCEA', 'FdOdisha', 'gapg_dept', 'SecyChief', 'Naveen_Odisha', 'CMO_Odisha', 'pranabpdas', 'MoSarkar5T', 'vijaykbandhu', 'Vkpandianfancl1', 'dr_arunsahoo', 'BJDDIGITALWING', 'sarojmedia', 'bada_khabar', 'jp_mohapatra', 'PMOIndia', 'rashtrapatibhvn']",2559765701,shyamasundar jena,shyamasundarje1,false,http://pbs.twimg.com/profile_images/1450446213782724612/QYQd5WYK_normal.jpg,"",http://abs.twimg.com/images/themes/theme1/bg.png,2,10,8,0,0,10,2021-10-30T02:15:42.000-07:00
1454278914042302467,1455785332092268552,2021-11-03T06:34:05.000-07:00,"","","","",Digging our way out of racial capitalism by hiring waves of DEI specialists at competitive salaries,"","",2942441696,AR Hamed,MadMaxFlapper,false,http://pbs.twimg.com/profile_images/1448494190006923275/8ig-SGRo_normal.jpg,https://pbs.twimg.com/profile_banners/2942441696/1540853436,http://abs.twimg.com/images/themes/theme1/bg.png,1027,308,3,0,0,1,2021-10-30T02:48:06.000-07:00
1455097962921533441,1455782158346424322,2021-11-03T06:21:28.000-07:00,https://twitter.com/sbsnow/status/1455097962921533441,"","",['https://bit.ly/UniteONApplication'],Stray Kids와 함께 할 화상 관객을 모집합니다!|We're recruiting online audiences to join Stray Kids!|온라인 관객 모집 링크(Online Audience Recruitment): https://t.co/NJx8fwhyEP,"","",113259902,SBS,SBSNOW,true,http://pbs.twimg.com/profile_images/1414832602670796817/-4UpAVbF_normal.jpg,https://pbs.twimg.com/profile_banners/113259902/1625813161,http://abs.twimg.com/images/themes/theme1/bg.png,1737353,110,2717,186,38,508,2021-11-01T09:02:43.000-07:00
1455110625357705216,1455790263566147586,2021-11-03T06:53:40.000-07:00,https://twitter.com/Zitterbart_WHOI/status/1455110625357705216/photo/1,['http://pbs.twimg.com/media/FDGWRVvXsAUqesw.jpg'],['photo'],['https://bit.ly/3GHJnCI'],We are #hiring!! Looking for a job between marine mammal science and #engineering. My lab is hiring a Research Associate to help with several different projects around marine mammal remote sensing. Contact me or apply https://t.co/7XoOhy0CK1 #whales @WHOI #conservation https://t.co/sgOi3Hk1JG,"['hiring', 'engineering', 'whales', 'conservation']",['WHOI'],1088850698425561088,Daniel P. Zitterbart,Zitterbart_WHOI,false,http://pbs.twimg.com/profile_images/1315022300832555009/SjSJhW9d_normal.jpg,https://pbs.twimg.com/profile_banners/1088850698425561088/1548437732,"",249,199,169,5,4,122,2021-11-01T09:53:02.000-07:00
1455159217082576898,1455784182790049792,2021-11-03T06:29:30.000-07:00,"","","","","CRi is hiring for our internal product team.  We are looking to add an iOS developer.  We have a native mobile app, Swift iOS development.  Come join our team, full time, direct, internal full time role here within CRi and From-Now-On.  Will hire ASAP.  #swift #ios #nativemobile","['swift', 'ios', 'nativemobile']","",501905357,John Bukowski,JBukowskiOmaha,false,http://pbs.twimg.com/profile_images/1257300407463940096/BPhiqQFS_normal.jpg,"",http://abs.twimg.com/images/themes/theme16/bg.gif,236,566,0,0,1,2,2021-11-01T13:06:07.000-07:00
1455188325673971712,1455779183167254531,2021-11-03T06:09:38.000-07:00,https://twitter.com/3Brain/status/1455188325673971712/photo/1,['http://pbs.twimg.com/media/FDHeEjkX0AMOAym.jpg'],['photo'],['https://resources.3brain.com/f1/open-positions/2021-12_ApplicationScientist.pdf'],"3Brain is #hiring!|We're looking for a full-time #ApplicationScientist who'll work with our scientific team to support customer projects, find creative approaches to solve customer needs concerning cell assays and... more details here:|https://t.co/Kw6NzllyJC https://t.co/xIqFuWTGoB","['hiring', 'ApplicationScientist']","",3049339192,3Brain,3Brain,false,http://pbs.twimg.com/profile_images/1330800495741505538/sm0ygEkM_normal.png,https://pbs.twimg.com/profile_banners/3049339192/1540481630,http://abs.twimg.com/images/themes/theme1/bg.png,617,464,9,0,0,7,2021-11-01T15:01:47.000-07:00
1455294168704507904,1455787214906953736,2021-11-03T06:41:33.000-07:00,https://twitter.com/SutherlandLab/status/1455294168704507904/photo/1,['http://pbs.twimg.com/media/FDI-UHFUcAEEaIy.png'],['photo'],['https://biology.uoregon.edu/graduate-studies/apply/'],We are hiring a #PhD student through @uo_biology @UO_OIMB to work on @NSF funded research investigating the role of gelatinous #zooplankton in #foodwebs using a combination of field and lab approaches to quantify predation by gelatinous animals. https://t.co/bejzXxaG2o https://t.co/R0QYk2IubL,"['PhD', 'zooplankton', 'foodwebs']","['UO_OIMB', 'NSF']",963284076177207297,Sutherland Lab,SutherlandLab,false,http://pbs.twimg.com/profile_images/963286502401699840/a0R5j7qK_normal.jpg,https://pbs.twimg.com/profile_banners/963284076177207297/1518500353,http://abs.twimg.com/images/themes/theme1/bg.png,439,308,17,0,1,14,2021-11-01T22:02:22.000-07:00
1455371056080896005,1455782936301563904,2021-11-03T06:24:33.000-07:00,"","","","",Tech job thread!  Reply here if you are #hiring!,['hiring'],"",956867275000373248,Scarab,5C4R48,false,http://pbs.twimg.com/profile_images/1450613801716441089/8wUikQMk_normal.jpg,https://pbs.twimg.com/profile_banners/956867275000373248/1634693407,http://abs.twimg.com/images/themes/theme1/bg.png,4865,450,41,2,12,22,2021-11-02T03:07:53.000-07:00
1455453361629802498,1455786357847203846,2021-11-03T06:38:09.000-07:00,https://twitter.com/fmiscience/status/1455453361629802498,['http://pbs.twimg.com/media/FDLPHiGXIAM-cgg.png'],['photo'],['https://bit.ly/3ECpeMF'],"#JobAlert: The group of @priscaliberali is hiring an Image Analysis expert for high-content image processing and visualization.|📝For more details and to apply: https://t.co/UAI0MdAqHH|📅Applications close November 15, 2021|#ImageAnalysis #ImageProcessing #ImageVisualization https://t.co/BETcxwa6lE","['JobAlert', 'ImageAnalysis', 'ImageProcessing', 'ImageVisualization']",['priscaliberali'],890127906512535552,FMI science,FMIscience,false,http://pbs.twimg.com/profile_images/1410500399006720004/wsyUEARx_normal.jpg,https://pbs.twimg.com/profile_banners/890127906512535552/1582709748,http://abs.twimg.com/images/themes/theme1/bg.png,3622,432,23,2,0,29,2021-11-02T08:34:57.000-07:00
1455475010571841546,1455762742871212034,2021-11-03T05:04:19.000-07:00,"","","",['http://ow.ly/pGqF50GE43v'],"📣Are you a #mediarelations expert? We want you! We're hiring a Head of Media Relations to assist the #Communications, #Technology and #Innovation Unit. Learn more and apply at the link below! 👇||https://t.co/awWA7o0FIg|#jobvacancy","['mediarelations', 'Communications', 'Technology', 'Innovation', 'jobvacancy']","",104485530,GRID-Arendal,GRIDArendal,false,http://pbs.twimg.com/profile_images/1318488647675629569/Vsbs9X-B_normal.jpg,https://pbs.twimg.com/profile_banners/104485530/1603118034,http://abs.twimg.com/images/themes/theme13/bg.gif,4166,1472,5,0,0,5,2021-11-02T10:00:58.000-07:00
1455480052737585154,1455771260172963843,2021-11-03T05:38:10.000-07:00,https://twitter.com/reymondgroup/status/1455480052737585154/photo/1,['http://pbs.twimg.com/media/FDG_a10XoAs9ysI.jpg'],['photo'],['https://gdb.unibe.ch/positions/'],"📢We are #hiring! Two fully funded PhD student positions are open in our group @reymondgroup @jrjrjlr, starting April 2022 to carry out a PhD thesis in #Chemical #Biology/#Peptide #Chemistry.|👉Find out more: https://t.co/rzDk8sImx6|@DCBPunibern #chemtwitter #PhD #PhDposition https://t.co/NFYgE1Wg66","['hiring', 'Chemical', 'Biology', 'Peptide', 'Chemistry', 'chemtwitter', 'PhD', 'PhDposition']","['reymondgroup', 'jrjrjlr', 'DCBPunibern']",727479305740128256,Reymond Group,reymondgroup,false,http://pbs.twimg.com/profile_images/1112100979124641792/a6QIsO5A_normal.png,https://pbs.twimg.com/profile_banners/727479305740128256/1553980390,http://abs.twimg.com/images/themes/theme1/bg.png,1201,460,61,2,2,54,2021-11-02T10:21:00.000-07:00
1455518543122993152,1455761773458513922,2021-11-03T05:00:28.000-07:00,https://twitter.com/ksdigital01/status/1455518543122993152,['http://pbs.twimg.com/tweet_video_thumb/FDL21H0XMAU-sgP.jpg'],['animated_gif'],['http://kingstonsuttondigital.org/jobs'],"We're hiring! Don't miss out, apply now!|https://t.co/Ms5wHR0cqG|@RBKingston|@SuttonCouncil|#hiring|#digitaljobs|#servicedesign https://t.co/ROdsxsJOub","['hiring', 'digitaljobs', 'servicedesign']","['RBKingston', 'SuttonCouncil']",1371492819551059971,KSDIGITAL,ksdigital01,false,http://pbs.twimg.com/profile_images/1397157842910646272/M1NX5Fy2_normal.jpg,https://pbs.twimg.com/profile_banners/1371492819551059971/1621264687,"",25,10,1,0,0,0,2021-11-02T12:53:57.000-07:00
1455534346203435022,1455789141459877888,2021-11-03T06:49:13.000-07:00,https://twitter.com/DrinkSolaPop/status/1455534346203435022/photo/1,"['http://pbs.twimg.com/media/FDMYxawWYAoJMYA.jpg', 'http://pbs.twimg.com/media/FDMYxawXIAcdEa_.jpg', 'http://pbs.twimg.com/media/FDMYxa7WQAUrdId.jpg']","['photo', 'photo', 'photo']","","Fun fact: In 1935, when Mussolini invaded Ethiopia, Black Americans felt compelled to join the Ethiopian army, being the only African nation to resist colonization. Recruitment drives, like these in Harlem, happened across the US. Thousands joined, but were blocked from leaving.. https://t.co/d6BHukNBlW","","",148891868,SOLAECLIPSE®️,DrinkSolaPop,false,http://pbs.twimg.com/profile_images/1364201299223404546/mk07DHJd_normal.jpg,https://pbs.twimg.com/profile_banners/148891868/1581283736,http://abs.twimg.com/images/themes/theme1/bg.png,39127,1359,824,11,13,267,2021-11-02T13:56:45.000-07:00
1455539811931017216,1455789951321350144,2021-11-03T06:52:26.000-07:00,https://twitter.com/BusinesssBotsPR/status/1455539811931017216/photo/1,['http://pbs.twimg.com/media/FDMdt2eWEAY2f44.jpg'],['photo'],"","Apply now at recruitment@bb.org.bw by Friday, 12 Nov 2021 https://t.co/CSuVS3pCnG","","",315433331,Business Botswana,BusinesssBotsPR,false,http://pbs.twimg.com/profile_images/954676389583769602/yLT1Hdke_normal.jpg,https://pbs.twimg.com/profile_banners/315433331/1588957018,http://abs.twimg.com/images/themes/theme16/bg.gif,10525,144,25,9,1,55,2021-11-02T14:18:28.000-07:00
1455549236309905414,1455764111237783553,2021-11-03T05:09:45.000-07:00,"","","",['http://binghamton.interviewexchange.com/jobofferdetails.jsp?JOBID=138812'],"Binghamton University (SUNY) @AnthroBing is hiring at the Assistant Prof level in Bio Anth. Geographic and topical research areas are open, but expertise in quantitative modeling is needed. Apply by Dec 1. Please share widely: https://t.co/4LkPfDwxIY","",['AnthroBing'],1336909290100191232,Kathy Wander,WanderKathy,false,http://pbs.twimg.com/profile_images/1408997196612112388/fwsO_LV5_normal.jpg,https://pbs.twimg.com/profile_banners/1336909290100191232/1624211844,"",159,178,18,0,1,29,2021-11-02T14:55:55.000-07:00
1455550749774069765,1455790567565189124,2021-11-03T06:54:53.000-07:00,"","","",['https://apply.workable.com/pixelated-noise-ltd/j/89B1E1BB36/'],Hiring! Looking for developers based in Greece who appreciate the power and beauty of functional programming. Join us if you already know Clojure or just curious.||https://t.co/WXt8ezKyhQ,"","",45704852,Stathis Sideris,stathissideris,false,http://pbs.twimg.com/profile_images/831809899747278848/6JU87FD5_normal.jpg,https://pbs.twimg.com/profile_banners/45704852/1599743273,http://abs.twimg.com/images/themes/theme1/bg.png,719,1397,17,3,0,7,2021-11-02T15:01:56.000-07:00
1455558663477895173,1455788976045019136,2021-11-03T06:48:33.000-07:00,"","","","","Hey everyone! My job is hiring! We have openings for a range of roles like ServiceNow Devs, Cloud Engineers, Microsoft Engineers, Technical Consultants, etc. Also have a program for those early in their careers (which I’m in!). DM if interested!","","",2577412056,RyANnnn,RyanDenyse_,false,http://pbs.twimg.com/profile_images/1442104792109649922/4YhMSbx9_normal.jpg,https://pbs.twimg.com/profile_banners/2577412056/1574127009,http://abs.twimg.com/images/themes/theme1/bg.png,745,555,776,7,47,537,2021-11-02T15:33:23.000-07:00
1455569739040890884,1455786529205358593,2021-11-03T06:38:50.000-07:00,"","","",['https://www.sandiegobusiness.org/about-edc/team/employment/'],"📢 We're hiring! 📢  Our new Research Coordinator and Research Manager will help our Research Bureau analyze, synthesize, and visualize data to inform our region’s leading companies, nonprofits, and policy makers. Apply now – or help us spread the word ⬇️ |https://t.co/RKIIKPguoB","","",113474827,San Diego Regional EDC,SDRegionalEDC,false,http://pbs.twimg.com/profile_images/1093232936013320193/Go9TeN6z_normal.jpg,https://pbs.twimg.com/profile_banners/113474827/1534455893,http://abs.twimg.com/images/themes/theme16/bg.gif,7002,1674,7,3,0,4,2021-11-02T16:17:23.000-07:00
1455574968951984132,1455779746734768130,2021-11-03T06:11:53.000-07:00,"","","","",Ready to switch to web3? @AlchemyPlatform is hiring engineers!||We’re working on:|- Scalable &amp; reliable infra|- Novel blockchain APIs|- Node client improvements|- Dev communities &amp; more!||Interested/know anyone who is? DMs open. Awarding a random NFT to one candidate/referrer.,"",['AlchemyPlatform'],1235335588036956164,probablynoam.eth,ProbablyNoam,false,http://pbs.twimg.com/profile_images/1432848377826328578/9G6xHT7A_normal.jpg,https://pbs.twimg.com/profile_banners/1235335588036956164/1629079989,"",168,1112,28,2,0,7,2021-11-02T16:38:10.000-07:00
1455579731907301377,1455774619093241860,2021-11-03T05:51:30.000-07:00,"","","","['https://5il.co/11cks', 'https://5il.co/11ckt', 'https://5il.co/11cku', 'https://5il.co/11ckr']",The Hueneme School District is hiring! Please click on the links for more information.||https://t.co/PsUtCY1Ql6||https://t.co/Fnss0935Hv|| https://t.co/5VLiSXT7YH||https://t.co/X586UlyCwM,"","",2959282537,Hueneme ESD,HuenemeElemSD,false,http://pbs.twimg.com/profile_images/1032708253287821312/8wVVs-Nn_normal.jpg,"",http://abs.twimg.com/images/themes/theme1/bg.png,581,266,0,0,0,1,2021-11-02T16:57:06.000-07:00
1455580606608420871,1455787831721447425,2021-11-03T06:44:00.000-07:00,https://twitter.com/rlcares/status/1455580606608420871,"","",['https://www.rugbyleaguecares.org/news/general/new-job-roles-community-and-welfare-officers/'],"WE'RE HIRING!||Do you have what it takes to enhance the lives of thousands of people across #rugbyleague communities?||If YES, we'd love to hear from you - please get in touch for more info about our fantastic new roles.||https://t.co/ZNNS2TAWh1||@TheRFL @RLWC2021 @Offload_RL",['rugbyleague'],"['TheRFL', 'RLWC2021', 'Offload_RL']",769337384,RL Cares,RLCares,false,http://pbs.twimg.com/profile_images/378800000674331282/ae236e8a79316bb48bcec67ccf6af39d_normal.jpeg,https://pbs.twimg.com/profile_banners/769337384/1605467946,http://abs.twimg.com/images/themes/theme1/bg.png,10079,1188,17,1,1,12,2021-11-02T17:00:34.000-07:00
1455581018048585740,1455769127168077826,2021-11-03T05:29:41.000-07:00,https://twitter.com/takeETSalert/status/1455581018048585740/photo/1,['http://pbs.twimg.com/media/FDNDOODXsAIDspp.jpg'],['photo'],['https://bit.ly/2XV1UtI'],"Our first virtual hiring information session is tomorrow between 10-11am. Don’t forget to register if you haven’t done so already: https://t.co/WgC9EUgoLi ||If you can’t make tomorrow, we’re offering another session on November 9 (2:30-3:30pm). #YegTransit https://t.co/yNNv5p1OhZ",['YegTransit'],"",281137182,Edmonton Transit Service (ETS),takeETSalert,true,http://pbs.twimg.com/profile_images/1386262308221972483/PDvnpzac_normal.jpg,https://pbs.twimg.com/profile_banners/281137182/1629735165,http://abs.twimg.com/images/themes/theme1/bg.png,10565,1,0,0,1,1,2021-11-02T17:02:12.000-07:00
