org_id,samp_id,samp_datetime,org_url,org_media_url,org_media_type,org_attached_links,org_text,org_hashtags,org_user_metions,user_id,user_name,user_screen_name,user_verified,user_profile_image_url,user_profile_banner_url,user_profile_background_image_url,user_followers_count,user_friends_count,org_favorite_count,org_quote_count,org_reply_count,org_retweet_count,org_datetime
1451858491581288454,1451858491581288454,2021-10-23T10:30:13.000-07:00,"","","","","I learnt the game well enough to realize that even if Arteta was not it, the very idea behind his hiring was correct and for that alone, Arsenal had a bright future. I also realized that even if Arteta was not it, his ideas would continue with a better coach at the club so I","","",1324379162421927939,AI,nonewthing,false,http://pbs.twimg.com/profile_images/1442427453767655424/bWjUg67o_normal.jpg,https://pbs.twimg.com/profile_banners/1324379162421927939/1630623029,"",15401,624,0,0,0,0,2021-10-23T10:30:13.000-07:00
1451858588146745347,1451858588146745347,2021-10-23T10:30:36.000-07:00,"","","",['https://www.jobs2careers.com/click.php?jid=4c5316ef785db4ee90ce37cce&ri=94b37639edf648a5bd7e2b53d7140cdd&job_loc=Chicago%2CIL&q=&spl=HdX4ubjHsRnnKbiu%3AgXnqcE%2BgaW4i3SZ%2B%2BN1xVw%3D%3D%3AaIrg8J430tXZXzlqqV%2FmuXXElaZ3f5%2BzRnF5aGgbAJN%2BtF%2FE0uMlYr0DOP90VFRzj8RfjmXxdw%3D%3D&encrypt=0&l=chicago%2Cil'],Starbucks is hiring in Chicago for a siren retail barista. Click now to apply! |https://t.co/15NeJD0aFC||#chicago #chi #jobshiring #jobsearching #jobvacancy #cv,"['chicago', 'chi', 'jobshiring', 'jobsearching', 'jobvacancy', 'cv']","",1287255669486137345,chicago_jobs_bot,chicago_job_bot,false,http://pbs.twimg.com/profile_images/1287255767829975040/e3_Bw1Jj_normal.jpg,https://pbs.twimg.com/profile_banners/1287255669486137345/1596940078,"",13,0,0,0,0,0,2021-10-23T10:30:36.000-07:00
1451858926081757185,1451858926081757185,2021-10-23T10:31:56.000-07:00,"","","",['https://bit.ly/3vGAxQO'],We're hiring! Click to apply: West - Spring Jr. Executive Sales Intern - https://t.co/z7rP7GZKKG,"","",78911293,Paycom Careers,paycomcareers,false,http://pbs.twimg.com/profile_images/837038267581227008/Izc25CUK_normal.jpg,https://pbs.twimg.com/profile_banners/78911293/1607544117,http://abs.twimg.com/images/themes/theme14/bg.gif,4474,610,0,0,0,0,2021-10-23T10:31:56.000-07:00
1451859070030278656,1451859070030278656,2021-10-23T10:32:31.000-07:00,"","","",['https://lnkd.in/dGBVd3Aw'],We're hiring for the first 100 member core team that will grow @Mindhouse into a truly global wellness brand. Check out the details here and write to us at careers@mindhouse.com if you're keen!|https://t.co/La15TffM4n,"",['Mindhouse'],801852127500865536,Harshil Gulati,harshil_0809,false,http://pbs.twimg.com/profile_images/1433679747163197443/iqZ-Wom6_normal.jpg,https://pbs.twimg.com/profile_banners/801852127500865536/1630650949,"",7,90,0,0,0,0,2021-10-23T10:32:31.000-07:00
1451859235709636611,1451859235709636611,2021-10-23T10:33:10.000-07:00,"","","","","@heather_aylward @OccupyDemocrats Lol it’s only a mandate in democratic ran states lol!!! Which those states are completely failing anyways! Like Chicago for example, I would like to not that they have some of the worst crimes and they are getting rid of police officers (really stupid) and then Indiana is hiring","","['heather_aylward', 'OccupyDemocrats']",502278686,Tyler Norton,thuggybear66,false,http://pbs.twimg.com/profile_images/429723078651031552/1UEBYBTa_normal.jpeg,https://pbs.twimg.com/profile_banners/502278686/1352082726,http://abs.twimg.com/images/themes/theme1/bg.png,57,320,0,0,0,0,2021-10-23T10:33:10.000-07:00
1451859284371857413,1451859284371857413,2021-10-23T10:33:22.000-07:00,https://twitter.com/evolveandgrow/status/1451859284371857413/photo/1,['http://pbs.twimg.com/media/FCYKUz6XoAgkDvv.jpg'],['photo'],['https://instagr.am/p/CVXdvFBpmKo/'],"A fitting video for a Saturday! Are you working today? Do you often work weekends? If so, do you perhaps need to look at your work/life balance?⁣|⁣|It's hard to know sometimes when you should be taking the next step and hiring someone else to help yo… https://t.co/VxGgKpepbQ https://t.co/RFH9CvXYAg","","",124771987,Alison Warner,evolveandgrow,false,http://pbs.twimg.com/profile_images/1321422197966184449/Hz4xWypE_normal.jpg,"",http://abs.twimg.com/images/themes/theme13/bg.gif,967,1206,0,0,0,0,2021-10-23T10:33:22.000-07:00
1451859778645409792,1451859778645409792,2021-10-23T10:35:20.000-07:00,"","","",['https://paiger.link/url/eyJhbGciOiJIUzI1NiJ9.eyJ1cmxfdGl0bGUiOiJTRU4gVGVhY2hpbmcgQXNzaXN0YW50IiwiaW1hZ2VfdXJsIjoiaHR0cHM6Ly9jb250ZW50LWFwcC1zcGFjZXMtMDEuYW1zMy5jZG4uZGlnaXRhbG9jZWFuc3BhY2VzLmNvbS9hc3NldHMvdGhpcmRfcGFydHkvaW1hZ2VzL2V4dGVybmFsLzE2MzM5NDgzMjYtMzcyOC16ZjFrcWw2aW5veDFnanIxbXJlNC5naWYiLCJpYXQiOjE2MzQ5ODUzMTksInJlZGlyZWN0X3VybCI6Imh0dHBzOi8vdGlueXVybC5jb20veWp1emhybmMifQ.qhLdOqAQq4yIzJ60oVVXGFQlGdNZhx8x1BTi_Z3Gkrk'],**We're Hiring**! SEN Teaching Assistant - #Felixstowe.|Please follow the link and apply today|#FelixstoweJobs #JobsInFelixstowe #SuffolkJobs #JobsInSuffolk #Suffolk #InspireEHC #InspireEHCJobs https://t.co/dAG4FkGslM,"['Felixstowe', 'FelixstoweJobs', 'JobsInFelixstowe', 'SuffolkJobs', 'JobsInSuffolk', 'Suffolk', 'InspireEHC', 'InspireEHCJobs']","",1267925970079698944,Inspire EHC,InspireEhc,false,http://pbs.twimg.com/profile_images/1271163598056849410/CVDN7vvk_normal.jpg,https://pbs.twimg.com/profile_banners/1267925970079698944/1605386436,"",117,333,0,0,0,0,2021-10-23T10:35:20.000-07:00
1451860320046104578,1451860320046104578,2021-10-23T10:37:29.000-07:00,"","","",['https://bit.ly/3E7LWvN'],"We're hiring! Read about our latest job opening here: Software App and Reporting Developer - https://t.co/6FIVFZ5MKz #Fallbrook, CA",['Fallbrook'],"",2433978697,ResourceMFG,ResourceMFGjobs,false,http://pbs.twimg.com/profile_images/1328727156898324484/FolzOQUq_normal.jpg,https://pbs.twimg.com/profile_banners/2433978697/1605628216,http://abs.twimg.com/images/themes/theme1/bg.png,1277,132,0,0,0,0,2021-10-23T10:37:29.000-07:00
1451860964362522628,1451860964362522628,2021-10-23T10:40:02.000-07:00,"","","",['https://startup.jobs/administrative-support-coordinator-wa-exp-world-holdings-2548918'],eXp World Holdings is growing! 💪  Hiring an Administrative Support Coordinator - WA (Seattle) https://t.co/4AM8JYxkJw,"","",784795003977625600,⛑ Support Startup Jobs,AllSupportJobs,false,http://pbs.twimg.com/profile_images/1000729103186751489/9HmcqEdC_normal.jpg,https://pbs.twimg.com/profile_banners/784795003977625600/1527427785,http://abs.twimg.com/images/themes/theme1/bg.png,920,10,0,0,0,0,2021-10-23T10:40:02.000-07:00
1451861042913492995,1451861143413211139,2021-10-23T10:40:45.000-07:00,"","","",['https://www.linkedin.com/jobs/view/2629936764/?refId=Q10nIB34pCZRThv3Pltqrw%3D%3D&trackingId=5v6umBzoe3ufq3SGR259bA%3D%3D'],We are seeking a Digital Asset (#crypto) Sales Partner to support @AshiCapital.||Apply here: https://t.co/AYKcHL4sVf||Please retweet this if you know some people interested in the position.||#blockchain #Bitcoin #BTC #ETH #cryptocurrency #BSC #hiring #fund,"['crypto', 'blockchain', 'Bitcoin', 'BTC', 'ETH', 'cryptocurrency', 'BSC', 'hiring', 'fund']",['AshiCapital'],1445055993164009472,Ashi Capital,AshiCapital,false,http://pbs.twimg.com/profile_images/1451844335641694212/XzlgtS4J_normal.jpg,https://pbs.twimg.com/profile_banners/1445055993164009472/1634981742,"",1,1,1,0,0,1,2021-10-23T10:40:21.000-07:00
1451861657324507137,1451861657324507137,2021-10-23T10:42:48.000-07:00,"","","","",NOW HIRING: Weekday Morning Assistant Slush Pile Editor at Brooklyn's latest tech-editorial printing press,"","",739988475693371393,Job4U Bot,job4u_bot,false,http://pbs.twimg.com/profile_images/775088983785238529/4xFQT-y__normal.jpg,https://pbs.twimg.com/profile_banners/739988475693371393/1473688536,"",136,2,0,0,0,0,2021-10-23T10:42:48.000-07:00
1451861664849022979,1451861664849022979,2021-10-23T10:42:49.000-07:00,"","","",['https://bit.ly/3m5iQHe'],"Central Garden &amp; Pet could not succeed without the amazing people who bring our company to life every day. Want to join us? We are hiring in Chattanooga, TN, apply today! https://t.co/CXsCskQB7D #Driver #Driverjobs","['Driver', 'Driverjobs']","",705461059079909376,Central Garden & Pet,workatcentral,false,http://pbs.twimg.com/profile_images/1337541992511807489/yfP4hi3w_normal.jpg,https://pbs.twimg.com/profile_banners/705461059079909376/1607729837,http://abs.twimg.com/images/themes/theme1/bg.png,330,31,0,0,0,0,2021-10-23T10:42:49.000-07:00
1451861838711373828,1451861838711373828,2021-10-23T10:43:31.000-07:00,https://twitter.com/APSapply/status/1451861838711373828/photo/1,['http://pbs.twimg.com/media/FCYMpi-WUAQQCe9.jpg'],['photo'],['https://workfor.us/apstemps/f0r3e'],"#AutomationPersonnelServices is hiring a #Carpenter, apply now! (#RossvilleGAUnitedStates) #job https://t.co/4X9PlepeHW #job #hiring https://t.co/q1o7WwmRiu","['AutomationPersonnelServices', 'Carpenter', 'RossvilleGAUnitedStates', 'job', 'job', 'hiring']","",3826590513,Automation Personnel,APSapply,false,http://pbs.twimg.com/profile_images/652236314062909440/tvvexy94_normal.jpg,https://pbs.twimg.com/profile_banners/3826590513/1446065100,http://abs.twimg.com/images/themes/theme1/bg.png,193,274,0,0,0,0,2021-10-23T10:43:31.000-07:00
1451861868046286859,1451861868046286859,2021-10-23T10:43:38.000-07:00,"","","",['https://stronghold.co/jobs/head-of-marketing/'],@Strongholdpay is #hiring a Head of Marketing!||Are you a team player who wants to join a fast-growing company building the future of #crypto #payments and #fintech?|Apply: https://t.co/GDqLIlFC8r||$SHx #Stronghold #XRPCommunity #XRPArmy #Stellar #XLM  #FlareNetwork #FLR #XRP,"['hiring', 'crypto', 'payments', 'fintech', 'Stronghold', 'XRPCommunity', 'XRPArmy', 'Stellar', 'XLM', 'FlareNetwork', 'FLR', 'XRP']",['strongholdpay'],1430048924182609920,TheDave,thedave003,false,http://pbs.twimg.com/profile_images/1430049151446765570/yx4l88tU_normal.jpg,https://pbs.twimg.com/profile_banners/1430048924182609920/1630749219,"",59,377,0,0,0,0,2021-10-23T10:43:38.000-07:00
1451861991883214849,1451862013693542402,2021-10-23T10:44:13.000-07:00,"","","",['https://tinyurl.com/yjl3ldaj'],New #job: Hardware/ computer/ Technical Engineer Location: Cork Salary: 34kpa - 37kpa .. https://t.co/nKTKsxbiHi #jobs #hiring,"['job', 'jobs', 'hiring']","",1142076205191061504,Global Technology Solutions Ltd,GTS_Recruiting,false,http://pbs.twimg.com/profile_images/1142077272947646465/-rd_UOgs_normal.jpg,https://pbs.twimg.com/profile_banners/1142076205191061504/1561127266,"",14,15,0,0,0,1,2021-10-23T10:44:07.000-07:00
1447366366630014976,1451850266777583617,2021-10-23T09:57:32.000-07:00,https://twitter.com/127voting/status/1447366366630014976?t=nQG-2T7x1DB6XhC3BcXs0Q&s=19,['http://pbs.twimg.com/media/FBYUCRjVUAI1fTD.jpg'],['photo'],['http://bit.ly/127votingRecruitmentForm'],[VOTING TEAM RECRUITMENT]||We are now accepting applications for our different VOTING TEAMS! 📲||If you are interested in joining our teams for—|🔘Account creation|🔘Idolchamp|🔘Mubeat|🔘Whosfan/Mwave||APPLY NOW!👇|🔗https://t.co/ECu7RpEEb6||#NCT127_Favorite|#NCT127 https://t.co/XKCcnL04J7,"['NCT127_Favorite', 'NCT127']","",1214862263804448775,NCT 127 Voting,127voting,false,http://pbs.twimg.com/profile_images/1446147120839286785/NE3pQVGi_normal.jpg,https://pbs.twimg.com/profile_banners/1214862263804448775/1633623317,"",13724,47,251,13,3,255,2021-10-11T01:00:07.000-07:00
1448444838265896963,1451839866497536004,2021-10-23T09:16:12.000-07:00,https://twitter.com/VativeGGs/status/1448444838265896963/photo/1,['http://pbs.twimg.com/media/FBno5VWWEAIZx0z.jpg'],['photo'],"","Recruitment? Sure. This Friday, October 14, recruitment will begin. This time I'll be picking up Fortnite players so if you're interested, shoot me a Tweet AND add Syynz#0006 on Discord! ||#Fortnite #ApexLegends #eSports #FortniteCreative #gamingcommunity #twitchstreamer https://t.co/Zq0tBEefd6","['Fortnite', 'ApexLegends', 'eSports', 'FortniteCreative', 'gamingcommunity', 'twitchstreamer']","",1310596955991683072,Vative GGs | Est. 2021 • #VativeFTW,VativeGGs,false,http://pbs.twimg.com/profile_images/1448020448365748229/K5Dz0IjS_normal.jpg,https://pbs.twimg.com/profile_banners/1310596955991683072/1634069953,"",6,11,3,0,2,20,2021-10-14T00:25:34.000-07:00
1449084137764278272,1451849282429104138,2021-10-23T09:53:37.000-07:00,https://twitter.com/HonourableHloni/status/1449084137764278272/photo/1,['http://pbs.twimg.com/media/FBwuV8tX0AMdhhO.jpg'],['photo'],"",SAPS is hiring Security Officers to guard Hawks offices. https://t.co/UNMK611o0D,"","",1272952160,Bra Hloni,HonourableHloni,false,http://pbs.twimg.com/profile_images/1376191592248320009/XoBmPDrO_normal.jpg,https://pbs.twimg.com/profile_banners/1272952160/1634418130,http://abs.twimg.com/images/themes/theme1/bg.png,38124,1702,152,5,17,95,2021-10-15T18:45:55.000-07:00
1450230202936840195,1451855259563970560,2021-10-23T10:17:22.000-07:00,"","","","",I was spiked last month in a club in Glasgow and the bouncers watched as my friends dragged me outside as I couldn’t see and could barely breath n then they refused to let my pal bring me out a cup of water :) Clubs need to do better and that starts with hiring the right staff.,"","",4796267793,Rachael Orr,rachael_orrr,false,http://pbs.twimg.com/profile_images/1427919339315945473/HoEDYV02_normal.jpg,https://pbs.twimg.com/profile_banners/4796267793/1624715185,"",320,339,15362,66,43,1224,2021-10-18T22:39:59.000-07:00
1450865962102583301,1451860669100224512,2021-10-23T10:38:52.000-07:00,"","","","","My team at  is hiring a human factor researcher. If you have experience designing, running and analyzing user studies and want to work on futuristic features for iOS devices, please reach out!","","",15433225,Nils Hayat,nilsou,false,http://pbs.twimg.com/profile_images/671762259316609024/Tn4RyI-o_normal.jpg,https://pbs.twimg.com/profile_banners/15433225/1429071648,http://abs.twimg.com/images/themes/theme1/bg.png,1191,463,60,2,2,31,2021-10-20T16:46:15.000-07:00
1450870151872761862,1451843280463933440,2021-10-23T09:29:46.000-07:00,https://twitter.com/penycaefc1/status/1450870151872761862/photo/1,['http://pbs.twimg.com/media/FCKGsc4XIAg129V.jpg'],['photo'],['https://www.facebook.com/penycae.fc/posts/4392111444157629'],"🌟 WE ARE HIRING - FIRST TEAM MANAGER 🌟|Unfortunately, due to work commitments, Manager Lee Pope has had to step down from the role. ||More Details:👇👇|https://t.co/Sj8kkPbttQ https://t.co/eGzE4083gm","","",603013222,Penycae FC,penycaefc1,false,http://pbs.twimg.com/profile_images/1283439753203978243/bSDPB2O1_normal.jpg,https://pbs.twimg.com/profile_banners/603013222/1594830858,http://abs.twimg.com/images/themes/theme1/bg.png,3070,1408,17,0,2,8,2021-10-20T17:02:54.000-07:00
1451177339556179968,1451860611357360129,2021-10-23T10:38:38.000-07:00,https://twitter.com/asherblab/status/1451177339556179968,"","",['https://jobs.ncl.ac.uk/job/Newcastle-Animal-Research-Technician/729666601/'],We are hiring. Animal Research Technician. To be based in the beautiful Lake District and working closely with ⁦@lakesfreerange⁩ on laying hen behaviour and welfare https://t.co/ctnYhQdn4J,"",['lakesfreerange'],861941562783268864,Asher Behaviour Lab,asherblab,false,http://pbs.twimg.com/profile_images/1073475283796324352/hrniLOPa_normal.jpg,https://pbs.twimg.com/profile_banners/861941562783268864/1494338220,"",1485,1001,27,2,0,41,2021-10-21T13:23:33.000-07:00
1451183421405859847,1451844183912820736,2021-10-23T09:33:22.000-07:00,https://twitter.com/djdaviesfuels/status/1451183421405859847/photo/1,['http://pbs.twimg.com/media/FCOjZnrUYAofHqa.png'],['photo'],"","We're Hiring!!!|Due to continued expansion we are looking for a Class 2 ADR Tanker Driver, think you've got what it takes. Then get in touch.. https://t.co/cuxMp3EiA3","","",868630578,DJ DAVIES,djdaviesfuels,false,http://pbs.twimg.com/profile_images/1333347664080072708/OI0uV_At_normal.jpg,https://pbs.twimg.com/profile_banners/868630578/1628523917,http://abs.twimg.com/images/themes/theme1/bg.png,1162,492,3,0,0,5,2021-10-21T13:47:44.000-07:00
1451247950655545351,1451854174560346113,2021-10-23T10:13:04.000-07:00,https://twitter.com/SoaRGaming/status/1451247950655545351/video/1,['http://pbs.twimg.com/media/FCPiTZiX0AMNqpP.jpg'],['video'],['https://hitmarker.net/companies/soar-gaming'],"🚨 WE'RE HIRING 🚨||We are excited to offer more full-time roles at SoaR Gaming||💼 Content Director|💼 Account Manager||If you know someone interested tag them below, and if YOU are interested, learn more &amp; apply here 👇||https://t.co/2y3V9i4qpf https://t.co/BE8woOa8Sj","","",287455903,SoaR,SoaRGaming,true,http://pbs.twimg.com/profile_images/1451291700488548364/QtVctbcJ_normal.jpg,https://pbs.twimg.com/profile_banners/287455903/1634051006,http://abs.twimg.com/images/themes/theme1/bg.png,496142,87,236,5,31,31,2021-10-21T18:04:08.000-07:00
1451490555351928845,1451833704293277696,2021-10-23T08:51:43.000-07:00,https://twitter.com/bridgycc/status/1451490555351928845,['http://pbs.twimg.com/media/FCS681vWUAI34Ae.jpg'],['photo'],"",🏏 WE'RE HIRING! 🏏|We have a fantastic opportunity for a Head/Player Coach to lead our team of qualified coaches to plan and deliver our Cricket Programme across the club. See below for more details. If you are interested please contact our club email below or dm 💙💙 https://t.co/BGqNGqEuaZ,"","",571551173,Bridgwater CC,BridgyCC,false,http://pbs.twimg.com/profile_images/1394625168195178496/UYKuunkx_normal.jpg,https://pbs.twimg.com/profile_banners/571551173/1623668401,http://abs.twimg.com/images/themes/theme1/bg.png,1982,524,19,2,1,14,2021-10-22T10:08:10.000-07:00
1451495663917731876,1451858493590355973,2021-10-23T10:30:13.000-07:00,https://twitter.com/ThePandemicInst/status/1451495663917731876/photo/1,['http://pbs.twimg.com/media/FCS--MoWUAMsCSC.jpg'],['photo'],"",We are delighted to announce the build out of our HQ team in Liverpool.  |Phase 1 of our recruitment plan will see opportunities to join the team for recent graduates and interns through to leadership positions.  |Watch this space over the comming weeks and months|#TeamScience https://t.co/PvOVM1D08l,['TeamScience'],"",1395049527355265024,The Pandemic Institute,ThePandemicInst,false,http://pbs.twimg.com/profile_images/1436315925230333977/l-A63fQF_normal.jpg,https://pbs.twimg.com/profile_banners/1395049527355265024/1631279377,"",719,67,54,4,2,19,2021-10-22T10:28:28.000-07:00
1451521097917210637,1451837684108963845,2021-10-23T09:07:32.000-07:00,"","","",['https://us-redhat.icims.com/jobs/89713/us-raleigh/job'],SEO job alert! Red Hat is hiring a Tech SEO to:|- improve our platform|- identify opportunities &amp; issues|- drive creative solutions|- solve enterprise level challenges|- learn SO MANY THINGS!|- work with clever folks|#seo #techseo #seojob #opensource ||https://t.co/POiu6OJ0lb,"['seo', 'techseo', 'seojob', 'opensource']","",14297139,JP “Web Crawling Chaos” Sherman 🦖,jpsherman,false,http://pbs.twimg.com/profile_images/1175037130944450560/QeKSxXQJ_normal.jpg,https://pbs.twimg.com/profile_banners/14297139/1629925952,http://abs.twimg.com/images/themes/theme9/bg.gif,4141,2126,8,1,0,8,2021-10-22T12:09:32.000-07:00
1451531801432780801,1451854719656374275,2021-10-23T10:15:13.000-07:00,"","","",['https://bit.ly/2Zf9sIh'],"My department is hiring a Science Education Specialist to support chemistry teaching, faculty and TA development, and DBER. I have worked with several SESs so please ask me questions about the position if you have them. Apply by Nov 3 here: https://t.co/WsqjoE1nl5 @chemjobber","",['Chemjobber'],1054880692952227841,Jaclyn J. Stewart,JaclynJStewart,false,http://pbs.twimg.com/profile_images/1107402434312179712/lELNKO7m_normal.png,https://pbs.twimg.com/profile_banners/1054880692952227841/1552861246,"",603,1051,25,0,0,24,2021-10-22T12:52:04.000-07:00
1451544221903634438,1451860832871124993,2021-10-23T10:39:31.000-07:00,"","","",['https://resolvephilly.org/communications-manager'],"Job alert 🚨: We're hiring a Communications Manager to lead our public relations efforts, build out our blog, and boss me around. We're looking for a storyteller who loves building narratives AND relationships. ||Position is remote, and the salary is 70K. |https://t.co/bFvQbMC8SY","","",963533773949239297,Resolve Philly,resolvephilly,false,http://pbs.twimg.com/profile_images/1222567641237409795/5SOxb14m_normal.jpg,https://pbs.twimg.com/profile_banners/963533773949239297/1580500410,"",2530,505,1,0,0,6,2021-10-22T13:41:25.000-07:00
1451548903313068042,1451841813145341952,2021-10-23T09:23:56.000-07:00,https://twitter.com/Goleudy_Tweets/status/1451548903313068042/photo/1,['http://pbs.twimg.com/media/FCTVGNgWQAETEpy.jpg'],['photo'],['http://goleudy.org'],"Want to make a real difference in #Pembrokeshire?||We have fantastic #AssistantSupportWorkers vacancies in Pembs. ||£9.24 per hour.||Apply at https://t.co/lnYLYtq4EV, or email recruitment@goleudy.org to join virtual event on Mon 25 Oct 2-4pm! https://t.co/DwNUdDOlrH","['Pembrokeshire', 'AssistantSupportWorkers']","",202571158,Goleudy,Goleudy_Tweets,false,http://pbs.twimg.com/profile_images/1280779312967356416/FA6_FaE8_normal.jpg,https://pbs.twimg.com/profile_banners/202571158/1594385747,http://abs.twimg.com/images/themes/theme1/bg.png,2943,1981,2,1,0,3,2021-10-22T14:00:01.000-07:00
1451586316773195785,1451843403617013762,2021-10-23T09:30:16.000-07:00,https://twitter.com/NPRCodeSwitch/status/1451586316773195785/photo/1,['http://pbs.twimg.com/media/FCURpZ0VEAAhwdv.jpg'],['photo'],['https://www.npr.org/sections/codeswitch/2021/10/20/250024970/code-switch-is-hiring-a-host'],One (1) week left to apply to be the next host of Code Switch 👇🏿||https://t.co/UF39ZtERyg https://t.co/uPNP5D8UFB,"","",1117836660,NPR's Code Switch,NPRCodeSwitch,true,http://pbs.twimg.com/profile_images/1242537406420725766/y_0QoWW8_normal.png,https://pbs.twimg.com/profile_banners/1117836660/1585078978,http://abs.twimg.com/images/themes/theme1/bg.png,154114,1372,52,6,4,22,2021-10-22T16:28:41.000-07:00
1451588610378145814,1451841465706065922,2021-10-23T09:22:33.000-07:00,https://twitter.com/MAVscotland/status/1451588610378145814/photo/1,"['http://pbs.twimg.com/media/FCUUI2xXoAwNPPM.jpg', 'http://pbs.twimg.com/media/FCUUI2uXoCUP7FL.jpg']","['photo', 'photo']",['http://www.MAV.scot/jobs'],WE ARE HIRING! ||We’re on the lookout for a new @NavigatorsScot for @NHSTayside at Ninewells Hospital Dundee and a part time @PathfinderScot for Inverness ||To apply https://t.co/zNWJinGn3U ||Both closing 12th November @4pm https://t.co/ItP9wHkSNB,"","['NavigatorsScot', 'NHSTayside', 'PathfinderScot', '4pm']",248359538,Medics Against Violence,MAVscotland,false,http://pbs.twimg.com/profile_images/1399851276087742466/HGklDc1s_normal.jpg,https://pbs.twimg.com/profile_banners/248359538/1620574442,http://abs.twimg.com/images/themes/theme1/bg.png,6205,4733,11,1,0,10,2021-10-22T16:37:48.000-07:00
1451589421334241292,1451853332654563328,2021-10-23T10:09:43.000-07:00,"","","",['https://www.unipd.it/procedura-2021RUAPON'],We are hiring!! |We are looking for a researcher to work at @DFAUnipd on nanostructured materials for solar-assited water remediation. Three-years position. DEADLINE: 2nd Nov @ 1pm (local time).|https://t.co/2maohmWAzb,"",['DFAUnipd'],1451586168584380416,Chiara Maurizio,ChiaraMaurizioC,false,http://pbs.twimg.com/profile_images/1451586270673739810/QO6r8FVz_normal.png,"","",1,0,0,0,0,4,2021-10-22T16:41:01.000-07:00
1451590425756721153,1451841385091538945,2021-10-23T09:22:14.000-07:00,https://twitter.com/PathfinderScot/status/1451590425756721153/photo/1,['http://pbs.twimg.com/media/FCUVyswXEAcJxwU.jpg'],['photo'],['http://www.mav.scot/jobs'],WE’RE HIRING! ||We’re looking for a part- time @PathfinderScot to join our team in Inverness ||To apply go to https://t.co/ZjLYiV7KqM ||Closing date 12th November @4pm we’d love to hear from you! https://t.co/kyWWaKNhDA,"","['PathfinderScot', '4pm']",1377348892346490900,Pathfinder,PathfinderScot,false,http://pbs.twimg.com/profile_images/1377349512231055361/1zKEHq11_normal.jpg,https://pbs.twimg.com/profile_banners/1377348892346490900/1632130008,"",260,662,6,0,0,4,2021-10-22T16:45:01.000-07:00
1451602883007242240,1451842556287881225,2021-10-23T09:26:54.000-07:00,"","","",['https://review.firstround.com/podcast/episode-40'],"Our COO, Gretchen Howard, was interviewed for @firstround's new podcast. Listen to this conversation about Gretchen's executive hiring philosophy and the three must-have traits that she looks for in executive hires. https://t.co/Ym67NljRzv","",['firstround'],1428741891911086088,Robinhood Comms,RobinhoodComms,true,http://pbs.twimg.com/profile_images/1447646266863722496/Z7_FyHpv_normal.png,https://pbs.twimg.com/profile_banners/1428741891911086088/1634590505,"",22792,6,184,1,186,25,2021-10-22T17:34:31.000-07:00
1451612604250656803,1451855657494327301,2021-10-23T10:18:57.000-07:00,"","","",['https://sc.edu/study/colleges_schools/artsandsciences/english_language_and_literature/my_english/documents/job_ad_latinx_literature_2021_b.pdf'],My department is bucking all those national trends and HIRING an assistant prof of Latinx Literatures and Cultures! Please apply or spread the word! I'm happy to answer any questions. https://t.co/SZ33wcuNYP,"","",423012813,Anne Gulick,aydub78,false,http://pbs.twimg.com/profile_images/1018871493739073536/RXHAXZLv_normal.jpg,"",http://abs.twimg.com/images/themes/theme1/bg.png,340,415,27,2,0,24,2021-10-22T18:13:09.000-07:00
