org_id,samp_id,samp_datetime,org_url,org_media_url,org_media_type,org_attached_links,org_text,org_hashtags,org_user_metions,user_id,user_name,user_screen_name,user_verified,user_profile_image_url,user_profile_banner_url,user_profile_background_image_url,user_followers_count,user_friends_count,org_favorite_count,org_quote_count,org_reply_count,org_retweet_count,org_datetime
1457120874864259075,1457120874864259075,2021-11-06T23:01:03.000-07:00,"","","",['https://bit.ly/3kxY4PB'],Here are eight tips for hiring managers seeking to conducting excellent remote interviews in order to identify top talent from a distance.|#RemoteInterviews #IdentifyingTalent https://t.co/eHd15PjGnY,"['RemoteInterviews', 'IdentifyingTalent']","",817833108,sandra egloff,SandraEgloff,false,http://pbs.twimg.com/profile_images/686655480232558596/O4BZ4kQX_normal.jpg,https://pbs.twimg.com/profile_banners/817833108/1443781299,http://abs.twimg.com/images/themes/theme1/bg.png,60,135,0,0,0,0,2021-11-06T23:01:03.000-07:00
1457121106519859200,1457121106519859200,2021-11-06T23:01:58.000-07:00,"","","","","@mariacaulfield @RCObsGyn That will allow the maternity units at 2 hospitals to hire a new 'Diversity Manager'! Come on, stop the overstaffing, hiring unnecessary managers and do some real work.","","['mariacaulfield', 'RCObsGyn']",4716254643,Jonathan R,drjonathan77,false,http://pbs.twimg.com/profile_images/800329069988577282/lzb4VGEq_normal.jpg,"",http://abs.twimg.com/images/themes/theme1/bg.png,574,480,0,0,0,0,2021-11-06T23:01:58.000-07:00
1457122015027073024,1457122015027073024,2021-11-06T23:05:35.000-07:00,https://twitter.com/forgeandfoster/status/1457122015027073024/photo/1,['http://pbs.twimg.com/media/FDi8orOXMAQIDHM.jpg'],['photo'],['https://forgeandfoster.ca/careers/'],We're hiring! https://t.co/9gGfYlpl1R||#hiring #employment #hamont #hamilton #jobs  #recruiting #career #employment #jobsearch https://t.co/T1kIoaEWSM,"['hiring', 'employment', 'hamont', 'hamilton', 'jobs', 'recruiting', 'career', 'employment', 'jobsearch']","",725022189016256513,Forge & Foster,forgeandfoster,false,http://pbs.twimg.com/profile_images/725031661163843584/TVpzdcDU_normal.jpg,https://pbs.twimg.com/profile_banners/725022189016256513/1461697683,http://abs.twimg.com/images/themes/theme1/bg.png,1772,1497,0,0,0,0,2021-11-06T23:05:35.000-07:00
1457122189962928136,1457122189962928136,2021-11-06T23:06:16.000-07:00,"","","",['https://bit.ly/3wlnJQ6'],"Want to work at Gulf Coast Regional Medical Center? We're hiring in #PanamaCity, FL! Click for details: https://t.co/stJFcYw2Jq #ER","['PanamaCity', 'ER']","",1218262135513415680,HCAHealthJobs,hca_health,false,http://pbs.twimg.com/profile_images/1218262705578168320/wvIb25s1_normal.jpg,https://pbs.twimg.com/profile_banners/1218262135513415680/1582046265,"",1400,49,0,0,0,0,2021-11-06T23:06:16.000-07:00
1457122341989851138,1457122341989851138,2021-11-06T23:06:53.000-07:00,"","","","",Been trying to tell y’all A&amp;M DC Mike Elko is that dude. I had hoped Saban would take a crack at hiring him last year,"","",180110671,~𝙂𝙧𝙞𝙩𝙯~,ewhigham,false,http://pbs.twimg.com/profile_images/1429487244428156929/if7dx5Qk_normal.jpg,https://pbs.twimg.com/profile_banners/180110671/1592028183,http://abs.twimg.com/images/themes/theme1/bg.png,2011,1688,0,0,0,0,2021-11-06T23:06:53.000-07:00
1457122344732823553,1457122506423382027,2021-11-06T23:07:32.000-07:00,"","","",['https://bit.ly/3wujku7'],"Want to work at Transwestern? We're hiring in San Francisco, CA! Click for details: https://t.co/Z2ddNYhg7s #Marketing #SF","['Marketing', 'SF']","",3017769209,Transwestern Careers,JoinTeamTW,false,http://pbs.twimg.com/profile_images/562988613151911936/CoidYHgt_normal.png,https://pbs.twimg.com/profile_banners/3017769209/1486745376,http://abs.twimg.com/images/themes/theme1/bg.png,220,244,0,0,0,1,2021-11-06T23:06:53.000-07:00
1457122472122359813,1457122878588080131,2021-11-06T23:09:00.000-07:00,"","","",['https://hotelnaukri.com/?p=30759'],Hotel Jobs In V Resorts Midwood Breeze Dehradun India https://t.co/0KJ4CfnTDA #hotelcareers #hoteljobs #hospitality #hiring #nowhiring #hotels #jobsearch #hotelvacancy #hotelrecruitment #jobshiring #jobinterview #hotelier #jobsite,"['hotelcareers', 'hoteljobs', 'hospitality', 'hiring', 'nowhiring', 'hotels', 'jobsearch', 'hotelvacancy', 'hotelrecruitment', 'jobshiring', 'jobinterview', 'hotelier', 'jobsite']","",30907560,Hotel Naukri .Com,hotelnaukri,false,http://pbs.twimg.com/profile_images/1201918500907843584/2RhXnqcy_normal.jpg,https://pbs.twimg.com/profile_banners/30907560/1575394678,http://abs.twimg.com/images/themes/theme13/bg.gif,1703,1924,0,0,0,1,2021-11-06T23:07:24.000-07:00
1457122808031420418,1457122808031420418,2021-11-06T23:08:44.000-07:00,"","","",['https://bit.ly/3wujPnZ'],"If you love #beautywithoutlimits and are looking for some extra $ for your holiday spending, Ulta Beauty is hiring! We are on the hunt for Beauty Advisors this holiday season, apply today and join us to #CelebrateMore! https://t.co/UfanrRvUAu","['beautywithoutlimits', 'CelebrateMore']","",732227909243535360,Ulta Beauty Jobs,ultabeautyjobs,false,http://pbs.twimg.com/profile_images/732233511365529602/4Fc8lYaD_normal.jpg,https://pbs.twimg.com/profile_banners/732227909243535360/1557522845,http://abs.twimg.com/images/themes/theme1/bg.png,1218,116,0,0,0,0,2021-11-06T23:08:44.000-07:00
1457122873584332801,1457122873584332801,2021-11-06T23:08:59.000-07:00,"","","","",@PetraMcCarron2 @SHEsus__Christ @RosannaPhillip @spiritdance33 @Roseymelhill @hugolowell @tina_reunite @jlynn_huber @ltwlauren @sergeivote @RobinMcMee @desjen @katibug817 @RoopMichelle @snarkunlimited @LEAD_Coalition @jackie14916195 @jacketrose86 @muse_mystery The asshole pretty much forced me into early retirement by cutting my hours even though I was his lead man on the toughest jobs. The criticism was justified - nepotism in hiring his drinking buddies,"","['PetraMcCarron2', 'SHEsus__Christ', 'RosannaPhillip', 'spiritdance33', 'Roseymelhill', 'hugolowell', 'tina_reunite', 'jlynn_huber', 'ltwlauren', 'sergeivote', 'RobinMcMee', 'desjen', 'katibug817', 'RoopMichelle', 'snarkunlimited', 'LEAD_Coalition', 'jackie14916195', 'jacketrose86', 'muse_mystery']",1222546376812351489,lezurko,lezurko,false,http://pbs.twimg.com/profile_images/1294637272617439233/y9Y0OH_x_normal.jpg,https://pbs.twimg.com/profile_banners/1222546376812351489/1597500555,"",30,55,0,0,0,0,2021-11-06T23:08:59.000-07:00
1457123096645672971,1457123096645672971,2021-11-06T23:09:52.000-07:00,"","","","","We're hiring in #Dixon, CA! Click the link in our bio to apply to this job and more: Superintendent at Richmond American Homes #superintendent","['Dixon', 'superintendent']","",22635683,TMJ-SAC Constr Jobs,tmj_sac_constru,false,http://pbs.twimg.com/profile_images/676517588185165824/pqO75gAe_normal.jpg,https://pbs.twimg.com/profile_banners/22635683/1450129338,http://abs.twimg.com/images/themes/theme1/bg.png,222,147,0,0,0,0,2021-11-06T23:09:52.000-07:00
1457123230003699713,1457123230003699713,2021-11-06T23:10:24.000-07:00,"","","","","@444hal I know you’re a concert/festival person so you know people pass out all the time, from Travis’s perspective it’s not hard to imagine that he thought it was like any other festival. I think the true villains in this is all of the staff as well as the hiring staff.","",['444hal'],3037043889,🌘,sadsoulstice,false,http://pbs.twimg.com/profile_images/1445053271681404939/grQKseWG_normal.jpg,https://pbs.twimg.com/profile_banners/3037043889/1620233321,http://abs.twimg.com/images/themes/theme1/bg.png,336,692,0,0,0,0,2021-11-06T23:10:24.000-07:00
1457123878279565312,1457123878279565312,2021-11-06T23:12:59.000-07:00,"","","","","@AFCRRE @Soapy777 @OsmanZtheGooner Is that a good thing? Constant chopping and changing, raul, Sven, garlick, Vinai, gazidis, Emery, edu, Arteta, cagigao, getting rid of scouting, then hiring a company to find us new scouts. There’s no sustainability for a long term plan😂already rumours edu is off after January","","['AFCRRE', 'Soapy777', 'OsmanZtheGooner']",1432679393013506049,#ArtetaOut,BanterClubAFC,false,http://pbs.twimg.com/profile_images/1450408088272523265/8SXE-kVW_normal.jpg,https://pbs.twimg.com/profile_banners/1432679393013506049/1630412547,"",12,132,0,0,0,0,2021-11-06T23:12:59.000-07:00
1457124155925712896,1457124155925712896,2021-11-06T23:14:05.000-07:00,"","","","","The best thing about the Stephen Silas Rockets this season has been their defense and I for one never thought hiring Carlisle’s offensive Guru meant we’d have a top tier Defense… was the same in the first 6-8 games post harden pre injuries last year, too. #Rockets #LightTheFuse","['Rockets', 'LightTheFuse']","",168682294,Parker😷Ainsworth,painsworth512,false,http://pbs.twimg.com/profile_images/1121476528859119617/-3-R3Sm7_normal.jpg,https://pbs.twimg.com/profile_banners/168682294/1556215816,http://abs.twimg.com/images/themes/theme1/bg.png,1365,1523,0,0,0,0,2021-11-06T23:14:05.000-07:00
1457124202339880962,1457124202339880962,2021-11-06T23:14:16.000-07:00,"","","",['https://relode.co/FHU94YE'],"Great opportunity for Family Development Specialist  - Part Time in Gainesville, GA #hiring https://t.co/iqfvvIud7v via @relodetweets",['hiring'],['RelodeTweets'],2460446502,Gevonna Williams,GevonnaWilliams,false,http://pbs.twimg.com/profile_images/1431819193368948736/l1mPnaqK_normal.jpg,"",http://abs.twimg.com/images/themes/theme1/bg.png,32,101,0,0,0,0,2021-11-06T23:14:16.000-07:00
1457124520695787520,1457124520695787520,2021-11-06T23:15:32.000-07:00,"","","",['http://dlvr.it/SC2Fxt'],"Now Hiring: PT Custodian: Cerritos College, Norwalk CA - 90650 https://t.co/UXHUGBSVC3","","",850021051501125632,BlacksInHigherEd.com,BlacksHigherEd,false,http://pbs.twimg.com/profile_images/1382455206399537157/86UmDLfc_normal.png,https://pbs.twimg.com/profile_banners/850021051501125632/1491502849,http://abs.twimg.com/images/themes/theme1/bg.png,185,617,0,0,0,0,2021-11-06T23:15:32.000-07:00
1457124697502412803,1457124697502412803,2021-11-06T23:16:14.000-07:00,"","","","",@mecchax idk man i really don’t care all that much about this and definitely don’t care enough to continue this twitter conversation. travis should at the very least be able to held accountable for hiring or associating with bad venue management and he most definitely has a history,"",['mecchax'],1281345363085950976,Tsoumo,tsoumo_,false,http://pbs.twimg.com/profile_images/1394194426742800385/nk2p-Ta7_normal.jpg,https://pbs.twimg.com/profile_banners/1281345363085950976/1602620190,"",39,229,0,0,0,0,2021-11-06T23:16:14.000-07:00
1457124751005167616,1457124751005167616,2021-11-06T23:16:27.000-07:00,"","","","","@xLAWx_ @Keffy my old job 'furloughed' 95% of the staff, promised they'd bring us back for months &amp; then officially fired us all via zoom, after we all left reviews they're now hiring starting at $15 an hour when we started at $10.50 &amp; had gotten to $11.50 after 2 years working with them🥲","","['xLAWx_', 'Keffy']",915068407560785920,misguided soul🖤,WokestOfThemAll,false,http://pbs.twimg.com/profile_images/1422587825296486405/0WAbo3bn_normal.jpg,https://pbs.twimg.com/profile_banners/915068407560785920/1634343725,"",109,207,0,0,0,0,2021-11-06T23:16:27.000-07:00
1457124864607801348,1457124864607801348,2021-11-06T23:16:54.000-07:00,"","","","","Want to work at U.S. Bank? We're hiring in #Lynnwood, WA! Click the link in our bio for details on this job and more: Business Banking Specialist - Lynnwood #Sales","['Lynnwood', 'Sales']","",21677374,TMJ - SEA Sales Jobs,tmj_sea_sales,false,http://pbs.twimg.com/profile_images/668600468260548608/qKxaAt7g_normal.jpg,https://pbs.twimg.com/profile_banners/21677374/1448241749,http://abs.twimg.com/images/themes/theme1/bg.png,433,258,0,0,0,0,2021-11-06T23:16:54.000-07:00
1457124911562964992,1457124911562964992,2021-11-06T23:17:05.000-07:00,"","","",['https://bit.ly/3BYyfOw'],"Want to work at Workcare? We're hiring in Avila Beach, CA! Click for details: https://t.co/oatNNkXnCM #becauseyoumatter #HealthCare","['becauseyoumatter', 'HealthCare']","",1448396237728731137,WorkCare Careers,WorkCarejobs,false,http://pbs.twimg.com/profile_images/1448402360938557441/FpK7xcO4_normal.jpg,https://pbs.twimg.com/profile_banners/1448396237728731137/1634161551,"",2,0,0,0,0,0,2021-11-06T23:17:05.000-07:00
1457125283165884423,1457125283165884423,2021-11-06T23:18:34.000-07:00,"","","","",@MottChildren @usnews Why are you hiring science denying antivaxxers and giving them dubious “religious exemptions”,"","['MottChildren', 'usnews']",968538316206477313,misterian,MisterianZajac,false,http://pbs.twimg.com/profile_images/1451260325613944836/S6PF_4o5_normal.jpg,https://pbs.twimg.com/profile_banners/968538316206477313/1519752655,"",392,189,0,0,0,0,2021-11-06T23:18:34.000-07:00
1457125685143621632,1457125685143621632,2021-11-06T23:20:10.000-07:00,"","","",['https://startup.jobs/production-system-reliability-engineer-levio-2590342'],Levio is growing! 💪  Hiring a Production System Reliability Engineer (Montreal) https://t.co/v0iOP9DHec,"","",784792642446032896,🛠 Dev Startup Jobs,DevStartupJobs,false,http://pbs.twimg.com/profile_images/1000721477191262209/LVDIPSiN_normal.jpg,https://pbs.twimg.com/profile_banners/784792642446032896/1527425312,http://abs.twimg.com/images/themes/theme1/bg.png,1878,10,0,0,0,0,2021-11-06T23:20:10.000-07:00
1457125693578366976,1457125693578366976,2021-11-06T23:20:12.000-07:00,"","","",['https://startup.jobs/new-business-account-executive-nextroll-2590421'],NextRoll is growing! 💪  Hiring a New Business Account Executive (Atlanta) https://t.co/PVjyJ6BLIS,"","",1001797180896800768,✈️ Executive Startup Jobs,AllExecJobs,false,http://pbs.twimg.com/profile_images/1001798074681962497/4h3X4rzf_normal.jpg,https://pbs.twimg.com/profile_banners/1001797180896800768/1527682343,http://abs.twimg.com/images/themes/theme1/bg.png,641,10,0,0,0,0,2021-11-06T23:20:12.000-07:00
1457126707840880640,1457126729894539265,2021-11-06T23:24:19.000-07:00,"","","",['https://relode.co/FM8XAYE'],Great opportunity for Child &amp; Adolescent Behavioral Therapist-Illinois in Remote #hiring https://t.co/HNpWsraC4c via @relodetweets |#remotejobs,"['hiring', 'remotejobs']",['RelodeTweets'],2460446502,Gevonna Williams,GevonnaWilliams,false,http://pbs.twimg.com/profile_images/1431819193368948736/l1mPnaqK_normal.jpg,"",http://abs.twimg.com/images/themes/theme1/bg.png,32,101,0,0,0,1,2021-11-06T23:24:13.000-07:00
1457126778045145088,1457126778045145088,2021-11-06T23:24:30.000-07:00,"","","","",@pranck70 @OANN How many IRS agents are they hiring with the new bill?,"","['pranck70', 'OANN']",765550434643619840,Cathy M.,catmaj040,false,http://pbs.twimg.com/profile_images/1295735372018782211/1HcB4-du_normal.jpg,https://pbs.twimg.com/profile_banners/765550434643619840/1471357805,"",135,231,0,0,0,0,2021-11-06T23:24:30.000-07:00
1457126930130423812,1457126930130423812,2021-11-06T23:25:06.000-07:00,https://twitter.com/reacharoundu/status/1457126930130423812/photo/1,['http://pbs.twimg.com/media/FDjBOAKVkAEQb5U.jpg'],['photo'],"",@Carol105Baker Hospital systems are buckling under the weight of unvaccinated covid patients.||This makes these hiring &amp; firing policies unfortunate but rational. https://t.co/DpdJz05nzg,"",['Carol105Baker'],1429588082379030532,ReachAround,reacharoundu,false,http://abs.twimg.com/sticky/default_profile_images/default_profile_normal.png,"","",16,92,0,0,0,0,2021-11-06T23:25:06.000-07:00
1457127368418635779,1457127368418635779,2021-11-06T23:26:51.000-07:00,"","","",['https://blackbaud-careers.employeereferrals.com/jobs?locale=en&referrer_id=GA3a4'],Blackbaud is hiring! Come work with us to help “good take over” by supporting the global social good community.... https://t.co/PNKbkVsfFJ,"","",14622880,Athene Numphe,AtheneNumphe,false,http://pbs.twimg.com/profile_images/1305243095454408707/pOqseAbs_normal.jpg,https://pbs.twimg.com/profile_banners/14622880/1414408356,http://abs.twimg.com/images/themes/theme10/bg.gif,314,348,0,0,0,0,2021-11-06T23:26:51.000-07:00
1457127414849540100,1457127414849540100,2021-11-06T23:27:02.000-07:00,"","","",['https://curiouscat.qa/bogboogie/post/1250033875'],Is Chimeric Studios hiring any time soon? For either a job or an internship? — Definitely not right now! We’ve been so busy!  https://t.co/CRwmFfEBhj,"","",2686209296,SON M.,bogboogie,false,http://pbs.twimg.com/profile_images/1451292639760986117/rpoXDDjL_normal.jpg,https://pbs.twimg.com/profile_banners/2686209296/1635730360,http://abs.twimg.com/images/themes/theme1/bg.png,19781,997,0,0,0,0,2021-11-06T23:27:02.000-07:00
1457127432306106369,1457127432306106369,2021-11-06T23:27:06.000-07:00,"","","","","Career tip for landing jobs like 'EHS Intern' in #SanJose, CA. Go on informational interviews. The best way to get a meeting with a hiring manager is to ask for an informational meeting. #internship","['SanJose', 'internship']","",153927500,TMJ-SJC Intern Jobs,tmj_SJC_intern,false,http://pbs.twimg.com/profile_images/711442690915741696/5yxSaZyj_normal.jpg,https://pbs.twimg.com/profile_banners/153927500/1458456131,http://abs.twimg.com/images/themes/theme1/bg.png,332,239,0,0,0,0,2021-11-06T23:27:06.000-07:00
1457127728985960449,1457127728985960449,2021-11-06T23:28:17.000-07:00,"","","",['https://bit.ly/31stD6q'],We're hiring! Click to apply: Cook - https://t.co/PDUPdcjxrT #Cook #Hospitality,"['Cook', 'Hospitality']","",1322203178268532736,Heritage Careers,Heritage_Jobs,false,http://pbs.twimg.com/profile_images/1323650079425728514/D_OUBZVS_normal.jpg,https://pbs.twimg.com/profile_banners/1322203178268532736/1604417905,"",5,0,0,0,0,0,2021-11-06T23:28:17.000-07:00
1457127947589062660,1457127947589062660,2021-11-06T23:29:09.000-07:00,"","","","","@FightinTT Dabo, Day, Saban, Riley, Kirby all easily better. So definitely not a top 5 coach and has nothing impressive on his track record besides 1 national championship 8 years ago where he had the number 1 pick. Seems like we are firing O and hiring the same caliber coach imo","",['FightinTT'],1227819953610469377,OutTheBox,OutTheBoxPod,false,http://pbs.twimg.com/profile_images/1434903736682491904/11ffRcld_normal.jpg,https://pbs.twimg.com/profile_banners/1227819953610469377/1581570375,"",618,403,0,0,0,0,2021-11-06T23:29:09.000-07:00
1457129116054929408,1457129116054929408,2021-11-06T23:33:48.000-07:00,"","","","","Pechanga Resort &amp; Casino is hiring in #Temecula, CA! Click the link in our bio to apply: Catering &amp; Banquet Bartender - OC #bartender","['Temecula', 'bartender']","",108725480,TMJ-LAJ HRTA Jobs,tmj_LAJ_HRTA,false,http://pbs.twimg.com/profile_images/700490281519419392/C_JlHPy2_normal.jpg,https://pbs.twimg.com/profile_banners/108725480/1455844873,http://abs.twimg.com/images/themes/theme1/bg.png,116,80,0,0,0,0,2021-11-06T23:33:48.000-07:00
1457129193922338822,1457129193922338822,2021-11-06T23:34:06.000-07:00,"","","","","@EWHK70 But his rationalisation is awful, he claimed today in comms tbh Fernandes shouldn’t go with emotion yet the hypocrisy when discussing his mate. His soliloquy on not hiring the best managers as we failed with 2 of them, he’s actually sounding very stupid Eugene","",['EWHK70'],2367597721,FIGHT4MUFC,mufc4thefans,false,http://pbs.twimg.com/profile_images/449668634341048320/JRg3MDWU_normal.jpeg,https://pbs.twimg.com/profile_banners/2367597721/1404992103,http://abs.twimg.com/images/themes/theme1/bg.png,3296,1174,0,0,0,0,2021-11-06T23:34:06.000-07:00
1457129536252907520,1457129536252907520,2021-11-06T23:35:28.000-07:00,"","","",['https://bit.ly/3bQ288O'],We're hiring! Click to apply: Full Time Store Associate - Sperry - https://t.co/kruRNlvrED #Retail #B2C,"['Retail', 'B2C']","",711977178737610752,WWW Retail Jobs,WWWRetailJobs,false,http://pbs.twimg.com/profile_images/711977420803350528/N6MeuohI_normal.jpg,https://pbs.twimg.com/profile_banners/711977178737610752/1458585466,http://abs.twimg.com/images/themes/theme1/bg.png,210,47,0,0,0,0,2021-11-06T23:35:28.000-07:00
1457129650497458176,1457129650497458176,2021-11-06T23:35:55.000-07:00,"","","","",@ThatOhioGal Plenty of places here in Ohio that will train. Hondas are all hiring with no experience needed. Couple other jobs as well,"",['ThatOhioGal'],1144362238574321664,BernieMac65,BernieMac65,false,http://pbs.twimg.com/profile_images/1361447324380241920/Yno0Op6v_normal.jpg,"","",90,141,0,0,0,0,2021-11-06T23:35:55.000-07:00
1457129873449750530,1457129873449750530,2021-11-06T23:36:48.000-07:00,"","","",['https://bit.ly/3mR8wmP'],"Want to work at Prime Communications? We're hiring in #Plainview, TX! Click for details: https://t.co/tvn3cdt4wU #Sales","['Plainview', 'Sales']","",1423377207561494533,Sharon Mendoza,PrimecommsSM,false,http://pbs.twimg.com/profile_images/1423378437188763656/cGwOXb8V_normal.jpg,https://pbs.twimg.com/profile_banners/1423377207561494533/1628194840,"",5,10,0,0,0,0,2021-11-06T23:36:48.000-07:00
1457129928139366402,1457129928139366402,2021-11-06T23:37:01.000-07:00,"","","","",Stereotype accuracy aka racism. James Lindsay just said that this is why employers are not hiring black people. #betterdiscourse,['betterdiscourse'],"",1592581706,.,pavielle86,false,http://pbs.twimg.com/profile_images/1440078070442958866/AI7bl7dK_normal.jpg,https://pbs.twimg.com/profile_banners/1592581706/1610312454,http://abs.twimg.com/images/themes/theme1/bg.png,450,1889,0,0,0,0,2021-11-06T23:37:01.000-07:00
1457130100953174022,1457130100953174022,2021-11-06T23:37:42.000-07:00,"","","","",I mean are there no better officials available than the garbage guys they keep running out every weekend?? Or is it plain nepotism…some body’s wife’s daddy’s country club playing partner’s brother is responsible for hiring these  🤡 it is an absolute joke…and NOT just this game,"","",4071512477,Les  Kelly,ChasingKensho,false,http://pbs.twimg.com/profile_images/1410433311944724483/4mO7S7YF_normal.jpg,https://pbs.twimg.com/profile_banners/4071512477/1470575970,http://abs.twimg.com/images/themes/theme1/bg.png,1091,1384,0,0,0,0,2021-11-06T23:37:42.000-07:00
1457130697932476418,1457130697932476418,2021-11-06T23:40:05.000-07:00,"","","",['https://startup.jobs/warehouse-it-support-wayfair-2-2590444'],Wayfair is hiring 👉  Warehouse IT Support (South Elgin) https://t.co/wJystkR5kk,"","",784795003977625600,⛑ Support Startup Jobs,AllSupportJobs,false,http://pbs.twimg.com/profile_images/1000729103186751489/9HmcqEdC_normal.jpg,https://pbs.twimg.com/profile_banners/784795003977625600/1527427785,http://abs.twimg.com/images/themes/theme1/bg.png,939,10,0,0,0,0,2021-11-06T23:40:05.000-07:00
1457130815012450304,1457130815012450304,2021-11-06T23:40:33.000-07:00,"","","","",@KaiDaigoji @CryptoNasty75 @AbigailJHess That’s what everything is. The vast majority of gains from any asset is someone else buying hiring. ||Also greater fool is a funny name for it considering people who bought just 1 year ago might already be up 1000%+,"","['KaiDaigoji', 'CryptoNasty75', 'AbigailJHess']",2596782240,HEX.com,basedbtc_,false,http://pbs.twimg.com/profile_images/1442273794089914371/NGCwpVtL_normal.jpg,https://pbs.twimg.com/profile_banners/2596782240/1635146100,http://abs.twimg.com/images/themes/theme1/bg.png,529,473,0,0,0,0,2021-11-06T23:40:33.000-07:00
1248117575457751043,1457126108722171906,2021-11-06T23:21:51.000-07:00,"","","",['https://ccia.connxcareers.com//Job/Details/fe219d54d9be4ce0ad23d2815dcc58e9'],"I'm hiring a Senior #Bioinformatics Research Officer. Please apply if you're interested in studying atypical drivers of #paediatric #cancer using #WGS + #RNAseq investigating #noncoding mutations, #virus, #retrotransposons.  https://t.co/rApTqBVMec","['Bioinformatics', 'paediatric', 'cancer', 'WGS', 'RNAseq', 'noncoding', 'virus', 'retrotransposons']","",28207281,Mark Cowley,markjcowley,false,http://pbs.twimg.com/profile_images/439964936244973568/o2q5coT1_normal.jpeg,"",http://abs.twimg.com/images/themes/theme1/bg.png,1857,781,41,1,2,49,2020-04-09T05:16:33.000-07:00
1435262269131304960,1457111466910396420,2021-11-06T22:23:40.000-07:00,https://twitter.com/jaruz/status/1435262269131304960,['http://pbs.twimg.com/media/E-sTZwcWEAUYF9V.jpg'],['photo'],['https://career5.successfactors.eu/sfcareer/jobreqcareer?jobId=141520&company=C0000168410P'],Great opportunity to join an amazing organization! Are you passionate about AWS DevOps? Become part of the United Nations World Food Programme (@wfp) as our new DevOps Cloud Specialist. Apply at https://t.co/ANioyCcnQN #ITjobs  #hiring #devops #AWS #Cloud https://t.co/OnDQQ27oMp,"['ITjobs', 'hiring', 'devops', 'AWS', 'Cloud']",['WFP'],63712065,Antonio Zwollo,jaruz,false,http://pbs.twimg.com/profile_images/1046102218049556480/BipdBR6h_normal.jpg,https://pbs.twimg.com/profile_banners/63712065/1538245177,http://abs.twimg.com/images/themes/theme1/bg.png,299,207,26,5,1,28,2021-09-07T15:22:45.000-07:00
1452743686480142338,1457130269186662403,2021-11-06T23:38:23.000-07:00,"","","","",Join Checkr Forward this November 9th &amp; 10th to hear from the industry's best hiring managers and compliance professionals.||Get your free ticket now!,"","",2337966836,Checkr,checkr,false,http://pbs.twimg.com/profile_images/1410370793641500677/pziNC1qP_normal.png,https://pbs.twimg.com/profile_banners/2337966836/1625585899,http://abs.twimg.com/images/themes/theme1/bg.png,2536,346,28,1,0,6,2021-10-25T21:07:40.000-07:00
1455469897941663746,1457102839092858885,2021-11-06T21:49:23.000-07:00,"","","",['https://karlmaxberlin.recruitee.com/'],We're hiring|-&gt; MID/SENIOR Software Developer iOS (m/f/d)|-&gt; MID/SENIOR Software Developer Android|https://t.co/Kilx5knHJc,"","",323872784,Karlmax Berlin,KarlmaxBerlin,false,http://pbs.twimg.com/profile_images/958279934052569088/oqoFesue_normal.jpg,https://pbs.twimg.com/profile_banners/323872784/1626359200,http://abs.twimg.com/images/themes/theme1/bg.png,67,37,1,0,0,1,2021-11-02T09:40:39.000-07:00
