org_id,samp_id,samp_datetime,org_url,org_media_url,org_media_type,org_attached_links,org_text,org_hashtags,org_user_metions,user_id,user_name,user_screen_name,user_verified,user_profile_image_url,user_profile_banner_url,user_profile_background_image_url,user_followers_count,user_friends_count,org_favorite_count,org_quote_count,org_reply_count,org_retweet_count,org_datetime
1439223014915141634,1452275717358690308,2021-10-24T14:08:07.000-07:00,"","","",['https://www.directnews99.site/2021/09/how-to-find-worker-with-no-experience.html'],How to find a work without any Experience|https://t.co/blYlYMKqvk|#job #JobVacancy #JobOpportunity #jobsfortheweekend #JobSearch #JobAlert #jobseekers #personaldevelopment #work #WorkFromHome #careers #LifeGoesOn #business #freshers #Recruitment #recruiting #HIRINGNOW #education,"['job', 'JobVacancy', 'JobOpportunity', 'jobsfortheweekend', 'JobSearch', 'JobAlert', 'jobseekers', 'personaldevelopment', 'work', 'WorkFromHome', 'careers', 'LifeGoesOn', 'business', 'freshers', 'Recruitment', 'recruiting', 'HIRINGNOW', 'education']","",1414964059020038145,Direct News 99,directnews99,false,http://pbs.twimg.com/profile_images/1418207903350099981/j0gT88FR_normal.jpg,https://pbs.twimg.com/profile_banners/1414964059020038145/1626408911,"",20,60,3,0,0,3,2021-09-18T13:41:20.000-07:00
1445680043858874369,1452269230485823497,2021-10-24T13:42:21.000-07:00,"","","",['https://resume.io/r/NEStcrAQm'],Check out my #resume and get in touch if you’re #hiring or know a good opportunity. Made with @resumeio. https://t.co/62Mv6LLzvy,"['resume', 'hiring']",['resumeio'],851887985033457664,Nipho,Neepohh1,false,http://pbs.twimg.com/profile_images/1452246691155951618/74zDlwqZ_normal.jpg,https://pbs.twimg.com/profile_banners/851887985033457664/1601248472,"",771,936,0,0,0,1,2021-10-06T09:19:16.000-07:00
1445753052942659595,1452288699895586819,2021-10-24T14:59:42.000-07:00,https://twitter.com/naiara_re/status/1445753052942659595,['http://pbs.twimg.com/media/FBBYu7eUYAQaFs6.jpg'],['photo'],['https://careers.talentclue.com/en/job/78932496'],📢 We are hiring! Apply if you'd like to join the Eco-evolutionary genomic applied to marine management team in beautiful Sukarieta @azti_brta. Share please. Contact me for details. https://t.co/G3yqzKqSfY https://t.co/ZoTT5i7Upy,"",['azti_brta'],469475413,Naiara R-Ezpeleta,naiara_re,false,http://pbs.twimg.com/profile_images/1441354240845221893/a42i7MRP_normal.jpg,https://pbs.twimg.com/profile_banners/469475413/1632480643,http://abs.twimg.com/images/themes/theme6/bg.gif,1014,852,81,4,1,70,2021-10-06T14:09:23.000-07:00
1447578720374513668,1452279961310609418,2021-10-24T14:24:59.000-07:00,"","","",['https://www.coffeestainstudios.com/jobs/generalist-game-designer/'],"📣 We're hiring a Generalist Game Designer to help with Satisfactory!||If you think you might fit the bill, feel free to apply! If you think you might know someone who might be interested, tag em!||RTs to help spread the word are very much appreciated ❤️||https://t.co/YF14nmzSof","","",920980112019021825,Satisfactory,SatisfactoryAF,true,http://pbs.twimg.com/profile_images/1158375257633374209/_5kjxQIu_normal.jpg,https://pbs.twimg.com/profile_banners/920980112019021825/1618911579,http://abs.twimg.com/images/themes/theme1/bg.png,89373,36,250,10,17,95,2021-10-11T15:03:56.000-07:00
1450215655169527810,1452269381396877321,2021-10-24T13:42:57.000-07:00,"","","","",We're hiring a 2nd editor for main channel to go alongside @SadIy - we're looking for someone with heavy experience in Premiere (vegas is fine too)! This is a paid position &amp; looking to build a long term relationship! Send references :),"",['SadIy'],442385607,Shark 🦈 (Andrew),09sharkboy,false,http://pbs.twimg.com/profile_images/1246840767655665666/pu0fzyC2_normal.jpg,https://pbs.twimg.com/profile_banners/442385607/1585968092,http://abs.twimg.com/images/themes/theme1/bg.png,76230,390,51,1,25,5,2021-10-18T21:42:10.000-07:00
1451490923074887683,1452288789213327367,2021-10-24T15:00:04.000-07:00,https://twitter.com/getplumhq/status/1451490923074887683,['http://pbs.twimg.com/media/FCS5-P7VIAAQEHJ.jpg'],['photo'],['https://ajuniorvc.com/community/'],"👋 Hello new followers and old, what would you like to know about us?||Our co-founder and CEO, Abhishek (@thesanerguy) is joining an AMA with @ajuniorvc this Sunday. Join in: https://t.co/IfkeUl4L6E||Pro-tip: He has some great tips on #hiring and attracting the best talent.😉🪄 https://t.co/IkufihO4MZ",['hiring'],"['thesanerguy', 'ajuniorvc']",1171416043153047552,Plum,getplumhq,false,http://pbs.twimg.com/profile_images/1274758900659572736/VaDEqBNF_normal.png,https://pbs.twimg.com/profile_banners/1171416043153047552/1594215731,"",2191,245,16,0,0,2,2021-10-22T10:09:38.000-07:00
1451564487069286401,1452277799805456393,2021-10-24T14:16:24.000-07:00,"","","",['https://lnkd.in/eCi9CKBy'],[JOB] We are hiring! We are looking for a Project Director. We will also consider an experienced postdoctoral associate. More details here: https://t.co/eobsSQNM8u,"","",1185261608009945092,Marta Venier,venier_marta,false,http://pbs.twimg.com/profile_images/1186810484965679105/2waA-ksS_normal.jpg,"","",271,219,11,0,0,9,2021-10-22T15:01:57.000-07:00
1451608946691633157,1452277043433979906,2021-10-24T14:13:23.000-07:00,"","","",['https://www.linkedin.com/jobs/view/2768738667/'],We are hiring a Postdoctoral Associate. | |https://t.co/eiIVwfW1QS||We have developed molecular tools to map and manipulate microRNA-target interactions in specific cell types of the brain.,"","",1000150819923050496,LippiLab,LippiLab,false,http://pbs.twimg.com/profile_images/1000858550518693888/gKfP7GTp_normal.jpg,https://pbs.twimg.com/profile_banners/1000150819923050496/1548729628,"",672,802,30,6,1,24,2021-10-22T17:58:37.000-07:00
1451647991811608585,1452276182955831305,2021-10-24T14:09:58.000-07:00,https://twitter.com/acromtvernonil/status/1451647991811608585,['http://pbs.twimg.com/media/FCVKH0KXMAYyLwX.png'],['photo'],"",Acro Blue is hiring for 50+ General Laborer and Machine Operator positions. $14HR. Full-time. Apply this weekend and get working next week! #jobopportunities #hiring #fallweather🍂🍁 #ApplyNow #jobalert #October  #acroblue #mountvernonil #Illinois #jobsearch #jobseekers  #Working https://t.co/5LQ9gf3x6v,"['jobopportunities', 'hiring', 'fallweather', 'ApplyNow', 'jobalert', 'October', 'acroblue', 'mountvernonil', 'Illinois', 'jobsearch', 'jobseekers', 'Working']","",1401955526401998848,"AcroBlue Staffing Mount Vernon, IL",AcroMtVernonIL,false,http://pbs.twimg.com/profile_images/1401956662056042505/6OxbFWXp_normal.jpg,https://pbs.twimg.com/profile_banners/1401955526401998848/1623088291,"",8,72,0,1,0,0,2021-10-22T20:33:46.000-07:00
1451659679340404737,1452268980987744261,2021-10-24T13:41:21.000-07:00,https://twitter.com/MattTalhelm/status/1451659679340404737/photo/1,['http://pbs.twimg.com/media/FCVUx9ZX0AA6Rct.jpg'],['photo'],"",More restaurants &amp; even a convenience store are offering college tuition reimbursement to attract employees amid a shortages of workers.  On @WRAL at 6: I’ll tell you if the growing list of benefits is helping with hiring.||#Raleigh #Durham #WRAL #JobSeekers https://t.co/B78LVQ1oTO,"['Raleigh', 'Durham', 'WRAL', 'JobSeekers']",['WRAL'],288785542,Matt Talhelm WRAL,MattTalhelm,true,http://pbs.twimg.com/profile_images/1427444127810170884/uwV3vJ-O_normal.jpg,https://pbs.twimg.com/profile_banners/288785542/1620510064,http://abs.twimg.com/images/themes/theme15/bg.png,3631,1594,3,0,0,4,2021-10-22T21:20:12.000-07:00
1451709108755828743,1452280809474363402,2021-10-24T14:28:21.000-07:00,"","","",['https://www.fountainonlocust.com/hiring'],Do you love to give people a night to remember? Come join The Fountain on Locust front of house team. Work at an iconic St. Louis destination. https://t.co/nVUyl8weba #NowHiring #STL,"['NowHiring', 'STL']","",83490743,The Fountain On Locust,Fountain_Locust,false,http://pbs.twimg.com/profile_images/1408586837631905798/NRyPkark_normal.jpg,https://pbs.twimg.com/profile_banners/83490743/1625625410,http://abs.twimg.com/images/themes/theme1/bg.png,3695,2984,6,1,0,4,2021-10-23T00:36:37.000-07:00
1451746382142849024,1452267309440159763,2021-10-24T13:34:43.000-07:00,https://twitter.com/NicoleBarbaro/status/1451746382142849024,"","","","Many faculty do not agree that student teaching evaluations are a valid assessment of their teaching and do not want them used in hiring, promotion, or tenure decisions by their institutions. ||Faculty: What ARE the methods by which your teaching should be evaluated?","","",854840560749826049,Nicole Barbaro,NicoleBarbaro,false,http://pbs.twimg.com/profile_images/1439663247083261953/z6rQaZkq_normal.jpg,https://pbs.twimg.com/profile_banners/854840560749826049/1633737030,http://abs.twimg.com/images/themes/theme1/bg.png,14918,897,115,7,40,5,2021-10-23T03:04:44.000-07:00
1451954429297520646,1452282222522798090,2021-10-24T14:33:58.000-07:00,https://twitter.com/AshBaloghNM/status/1451954429297520646,"","","",Wondering if @krqe has a leave provision for failed political efforts that they somehow HAVE to keep hiring this guy back.,"",['krqe'],37462633,Ashley,AshBaloghNM,false,http://pbs.twimg.com/profile_images/1384262277356933130/zljDElA__normal.jpg,https://pbs.twimg.com/profile_banners/37462633/1610242015,http://abs.twimg.com/images/themes/theme14/bg.gif,1662,4983,37,1,5,3,2021-10-23T16:51:26.000-07:00
1451997376080646146,1452279645345361933,2021-10-24T14:23:44.000-07:00,"","","","","I’m actually running multiple businesses currently in Ghana and I will tell you the most stressful things to deal with is taxes, hiring, and innovation. #jobmanorspace",['jobmanorspace'],"",258018773,🇬🇭's Coconut Queen🦋,OhemaAkuaK,false,http://pbs.twimg.com/profile_images/1426631228015448065/0TJ80Mo4_normal.jpg,https://pbs.twimg.com/profile_banners/258018773/1355154433,http://abs.twimg.com/images/themes/theme1/bg.png,3399,2569,44,1,0,17,2021-10-23T19:42:05.000-07:00
1452002762909044739,1452288914774020101,2021-10-24T15:00:34.000-07:00,"","","",['https://bit.ly/2ZlEyyd'],We're hiring! Click to apply: Senior Principal Mechanical Engineer - https://t.co/Hl1yRAOjwI #AtriCureCareers #MedDevice,"['AtriCureCareers', 'MedDevice']","",3108302767,AtriCure Jobs,AtriCureJobs,false,http://pbs.twimg.com/profile_images/951943741484363776/3Te9Zpe2_normal.jpg,https://pbs.twimg.com/profile_banners/3108302767/1630614841,http://abs.twimg.com/images/themes/theme1/bg.png,391,231,1,0,0,1,2021-10-23T20:03:30.000-07:00
1452030564924641290,1452289274242650114,2021-10-24T15:01:59.000-07:00,"","","",['https://hope4college.com/about-the-hope-center/careers-at-the-hope-center/'],Ready to make an #impact?||👀 @hope4college - we are currently hiring:||🔥Managing Director of #ExternalAffairs |🔥Senior Director of #Strategic #Communications|🔥Director of #Evaluation|🔥#DataAnalytics Consultant|🔥Senior #Software #Engineer Consultant||https://t.co/dqtpSgN0gS,"['impact', 'ExternalAffairs', 'Strategic', 'Communications', 'Evaluation', 'DataAnalytics', 'Software', 'Engineer']",['hope4college'],32608975,Dr. Sara Goldrick-Rab,saragoldrickrab,true,http://pbs.twimg.com/profile_images/1405921995456487425/GUsTAYGp_normal.jpg,https://pbs.twimg.com/profile_banners/32608975/1590638142,http://abs.twimg.com/images/themes/theme18/bg.gif,48597,20102,20,0,1,23,2021-10-23T21:53:58.000-07:00
1452040897290543104,1452270722550833159,2021-10-24T13:48:16.000-07:00,https://twitter.com/NAfME/status/1452040897290543104/photo/1,['http://pbs.twimg.com/media/FCavgH8XMAUhG9x.png'],['photo'],['http://bit.ly/ReturnToMusicPhaseIII'],"Recruitment and retention in music programs are key concerns this school year as schools reopen. Find ideas for recruitment videos and how to craft your message for parents, students, and other stakeholders: https://t.co/FInGjrSWFX #musiced https://t.co/wtzbk4gWcB",['musiced'],"",17331872,nafme,NAfME,true,http://pbs.twimg.com/profile_images/1377628912151359499/-wxfqyfg_normal.png,https://pbs.twimg.com/profile_banners/17331872/1631805873,http://abs.twimg.com/images/themes/theme15/bg.png,36024,2512,17,0,1,12,2021-10-23T22:35:02.000-07:00
1452043788197588992,1452287087244455944,2021-10-24T14:53:18.000-07:00,"","","",['https://bit.ly/3GgEGzt'],"Organizers of a DIA concessions job fair were hoping about 5,000 people would show up, but only 100 or so attended, further proving the difficulty in hiring for jobs in brick-and-mortar operations https://t.co/g7qwsmGXxb","","",8731312,Denver7 News,DenverChannel,true,http://pbs.twimg.com/profile_images/1448886466722029598/a0eW1Y96_normal.jpg,https://pbs.twimg.com/profile_banners/8731312/1586315294,http://abs.twimg.com/images/themes/theme1/bg.png,287913,1117,50,3,25,20,2021-10-23T22:46:31.000-07:00
1452046084872749059,1452273547435515904,2021-10-24T13:59:30.000-07:00,https://twitter.com/chippraccoon/status/1452046084872749059,"","","",@kittynouveau Not to be rude but I was a 14 once and wanted to work because I had no money for myself. I wanted so many things in life but had no money. IDK if you live in Wisconsin but there are so many places that are open with no employees at all. So many are hiring with 15$ and up payments,"",['kittynouveau'],3499135336,chipp,ChippRaccoon,false,http://pbs.twimg.com/profile_images/1097312890795757573/JkfSCom__normal.jpg,https://pbs.twimg.com/profile_banners/3499135336/1482957714,http://abs.twimg.com/images/themes/theme1/bg.png,60,218,3,2,6,0,2021-10-23T22:55:39.000-07:00
1452073230378831877,1452270436520284161,2021-10-24T13:47:08.000-07:00,"","","","",@NBCNews It's funny how they think she is being political but when the Queen exempted herself from racial discrimination laws in hiring and climate change laws they had no problem with it,"",['NBCNews'],2843732473,Juliet,julietn89,false,http://pbs.twimg.com/profile_images/1330197734876442624/0npL-PpI_normal.jpg,https://pbs.twimg.com/profile_banners/2843732473/1484414152,http://abs.twimg.com/images/themes/theme1/bg.png,876,713,174,0,2,26,2021-10-24T00:43:30.000-07:00
1452074170204971008,1452285208716324870,2021-10-24T14:45:50.000-07:00,https://twitter.com/drugpolicyorg/status/1452074170204971008,['http://pbs.twimg.com/media/FCbNwyrXoAkxH_v.jpg'],['photo'],"",Want to end the drug war?||Want to join our team to help make that happen? ||We’re hiring for for 5 positions! See the thread for what we’re looking for. #EndTheDrugWar #NoMoreDrugWar https://t.co/ksl4QbtTH8,"['EndTheDrugWar', 'NoMoreDrugWar']","",16312001,Drug Policy Alliance,DrugPolicyOrg,true,http://pbs.twimg.com/profile_images/1410705681729138693/TyDR8782_normal.jpg,https://pbs.twimg.com/profile_banners/16312001/1630032397,http://abs.twimg.com/images/themes/theme1/bg.png,99603,2085,51,1,5,21,2021-10-24T00:47:15.000-07:00
1452149204550303746,1452275425988730882,2021-10-24T14:06:58.000-07:00,https://twitter.com/volspix/status/1452149204550303746,"","","","@LloydTesterman2 I know..||I'd like to thank Danny White for hiring his buddy..||And Josh Heupel for hiring his buddies, who have no clue how to coach in the SEC. ||Id like to thank Plowman for destroying the program.||Id like to thank Fulmer for collecting his money, and turning on Pruitt. ||🏆","",['LloydTesterman2'],726988280114323456,volspix,VolsPix,false,http://pbs.twimg.com/profile_images/1429612569959010312/EmrkW6JQ_normal.jpg,https://pbs.twimg.com/profile_banners/726988280114323456/1625709263,"",1718,1980,0,1,0,0,2021-10-24T05:45:24.000-07:00
1452213289413496836,1452284583622369296,2021-10-24T14:43:21.000-07:00,https://twitter.com/ihedelft/status/1452213289413496836/photo/1,['http://pbs.twimg.com/media/FCdMSkqWQAA2hZX.jpg'],['photo'],['https://bit.ly/2LFIQ8X'],We are hiring! This  #vacancy for a (Senior) Researcher has been re-opened! Check the job requirements and apply by 14 November 👉 https://t.co/4GOSidrHjh https://t.co/9gAclj0KAd,['vacancy'],"",19395129,IHE Delft 💧 where the water world meets,ihedelft,false,http://pbs.twimg.com/profile_images/847430946315878401/bG_Wwzd5_normal.jpg,https://pbs.twimg.com/profile_banners/19395129/1525254133,http://abs.twimg.com/images/themes/theme1/bg.png,17743,1259,7,1,0,1,2021-10-24T10:00:03.000-07:00
1452213350935498765,1452269285250932741,2021-10-24T13:42:34.000-07:00,https://twitter.com/MuskokaBible/status/1452213350935498765/photo/1,['http://pbs.twimg.com/media/FCdMWMKXMAgElwF.jpg'],['photo'],['https://www.muskokabible.com/files/1416/1358/6894/Job_Posting_Head_Chef.pdf'],Did you hear? We're hiring a HEAD CHEF at Muskoka Bible Centre! ||Pass this on to all your friends that are skilled in the kitchen!||Find out more at https://t.co/Y1I1YDDjnh https://t.co/B28KM7iUgk,"","",4107405609,Muskoka Bible Centre,MuskokaBible,false,http://pbs.twimg.com/profile_images/665249902557925377/A7G5YphX_normal.png,https://pbs.twimg.com/profile_banners/4107405609/1611617383,http://abs.twimg.com/images/themes/theme2/bg.gif,275,119,0,0,0,1,2021-10-24T10:00:18.000-07:00
1452217089259880448,1452275444498276360,2021-10-24T14:07:02.000-07:00,"","","","","My company is hiring o|Design Architects|Projects Architects|Interior Architects|If you're interested, send me a DM first.","","",134784381,TALATU¡,missbusola_ade,false,http://pbs.twimg.com/profile_images/1418478833842495490/1w71Hye5_normal.jpg,https://pbs.twimg.com/profile_banners/134784381/1632915598,http://abs.twimg.com/images/themes/theme1/bg.png,444,214,8,0,2,10,2021-10-24T10:15:09.000-07:00
1452220258908086281,1452284792603615252,2021-10-24T14:44:11.000-07:00,"","","","",@barcacentre That treble cost Barça 3-4 UCL's with Messi in his prime and hiring Klopp who was available at the time.,"",['barcacentre'],1294319178900439040,Avocado,Avacado76459952,false,http://pbs.twimg.com/profile_images/1295356268178296834/hVdi8Aw1_normal.jpg,"","",4,28,7,0,1,1,2021-10-24T10:27:45.000-07:00
1452234461999996931,1452285656227532801,2021-10-24T14:47:37.000-07:00,https://twitter.com/OKEx/status/1452234461999996931/photo/1,['http://pbs.twimg.com/media/FCdfjBuXMAA1Eyc.jpg'],['photo'],['https://lnkd.in/gT8ZcCDE'],#OKEx is #hiring! [🇭🇰Hong Kong-based]||🔘 Senior Product Manager Social Trading Community||🔘 Financial Product Expert - Derivatives Structuring||What's more? Get in touch with us: https://t.co/yzRh3aKIna https://t.co/IjqEX7DOwv,"['OKEx', 'hiring']","",867617849208037377,OKEx,OKEx,true,http://pbs.twimg.com/profile_images/1409758035665330176/tXgG8lr0_normal.jpg,https://pbs.twimg.com/profile_banners/867617849208037377/1631026602,http://abs.twimg.com/images/themes/theme1/bg.png,573166,353,147,3,345,44,2021-10-24T11:24:11.000-07:00
1452247993474818048,1452279938724343809,2021-10-24T14:24:54.000-07:00,"","","","",I love how employers are so desperate for workers and literally aren’t hiring anybody lmao,"","",1177195929256026112,☢️ Lam ☢️,LIKELAMAR,false,http://pbs.twimg.com/profile_images/1435476849719713792/vt3Rtb56_normal.jpg,https://pbs.twimg.com/profile_banners/1177195929256026112/1596881823,"",6066,1270,10,0,0,4,2021-10-24T12:17:57.000-07:00
1452254332137639940,1452289364822827010,2021-10-24T15:02:21.000-07:00,https://twitter.com/AlexReporterZA/status/1452254332137639940/video/1,['http://pbs.twimg.com/ext_tw_video_thumb/1452254218904080384/pu/img/cjpZKyfcT30gOCrE.jpg'],['video'],"",BREAKING: SOWETO residents have closed down a KFC store in Diepkloof accusing the management of hiring foreign nationals #KFCDiepkloof https://t.co/kCiDYrFENi,['KFCDiepkloof'],"",1282111731142098944,Alex Reporter,AlexReporterZA,false,http://pbs.twimg.com/profile_images/1430466889323585536/o4899htk_normal.jpg,https://pbs.twimg.com/profile_banners/1282111731142098944/1602610098,"",1683,1226,71,10,23,53,2021-10-24T12:43:09.000-07:00
1452266538178789376,1452266538178789376,2021-10-24T13:31:39.000-07:00,"","","","",@lesleyito @dwvcd Someone was asking why you would sell an English school instead of hiring a manager.||This is why.,"","['lesleyito', 'dwvcd']",107889420,Ben from 💴RetireJapan💴,sendaiben,false,http://pbs.twimg.com/profile_images/1443787644786282522/fddst-RE_normal.jpg,https://pbs.twimg.com/profile_banners/107889420/1420000742,http://abs.twimg.com/images/themes/theme6/bg.gif,1438,541,0,0,0,0,2021-10-24T13:31:39.000-07:00
1452266699797970945,1452266699797970945,2021-10-24T13:32:17.000-07:00,"","","","","Vizient is hiring in #Irving, TX! Click the link in our bio to apply: Software Engineer, Salesforce #salesforce","['Irving', 'salesforce']","",20831733,Dallas IT Jobs,tmj_dfw_it,false,http://pbs.twimg.com/profile_images/668655704467636224/vpm3X9t1_normal.jpg,https://pbs.twimg.com/profile_banners/20831733/1448254919,http://abs.twimg.com/images/themes/theme1/bg.png,1308,254,0,0,0,0,2021-10-24T13:32:17.000-07:00
1452266789912653829,1452266789912653829,2021-10-24T13:32:39.000-07:00,"","","","","Now hiring for 592 job opportunities at SCA (@SCAsurgery), Atrium Health (@AtriumCareers), DTE Energy (@DTEEnergyJobs), and more.","","['SCAsurgery', 'AtriumCareers', 'DTEEnergyJobs']",47541374,TMJ-USA Fac. Mgmt.,tmj_usa_facmgmt,false,http://pbs.twimg.com/profile_images/691496312215248896/7ZNqOW5k_normal.jpg,https://pbs.twimg.com/profile_banners/47541374/1453700544,http://abs.twimg.com/images/themes/theme1/bg.png,193,117,0,0,0,0,2021-10-24T13:32:39.000-07:00
1452266792655724547,1452266792655724547,2021-10-24T13:32:39.000-07:00,"","","","",where is hiring pls tell me,"","",3400233465,ac ⚖️,annacristiinnaa,false,http://pbs.twimg.com/profile_images/1368518887315279872/MAcflKpY_normal.jpg,https://pbs.twimg.com/profile_banners/3400233465/1630868193,http://abs.twimg.com/images/themes/theme1/bg.png,246,115,0,0,0,0,2021-10-24T13:32:39.000-07:00
1452266878332809221,1452279018548600832,2021-10-24T14:21:14.000-07:00,https://twitter.com/NOAAFish_NEFSC/status/1452266878332809221/photo/1,['http://pbs.twimg.com/media/FCZKSNFXEAg78lH.jpg'],['photo'],"['https://bit.ly/3vGZCuW', 'https://bit.ly/3CbjmsK']",We’re #hiring for a Research Fish Biologist ZP3. Location: #WoodsHole MA. Direct hire! Apps due: 10/25. Public/Career trans fed: https://t.co/KzoU2P6smh. Protected Species Branch info: https://t.co/yoVtLfIk6i. #Jobs https://t.co/5MrEGHnQOx,"['hiring', 'WoodsHole', 'Jobs']","",829347876635545600,NOAAFish_NEFSC,NOAAFish_NEFSC,false,http://pbs.twimg.com/profile_images/1359197860902948869/gLdQuGV2_normal.jpg,https://pbs.twimg.com/profile_banners/829347876635545600/1634058413,"",3254,638,2,0,0,4,2021-10-24T13:33:00.000-07:00
1452266956850176009,1452266956850176009,2021-10-24T13:33:18.000-07:00,"","","",['https://bit.ly/3C69Ozk'],"Want to work at Penske Truck Leasing? We're hiring in Stamford, CT! Click for details: https://t.co/GKkELC9sS6 #gopenskecareers #trucking","['gopenskecareers', 'trucking']","",247368550,Penske U.S. Jobs,GoPenskeCareers,false,http://pbs.twimg.com/profile_images/1042088392350154758/FaX4j3eT_normal.jpg,https://pbs.twimg.com/profile_banners/247368550/1537288191,http://abs.twimg.com/images/themes/theme1/bg.png,1631,1387,0,0,0,0,2021-10-24T13:33:18.000-07:00
1452267162484215811,1452267162484215811,2021-10-24T13:34:08.000-07:00,"","","","","Wine Rack, a division of Arterra Wines Canada is hiring in Stratford, ON, Canada! Read about our latest #Sales #Retail job opening via the link in our bio: Sales Associate - Wine Rack (Stratford)","['Sales', 'Retail']","",50382485,TMJ-CAW Jobs,tmj_caw_jobs,false,http://pbs.twimg.com/profile_images/693494270406184961/q7FxEBS9_normal.jpg,https://pbs.twimg.com/profile_banners/50382485/1454176894,http://abs.twimg.com/images/themes/theme1/bg.png,413,293,0,0,0,0,2021-10-24T13:34:08.000-07:00
1452267288711901201,1452267288711901201,2021-10-24T13:34:38.000-07:00,"","","","",Now hiring for 82 #Pharmaceutical job opportunities in #Milwaukee. Click the link in our bio to see them.,"['Pharmaceutical', 'Milwaukee']","",25759675,TMJ-MKE Pharm. Jobs,tmj_mke_pharm,false,http://pbs.twimg.com/profile_images/684097541038669825/kbOwL8HE_normal.jpg,https://pbs.twimg.com/profile_banners/25759675/1451936540,http://abs.twimg.com/images/themes/theme1/bg.png,284,261,0,0,0,0,2021-10-24T13:34:38.000-07:00
1452267321729368075,1452267321729368075,2021-10-24T13:34:45.000-07:00,"","","",['https://on.tcs.com/3AJwtQH'],TCS is hiring MBA grads.  |https://t.co/snyDUxIReg,"","",100531285,Shantharam,shantharam1,false,http://pbs.twimg.com/profile_images/1450157621994946560/DAqZHal8_normal.jpg,https://pbs.twimg.com/profile_banners/100531285/1458228547,http://abs.twimg.com/images/themes/theme9/bg.gif,706,105,0,0,0,0,2021-10-24T13:34:45.000-07:00
1452267407263760385,1452267407263760385,2021-10-24T13:35:06.000-07:00,"","","","",@CatWorkers @sommbunnylovesu Are you hiring japanese company?,"","['CatWorkers', 'sommbunnylovesu']",255946506,💉💉Meowgan,catsandsparkle,false,http://pbs.twimg.com/profile_images/1398068107961278466/e4iAMdXW_normal.jpg,https://pbs.twimg.com/profile_banners/255946506/1613575091,http://abs.twimg.com/images/themes/theme1/bg.png,1769,925,0,0,0,0,2021-10-24T13:35:06.000-07:00
1452267415954395140,1452267415954395140,2021-10-24T13:35:08.000-07:00,"","","","","Now hiring for 352 job opportunities at PHC (@ProHealthCareWI), Sevita (@JoinMENTORNetwk), Health eCareers (@HeC_Jobs), and more.","","['ProHealthCareWI', 'JoinMENTORNetwk', 'HeC_Jobs']",22159498,TMJ-MKE Nursing Jobs,tmj_mke_nursing,false,http://pbs.twimg.com/profile_images/667715227501244418/StenLPfG_normal.jpg,https://pbs.twimg.com/profile_banners/22159498/1448030692,http://abs.twimg.com/images/themes/theme1/bg.png,328,204,0,0,0,0,2021-10-24T13:35:08.000-07:00
